title,text
"A native port of the GameCube Animal Crossing has made its way to PC, which means all other cozy games are cancelled as nothing else matters",Let's revisit the game where all your villagers bully you.
"Nvidia's new Vera CPU has been designed for 'extremely high' single-core performance, but it's not coming to the PC for now",Dare we hope that those Olympus cores turn up in a future PC chip?
Arc Raiders' new update puts the Il Toro in its place (a grave) at long last: 'This is an adjustment many of you requested',The cheeky Energy Clip money-making exploit has also been patched up.
'Insanely punishing' survival game Atlas is being distilled 'into a more accessible form' for Ark: Survival Ascended's new DLC,The Tides of Fortune update will let players craft a customizable ship and sail it across a simulated ocean.
All Monster Hunter Stories 3 mutations and how to get them,How about a Pink Rathian or Azure Rathalos for your team?
Overwatch director says addressing the 5v5 versus 6v6 debates late 'cost us trust': 'We should have listened sooner',Aaron Keller reflected on Overwatch 2's live service development during a recent talk at GDC.
"Our idea of Azeroth could have looked very different, because Jeff Kaplan said he 'really wanted WoW to be first-person' in its early days: 'I argued a lot for that'",We narrowly dodged an FPMMORPG craze.
Bungie is adding an 'experimental' duos mode to Marathon for a few weeks: 'Some things will be a bit jank',Just the two of us.
"Epic CEO and billionaire Tim Sweeney has been using some of his cash to buy up 50,000 acres of forest so it can't be flattened","And made the ""largest private land donation in North Carolina history."""
"DLSS 5 clearly overwrites game characters with AI beauty standards, but Nvidia says devs have 'artistic control'",The first demo for Nvidia's new AI rendering technique doesn't do much to combat the perception that generative AI homogenizes artwork.
"A retired Microsoft engineer is training an AI to master Robotron: 2084, an incredibly difficult arcade game about a robot uprising",There is something deliciously karmic about this one.
Jeff Kaplan is sick of hearing you demonize games you weren't going to play anyway: 'Shut the f**k up. No one cares. We don't need to hear that you weren't into it',"In a 10-hour stream of his studio's upcoming game, Kaplan said he's ""bored"" with compulsive online outrage."
How to play on the Schedule 1 beta branch for early access to new updates,Anyone can access test builds by swapping branches on Steam.
"Resident Evil Requiem actor had to spend '2 to 3 minutes' audibly dying during her audition, while the casting director threw out surprise instructions: 'Now a zombie has bitten your left leg'","The new Resi is Grace actor Angela Sant'Albano's first videogame credit, but I'm guessing it won't be her last."
Nvidia has just shown off DLSS 5 coming this fall... and currently it looks a lot like an AI filter,"At the GTC keynote, Jen-Hsun has just showed off the AI-enhancement of DLSS 5."
"MSI reportedly plans on tackling 'the most challenging year since the company was founded', with 15-30% price raises, making DDR5 motherboards DDR4 compatible, and increasing AI server revenue",The RAMpocalypse is nowhere near done messing with market prices.
"In a wild turn for the Subnautica 2 lawsuit, a judge orders Krafton to restore fired Unknown Worlds CEO and gives them 9 more months to earn $250 million bonus","Litigation is ongoing, but this ruling represents a major loss for Krafton."
"Digg, which just relaunched in January, lays off staff and shuts down, but promises it's going to 'rebuild with a completely reimagined angle of attack'",Well that sure didn't work out.
Deus Ex's maligned sequel was the most 2026 game of 2003⁠: It clocked the 21st century even harder than Metal Gear Solid 2,Give me Deus Ex (Invisible War)
Nvidia GTC live: Jen-Hsun lays out 'the future of real-time rendering' in today's keynote and potentially 'it's gonna blow your mind',"Nvidia's GPU Technology Conference kicks off this week, with a leather-clad keynote from the company's CEO."
The Hitman TV show has been silently assassinated: 'It's dead in the water',Police suspect blood money was involved.
Tech creator proves for a second time that AA batteries are not a practical power alternative for your gaming PC,There's just enough time for a spot of Minecraft.
"YouTuber replaces PC fan with 15 miniature fans in unholy experiment dubbed 'The Fanhattan Project', performs pretty much the same as a standard fan","""This fan is basically a meme of the [Noctua] A12x25."""
"FF14's most determined challenge runner finally hits a wall after 1,000 hours, then unveils a backup strategy that took 233 days to prepare in secret: 'I wanted so badly to tell people'","If you had the strength to take another step, could you do it?"
Marathon dev effortlessly bodies haters who say Bungie's not the studio that made Halo anymore—rattles off 40 Halo OGs who still work there and says he can list more if you want,The lesson is: never tweet.
"Intel has published a whole host of security vulnerabilities, with mitigations rolling out, but attackers will need local access to actually do anything","Just don't let strangers near your rig soon, or any time really."
"Blizzard struggles to balance its Abundance world event in a way that makes anybody happy, with recent potential nerfs making it even more stressful to optimize","A done dance, this Abundance."
'C:\ is not accessible – Access denied': Windows 11 users locked out of own boot drive on Samsung PCs due to major issue,The fix is unfortunately not yet in.
"Bethesda steps in again to calm down hype around Starfield news next week, saying Todd Howard's EA College Football 26 skills are his 'only visionary power'","""He appreciates all the passionate feedback."""
"If you were scammed by malware hiding in your Steam games, the FBI wants to hear all about it",This is for games accused of scamming users between May 2024 and January 2026.
"Capcom celebrates 6 million units sold for Resident Evil Requiem, 'the fastest that a title in the series has reached this milestone'",Fans can expect continued support for Requiem.
"Nvidia's very keen on you 'catching the future of real-time rendering' at this year's GTC, though I suggest not waiting with bated breath for anything groundbreaking","It'll be 100% AI-powered stuff, of course, but that's not necessarily a bad thing."
Pulsar X3 CrazyLight Mini review,Hand heaven for relaxed claw grippers.
Witches and glitches are your targets in retro adventure Witchhunter.exe,"This week, Doki Doki Literature Club's discussion book is the Malleus Maleficarum."
"Five new Steam games you probably missed (March 16, 2026)",Sorting through every new game on Steam so you don't have to.
The remastered collection of the first Tomb Raider games just got a controversial patch with some truly terrible-looking new outfits: 'Lara deserves better than this',Players have taken to social media to share their disappointment.
"Abubakar Salim, Surgent Studios founder and Raised by Wolves star, gives us a guided tour of his PC: 'My desktop is so bad that even my wife refuses to look at my screen'","The creator of Tales of Kenzera: Zau discusses playing No Rest for the Wicked, Dave the Diver, and his lifelong love of Solitaire."
"This indie dev is making a Mirror's Edge-inspired freerunning game, complete with an in-game PDA that looks a lot like a PlayStation Portable",Return to the late aughts.
I spent 6 months saving up for a banged-up truck in GTA RP and now I know exactly what I want from GTA 6's multiplayer,Two worlds are yours.
Split spacebars are surely the next big gaming keyboard trend,Watch this space.
"As if seeing it on your screen wasn't enough, someone has created a lifesize animatronic version of the girl from Resident Evil Requiem, which is a really good, not at all terrifying idea, I'm sure",Bring your nightmares to life through arts and crafts!
GTA roleplay’s latest craze has players risking their cars in tense bouts of high-stakes hide and seek,"Don't leave me this way, sweet Rusty."
"Beaver-themed city-builder Timberborn has gnawed its way out of early access, and surprise! It has Factorio-style automation now",Beavering away.
"Fantasy heist sim Project Shadowglass is even more inspired by Thief than I had realised, as a new trailer shows off water arrows, blackjack knockouts, and authentically sloppy swordfighting",Heist to meet you.
"Deep Rock Galactic: Survivor is getting an expansion that introduces the series' first ever new class, and it’s a dwarf driving a weaponised bulldozer that flattens terrain and enemies alike",The Heavy Duty DLC is out next month.
How to beat every Invasive Monster in Monster Hunter Stories 3,Don't even bother trying to talk to these monsters.
All endangered species locations in Monster Hunter Stories 3,Gotta hatch 'em all.
"Darktide is getting a new extraction-esque mode where you go outside and try not to die from radiation poisoning: 'If time runs out and you die, you get nothing'","No PvP, but a familiar loop nonetheless."
"Executive producer on The Simpsons says 'never say never' regarding a Hit & Run revival, even if he prefers the 2007 game",There's no accounting for taste.
"I desperately want the Just Cause creator's new open-city game to be great, but I'm not convinced by its latest trailer","Samson has a great premise, but the new footage leaves me with concerns."
"It's not quite finished yet, but Marathon is rolling out an ""experimental duo queue"" later this week - and there are more experiments to come","Marathon will implement a limited duo queue later this week, as Bungie experiments with an alternative to lonesome solo play and hectic three-person teams in its new extraction shooter. Read more"
"Netflix Assassin's Creed series casts Girl With a Dragon Tattoo star, as well as actors from Mission Impossible and Indiana Jones","After what felt like many years of silence, things are finally picking up for Netflix's Assassin's Creed adaptation, with four more high-profile actors announced to be joining the series. Read more"
"Bethesda promises Nvidia's controversial DLSS 5 AI filters will be ""totally optional"" for players","Bethesda will be ""further adjusting the lighting and final effect"" of Nvidia's DLSS 5 visuals on Starfield , following the controversial AI-tech's reveal. Read more"
"Crimson Desert's PS5 trophies have been revealed, and they read like riddles (which is both exciting and scary)","Crimson Desert is arriving in just two days, and everybody who has been keeping track of its journey is either super excited or praying it's not a jumbo-sized disappointment. Ahead of the launch, we now have a first look at the open-world game's trophy list, and it's a baffling one. Read more"
"Nvidia reveals DLSS's AI upscaled graphics filter, gets roundly mocked by pretty much everyone on the Internet","As concerns of a growing ""AI bubble"" continue to pile up while half the world is on fire, tech and gaming giants are trying their hardest to push AI-enabled ""innovations"". Nvidia is the latest company attempting to justify its massive investment in AI with DLSS 5 , an ""AI-Powered breakthrough in visual fidelity for games."" Read more"
"Base PS5 footage of Crimson Desert finally emerges, and it looks OK?","The technical prowess of incoming open-world role-playing game Crimson Desert is exciting, but for every impressive video we've seen of the game, there lurks a background concern: we haven't yet seen it running on standard console hardware - on a base PlayStation 5. Now, however, we have. Read more"
"Krafton responds to Subnautica 2 legal ruling: ""we are evaluating our options as we determine our path forward""","Krafton has provided a statement to Eurogamer on yesterday's court ruling on Unknown Worlds and Subnautica 2 . This ruling stated that the CEO must be brought back into his role, he must have control over the Steam page and Early Access launch of Subnautica 2, and the $250m performance-based bonus package must be extended. Read more"
"Four years ago, Tunic had a transformative effect on me - now it's getting a Switch 2 upgrade, you really must play it","In another life, I wrote extensively about Tunic over at our sister site, VG247 . It was my favourite game of 2022. I was obsessed. As well as deep dives into the intricate (and often musical) puzzle design , the hidden messages people took years to find , and why the soundtrack elevates the game from memorable to unforgettable , I wrote multiple articles about the game each time it came to a different platform. I just wanted people to play it. If even one other person picked up this game and felt the same sort of childlike sense of wonder and spaciousness that I did when I first played it, I'd feel content. I'm that serious about Tunic. I think it healed something young and vital, deep inside me. Read more"
The Last of Us season three casts Abby's father,Two more cast members have been confirmed to be joining the cast of HBO's The Last of Us adaptation. Read more
The Nintendo Switch 2 just got a huge update that brings a surprise upgrade to loads of your old Switch games (with a few exceptions),"Nintendo has just released a new update for both the Switch 2 and Switch, bringing the system software up to Version 22.0.0. Whilst a lot of the tweaks and changes are what you'd expect from a firmware update like this - stability fixes, language additions, UI improvements in the Nintendo eShop, and so on - there's one pretty significant feature that's going to make a lot of your older games run better on the Switch 2's fancy new hardware. Read more"
"Judge delivers bombshell order for Krafton to reinstate fired Subnautica 2 devs and CEO, putting $250m bonus package back on the table","A judge has ruled that South Korean video game giant Krafton must reinstate CEO of Unknown Worlds Ted Gill, after he was fired from the position in July, 2025. He must also be put back in charge with ""full operating authority"" of the studio and of Subnautica 2 's Early Access release as part of this ruling. Read more"
"If you're still playing Pokémon Go, you're helping train data-gobbling GPS AI for Niantic Spatial","Everyone in tech seems to be into AI these days, developer Niantic doesn't want to be left behind. With the help of images captured through the Pokémon Go app, the company is helping its spinout Niantic Spatial endeavour, which focuses on ""geospatial AI"" and digital maps of the physical world. Niantic Spatial's long-term goal is to enable machines, robots, and AR glasses to understand, navigate, and interact with the physical world with centimeter-level precision. Read more"
"Saudi Arabia now owns just over 10% of Capcom, as another national investment company scoops up more shares in the Resident Evil and Street Fighter publisher","An investment fund connected to the Saudi Arabian Public Investment Fund (PIF) has acquired roughly five percent of Capcom, as the country continues to invest in the video game industry. Read more"
"""Shut the f*ck up, no one cares"" - former Overwatch boss Jeff Kaplan slams ""nerd baby rage""","Former Overwatch boss Jeff Kaplan has been getting chatty following the announcement of his new open-world survival shooter, The Legend of California. And he's now shared his thoughts on the toxic side of gaming fandom - what he calls ""nerd baby rage"" - offering some advice to those who insist on loudly complaining to developers about games they have no intention of playing: ""Shut the f*ck up, no one cares."" Read more"
Crimson Desert makes last-minute change to Steam release with the addition of infamous Denuvo DRM,"Earlier today, we shared the news that Doom: The Dark Ages' Denuvo DRM protection has been cracked . Now, only three days before launch, we've just learned upcoming triple-A behemoth Crimson Desert will have that layer of protection on PC. Read more"
"Slay the Spire 2 records huge week-one sales, and there's a board game expansion coming (that lets you play as the bosses)","Slay the Spire 2 has been one of Steam's best selling games for days, and now we know what that translates to in terms of actual sales. Developer Mega Crit has announced that Slay the Spire 2 has sold a massive 3 million copies already. Read more"
Does Marathon's story have you confused? This fan-made timeline is a fantastic way to figure it all out,If you've found yourself totally confused by the story of Marathon - or rather you wish you could quickly catch up on all the series' history to better understand the events of Bungie's latest extraction shooter - a group of fans have created the perfect resource for you. Read more
"""You've got to shut this down"" - Jeff Kaplan recalls the ""disaster"" of Blizzard MMO Titan's development","Jeff Kaplan, a former Blizzard designer renowned for leading the creation of Overwatch , has shed more light on arguably Blizzard's biggest failure: the cancelled massively-multiplayer game Titan. Read more"
"""There are already many torches, many versions of Zelda"" - Breath of the Wild voice actor Patricia Summersett isn't ready to let go of Princess Zelda just yet","Among The Legend of Zelda: Breath of the Wild and Tears of the Kingdom 's many strengths, Patricia Summersett's performance as the titular Princess stands out. She characterised the long-eared heroine well, and - for many fans - has become the definitive voice of the classic character. As fans look forward to news on the franchise's future for its 40th anniversary, the actor is saying she isn't done with the role yet... if Nintendo wants to keep her around. Read more"
"Doom: The Dark Ages has had its controversial Denuvo DRM software compromised by pirates, making it the first 2025 release to be 'cracked'","Xbox-published shooter Doom: The Dark Ages has been cracked by anti-DRM pirates, it's been revealed, with a Reddit user who goes by voices38 announcing the bypassing of its unpopular Denuvo software on 13th March ( via TheGamer ). Read more"
"In an industry beset by layoffs and crunch, Japanese publisher Atlus is raising salaries and working to reduce fixed overtime","Yesterday, we learned of layoffs at Warner Bros. Montréal , the latest in a unbearably long list of bad games industry news in recent months. Today, for a change, we have a positive bit of industry news, this time coming from Japanese publisher Atlus (who you'll probably know for Persona, Shin Megami Tensei, and Metaphor ReFantazio). Read more"
"Marathon's latest update adds a locked-off fourth map, indicating the extraction shooter's hardest challenge will soon be revealed","If you've booted up Marathon today before work (or for the naughtier of you out there, whilst at work), you may have noticed a major change. Not only has a mysterious mail landed in your inbox, but a locked-off fourth map has appeared on the menu. It looks as though Cryo Archive - the hardest map yet - is nearly here. Read more"
"Resident Evil Requiem crosses 6 million copies sold, becoming the fastest-selling game in the survival horror series' history","March has been a super busy month when it comes to big video game releases, yet players haven't stopped talking about late February's Resident Evil Requiem , which has even climbed to the second top spot of Metacritic's user score ranking . Now, Capcom has finally released sales numbers for the game so far, and it's an even bigger launch than expected. Read more"
Warner Bros. Montréal devs report layoffs,Several Warner Bros. Montréal developers are reporting that they have been laid off. Read more
"Bethesda drops unusual tease that it'll have Starfield news for us ""next week""","Bethesda has teased that we can expect new information about Starfield ""next week"". Read more"
"The Simpsons: Hit & Run writer and series showrunner says ""never say never"" to a possible revival","The Simpsons showrunner and The Simpsons: Hit & Run writer Matt Selman reckons we should ""never say never"" to a possible remake or revival. Read more"
"Arc Raiders CEO says studio has ""re-recorded"" AI lines: ""A real professional actor is better than AI; that's just how it is""","Arc Raiders developer Embark Studios has re-recorded some of its AI-generated voice lines, acknowledging ""there is a quality difference"" between lines recorded by human actors and those generated by AI. Read more"
"Silent Hill, Gravity Rush creator Keiichi Toyama is recruiting for a ""new large-scale project""","Silent Hill, Siren, and Gravity Rush creator Keiichi Toyama is recruiting for a ""new large-scale project"". Read more"
"Pokémon Pokopia has finally convinced me that the Switch 2's mouse controls are actually a worthwhile addition, after all","Let's be honest, no-one is going into a shop and picking up a Switch 2 because of Drag x Drive , are they? Nor are they seeking out the new(ish) console for a mouse-controlled version of Metroid Prime 4 (even if it is sort-of good). The mouse capabilities of the Switch 2 feel under-utilised so far - in fact, the only time I can really remember vibing with them is in a newly bolted-on mini-game in Bravely Default Flying Fairy HD Remaster . Not exactly the DS' stylus or the Wii's Wiimote, is it? Read more"
Reverse-engineering Marathon's visual mood board magic,"If extraction shooters are games in which you duck out of the fray between matches to look at what you just collected, I guess I'm almost playing Marathon the right way. I struggle to keep up with a team, let alone support other players in any meaningful manner, and I'm truly useless in most gunfights. But when the game is over I'm still eagerly checking through my winnings. Read more"
"What we've been playing - ""I have learned the hard way that trusting others is a suckers game""","Hello and welcome back to our regular feature where we write a little about the games we've been playing. This week, everyone's playing Pokémon Pokopia apart from Bertie and Connor, who are arguably the staff members with the best taste - an observation I make completely unbiasedly. Connor does appear to have become quite evil, though, so I think it's best I distance myself from him as well. Read more"
"""People were just not ready for"" Starfield, says game's composer as he talks ""visionary"" Todd Howard","Starfield composer and long-time Bethesda collaborator Inon Zur has been discussing his decades-spanning work with the studio, sharing his thoughts on ""visionary"" Bethesda boss Todd Howard , as well as his belief that ""people were just not ready for"" 2023's divisive space adventure. Read more"
"Marathon still hasn't unlocked its fourth zone, but this group of ARG hunters is working to change that - and they're on the cusp of something big","There's a treasure hunt of sorts in progress within Marathon, with the best and brightest puzzle solvers and solution sleuths gathering together in search of a glorious prize. That prize is, of course, unlocking the Cryo Archive map for the entire playerbase of Bungie's new extraction shooter . It's also a chance for players to make their mark in the game's legacy, to be one piece of the history Marathon. Read more"
"Help, I can't stop playing Pokémon Pokopia!","I admit I was a bit surprised when I looked at my Pokémon Pokopia playtime on Monday and discovered I'd somehow put in nearly 24 hours over the weekend. But still, that didn't stop me from scoffing when my colleagues started talking about how they'd been losing sleep to the thing. Ridiculous, I thought! Impossible! So it almost feels inevitable that, a day later, this article comes to you through a thick fog of sleep deprivation - and all because I stayed up till 2am last night, unshakably compelled to fix every damned bridge in Bleak Beach. Pokopia has me good . Read more"
"As Witcher 3 DLC rumours swirl, CD Projekt Red wants you to know that Cyberpunk 2077 won't be getting any more 'secret' content","Unless you've been living under a roc (pun intended), you'll know that there's a pretty hefty rumour going around about The Witcher 3 and some potential new DLC for the game, said to be releasing some 11 years after the game's initial launch . Read more"
"""We are not powerless, every action matters"" - Indie studio Speculative Agency returns Microsoft Xbox funding and urges others to boycott","Indie studio Speculative Agency - which is currently making ""a narrative courtroom deck-builder about ordinary people who make the powerful pay for destroying our future"", called All Will Rise (quote from Kickstarter ) - has made the brave decision to return funding given by Xbox and Microsoft to join the No Games For Genocide boycott . Read more"
"Pokémon Pokopia's first patch announced, tackles progress-halting bugs and makes progression a bit easier to figure out","Pokémon Pokopia is good, isn't it? Despite selling over 2.2m copies within a week of launch, and being so impressive that it's even making Nintendo stock go up , there are a few issues with the game that are impeding everyone from having a great time with the title. Don't worry, though, Nintendo has confirmed we will soon get an update that addresses a variety of bugs present in the launch version of the game. Read more"
"Slay the Spire 2 fan drew badly every day until its release, now they've created an art book to celebrate","One Slay the Spire fan who took it upon themselves to ""draw badly"" until the release of Slay the Spire 2 has created an art book cataloguing their works. With the game now released, they've revealed this lovely creation to the world. Read more"
