title,text
Resident Evil Requiem Is Selling Faster Than Any Game In The Series,"Just a few days after Capcom reported that Resident Evil Requiem had set a franchise best with 5 million sales in its launch week, the company has had to update those figures. The horror hit has increased its lifetime sales to 6 million units sold globally, which now makes it the fastest-selling Resident Evil game to date. In total, the Resident Evil franchise has now sold 183 million units since it kicked off in 1996. Those numbers will likely increase in time as Capcom has confirmed that a new story expansion is in development , and while that won't be out for a while yet, more immediate updates include a photo mode and a mystery minigame. Capcom had previously attributed the success of Resident Evil Requiem to a well-run marketing campaign and the game catering to a wide variety of players with its difficulty modes while still retaining its core survival-horror appeal. The company confirmed ongoing support and additional game content as the series celebrates its 30th anniversary. ""Capcom is readying various plans for this anniversary to delight series fans, such as a collaboration between Universal Studios Japan and Resident Evil Requiem in 2026, and orchestral concerts in Japan, the US, and Europe,"" Capcom said in a press release. Continue Reading at GameSpot"
Marvel Rivals' Staying Power Comes Down To One Key Strategy,"Launching a live-service game might be one of the toughest prospects in the video game industry currently, as several ambitious titles have sadly failed to find an audience and have folded shortly after launch. Marvel Rivals isn't one of those games, as the free-to-play action game has maintained its momentum with a constant influx of new heroes and game modes since it first hit PC and consoles in December 2024. While the market might be tough, Marvel Rivals executive producer Danny Koo believes that there is space for both single-player and live-service games to flourish, as the industry has gone through numerous phases over the decades where certain ideas and genres were declared to be at death's door. The key to success for other studios might lie in being nimble and agile enough to adapt to the needs of an audience quickly. ""I think live-service is going to continue; there's a place for it. Single-player games are going to continue; there will be a place for it,"" Koo said to GameSpot at GDC 2026. ""Over the course of 22 years, it's the same narrative being looped based on whichever slice of timeline you look at. Like, once upon a time, it's like AAA games are dead, indie games are in trouble. It's never-ending, the medium is evolving, and we have to be nimble enough to adopt technology and go where the audience is."" Continue Reading at GameSpot"
The Director Of The Next Resident Evil Movie Has Already Beaten Requiem Twice,"If you needed more proof that Weapons director Zach Cregger has the credentials to make a new Resident Evil film , look no further than his play history. According to a reporter, Cregger has already completed the latest game in the franchise twice. Deadline writer Destiny Jackson shared a photo of herself and Cregger on X , with the caption mentioning that she ""talked to him about Resident Evil Requiem (he said he beat it twice already!)."" Jackson remarked in a reply that Cregger ""said the scariest one is RE [Village], he noped out."" I fulfilled a lifelong dream of meeting the whitest kid I know! Zac Cregger & talked to him about Resident Evil Requiem (he said he beat it twice already!) ♥️♥️♥️ I’m so happy. pic.twitter.com/7CYkywFoPv — Destiny Jackson (@DestinyDreadful) March 14, 2026 There was little doubt that Cregger is a fan of the series--in an interview, he called himself ""someone who has played I don't know how many thousands and thousands of hours of Resident Evil"" and promised that his film ""lives in the world"" of Resident Evil 2 and 3 . Continue Reading at GameSpot"
The Devil In Me Game Dev Celebrates Star's Win At The Oscars,"Actor Jessie Buckley took home the Academy Award for Best Actress at the 98th Academy Awards on Sunday, and now the developer behind a game she starred in is celebrating her achievement for the movie Hamnet. Buckley played the starring role of Kate Wilder, an investigative journalist, in The Dark Pictures Anthology: The Devil in Me. ""An amazing award season for Jessie,"" going on to mention how she also won the top acting awards for actresses at the BAFTAs, Critics' Choice, Golden Globes, and Actor Awards. ""Congrats!"" developer Supermassive said. ""She'll likely need a new trophy cabinet."" Continue Reading at GameSpot"
Assassin's Creed TV Show: Here's Who Will Star In And Direct,"Netflix and Ubisoft are making an Assassin's Creed TV series, and the cast is coming together ahead of the start of production in 2026. The director for the series has also been announced. So far, nine cast members for the Assassin's Creed TV show have been confirmed, but as of yet, no roles have been announced. For now, here's who we know will appear on the show: Toby Wallace Zachary Hart Lola Petticrew Laura Marcus Tanzyn Crawford Noomi Rapace Ramzy Bedia Sean Harris Corrado Invernizzi Wallace is known for his roles in the movies The Bikeriders and Babyteeth, while Hart is perhaps best known for the Apple TV show Slow Horses. Petticrew, meanwhile, starred on the TV series Say Nothing. Marcus previously appeared in Death by Lightning and will be in this year's year's Hunger Games movie, Sunrise on the Reaping. Crawford is in the new Game of Thrones TV show A Knight of the Seven Kingdoms. Continue Reading at GameSpot"
"Today's Games Can Feel ""Soulless,"" But Can Punch The Monkey Change That?","Punch the monkey, an adorable macaque born last July in Japan, captured the world's attention recently. He was abandoned by his mother and rejected by his community, only to find solace and comfort in a $20 orangutan plush toy from IKEA. His story tugged on the heartstrings of people worldwide who felt bad for the little guy and wanted him to find companionship. He eventually did, and Punch's prospects are seemingly better now. But Punch still lives in a zoo--the Ichikawa City Zoo--and that's not sitting well with everyone. A new video game, Zoo Fighter , has players taking on the role of Punch and ... punching bullies away with his fist or a swift kick. Knock out 100 and Punch gets to go to a sanctuary, instead of a zoo. And that's the point of the video game. ""This game is a love letter to all animals doing a bid at the zoo. Animal sanctuaries are often better for primates than zoos because they put the animals' well-being first instead of public display,"" reads a line from the game's description. ""They offer larger, more natural spaces and rescue animals from neglect or captivity rather than breeding them,"" the description goes on. ""The focus is on lifelong care and less human interferecne, giving primates a safer, less stressful place to live."" Continue Reading at GameSpot"
Donkey Kong Bananza Began As A Goomba With Giant Fists,"Nintendo loves to build on what it has already created. Donkey Kong Bananza , a game that mixes 3D platforming with freeform destruction, began as a prototype that built on ideas featured in Super Mario Odyssey, and the prototype featured a Goomba with giant fists. Super Mario Odyssey’s Luncheon Kingdom, among other areas, featured breakable structures scattered throughout the environment. These objects could be smashed into pieces using many of the special abilities Cappy gave Mario. Nintendo producer Kenta Motokura and programmer Tatsuya Kurihara explained how that mechanic eventually helped inspire the creation of Donkey Kong Bananza during a talk at the Game Developers Conference in San Francisco this week. After Odyssey was complete, Kurihara put together a simple prototype using assets from the game. He strapped two giant fists onto a Goomba to test how it would feel to smash through walls and even grab debris from those walls to throw. You can see our rendition of what that may have looked like above. Continue Reading at GameSpot"
Team Fortress 2 Update Released,
