title,text
"There's a Naughty Dog reunion happening at DICE 2026, with Neil Druckmann set to present former partner Evan Wells with its highest award","It's been a while since we last had news on Intergalactic: The Heretic Prophet (beyond talk of more crunch ), Naughty Dog 's newest IP, but boss Neil Druckmann has been able to openly talk about other things, such as HBO's ongoing The Last of Us show . Next month, however, he'll be found in the open again as he presents former partner Evan Wells with DICE's esteemed Hall of Fame Award. Read more"
"New games performed really well on Steam last year, shaking the dominance of the same old live service games",New games performed really well on Steam last year - notably better than the year before. Read more
"Despite what fans are saying, Cyberpunk 2 creative director really doesn't think a longer Act 1 would have made Cyberpunk 2077 any better","More than five years after its troubled original release, Cyberpunk 2077 continues to be one of the most relevant open-world RPGs of the modern era. Much of its success comes from the believable relationships it quickly establishes between its key characters and V, but the pre-disaster prologue with preem choom Jackie was never meant to go on for too long. Read more"
"""Steam Charts don't measure fun"" - Splitgate Arena Reloaded developer responds to concerning PC launch numbers","Splitgate Arena Reloaded developer 1047 Games has shared some words regarding how its rereleased and repackaged game is doing over on Valve's PC platform, stating: ""Steam Charts don't measure fun."" Read more"
"Why is Arc Raiders cheaper than most triple-A games? Thanks to Helldivers 2, mostly","Embark Studios' founder Patrick Soderlund has stated that Arc Raiders , a game initially meant to release as a free-to-play title, launched as a $40 premium price point in part due to Helldivers 2 's approach. Read more"
Stranger Things' final battle was influenced by Baldur's Gate 3,"The Duffer brothers, creators of Stranger Things, have said the final battle of the TV series was partially inspired by Baldur's Gate 3 . Matt Duffer was apparently playing the game while devising the showdown. Read more"
PlayStation's top five most-played games of 2025 are exactly the same as 2024's,"The top five games played on the PlayStation in 2025 by US players were exactly the same as in 2024, according to Circana's Player Engagement Tracker. Read more"
The Traitors' Celia Imrie and more announced for Amazon's live-action Tomb Raider series,Amazon has announced more cast members joining its live-action Tomb Raider series . Read more
"""We don't need to demonise it"" - actor Troy Baker believes gen-AI could drive people to seek out ""authentic"" experiences","Troy Baker, one of the most well known actors working in video games, believes generative AI could have a positive effect overall on performing arts. Baker thinks it'll cause a reaction whereby people will seek out ""authentic"" experiences more - live shows, live theatre - and turn away from ""gruel that gets distilled to me through a black mirror"". Read more"
Here are our Xbox Game Pass games for January,Microsoft has revealed the first batch of games coming to its Xbox Game Pass subscription service this January. Read more
"007 First Light can run on a seven-year-old GPU according to new PC requirements, but 4K specs are strangely absent","Hitman developer IO Interactive has detailed the PC requirements for its upcoming James Bond origin story, 007 First Light. Read more"
Final Fantasy 14 sees severe server outages on savage raid release due to DDOS attacks,"Final Fantasy 14 has released its latest Savage-tier raid today, pushing the game's best and brightest to race through this new challenge group content to earn powerful loot and see which region can take it down first. However, for Americans, this is proving difficult due to ongoing DDOS attacks and server outages. Read more"
Sony has patented an AI gaming ghost that will play PlayStation games for you when you get stuck,"A patent filed by Sony over a year ago has resurfaced, and shows the company has ideas for an AI 'ghost' that could assist players if they get stuck in a game. Read more"
"Amidst a sea of GenAI, Nvidia's DLSS 4.5 update means gamers are at least getting something out of CES","The PC graphics market might be in peril in hardware terms, with prices spiraling and availability inconsistent, but on the software side things are at least reliably moving forward - with Nvidia today announcing the latest upgrade to its DLSS technology. Read more"
"Arc Raiders player calls for help during game, gets door kicked-in by concerned neighbour","An Arc Raiders player calling for help while playing the game had their door kicked in by a concerned neighbour, who thought their wails were a sign of real-world distress. Read more"
From the Air Force to arcades to home consoles: Sega co-founder David Rosen dies aged 95,"UPDATE: Sega has officially responded to the passing of David Rosen, saying it's ""deeply saddened"" to hear of the news. Read more"
"Surprise! Xbox Game Pass has added two more games, as five others get ready to leave the service soon",The team over at Xbox has added two previously unannounced games to its Game Pass subscription service. Read more
One of the best action games released in recent memory is getting a special re-release soon,"Hi-Fi Rush , the most recent game from Tango Gameworks, is getting a special re-release in collaboration with Limited Run Games. Read more"
"CES 2026: HP announces the ""world's most powerful gaming laptop"" and next-gen QD-OLED monitor","HP is always a major player at CES in Las Vegas, and it has announced a raft of HyperX-branded and OLED-equipped gaming laptops with next-gen Intel and AMD processors - including one it claims is the ""world's most powerful gaming laptop with fully internal cooling"". HP has also unveiled a series of (mostly) OLED gaming monitors, including a tantalising 34-inch 360Hz ultra-wide. Read more"
The Last of Us season three to recast Manny,The upcoming third season of HBO's The Last of Us TV adaptation will feature a new actor playing WLF member Manny. Read more
Beloved Final Fantasy artist Toshiyuki Itahana leaves Square Enix,"Toshiyuki Itahana, character artist for the Final Fantasy series, including games like Final Fantasy 9 , Final Fantasy Crystal Chronicles , and Final Fantasy 14 : Dawntrail, has left Square Enix . Read more"
"Alicia Vikander's Tomb Raider film from 2018 just made it onto Netflix's top 10, ahead of series' 30th anniversary this year","Alicia Vikander's turn as Lara Croft in 2018's Tomb Raider adaptation is having a bit of a renaissance it seems. The film, which is largely based on the rebooted Survivor timeline, recently popped up on the Netflix top 10 films list, seven years (give or take) since its initial release. Read more"
"Arc Raiders may have just surpassed over 12m lifetime sales, analyst estimates","Arc Raiders may have surpassed 12m sales at the start of 2026, according to video game industry analysts. Read more"
The Blood of Dawnwalker's main musical theme sounds a lot like The Witcher 3's - and for good reason,"Polish developer Rebel Wolves has unveiled the main musical theme for its promising dark fantasy role-playing The Blood of Dawnwalker, and surprise surprise, it sounds a lot like The Witcher 3 . Read more"
"Nintendo ""intentionally held back"" many aspects of Zelda: Tears of the Kingdom so there was more content for Hyrule Warriors to work with","On its release back in 2023, Nintendo kept the Imprisoning War Sages from The Legend of Zelda: Tears of the Kingdom shrouded in a certain amount of mystery. In fact, despite them playing a fairly key role in terms of the overall backstory, we only saw them in the game very briefly. Read more"
What do you want to happen to the Final Fantasy franchise? You've got a few days to tell Square Enix directly,"There are a few series staples you can expect from Final Fantasy : a guy called Cid, moogles, chocobos, that lovely arpeggio motif in the music, and… surveys? If you've been reading this site for a while - or, indeed, following the Final Fantasy series - you'll know that Square Enix likes to lobby the fanbase to hear our thoughts about the series' identity and future. Read more"
"Oops, League of Legends was briefly unplayable as Riot Games forgot to renew the digital licence","Popular MOBA League of Legends was briefly unplayable over the past 24 hours, as the digital licence for the game expired. Read more"
"Clair Obscur: Expedition 33 developer feels it needs to ""trust its instincts"" for its next game, instead of being guided by fan pressure","Clair Obscur: Expedition 33 developer Sandfall will focus on what those at the studio personally think is ""cool"" for its next game, rather than feel any pressure to focus on what anyone else thinks it should do. Read more"
"After a controversial marketing campaign, Splitgate Arena Reloaded fails to find an audience despite two official launches","Splitgate Arena Reloaded, an overhauled relaunch of arena shooter Splitgate 2, appears to be facing a rocky start in its efforts to revitalise the game. Read more"
"Yes, aggression-matchmaking is now a thing in Arc Raiders","If you've found you've been coming up against tougher players in Arc Raiders just recently, that could well be because you've been deemed an ""aggressive"" player. Read more"
Resident Evil 4 Remake cut an entire opening chapter that starred Ashley,Capcom cut an entire chapter in which you played as Ashley in the opening of Resident Evil 4 Remake . Read more
Dataminers think they've discovered even more proof that Monster Hunter Wilds is coming to Nintendo Switch 2,Dataminers believe they've discovered more evidence that Monster Hunter Wilds could be coming to Nintendo Switch 2 . Read more
"2025 Steam Award winners announced, and the player-voted results are a little surprising","43.8 million player votes later, the winners of the 2025 Steam Awards have been announced, with Hollow Knight: Silksong securing top prize, Game of the Year. Read more"
"Xbox suffers ""worst year on record"" for console sales in the UK",2025 has been the worst year on record for Xbox console sales in the UK. Read more
Silent Hill 2 Remake and Cronos dev has one word for you - RemosdNeulSerorehsoOvamCeyerd,Silent Hill 2 Remake and Chronos: The New Dawn developer Blooper Team kicked off the new year with a mysterious word: remosdneulserorehsoovamceyerd. Read more
Anthem's end is nearly here - only days remain before EA will switch off the servers to BioWare's ill-fated multiplayer game,"Time flies (like a Javelin suit): there are only 10 days left to play BioWare's ill-fated multiplayer game Anthem before the servers are switched off, presumably forever. Read more"
"AMD and Nvidia will reportedly raise GPU prices ""significantly"" in 2026","According to a new report, both AMD and Nvidia will raise the prices of their consumer GPUs ""significantly"" this year. If this report is true, both companies will have pushed these price hikes by next month. Read more"
Underrated 'slow life RPG' Fantasy Life i gets a free roguelike mode in surprise new year update,Underrated 'slow life' role-playing game Fantasy Life i: The Girl Who Steals Time - which stole a lot of my time last year on Switch 2 - has just received an exciting new year content drop. Read more
Is there really going to be a new Witcher 3 expansion this year?,"UPDATE 4.10PM GMT: CD Projekt Red, for what it's worth, has told me it does not comment on rumour or speculation - the company's usual line. Read more"
Prices of an obscure PS4 game are skyrocketing thanks to the latest PS5 jailbreak efforts,"The price of an obscure PS4 game is skyrocketing on the second-hand market, thanks to its necessity in a new PS5 jailbreak. This game, of which 1,000 or less physical copies were produced, has suddenly become a hot commodity among jailbreak enthusiasts and resellers alike. Read more"
"The first announcement for Persona's 30th anniversary isn't that thrilling, but don't worry: there's more to come","It's a big year for gaming anniversaries. There are five massive series that turn 40 years old in 2026 - The Legend of Zelda, Metroid, Dragon Quest, Kid Icarus, and Castlevania - whilst Sonic the Hedgehog turns 35, and Persona and Pokémon both turn 30. There's probably a lot of celebratory stuff coming over the next 12 months, but let's start with a franchise we know is getting some attention this year before anything else: Persona. Read more"
"A new Deux Ex isn't coming in 2026 as people in charge are ""psychopaths"", jokes series voice lead","Elias Toufexis, the voice actor behind robotic employee of the year and Deus Ex main character Adam Jensen, has assured fans that a new entry in the sci-fi series will not be coming in 2026, as the people in charge are ""psychopaths"". Read more"
"Blue Prince, our game of the year, is so much more than just a brilliant puzzler","My great aunt lived to be 102, and when she was dying she revealed that she had been married not five times but six. We have no idea who the sixth husband was or where he fit into the Aunt Mickey timeline. I have to assume we'll never know. Read more"
Here are our PS Plus monthly games for January,Sony has unveiled its PS Plus monthly game offerings for January. Read more
Arc Raiders was Steam's best-selling game over the holiday period,Arc Raiders was Steam's biggest-selling game over the holiday period. Read more
"Square Enix's Yosuke Saito teases there's ""just a little something"" on the way for fans of Nier and Dragon Quest in 2026","Nier producer Yosuke Saito has teased that there's ""just a little something"" on the way for fans in 2026. Read more"
"The 50 best games of 2025, ranked","It's been another strange, difficult, and yet somehow also brilliant year for video games in 2025. Triple-A releases have been sparse again, compared to the boom times of old, with a great big GTA 6 -shaped hole left in the final few months of the year. And yet once again, every gap left by the established order has been filled twice over with something brilliantly new. Read more"
"Rainbow Six Siege still struggling after Ubisoft was forced to briefly ""intentionally"" shut it down following third-party hack","Rainbow Six Siege is still struggling today after hackers gave out ""billions"" in in-game currency, forcing Ubisoft to briefly ""intentionally"" shut down the game. Read more"
"Former GTA director commends Larian Studios for stepping away from Baldur's Gate: ""It's easier to just keep on doing what you're doing""","Former Rockstar technical director, Obbe Vermeij, has commended Baldur's Gate 3 developer Larian Studios for walking away from the hugely successful Dungeons & Dragons series, calling it a ""bold move"". Read more"
Phantom Blade Zero clocks up over 1 million wishlists in just 2 weeks,Chinese action game Phantom Blade Zero has amassed over a million wishlists in the two weeks since its September 2026 release date was confirmed . Read more
"Eurogamer readers' top 50 games of 2025 - ""It made me cry three times""","2025 has gone by in a flash, hasn't it? Well, apart from the days I've spent tabulating all your Game of the Year votes and presenting the results here - that has felt like an eternity and I think has given me permanent neck pain. But, let's not worry about that. I'm sure you'll agree it was worth the sacrifice. Read more"
"Peak isn't ""trying to be Game of the Year"", but ""friendslop"" games do put ""connection front and centre of the experience""","Peak developer Aggro Crab has hit back at ""friendslop"" haters, insisting there's a place for co-op games that ""deliver a specific experience"", especially as they can be ""very cost-effective for indie production"". Read more"
GOG and CD Projekt founder Michał Kiciński acquires 100% ownership of GOG,"Michał Kiciński, co-founder of CD Projekt, has acquired 100 percent ownership of GOG, the DRM-free digital games store. Read more"
"Despite a load of great games in 2025, No Man's Sky is the happy place that keeps drawing me back in again","If we're plotting out the year based on unexpected obsessions, mine were (in no particular order) weird Italian genre cinema of the 60s and 70s, an unhealthy appetite for unnecessarily elaborate physical media collector's editions, folk horror in literally any form I could consume, and, apparently, No Man's Sky . According to Steam's usual end-of-year thing, the exploratory space sim is by far my most played game of 2025, accounting for - somewhat incredibly - nearly 20 percent of my total playtime. Read more"
"Penises set Dispatch apart, and I mean that quite sincerely","I think a lot of Dispatch can be distilled into a single moment at the beginning of the game when the player comes face to face with a penis. There it is, dangling visibly between the legs of an unclothed, toxic-drenched super-villain you're about to fight. The camera all but centers on it. There's no way you can miss it unless you've flipped the nudity switch off, in which case it's replaced by an even more conspicuous black box that only amplifies the naughtiness of the part hidden within. But most people don't turn nudity off because they're expecting boobs. That's what we usually see. In Dispatch, however, it's a penis we see waggling unavoidably on our screens. Read more"
"Donkey Kong Bananza might not be the best game of the year, but it's surely the one I loved the most","I think these days, after years of Nintendo outright eschewing the console power rat race and focusing instead on different ways to play and honing their core craft, we forget that Nintendo is still a pretty sharp company in terms of technical innovation. Raw power went aside with the Wii, but the company's dedication to tinkering around the edges to create stand-out original experiences in other ways remained - or perhaps even intensified. There's been a lot of examples over the years, of course, from clever game design innovations to zany peripherals - but Donkey Kong Bananza has to be one of the finest showcases of that thinking from Nintendo in years. Read more"
"Despelote showed me the year's greatest intro sequence, and its greatest advert for video games full stop","I'm going to spoil the opening of Despelote here - an opening which I think, as you can probably tell, is pretty glorious. It's not a spoiler so much as a contaminator, a finger on the scales of something it'll feel wonderful to go into unweighted. So go away right now if you want to experience it for yourself. Read more"
"Divinity Team Says Character Creation Will Be ""Even Better"" Than Baldur’s Gate 3","Baldur's Gate 3 was the kind of game that could take hours to get started, thanks in part to a rich character customization suite that allowed players to fine-tune everything from their race to several minute details. For the upcoming Divinity , developer Larian Studios says that players can expect ""even better"" options for fine-tuning their character when the game eventually launches. ""We are planning to have an even better one! More colors, more options, more control,"" Divinity art director Alena Dubrovina wrote in a Reddit AMA session . That's a high bar for the studio to set, considering just how detailed the Baldur's Gate 3 character customization system is. Beyond the standard options, players can also tinker with unique biological traits depending on the race they choose, fiddle around with facial features, and much more. Just when you think you've got your character nailed down, the game also offers you a chance to design a Spirit Guardian for your adventurer, a character who will appear in your dreams. Continue Reading at GameSpot"
Palworld Is Making A Play For The Trading Card Crowd Later This Year,"Palworld: Official Card Game, a brand-new trading card game based on Pocketpair's creature-collecting game, has been revealed by Bushiroad and developer Pocketpair. While details are light for now, the game already has a launch date penciled in for July 30. Bushiroad describes Palworld: Official Card Game as a two-player competitive card game where players can ""enjoy strategic and tactical battles"" by deploying unique Pals to the battlefield. ""Players fight alongside their Pal companions, gathering resources, and building bases as they aim for victory,"" the description reads. Each Pal also has unique traits, and cleverly utilizing them can open up a path to victory. Rumblings of a Palworld trading card game kicked off last year after Pocketpair and Animate subsidiary COS purchased shares in Japanese card game publisher Bushiroad. Bushiroad Corporation's CEO and president, Takaaki Kidani, sold his shares to the company (via Automaton ). This followed Pocketpair's formation of Palworld Entertainment, a new company arm dedicated to maximizing Palworld's merchandising opportunities. Continue Reading at GameSpot"
"Download The Hytale Launcher Now, As Hypixel Estimates ""Over 1 Million"" Players At Launch","Hytale has been on quite a development journey. After being acquired and subsequently shuttered by Riot Games, the original development team bought the Minecraft rival back and recommenced development in November 2025. On January 13, the title goes into early access, which the team acknowledges will be unpolished and full of bugs. Still, Hypixel--the developer behind one of the most popular Minecraft servers of all time--is expecting mammoth launch-day numbers, estimating ""over 1 million"" players. To that end, the studio is encouraging users to download the game's launcher ahead of time in order. Hypixel's CEO, Simon Collins-Laflamme, posted on X stating, ""We expect over 1 million players on the early access release day for Hytale ... Please download the launcher today and log in now to help us significantly reduce launch-day stress."" Hypixel's preorders have been open since early December, so the team has had around a month to gauge interest, meaning this player estimate is based on those figures and not just speculation. Hypixel has already allowed mod creators early access to the game so they can research and develop the best Hytale mods for the early access release. Modders are adding new game modes, cosmetics, items, and quality-of-life improvements to the game, with more being added daily. When the game launches tomorrow, January 13, all of those mods will be available via Curseforge thanks to an agreement between the modding platform and Hypixel Studios. Continue Reading at GameSpot"
Diablo 4 Leaderboards Are Coming,"Leaderboards have previously been a part of the Diablo franchise, and starting today, they're back. Blizzard is releasing a new Diablo 4 update across all platforms that reintroduces leaderboards as well as the multi-level dungeons known as The Tower. Blizzard's official site states that The Tower and the leaderboards are both in beta, with more refinements to come in future seasons. The leaderboards will be divided by the seven playable classes--Paladin, Rogue, Druid, Barbarian, Sorcerer, Necromancer, and Spiritborn. Additionally, the leaderboard rankings will only be set for two weeks periods rather than the entire season. Essentially, everyone gets a chance for a fresh start while Blizzard works out any kinks in the system. The leaderboard's rankings are directly linked to The Tower as players' scores are tabulated based on their performance when fighting monsters and bosses. Experienced players with refined character builds should be right at home in the chaos. For less experienced players, The Tower provides enhanced damage levels when players destroy the numerous pylons in the complex. That may not be the equal of having incredibly powerful characters, but it means that players of all skill levels are far from helpless against the onslaught of creatures coming for them in The Tower. Continue Reading at GameSpot"
Nintendo's Switch Game Voucher Program Will End Permanently This Month,"Nintendo is discontinuing the sale of Switch Game Vouchers, a program that allowed Nintendo Switch Online members to get a discount on first-party Switch games by purchasing two game vouchers for $100. While existing vouchers will remain valid, no new vouchers will be sold after January 30, 2026. With precious few discounts available for first-party Switch games, Nintendo's game vouchers allowed players to save a little cash by purchasing two vouchers for $100, saving $10 per game as long as both were $60 titles. While the program had a few caveats, including a one-year expiry and the requirement of an active Nintendo Switch Online membership, it offered a reliable discount on first-party games. If you want to take advantage of this discount one last time, game vouchers will still be sold until January 30, and will stay valid for one year after the date of purchase. You can also check the expiry date on any unused vouchers through the Nintendo Switch Online section of your Nintendo account. Continue Reading at GameSpot"
Baldur's Gate 3 Won't Be Coming To Switch 2,"In October 2025, rumors suggested that Larian Studios' hit RPG Baldur's Gate 3 could be getting a port for Nintendo's Switch 2 . Unfortunately, that report has turned out to be inaccurate as Larian has confirmed that its wildly popular D&D will not be coming to Nintendo's console. During a recent AMA session on Reddit , Baldur's Gate 3 director Swen Vincke acknowledged that the company wanted to work on a Switch 2 port, but it was denied. ""We would have loved to [bring Baldur's Gate 3 to Switch 2], but [it] wasn't our decision to make,"" wrote Vincke. That likely means the port was either shot down by Nintendo or by Hasbro/Wizards of the Coast, which controls the rights for all things Dungeons & Dragons-related. Continue Reading at GameSpot"
