title,text,scraped_at
Subnautica 2 is the latest behemoth to mess with other games' launch plans at the last minute: 'we need to dodge the Leviathan',Outbound will release three days earlier to avoid decimation.,2026-05-01T01:52:02.270920
"April's top 5 robots: they fail, they flail, they play ping pong and poop NFTs",Robots may someday dominate our world. Let's keep an eye on them.,2026-05-01T01:52:02.270920
"The new 'Xbox mode' for Windows 11 has arrived, but don't get your hopes up for performance improvements: it's just a new UI","The ""dedicated gaming experience"" for WIndows 11 is now rolling out in ""select markets.""",2026-05-01T01:52:02.270920
"I played the MindsEye mission about the alleged game saboteurs, and it sucks so bad","The mission is dull and witless, and the promised ""evidence"" of sabotage against developer Build a Rocket Boy utterly fails to materialize.",2026-05-01T01:52:02.270920
Fortnite's new partnered Star Wars games were not a great showcase of UEFN,The limitations of UEFN were on full display at a studio lot in Los Angeles.,2026-05-01T01:52:02.270920
Cyberpunk bartending sim VA-11 Hall-A devs' first game in 10 years finally launches this summer,.45 Parabellum Bloodhound is more my speed.,2026-05-01T01:52:02.270920
"EVE Online dev pays out $80,000 to mod contest winners for its experimental survival MMO",EVE Frontier is a game for true sickos.,2026-05-01T01:52:02.270920
"Invincible Vs may pack a punch for fans of the show, but I wish it had more going on outside its tight versus mode","Here's what I think, Mark.",2026-05-01T01:52:02.270920
"Xbox CEO Asha Sharma, who took the job less than 3 months ago, says 'player and revenue growth has not yet met our ambition' as Microsoft gaming continues to slide","I mean, yeah. No kidding.",2026-05-01T01:52:02.270920
"Gabe Newell was an enthusiastic supporter of OpenAI in 2018, donating $20 million and even acting as the sole member of an 'informal advisory board'","$20,008,279, to be precise.",2026-05-01T01:52:02.270920
"I'm having to completely retrain my muscle memory in Deep Rock Galactic: Survivor after 150 hours, because the new class they've added is just a dwarf in a car",The Heavy Duty expansion also adds a new mode and biome to the best Vampire Survivors-like around.,2026-05-01T01:52:02.270920
"Finally, someone is making a TV show based on a videogame that I actually want to watch","Sure, Fallout is cool, but have you ever played Atomfall?",2026-05-01T01:52:02.270920
How to get Water Filters in Arc Raiders,Break into boxes and cross your fingers.,2026-05-01T01:52:02.270920
How to get Agave in Arc Raiders,My least favourite forageable.,2026-05-01T01:52:02.270920
"Don't do this to me Zach Cregger, don't get me excited for a Resident Evil movie—I can't get hurt again","The higher we fly, the harder the fall.",2026-05-01T01:52:02.270920
"So, 47% of PC Gamer readers say they don't use AI at all, but I wonder...",Are you guys really not using upscaling in your games?,2026-05-01T01:52:02.270920
Glorious GHS Eternal review,"This ticks all the right boxes, but is outclassed by budget headsets that push the boat out.",2026-05-01T01:52:02.270920
Raspberry Pi-based homebrew dongle enables full wireless Sony DualSense controller functionality on the PC including haptics,"With better latency than a generic Bluetooth dongle, too?",2026-05-01T01:52:02.270920
"A gaming CEO just said 'We’ve been a little bit too romantic about the idea that we should have employees and give people long-term job security', and doesn't that sum up everything wrong with the industry right now",Netflix removing Monument Valley 3 seems to have shifted the studio's strategy.,2026-05-01T01:52:02.270920
'Our demand fulfillment rate is now at a record low' says Samsung as it makes its DRAM 90% more expensive than the previous quarter,"High demand, high prices, it's basic economics.",2026-05-01T01:52:02.270920
"After a glitch accidentally gave away a beloved RPG for free, the developer is letting you keep it","InXile's busy with Clockwork Revolution, but some of you can play its classic Wasteland game for free.",2026-05-01T01:52:02.270920
Subnautica 2's lead game designer says it helped cure his sea terror—only for its new apex ocean predator to give him all-new phobias: 'This is going to make many people sad and scared',Subnautica 2 is inventing new reasons to fear squids.,2026-05-01T01:52:02.270920
"Subnautica 2 devs say it's 'an exploration game first,' expanding on the first game's 'masterclass' in player-driven discovery","Subnautica 2 features a new world and new ocean, but its devs hope it offers a familiar sense of wonder.",2026-05-01T01:52:02.270920
"Subnautica 2 now has a firm early access launch date, and it's really soon","After months of turmoil, the aquatic survival sim is almost upon us.",2026-05-01T01:52:02.270920
"I just watched someone try to explain Deadlock to Joe Rogan for 6 minutes, and surprisingly, they kinda nailed it",Locked in.,2026-05-01T01:52:02.270920
How to get Red Coral Jewelry in Arc Raiders,A tricky trinket to find.,2026-05-01T01:52:02.270920
"After 3 hours with 007 First Light, IO's weaknesses are on display in a way they haven't been since Hitman: Absolution","James Bond: Spy, lover, connoisseur, obsessive hand-sanitizer collector.",2026-05-01T01:52:02.270920
'Motivated by jealousy...' OpenAI lashes out at Elon in blog post claiming the billionaire 'spent years harassing OpenAI through baseless lawsuits and public attacks',"Musk has said the current lawsuit is ""actually very simple. It's not okay to steal a charity.""",2026-05-01T01:52:02.270920
Microsoft's latest PowerToys tool brings control of your monitor into Windows: a must-have for anyone with lots of big monitors and too little time,"Power at your fingertips. Well, mouse button.",2026-05-01T01:52:02.270920
Former ESO boss Matt Firor talks about the death of unrealised MMO Project Blackbird: 'Microsoft is Microsoft',"""A giant successful videogame on the Microsoft level was frankly not that stimulating to them.""",2026-05-01T01:52:02.270920
Samsung says there are 'no supply chain issues to date' from war in the Middle East but the company is making logistical changes,The company has stocked up and is figuring out alternative logistics.,2026-05-01T01:52:02.270920
You don't actually have to fight Arc Raiders deadly new robot to get its parts,You'll need Turbine Compressors for the Avian Alarm project and a new gadget.,2026-05-01T01:52:02.270920
'Where the goblins came from': OpenAI's strange but not entirely surprising story of little critters infesting ChatGPT's output,"'Goblins, gremlins, and other creatures...'",2026-05-01T01:52:02.270920
"MMO vet Matt Firor was going to make Fallout Online in 2007, but Interplay 'went totally dark on me' and he went to Bethesda to make ESO instead",What could've been.,2026-05-01T01:52:02.270920
"'Why didn't anyone think of this before?': Former Elder Scrolls Online boss loves Crimson Desert, but making 'a singleplayer MMO is almost like cheating' to him",Pearl Abyss skipped the hardest part.,2026-05-01T01:52:02.270920
Arc Raiders' weapon durability changes are mystifying—especially when repairing guns is one of the least enjoyable parts of the game,I have to repair my Anvil every run now. That's… fun?,2026-05-01T01:52:02.270920
How to get Fertilizer in Arc Raiders,Use the best Fertilizer farm to finish your Avian Alarm project quickly.,2026-05-01T01:52:02.270920
Microsoft predicts memory crisis will affect its revenue as struggling OEMs won't be as liberal with Windows spending,"Reaping what it sows in the AI era, perhaps.",2026-05-01T01:52:02.270920
First test of new ROG Equalizer cable intended to be overkill for your GPU isn't as clear cut as one might expect,Der8auer has put this cable to the test.,2026-05-01T01:52:02.270920
"Heroes of Might and Magic: Olden Era isn't a reimagining or a divisive reinterpretation, it's just a brilliant strategy game",Conquering the world like it's 1999.,2026-05-01T01:52:02.270920
How to get Moss in Arc Raiders,You'll need Moss for your Avian Alarm project.,2026-05-01T01:52:02.270920
Take-Two CEO wants to ensure GTA 6's price 'feels very reasonable' but also says that games aren't expensive as they could be right now,"You'll pay for it with your soul, that sounds reasonable to me.",2026-05-01T01:52:02.270920
'This is the first time where I'm seeing no light at the end of the tunnel': How the memory crisis is hitting PC builders,It seems like costly memory prices are making everyone hurt.,2026-05-01T01:52:02.270920
"Apple has reportedly 'given up' on the Vision Pro headset and that doesn't seem like a good thing for VR, generally","No more Metaverse, Vision Pro apparently dead, VR just can't get a break... roll on Steam Frame.",2026-05-01T01:52:02.270920
Microsoft CEO says the company is focused on 'fundamentals' to 'win back fans and strengthen engagement' in Windows 11,"The software giant has already made some changes, so let's hope they stick.",2026-05-01T01:52:02.270920
"The next Tales Of remaster has leaked, and it's probably not what you're expecting","Bandai Namco's remaster mission continues apace, this time with a deep cut.",2026-05-01T01:52:02.270920
"Thanks to Musk v. Altman lawsuit, it's now public record that Gabe Newell emailed Elon Musk to get his pal Hideo Kojima a tour of SpaceX and OpenAI",The man really wants to go to space.,2026-05-01T01:52:02.270920
Neverness to Everness tier list and best characters,Your guide to the top tier characters and team compositions for Neverness to Everness.,2026-05-01T01:52:02.270920
"This mod brings concussions back into Madden 26, including symptoms like blurred vision, dizziness, and slower reaction times",The mod was created by the Derek Sheely Foundation to bring more awareness to the dangers and warning signs of traumatic head injuries.,2026-05-01T01:52:02.270920
"Chinese-made soulslike Wuchang: Fallen Feathers, set in historical China, is now owned by... Italians?","The property was purchased by 505 Games parent company Digital Bros., following the reported dissolution of original developer Leenzee.",2026-05-01T01:52:02.270920
Two computer giants of the 80s - the Spectrum and C64 - are being turned into pocket-sized handhelds by the makers of Evercade,"<img src=""https://assetsio.gnwcdn.com/evercade-home-computer-handhelds.jpg?width=690&quality=85&format=jpg&auto=webp"" /> <p>If, like me, your childhood was one of Masters of the Universe and Rainbow Brite rather than a strange computer-generated man poking his head out a toilet, prepare to ready the nostalgia klaxon: Evercade maker Blaze Entertainment - via its Hyper Mega Tech arm - has unveiled handheld editions of two 80s home computer giants, the Spectrum and Commodore 64, that are launching this October.</p> <p><a href=""https://www.eurogamer.net/spectrum-commodore-64-handhelds-october"">Read more</a></p>",2026-05-01T01:52:02.270920
"That weird 007: First Light PS5 controller design is deliberate, IOI art director explains","<img src=""https://assetsio.gnwcdn.com/bond-controller.jpg?width=690&quality=85&format=jpg&auto=webp"" /> <p>Remember a couple of weeks ago when the internet got unusually annoyed (or maybe not that unusually) about the design of 007: First Light's limited edition DualSense PS5 controller?</p> <p><a href=""https://www.eurogamer.net/007-first-light-weird-ps5-controller-design-deliberate"">Read more</a></p>",2026-05-01T01:52:02.270920
"Krafton's removal from Subnautica 2 Steam page ""blown up a little bigger than it was meant to"", as developers emphasise continued co-publishing support","<img src=""https://assetsio.gnwcdn.com/subnautica-steam.jpg?width=690&quality=85&format=jpg&auto=webp"" /> <p>Publisher Krafton's removal from the <a href=""https://www.eurogamer.net/games/subnautica-2"">Subnautica 2</a> Steam page may have been ""blown up a little bigger than it was meant to"", as developers from Unknown Worlds have reaffirmed that the partnership is ongoing.</p> <p><a href=""https://www.eurogamer.net/subnautica-2-krafton-steam-page"">Read more</a></p>",2026-05-01T01:52:02.270920
"Despite Krafton's ""AI-first"" ambitions, absolutely no generative AI has been involved in Subnautica 2: ""It's not something we're using at all""","<img src=""https://assetsio.gnwcdn.com/subnautica-ai.jpg?width=690&quality=85&format=jpg&auto=webp"" /> <p>No generative AI has been used to create oceanic survival game <a href=""https://www.eurogamer.net/games/subnautica-2"">Subnautica 2</a>, despite publisher Krafton's publicly stated ""AI-first company"" ambitions.</p> <p><a href=""https://www.eurogamer.net/subnautica-2-no-generative-ai"">Read more</a></p>",2026-05-01T01:52:02.270920
"""Co-op makes everything significantly more difficult"" - How Subnautica 2's addition of multiplayer required ground-up rethinking of the survival classic","<img src=""https://assetsio.gnwcdn.com/subnautica-2-helmet-warning.jpg?width=690&quality=85&format=jpg&auto=webp"" /> <p>It's an accepted reality of horror - be it in video games or elsewhere - that things are more daunting when you're alone. The stakes may lessen in a group, the threat may diminish. The same is true of survival games, where extra hands can construct a base or fend off a threat in a fraction of the time of a solo player. So what happens when a popular survival game, known for lurking dangers deep in the ocean, opens the door to four-player co-op?</p> <p><a href=""https://www.eurogamer.net/subnautica-2-coop-interview"">Read more</a></p>",2026-05-01T01:52:02.270920
"Despite live-action Bond's reported toils, 007: First Light dev says working with Amazon MGM has actually been ""surprisingly straightforward""","<img src=""https://assetsio.gnwcdn.com/bond-amazon.jpg?width=690&quality=85&format=jpg&auto=webp"" /> <p>For all the reported toil and general sluggishness with the James Bond license at owners Amazon MGM, working with them has actually been ""the easy part"" for 007: First Light developer IOI Interactive, according the game's art director Rasmus Poulsen.</p> <p><a href=""https://www.eurogamer.net/007-first-light-dev-james-bond-working-with-amazon-mgm-surprisingly-straightforward"">Read more</a></p>",2026-05-01T01:52:02.270920
Playing 007: First Light makes me wonder if it's actually possible to nail James Bond - but IOI has made a cracking attempt,"<img src=""https://assetsio.gnwcdn.com/007-First-Light-preview-header.jpg?width=690&quality=85&format=jpg&auto=webp"" /> <p>I've played about three hours of Hitman studio <a href=""https://www.eurogamer.net/companies/io-interactive"">IO Interactive</a>'s 007: First Light, give or take. The most immediate takeaway I have? This is not a Hitman game. I'm not a major Hitman expert, mind, so I can't speak to the really minute things that might subtly carry across, but I've played enough to know the essentials. I always saw Hitman, especially the most recent version, as being about playing in a big, layered sandbox of lethality. You can biff a guy with a flying suitcase or drop a piano on someone or, I dunno, twist a sign around so when your assination target runs really, really fast they unwittingly go straight off a cliff.</p> <p><a href=""https://www.eurogamer.net/007-first-light-game-preview-james-bond-hands-on-interview"">Read more</a></p>",2026-05-01T01:52:02.270920
"Nintendo just surprised everyone with a Super Mario Galaxy 2 update, which adds new story content over a decade after the game originally released","<img src=""https://assetsio.gnwcdn.com/rosalina_SOoooZk.jpg?width=690&quality=85&format=jpg&auto=webp"" /> <p>Over a decade after its original release, Nintendo has casually added a new bit of lore to <a href=""https://www.eurogamer.net/games/super-mario-galaxy-2"">Super Mario Galaxy 2</a>.</p> <p><a href=""https://www.eurogamer.net/super-mario-galaxy-2-update-new-story-rosalina"">Read more</a></p>",2026-05-01T01:52:02.270920
"""Beware of utopia"" - 007: First Light dev says studio hasn't used any generative AI on Bond game","<img src=""https://assetsio.gnwcdn.com/bond-ai.jpg?width=690&quality=85&format=jpg&auto=webp"" /> <p>007: First Light's art director Rasmus Poulsen says developer <a href=""https://www.eurogamer.net/companies/io-interactive"">IO Interactive</a> hasn't used any generative AI on the upcoming James Bond game, noting that, aptly, ""the thematics of Bond are often: beware of utopia.""</p> <p><a href=""https://www.eurogamer.net/007-first-light-dev-not-using-gen-ai-beware-utopia-bond-theme"">Read more</a></p>",2026-05-01T01:52:02.270920
"Our first trailer for Zach Cregger's Resident Evil movie has echoes of Weapons and more, but does fall a little short on lickers","<img src=""https://assetsio.gnwcdn.com/a-scared-man-shines-a-light-from-(I-think)-his-phone-is-Resident-Evil-movie-trailer.jpg?width=690&quality=85&format=jpg&auto=webp"" /> <p>The first trailer for the Resident Evil movie, from Weapons director Zach Cregger, is here, and so far it doesn't seem to be <em>all </em>that Resident Evil.</p> <p><a href=""https://www.eurogamer.net/resident-evil-movie-zach-cregger-first-trailer"">Read more</a></p>",2026-05-01T01:52:02.270920
"Dragon Quest 11 S gets rated for Switch 2, potentially giving Square Enix a fifth bite of the apple","<img src=""https://assetsio.gnwcdn.com/dq11-switch-2.jpg?width=690&quality=85&format=jpg&auto=webp"" /> <p><a href=""https://www.eurogamer.net/companies/square-enix"">Square Enix</a> is on a bit of a roll with its <a href=""https://www.eurogamer.net/platforms/switch-2"">Switch 2</a> ports at the moment, <a href=""https://www.eurogamer.net/final-fantasy-7-rebirth-switch-2-impressions"">as I'm sure Final Fantasy 7 Rebirth is very keen to remind you</a>. But today, Square Enix's other big RPG behemoth is in the spotlight, as a classification for a potential Nintendo Switch 2 version of Dragon Quest 11 S has surfaced in Taiwan. The listing appeared on 29th April.</p> <p><a href=""https://www.eurogamer.net/dragon-quest-11-s-switch-2-rating"">Read more</a></p>",2026-05-01T01:52:02.270920
"Sony confirms it's added ""one-time"" DRM to digital PlayStation games requiring you to go online to avoid losing access, but doesn't comment on ""CBOMB"" issue","<img src=""https://assetsio.gnwcdn.com/Helldivers-2-Siege-Breakers.jpg?width=690&quality=85&format=jpg&auto=webp"" /> <p>Sony has issued a statement confirming the introduction of a new DRM online check for newly bought PlayStation games, reassuring the public that games can be bought and played as usual. This statement, however, does not address concerns around the ""CBOMB"" issue.</p> <p><a href=""https://www.eurogamer.net/sony-comment-playstation-30-day-drm"">Read more</a></p>",2026-05-01T01:52:02.270920
"Intergalactic: The Heretic Prophet is ""a different side of Naughty Dog"", says lead actress","<img src=""https://assetsio.gnwcdn.com/Intergalactic-The-Heretic-Prophet-trailer-screenshot-showing-a-female-in-a-grey-vest-shaving-her-head.jpg?width=690&quality=85&format=jpg&auto=webp"" /> <p><a href=""https://www.eurogamer.net/companies/naughty-dog"">Naughty Dog</a>'s next game, Intergalactic: The Heretic Prophet, is ""a different side"" of The Last of Us and Uncharted studio Naughty Dog.</p> <p><a href=""https://www.eurogamer.net/intergalactic-the-heretic-prophet-naughty-dog-different-side"">Read more</a></p>",2026-05-01T01:52:02.270920
"Xbox ""has work to do"", but is ""recommitting"" to core fans following hardware revenue drop of 33% year-on-year","<img src=""https://assetsio.gnwcdn.com/green-Xbox-logo-on-a-dark-background.jpg?width=690&quality=85&format=jpg&auto=webp"" /> <p>Earlier today, Microsoft shared its <a href=""https://www.microsoft.com/en-us/investor/earnings/fy-2026-q3/press-release-webcast"">earnings results Q3 FY2026</a>, covering for the period between 1st January and 31st March. Microsoft's revenue is up 18 percent, at $82.9bn, though gaming revenue fell seven percent. Xbox content and services also saw a drop of five percent year on year. Microsoft attributed this to ""a prior year comparable that benefited from strong first-party performance"".</p> <p><a href=""https://www.eurogamer.net/microsoft-xbox-recommitting-hardware-revenue-drop-fy2026-q3"">Read more</a></p>",2026-05-01T01:52:02.270920
"Nine years later, Injustice 3 is reportedly finally in development","<img src=""https://assetsio.gnwcdn.com/harley-ij-2.jpg?width=690&quality=85&format=jpg&auto=webp"" /> <p>A new report has claimed that Mortal Kombat developer NetherRealm Studios is working on Injustice 3, a new installment to the popular DC fighting game franchise.</p> <p><a href=""https://www.eurogamer.net/injustice-3-reportedly-in-development"">Read more</a></p>",2026-05-01T01:52:02.270920
"3.7 million players later, UK-made action-survival game Atomfall is getting its own TV show","<img src=""https://assetsio.gnwcdn.com/atomfall_DauHvLN.jpg?width=690&quality=85&format=jpg&auto=webp"" /> <p>Today, publisher Rebellion has announced that its 2025 action-survival game, Atomfall, is the latest game to make the transition from console to TV screen. Rebellion and Two Brothers Pictures have announced a television adaptation of Atomfall (<a href=""https://www.eurogamer.net/clair-obscur-expedition-33-takes-best-game-award-at-2026-bafta-games-awards-but-shares-spotlight-with-dispatch-with-3-wins-each#:~:text=Clair%20Obscur%3A%20Expedition%2033%20takes,3%20wins%20each%20%7C%20Eurogamer.net"">which won Best British Game at 2026's BAFTA Game Awards</a>, by the way), but no casting or release window information has been revealed just yet.</p> <p><a href=""https://www.eurogamer.net/atomfall-tv-show-revealed"">Read more</a></p>",2026-05-01T01:52:02.270920
"Take-Two CEO says ""there's nothing to announce"" about an LA Noire sequel after acquiring its creator's studio, but ""the teams are always looking at what we have""","<img src=""https://assetsio.gnwcdn.com/0fdbc4f9c1b44642a4acde8073ebfde2.jpg?width=690&quality=85&format=jpg&auto=webp"" /> <p>15 years after its original release, Team Bondi and <a href=""https://www.eurogamer.net/companies/rockstar-games"">Rockstar Games</a>' LA Noire continues to have a sizeable following, but - despite <a href=""https://www.eurogamer.net/rockstar-mulling-la-noire-2-development"">Rockstar saying it wouldn't ""count out the possibility"" of a follow-up back in 2012</a> - a sequel has never emerged. Even so, new comments from Take-Two CEO Strauss Zelnick have suggested there's potentially still hope.</p> <p><a href=""https://www.eurogamer.net/take-two-ceo-la-noire-sequel"">Read more</a></p>",2026-05-01T01:52:02.270920
"As rumours of a new Star Fox game swirl, we finally know what happened to the series' iconic promotional puppets from the 90s","<img src=""https://assetsio.gnwcdn.com/Star-Fox-puppets-showing-four-space-exploring-animals-looking-heroically-towards-the-sky.jpg?width=690&quality=85&format=jpg&auto=webp"" /> <p>Back in the hazy days of the early 90s, Nintendo used puppet versions of Fox McCloud, Slippy, Falco and Peppy to promote its then-upcoming release of SNES classic <a href=""https://www.eurogamer.net/games/star-fox"">Star Fox</a> (or Starwing, if you must). After the campaign had run its course, however, the puppets faded from the public eye (though, not from our memories). But, what actually happened to them?</p> <p><a href=""https://www.eurogamer.net/star-fox-puppets-fate"">Read more</a></p>",2026-05-01T01:52:02.270920
Here are our PS Plus monthly games for May,"<img src=""https://assetsio.gnwcdn.com/Nine-Sols-image-showing-some-cats-in-a-bathing-area-with-a-PS-Plus-logo-in-the-upper-left-corner.jpg?width=690&quality=85&format=jpg&auto=webp"" /> <p>We are on the cusp of yet another month, and that means another batch of games for PlayStation Plus, and today Sony revealed what's in store for all subscribers this May.</p> <p><a href=""https://www.eurogamer.net/here-are-our-ps-plus-monthly-games-for-may"">Read more</a></p>",2026-05-01T01:52:02.270920
GreedFall: The Dying World studio Spiders is reportedly closing its doors after parent company Nacon failed to find a buyer,"<img src=""https://assetsio.gnwcdn.com/GreedFall_Dying-World_character-closeup.jpg?width=690&quality=85&format=jpg&auto=webp"" /> <p>Less than two months after narrative-driven RPG sequel <a href=""https://www.eurogamer.net/games/greedfall-2"">GreedFall: The Dying World</a> left early access, its developer, Spiders, is reportedly being shut down. It's claimed the Paris-based studio is being liquidated after parent company Nacon failed to find a buyer.</p> <p><a href=""https://www.eurogamer.net/greedfall-studio-spiders-reportedly-shutting-down"">Read more</a></p>",2026-05-01T01:52:02.270920
"""What a joke"" - Marathon players are losing patience after getting constantly pelted with grenades, as Bungie promises fix","<img src=""https://assetsio.gnwcdn.com/marathon-bungie_5UWu4c4.jpg?width=690&quality=85&format=jpg&auto=webp"" /> <p>Grenade spamming remains a massive problem in Marathon, despite previous nerfs from developer Bungie. Now, with players losing patience with the deluge of explosives heading their way, Bungie has promised further adjustments to stack sizes to help remedy the problem.</p> <p><a href=""https://www.eurogamer.net/marathon-grenade-spam-bungie-nerfs"">Read more</a></p>",2026-05-01T01:52:02.270920
