title,text,scraped_at
"Final Fantasy 7 Remake 3 will not ""compromise on graphics whatsoever"" despite move to multiplatform release","<img src=""https://assetsio.gnwcdn.com/switch-2-games-final-fantasy-7-remake.jpg?width=690&quality=85&format=jpg&auto=webp"" /> <p>If learning that the next entry into the <a href=""https://www.eurogamer.net/final-fantasy-7-remake-review-a-faithful-remake-with-a-few-missteps-along-the-way"">Final Fantasy 7 Remake</a> series was going multiplatform had you worried about the graphical quality of <a href=""https://www.eurogamer.net/companies/square-enix"">Square Enix</a>'s upcoming narrative rollercoaster, a recent interview with director Naoki Hamaguchi should put those fears to rest.</p> <p><a href=""https://www.eurogamer.net/final-fantasy-7-remake-3-will-not-compromise-on-graphics-whatsoever-despite-move-to-multiplatform-release"">Read more</a></p>",2026-02-19T12:35:57.046390
A console release for Steam's cat-breeding roguelike hit Mewgenics is currently in the works,"<img src=""https://assetsio.gnwcdn.com/black-and-white-screenshot-from-Mewgenics-trailer-showing-a-scientist-with-hearts-in-his-eyes.jpg?width=690&quality=85&format=jpg&auto=webp"" /> <p>A console release for Steam's cat-breeding roguelike Mewgenics is currently in the works.</p> <p><a href=""https://www.eurogamer.net/a-console-release-for-steams-cat-breeding-roguelike-hit-mewgenics-is-currently-in-the-works"">Read more</a></p>",2026-02-19T12:35:57.046390
Dead by Daylight movie will be written by Crawl and The Conjuring writers,"<img src=""https://assetsio.gnwcdn.com/DBD_Standard_Edition-1024x560.jpg?width=690&quality=85&format=jpg&auto=webp"" /> <p>David Leslie Johnston-McGoldrick and Alexandre Aja will write Blumhouse-Atomc Monster's feature adaptation of Behaviour Interactive's <a href=""https://www.eurogamer.net/games/dead-by-daylight"">Dead by Daylight</a>.</p> <p><a href=""https://www.eurogamer.net/dead-by-daylight-movie-will-be-written-by-crawl-and-the-conjuring-writers"">Read more</a></p>",2026-02-19T12:35:57.046390
"""Father of Sega hardware"" Hideki Sato has reportedly died","<img src=""https://assetsio.gnwcdn.com/megadrive.jpg_iDI9m3H.jpg?width=690&quality=85&format=jpg&auto=webp"" /> <p>Hideki Sato, the designer of most Sega home consoles, has allegedly died.</p> <p><a href=""https://www.eurogamer.net/father-of-sega-hardware-hideki-sato-has-reportedly-died"">Read more</a></p>",2026-02-19T12:35:57.046390
"TT Games downgrades PC requirements after initially suggesting players needed 32GB RAM to meet ""recommended"" spec","<img src=""https://assetsio.gnwcdn.com/lego-batman_X6nRtxS.jpg?width=690&quality=85&format=jpg&auto=webp"" /> <p>TT Games has revised its PC specs for Lego Batman: Legacy of the Dark Knight downward after initially recommending at least 32GB of RAM.</p> <p><a href=""https://www.eurogamer.net/tt-games-downgrades-pc-requirements-after-initially-suggesting-players-needed-32gb-ram-to-meet-recommended-spec"">Read more</a></p>",2026-02-19T12:35:57.046390
Scott Pilgrim EX playable demo available now on Steam,"<img src=""https://assetsio.gnwcdn.com/Scott-Pilgrim-EX-new-key-art.jpg?width=690&quality=85&format=jpg&auto=webp"" /> <p>A playable demo for adventure brawler Scott Pilgrim EX is now available.</p> <p><a href=""https://www.eurogamer.net/scott-pilgrim-ex-playable-demo-available-now-on-steam"">Read more</a></p>",2026-02-19T12:35:57.046390
Bloober Team's big reveal is Layers of Fear 3,"<img src=""https://assetsio.gnwcdn.com/Screenshot-2026-02-15-at-14.55.35.png?width=690&quality=85&format=jpg&auto=webp"" /> <p><a href=""https://www.eurogamer.net/companies/bloober-team"">Bloober Team</a>'s countdown to Valentine's Day has ended, and despite all those rose references, it's not a Rule of Rose revival, but is, in fact, <a href=""https://www.eurogamer.net/games/layers-of-fear"">Layers of Fear</a> 3.</p> <p><a href=""https://www.eurogamer.net/bloober-teams-big-reveal-is-layers-of-fear-3"">Read more</a></p>",2026-02-19T12:35:57.046390
"Discord advises UK users that they ""may be part of an experiment"" where instead of their age verification data never leaving their phone, it will now actually leave their phone","<img src=""https://assetsio.gnwcdn.com/Screenshot-2026-02-14-at-18.32.02.png?width=690&quality=85&format=jpg&auto=webp"" /> <p>UK Discord users have raised concerns about the company's new age verification processes, claiming that while it had originally promised that ""video selfies submitted for facial age estimation will never leave a user's device"", a change in service provider allegedly now suggests otherwise.</p> <p><a href=""https://www.eurogamer.net/discord-advises-uk-users-that-they-may-be-part-of-an-experiment-where-instead-of-their-age-verification-data-never-leaving-their-phone-it-will-now-actually-leave-their-phone"">Read more</a></p>",2026-02-19T12:35:57.046390
"Clair Obscur: Expedition 33 adds yet another Game of the Year award to the list, this time from the DICE Awards","<img src=""https://assetsio.gnwcdn.com/Clair-Obscur_-Expedition-33_20250412215558.png?width=690&quality=85&format=jpg&auto=webp"" /> <p><a href=""https://www.eurogamer.net/games/clair-obscur-expedition-33"">Clair Obscur: Expedition 33</a> secured five awards at this week's Academy of Interactive Arts & Sciences' (AIAS) DICE Awards (not to be confused with EA's Stockholm studio of the same name), including the coveted Game of the Year prize, while Sucker Punch's <a href=""https://www.eurogamer.net/games/ghost-of-yotei"">Ghost of Yotei</a> secured three, including for Adventure Game of the Year.</p> <p><a href=""https://www.eurogamer.net/clair-obscur-expedition-33-adds-yet-another-game-of-the-year-award-to-the-list-this-time-from-the-dice-awards"">Read more</a></p>",2026-02-19T12:35:57.046390
"GTFO and Den of Wolves developer 10 Chambers confirms ""large number"" of layoffs, including ""several of the studio's co-founders""","<img src=""https://assetsio.gnwcdn.com/den-of-wolves-announcement-a.jpg?width=690&quality=85&format=jpg&auto=webp"" /> <p>Within hours of co-founder and chief development officer, Hjalmar Vikstr&ouml;m, <a href=""https://www.linkedin.com/posts/hjalmarvikstrom_hey-im-not-the-most-active-on-linkedin-activity-7427282044239413248-_sVU"">announcing his departure</a> to make ""way smaller games"", GTFO studio 10 Chambers has undertaken a ""significant restructuring of the studio, impacting a large number of roles, including several of the studio's co-founders"".</p> <p><a href=""https://www.eurogamer.net/gtfo-and-den-of-wolves-developer-10-chambers-confirms-large-number-of-layoffs-including-several-of-the-studios-co-founders"">Read more</a></p>",2026-02-19T12:35:57.046390
Steam wants you to share your PC specs on your reviews,"<img src=""https://assetsio.gnwcdn.com/steam_share_image.jpg?width=690&quality=85&format=jpg&auto=webp"" /> <p>Valve is testing the ability to permit Steam reviewers to include hardware specs in their reviews.</p> <p><a href=""https://www.eurogamer.net/steam-wants-you-to-share-your-pc-specs-on-your-reviews"">Read more</a></p>",2026-02-19T12:35:57.046390
"Why is there such a bustling community around Marathon's soundtrack, when the game isn't even out yet? One producer tells us why","<img src=""https://assetsio.gnwcdn.com/New-Project-(28).jpg?width=690&quality=85&format=jpg&auto=webp"" /> <p>If there's one thing that I am unapologetically a fan of when it comes to Marathon, it's the game's approach to music. An electronic tracklist is nothing new in video games, of course, but this mix of aggressive high-tempo tunes and haunting vocals had me hooked the moment I first heard a song from the game's trailers. It turns out I'm not alone.</p> <p><a href=""https://www.eurogamer.net/why-is-there-such-a-bustling-community-around-marathons-soundtrack-when-the-game-isnt-even-out-yet-one-producer-tells-us-why"">Read more</a></p>",2026-02-19T12:35:57.046390
"What we've been playing - ""I think my brain might be cooked""","<img src=""https://assetsio.gnwcdn.com/Nioh-3-image-showing-a-warrior-with-a-blade.jpg?width=690&quality=85&format=jpg&auto=webp"" /> <p>Hello and welcome back to our regular feature where we write a little about the games we've been playing. This week, Bertie plays a classic but finds himself getting a bit bored; Marie adopts a black cat called Salem; Tom can't get out of the menus; Victoria makes a young child cry; Dom Platinums a game and feels very smug about it; and Connor finds an inventive way to play two MMOs at once.</p> <p><a href=""https://www.eurogamer.net/what-weve-been-playing-i-think-my-brain-might-be-cooked"">Read more</a></p>",2026-02-19T12:35:57.046390
"""There's actually millions of people that still play it"" - Blizzard insists Diablo 3 still has a ""massive"" playerbase","<img src=""https://assetsio.gnwcdn.com/media_gallery_2.webp?width=690&quality=85&format=jpg&auto=webp"" /> <p>It's tempting to believe that the <a href=""https://www.eurogamer.net/games/diablo-iii"">Diablo 3</a> playerbase has been eclipsed by a resurgent <a href=""https://www.eurogamer.net/games/diablo-ii"">Diablo 2</a>: Resurrected on one side, and <a href=""https://www.eurogamer.net/games/diablo-iv"">Diablo 4</a> on the other, but according to Blizzard, that's not the case. Apparently there's still a ""massive"" playerbase playing Diablo 3, and it counts players in the ""millions"".</p> <p><a href=""https://www.eurogamer.net/millions-of-people-still-play-diablo-3-insists-blizzard"">Read more</a></p>",2026-02-19T12:35:57.046390
Reanimal doesn't exactly disprove co-op is the enemy of horror but it shows there's a place for human connection too,"<img src=""https://assetsio.gnwcdn.com/reanimal-co-op-header1.jpg?width=690&quality=85&format=jpg&auto=webp"" /> <p>Silence. Two crouched shapes silhouetted in the moonlight, breath held tight as something stirs. A torch beam slices through the shadows; strange grasping limbs slide into view; tension mounts, hearts pound, and then suddenly a voice cuts in, ""Hang on a minute, I'm just gonna run to the loo.""</p> <p><a href=""https://www.eurogamer.net/reanimal-doesnt-exactly-disprove-co-op-is-the-enemy-of-horror-but-it-shows-theres-a-place-for-human-connection-too"">Read more</a></p>",2026-02-19T12:35:57.046390
"Nioh 3 gets its first big post-launch patch on Steam and PlayStation 5, and it mostly affects progress-halting bugs","<img src=""https://assetsio.gnwcdn.com/Nioh-3-image-showing-a-warrior-with-a-blade.jpg?width=690&quality=85&format=jpg&auto=webp"" /> <p>Team Ninja and Koei Tecmo have released a new patch for <a href=""https://www.eurogamer.net/games/nioh-3"">Nioh 3</a>, with a swathe of fixes addressing - among other things - crashing and progression issues.</p> <p><a href=""https://www.eurogamer.net/nioh-3-gets-its-first-big-post-launch-patch-on-steam-and-playstation-5-and-it-mostly-affects-progress-halting-bugs"">Read more</a></p>",2026-02-19T12:35:57.046390
"Worried about Project Windless and generative AI? Don't fret, Krafton says the game is not using ""generative AI for content creation or narrative elements""","<img src=""https://assetsio.gnwcdn.com/Project-Windless-image-showing-a-large-chicken-like-character-holding-a-weapon.jpg?width=690&quality=85&format=jpg&auto=webp"" /> <p>The Project Windless team isn't using gen-AI for ""content creation or narrative elements"", Krafton has confirmed.</p> <p><a href=""https://www.eurogamer.net/worried-about-project-windless-and-generative-ai-dont-fret-krafton-says-the-game-is-not-using-generative-ai-for-content-creation-or-narrative-elements"">Read more</a></p>",2026-02-19T12:35:57.046390
"""We were turned into a joke from minute one"" - fired Highguard developer reflects on game's ill-fated launch and ""false assumptions"" after Game Awards reveal","<img src=""https://assetsio.gnwcdn.com/Screenshot-from-Highguard.jpg?width=690&quality=85&format=jpg&auto=webp"" /> <p>A former Wildlight developer has shared their thoughts on Highguard's release after its announcement at The Game Awards last year, stating due to ""false assumptions"" around its debut trailer, ""we were turned into a joke"".</p> <p><a href=""https://www.eurogamer.net/we-were-turned-into-a-joke-from-minute-one-fired-highguard-developer-reflects-on-games-ill-fated-launch-and-false-assumptions-after-game-awards-reveal"">Read more</a></p>",2026-02-19T12:35:57.046390
"One of the coolest trailers yesterday wasn't from the State of Play, it was a brand-new look at the stylish arcade racer Screamer","<img src=""https://assetsio.gnwcdn.com/screamer-face.jpg?width=690&quality=85&format=jpg&auto=webp"" /> <p>Yesterday was a big day for new video game trailers, courtesy of the Sony State of Play. But a little earlier, away from the limelight, came another lengthy showcase of an especially cool looking game you might have missed.</p> <p><a href=""https://www.eurogamer.net/one-of-the-coolest-trailers-yesterday-wasnt-from-the-state-of-play-it-was-a-brand-new-look-at-the-stylish-arcade-racer-screamer"">Read more</a></p>",2026-02-19T12:35:57.046390
"Untitled Goose Game developer's next game, Big Walk, coming to PS Plus Essential","<img src=""https://assetsio.gnwcdn.com/Big-Walk-image-showing-round-little-figures-standing-on-a-rocky-pass-with-a-PS-Plus-logo-in-the-upper-right-corner.jpg?width=690&quality=85&format=jpg&auto=webp"" /> <p>Last night, we got a flurry of PlayStation-flavoured announcements thanks to the most recent State of Play. From the <a href=""https://www.eurogamer.net/the-biggest-surprise-of-the-night-a-brand-new-aaa-john-wick-game-coming-from-the-developer-of-space-marine-2"">gun-fu of Jon Wick</a> and <a href=""https://www.eurogamer.net/open-world-ps5-game-project-windless"">the hench chicken man in Project Windless</a> to <a href=""https://www.eurogamer.net/gris-developers-beautiful-neva-gets-new-prologue-and-its-coming-sooner-than-youd-think"">the serene colour palette of Neva: Prologue</a>, it was a pretty stacked show.</p> <p><a href=""https://www.eurogamer.net/untitled-goose-game-developers-next-game-big-walk-coming-to-ps-plus-essential"">Read more</a></p>",2026-02-19T12:35:57.046390
Here are our PS Plus Premium and Extra games for February,"<img src=""https://assetsio.gnwcdn.com/Spider-Man-2's-Miles-and-Peter-in-their-spidey-suits-with-a-PS-Plus-logo-in-the-lower-right-corner.jpg?width=690&quality=85&format=jpg&auto=webp"" /> <p>Sony has lifted the lid on its PS Plus Premium and Extra game offerings for February.</p> <p><a href=""https://www.eurogamer.net/here-are-our-ps-plus-premium-and-extra-games-for-february"">Read more</a></p>",2026-02-19T12:35:57.046390
"Good news vampire hunters, Castlevania: Belmont's Curse is ""the beginning of numerous new products around Castlevania""","<img src=""https://assetsio.gnwcdn.com/Castlevania-belmonts-curse-art.jpg?width=690&quality=85&format=jpg&auto=webp"" /> <p>If you watched last night's <a href=""https://www.eurogamer.net/sony-state-of-play-february-2026-everything-announced"">Sony State of Play</a> and were especially hyped over Castlevania: Belmont's Curse, there's some really good news for you tucked away on <a href=""https://www.konami.com/games/castlevania/eu/en/"">the official Castlevania website</a>.</p> <p><a href=""https://www.eurogamer.net/castlevania-belmonts-curse-is-the-beginning-of-numerous-new-products-around-castlevania"">Read more</a></p>",2026-02-19T12:35:57.046390
"Open world PS5 game Project Windless is part-God of War, part-Dynasty Warriors, and has a veteran Far Cry director as its lead","<img src=""https://assetsio.gnwcdn.com/project-windless-header.jpg?width=690&quality=85&format=jpg&auto=webp"" /> <p><strong>UPDATE 10AM GMT:</strong> There's a Project Windless developer diary video which offers an extended look at the game, and at some making-of footage of the game. There's not much more information in it, but the reference is to the main character being the Hero King, who is presumably the main character of the book series The Bird That Drinks Tears. This is their origin story, set 1500 years before the events of those books.</p> <p><a href=""https://www.eurogamer.net/open-world-ps5-game-project-windless"">Read more</a></p>",2026-02-19T12:35:57.046390
Ghost of Yōtei's online co-op multiplayer Legends arrives next month,"<img src=""https://assetsio.gnwcdn.com/Ghost-of-Yotei-Legends-trailer-screenshot-showing-an-enemy-with-snakes-coming-from-their-face.jpg?width=690&quality=85&format=jpg&auto=webp"" /> <p>Ready your swords, as <a href=""https://www.eurogamer.net/games/ghost-of-yotei"">Ghost of Y&omacr;tei</a>'s online co-op multiplayer - known as Legends - is set to arrive in a little under a month.</p> <p><a href=""https://www.eurogamer.net/ghost-of-yoteis-online-co-op-multiplayer-legends-arrives-next-month"">Read more</a></p>",2026-02-19T12:35:57.046390
"Turns out Game Freak's ""relatively small"" internal team is supported by ""several dozen"" development partners for Beast of Reincarnation","<img src=""https://assetsio.gnwcdn.com/Beast-of-Reincarnation-trailer-screenshot-showing-a-dark-haired-female-with-her-hair-falling-over-her-eyes.jpg?width=690&quality=85&format=jpg&auto=webp"" /> <p>Game Freak has shed a little more light on the ""relatively small"" internal team working on its upcoming release, Beast of Reincarnation.</p> <p><a href=""https://www.eurogamer.net/turns-out-game-freaks-relatively-small-internal-team-is-supported-by-several-dozen-development-partners-for-beast-of-reincarnation"">Read more</a></p>",2026-02-19T12:35:57.046390
"Though Beast of Reincarnation is all about ""loneliness"", Game Freak doesn't want it to be sad: enter ""warmth"", ""reliability"" and your dog pal","<img src=""https://assetsio.gnwcdn.com/Koo-and-Emma-in-Beast-of-Reincarnation.jpg?width=690&quality=85&format=jpg&auto=webp"" /> <p>Game Freak may be best known as the developer behind many a Pok&eacute;mon game, but that could soon be changing with its upcoming release, Beast of Reincarnation.</p> <p><a href=""https://www.eurogamer.net/though-beast-of-reincarnation-is-all-about-loneliness-game-freak-doesnt-want-it-to-be-sad-enter-warmth-reliability-and-your-dog-pal"">Read more</a></p>",2026-02-19T12:35:57.046390
God of War goes 2D with pixelated Sons of Sparta (which is out right now!) as original PS2 trilogy eyes up the remake treatment,"<img src=""https://assetsio.gnwcdn.com/New-Project-(25)_tbK9WnT.jpg?width=690&quality=85&format=jpg&auto=webp"" /> <p>Santa Monica Studio has revealed a new game in the God of War series, and it is a 2D side-scroller.</p> <p><a href=""https://www.eurogamer.net/god-of-war-goes-2d-with-pixelated-sons-of-sparta-which-is-out-right-now-as-original-ps2-trilogy-eyes-up-the-remake-treatment"">Read more</a></p>",2026-02-19T12:35:57.046390
"As Silent Hill's stellar revival continues, here's our first proper look at next game Silent Hill: Townfall","<img src=""https://assetsio.gnwcdn.com/silent-hill-townfall_qk4p7AE.jpg?width=690&quality=85&format=jpg&auto=webp"" /> <p>
After years in the video game wilderness, Silent Hill finally feels like its back on track (we'll ignore the recent movie, however), and hopes are high that its winning streak will continue as we get our first proper look at the next game in the series, <a href=""https://www.eurogamer.net/games/silent-hill-townfall"">Silent Hill: Townfall</a>. 
</p> <p><a href=""https://www.eurogamer.net/heres-our-first-proper-look-at-silent-hill-townfall"">Read more</a></p>",2026-02-19T12:35:57.046390
"Crystal Dynamics just announced the first new Legacy of Kain game in 23 years (and another slick-looking Soul Reaver remaster, too)","<img src=""https://assetsio.gnwcdn.com/lok-header.jpg?width=690&quality=85&format=jpg&auto=webp"" /> <p>The <a href=""https://www.eurogamer.net/games/legacy-kain-soul-reaver"">Legacy of Kain</a> franchise might be one of the most beloved cult franchises in gaming (for Millennial goths with an English degree, like myself, at least). The dark fantasy action-adventure series kicked off with Blood Omen back in 1996, and followed that up with Soul Reaver in 1999, before a three-year run of <a href=""https://www.eurogamer.net/r-soulreaver2-ps2"">Soul Reaver 2</a>, Blood Omen 2, and Legacy of Kain: <a href=""https://www.eurogamer.net/games/defiance"">Defiance</a> rounded off the series for a <em>very </em>long time in 2003. Fast-forward 21 years, and we saw the release of <a href=""https://www.eurogamer.net/games/legacy-of-kain-soul-reaver-1-and-2-remastered"">Legacy of Kain: Soul Reaver 1 & 2 Remastered</a> in 2024 - reigniting dormant fans everywhere and bringing the esteemed series back into the spotlight.</p> <p><a href=""https://www.eurogamer.net/legacy-of-kain-ascendance-defiance-remastered-release-dates-march"">Read more</a></p>",2026-02-19T12:35:57.046390
The time has come for you to judge Marathon for yourself (again): there's a new 'server slam' running late Feb into March,"<img src=""https://assetsio.gnwcdn.com/Marathon-encounter.jpg?width=690&quality=85&format=jpg&auto=webp"" /> <p>Marathon is almost here, at long last. It's been a bumpy journey to get here, but the finish goal is finally in sight for Bungie. To celebrate the incoming launch, the developer has announced it will be hosting a Server Slam <strong>coming 26th February 26 and running until 2nd March</strong>. Which, for my money, is perilously close to the official release on 5th March.
</p> <p><a href=""https://www.eurogamer.net/the-come-has-come-for-you-to-judge-marathon-for-yourself-again-theres-a-new-server-slam-running-late-feb-into-march"">Read more</a></p>",2026-02-19T12:35:57.046390
The biggest surprise of the night? A brand new AAA John Wick game coming from the developer of Space Marine 2,"<img src=""https://assetsio.gnwcdn.com/John-Wick-in-a-suit-and-tie-in-the-upcoming-John-Wick-game.jpg?width=690&quality=85&format=jpg&auto=webp"" /> <p>Now, there were many things I was expecting to turn up at this evening's PlayStation State of Play. A Resident Evil Requiem demo, for example (I am not annoyed we don't have one yet, you are). One thing that wasn't on my bingo card, though, was a John Wick game. But, that's exactly what we got.</p> <p><a href=""https://www.eurogamer.net/the-biggest-surprise-of-the-night-a-brand-new-aaa-john-wick-game-coming-from-the-developer-of-space-marine-2"">Read more</a></p>",2026-02-19T12:35:57.046390
"Dead or Alive fans are eating well tonight: Koei Tecmo announces a new game is in development, and Dead Or Alive 6 Last Round launches this summer","<img src=""https://assetsio.gnwcdn.com/New-Project-(24)_75AJw2F.jpg?width=690&quality=85&format=jpg&auto=webp"" /> <p>It's been about seven years since we last had a meaningful udpate in the Dead or Alive franchise, but that all changed this evening when Koei Tecmo made an unexpected appearance at <a href=""https://www.eurogamer.net/playstation-state-of-play-february-2026-live-report-a-look-ahead-at-sonys-plans"">the PlayStation State of Play</a> to give us some new about the beloved fighting series.
</p> <p><a href=""https://www.eurogamer.net/koei-tecmo-announces-a-new-game-is-in-development-and-dead-or-alive-6-last-round"">Read more</a></p>",2026-02-19T12:35:57.046390
"Gris developer's beautiful Neva gets new prologue, and it's coming sooner than you'd think","<img src=""https://assetsio.gnwcdn.com/image-(10)_b1oBNTH.png?width=690&quality=85&format=jpg&auto=webp"" /> <p>Rather out of the blue, Nomada Studio has announced a prequel to its beautiful puzzle-platformer Neva.</p> <p><a href=""https://www.eurogamer.net/gris-developers-beautiful-neva-gets-new-prologue-and-its-coming-sooner-than-youd-think"">Read more</a></p>",2026-02-19T12:35:57.046390
Rayman fans rejoice! His first ever adventure is getting a fancy 30th anniversary edition and it's out very soon,"<img src=""https://assetsio.gnwcdn.com/rayman-30-anniversary-edition.jpg?width=690&quality=85&format=jpg&auto=webp"" /> <p>
Beloved limb-flinging video game mascot Rayman is 30 this year, and Ubisoft is celebrating the occasion with a special edition of his first ever adventure - and it's out on PS5 tomorrow, 13th February.
</p> <p><a href=""https://www.eurogamer.net/rayman-is-getting-a-fancy-30th-anniversary-edition-and-its-out-very-soon"">Read more</a></p>",2026-02-19T12:35:57.046390
Game Freak's Beast of Reincarnation gets release date with new gameplay trailer,"<img src=""https://assetsio.gnwcdn.com/Emma-in-Beast-of-Reincarnation.jpg?width=690&quality=85&format=jpg&auto=webp"" /> <p>Game Freak has revealed a release date for its upcoming action-RPG, Beast of Reincarnation.</p> <p><a href=""https://www.eurogamer.net/game-freaks-beast-of-reincarnation-gets-release-date-with-new-gameplay-trailer"">Read more</a></p>",2026-02-19T12:35:57.046390
Unlikely sequel Kena: Scars of Kosmora comes to PS5 and PC in 2026,"<img src=""https://assetsio.gnwcdn.com/kena-2-header.jpg?width=690&quality=85&format=jpg&auto=webp"" /> <p>
Sumptuous 2021 action-adventure Kena: Bridge of Spirits is getting a sequel, despite previous word from its developer suggesting one was unlikely, and it's coming to PlayStation 5 and PC later this year.
</p> <p><a href=""https://www.eurogamer.net/unlikely-sequel-kena-scars-of-kosmora-comes-to-ps5-and-pc-in-2026"">Read more</a></p>",2026-02-19T12:35:57.046390
"Death Stranding 2: On the Beach washes up on PC in March, less than a year since it arrived on PS5","<img src=""https://assetsio.gnwcdn.com/Death-Stranding-2-trailer-screenshot-showing-a-masked-figure-in-red-pointing-to-themself-with-their-thumb.jpg?width=690&quality=85&format=jpg&auto=webp"" /> <p><a href=""https://www.eurogamer.net/games/death-stranding-2"">Death Stranding 2: On the Beach</a> is coming to PC, and really rather soon.</p> <p><a href=""https://www.eurogamer.net/death-stranding-2-on-the-beach-washes-up-on-pc-in-march-less-than-a-year-since-it-arrived-on-ps5"">Read more</a></p>",2026-02-19T12:35:57.046390
