title,text
I've found my perfect summer game: A stomach-churning horror story about Czech train conductors built over a bafflingly deep simulation of a fictional subway,Rancid vibes only.
"Steam has raked in an estimated $11.1 billion gross revenue so far this year, says market analyst—its 'biggest-ever six months'",PC gaming continues to embiggen.
"College Football 27 to remove microtransactions after player backlash, though EA maintains they were only added to 'give players more choice'","The goal for CFB 28 is ""greater transparency and communication."""
The Elder Scrolls Online's developer deserved better than to get sucker-punched by Microsoft twice in two years,$2 billion over 10 years can't save you from Xbox.
Handheld gaming PCs are cooked,"Fancy a spot of pessimism, perchance?"
"Star Citizen's next update will switch focus to fixing its bug-riddled previous update, with bigger changes shunted to a later patch","""We're moving Siege of Orison and all instance-related content out of Alpha 4.9.0""."
"After 17 years, a developer has finally revived the dream of Hannah Montana Linux, an open source operating system themed around Hannah Montana",The era of Windows is at an end.
"Mortal Shell 2 is the latest game to join the Grand Theft Auto 6 release crush, but I don't think it has much to worry about because it looks sick as hell",Cold Symmetry's soulslike releases in August.
"After Space Marine 2 'literally changed everything', Saber Interactive has been inundated with offers from major licenses: 'We are in a very fortunate position to turn down more than we can accept'","""It changed how people look at us."""
A piece of GTA modding history that was considered lost has been rebuilt from scratch and fixed 22 years later,Ghost City is back and it's hauntingly beautiful.
"Call of Duty fans surprised to discover new Black Ops 2 port preserves the emblem editor, not surprised to find swastikas being made with it",The new PlayStation ports have preserved a controversial feature of the originals.
Xbox's new chief strategist is a metaverse true believer,Matthew Ball was hired to help fix Xbox. Will gamers like what he prescribes?
'Surprised there was anyone left to post this': Fans react as The Elder Scrolls Online debuts seasonal content days after hundreds laid off from studio,"Bad timing, or the worst timing?"
Assassin's Creed Black Flag Resynced sells 2 million copies in 1 day and achieves the 'highest concurrent player count ever recorded for an Assassin's Creed title' on Steam,The kids love Kenway.
How to get hardwood in Palworld,A requirement for crafting High Quality Wooden Boards.
"Microsoft responds to racist Xbox layoff conspiracy theory, says CEO Asha Sharma is 'American born, raised, and educated'","There are a lot of good reasons to criticize the people responsible for Xbox layoffs, but racism isn't one of them."
Palworld revises some of its most egregious creature designs for its 1.0 release,Some of Pocketpair's Pals now bear a bit less resemblance to their Pokémon predecessors.
"id Software provides proof of life, says it 'still has the crew we need to build the games and tech we're known for' after massive layoffs","""The team today is about the same size we were when making DOOM (2016)."""
How to unlock Samael's romance and begin dating the brooding bartender in Moonlight Peaks,"Samael definitely is datable, even though it doesn't seem that way at first."
Indie dev defends criticism of Steam refund abuse amid review bombing of his game: 'It's wrong to refund a game after having fun with it and completing it',"Mateo Covic said his 'rage game' is actually doing quite well on Steam, and its refund rate is normal—but that wasn't his point."
Where to find the fallen tree and unblock the waterfall in Moonlight Peaks,Help your new friends rejoin their neighbors by learning a spell to hoist a blockage.
Ubisoft tells Black Flag microtransaction critics that they control the DLC they buy,I'm sure they'll be glad to hear it.
Meta says its working on 'multiple next-generation headsets' despite the struggles of VR and the heat death of the metaverse,Down but not out.
Multiple motherboard and PC component makers move forward with Chinese-made memory validation,A new challenger has appeared.
Marvel Rivals needs to pick a lane and either fully embrace balancing for 'fun' long term or stick to some serious changes,Season 9 is starting to look wild.
'Valve isn't interested in a nuanced conversation' says indie dev suffering from Steam censorship,"""Valve loves it when Cyberpunk 2077 and Baldur's Gate 3 throw customizable genitals at you in the first five minutes, but of course I can't."""
Asus ZenBook A16 review,The latest Snapdragon chip in a thin and light shell.
"'Finally a card I can afford': Nvidia announces GeForce-themed trading cards, which are free but you'll need to travel or get lucky to win some for yourself","More of this, and less AI, please."
What memory crisis? 79% of PC Gamer readers are rocking 32 GB or more RAM in their gaming rigs,"Sadly that does also mean 21% are on 16 GB or less, with upgrades only getting more expensive."
"E-Ink faceplates for the Steam Machine are coming, but not from Valve",I am going to put the filthiest fanfiction on this thing.
"Legendary dad fixes their kid's dead RTX 3070 by ripping the capacitor out of an old radio and slapping it on the side, saving over $100 in the process",Is he looking for customers? I have a friend looking for some repairs.
Indie developer says Steam did them a solid by fixing their unbootable game to beat the Next Fest deadline,"""Steam Support went way above and beyond."""
"Valve's Steam Frame launch looks imminent, with new 'Great on Frame' category spotted",Though there are only four games as of right now.
KTC 25M1 review,"Smooth, snappy, and surprisingly well-priced for a high refresh panel."
Arc Raiders has targeted yet another duplication exploit just a couple of days after celebrating a drop in suspicious player accounts,Fixed in record timing.
Bethesda union staff to march outside studios over Xbox layoffs: 'The company wants us to accept this as a done deal and quietly disappear',"""We need to show management right now that we mean business."""
"AMD Zen 6 server CPUs are launching this month, which has me hopeful for a desktop release this year",Here's hoping the swap to 2 nm is huge.
"One of my favorite Warhammer 40,000 books is getting an unexpected sequel","The Infinite and the Divine didn't need a follow-up, but I'm glad it's getting one."
"The Rolling Stones are in Roblox, because I guess that's what rock and roll is now",I specifically asked for this to be painted black.
How do you put a price tag on a legacy like id Software's?,"If Xbox can't find the value in owning the beating heart of the first-person shooter, perhaps it shouldn't be in the videogame business at all."
"Steam was showing a 'too many requests' error, but it's back","If Steam said ""You've made too many requests recently,"" don't worry: it's wasn't just you."
John Carmack reacts to massive layoffs at id Software: 'My 'Microsoft will probably be a good steward of the brand' statement isn't aging well',"""You can't rule out the possibility that executives are idiots, but that shouldn't be your default belief."""
"US Federal Reserve taps Xbox CEO Asha Sharma, who just laid off 3,200 employees, to lead task force on jobs","The Federal Reserve says its newly-announced task forces represent a ""commitment to price stability and maximum employment."""
The only indie roguelike action RPG that rivals Hades and Diablo for me just got an incredible new expansion,Hell Clock: Cursed War has me squeezing in runs everywhere I can.
Destiny 2 players get a final farewell gift from Bungie,Gloriabundus.
The most deranged videogame challenge run I've seen: A no-hit playthrough of the 'Unfair' difficulty in a 100-hour RPG,You're just not supposed to be able to do that.
Palworld studio says delete your old mods before the 1.0 release: 'Disabling them is not enough',Old mod data could cause real trouble with all the changes made for the big launch.
Roughly 192 Subnautica 2 players have drowned every minute since launch,"Good job, team."
"Microsoft filing shows total ZeniMax layoffs at 379, with over half coming from Elder Scrolls Online studio that's lost at least 60% of its staff in the past year","213 from ZeniMax Online Studios, 166 from ZeniMax Media (which includes the layoffs at Bethesda Game Studios)."
Rumour suggests Intel is cooking up a 12 Xe desktop Nova Lake CPU,'Decent discrete graphics? In my desktop processor?'
"Warframe's next major update blends Blade Runner, The Sopranos, and film noir in a whole new solar system, coming later this year","Digital Extremes has wrapped up this year's Tennocon Live event with a massive reveal trailer for Warframe 's next major update: Warframe: Tau. This update brings players to a Blade Runner and Sopranos-inspired locale, and tackles themes of addiction and its dangers head-on. Read more"
"""This is our Spider-Man 3"" - Soulfame's Warsong update adds ""edgelord"" progression path later this year","Digital Extremes has revealed a lenghty new gameplay trailer for its fantasy action game Soulframe. It's next major update - Warsong - adds a new quest. It'll also come with rideable mounts and ""vegan"" fishing. Read more"
"id Software insists in new statement that it still has ""the crew we need to build the games and tech we're known for""","id Software has posted a brief statement on social media, thanking players and well-wishers ""for the support"" and insisting that despite the recent job cuts, ""we still have the crew we need to build the games."" Read more"
Assassin's Creed Black Flag Resynced opens to 2 million sales on launch day,"Assassin's Creed Black Flag Resynced is off to a ""strong start"", selling two million copies on launch day. Read more"
"""I sued their asses and won!"" Gamer wins legal battle to get hacked Xbox account back after they were told to rebuy all their digital games","Xbox has lost a legal battle in Brazil after a gamer ""sued their asses and won"" for suspending their account, along with all of their digital games, after it was hacked. Read more"
"EU admits it cannot stop Sony killing physical discs – ""companies are free to offer games and services in the manner that they see fit""","The European Union has confirmed it cannot prevent Sony from scrapping physical discs, stating ""companies are free to offer games and services in the manner that they see fit"". Read more"
"Obsidian game director reacts to people ""spouting off"" about the studio and how it's not what it ""used to be""","A director at Obsidian Entertainment has shared their thoughts about the ""extremely difficult week"" at the studio, stressing how hard it's been to see ""a bunch of cold take artists coming out of the woodwork"" and ""spouting off"" about ""what Obsidian is or what it isn't"". Read more"
"As Criterion rebrands on its 30th anniversary, are its beloved racing franchises like Burnout falling away in the rearview mirror?","Criterion, a legendary UK development studio, is going through something of a re-brand. Its legacy is built upon a foundation of classics, Burnout Paradise and Star Wars: Battlefront to name but a few. However these days, it now finds itself one of many Battlefield Studios , a collective of separate studios all collaborating on EA's premier military shooter. Read more"
"What we've been playing - ""I can't sit and do nothing other than melt into my sofa""","Hello and welcome back to our regular feature where we write a little about the games we've been playing. This week, everyone's hot again. Nice of you to notice, Bertie. Kelsey's getting into embroidery with Silksong providing artistic inspiration; Bertie's banging on about the time system in The Blood of Dawnwalker; Marie's got a crush on Death; and Matt thinks he's found an ingenious bit of fourth-wall breaking in a game. Read more"
"""Just too gay"" - Robert Yang is battling censorship to launch a collection of his award-winning games on Steam and Itch, and it's completely free","Robert Yang, the award-winning designer behind the likes of The Tearoom and Rinse and Repeat, is battling increasingly restrictive rules adopted by digital storefronts to launch an ""ongoing re-remaster"" compilation of his short experimental games. It's called Radiator Forever and is available now for free - although it might take a bit of hunting to find it. Read more"
"As Xbox and PlayStation flounder, Steam is reportedly having another record year","Valve's PC storefront Steam continues to go from strength to strength. In the first half of 2026, it recorded its highest-ever results, generating an enormous $11.1bn in revenue, which is more than it made during the game-heavy end of last year, and considerably more than it made during the first half of 2025. Read more"
"Xbox needs to make a choice, says former PlayStation leader Shawn Layden: be a publisher or a platform, but you can't be both","Few people know more about helping run a successful console business than Shawn Layden. He was there at Sony when the PlayStation dream was first dreamt , and over the course of three decades he helped realise it and shape it. He was there for PlayStation 1, 2, 3, and 4. He helped lead the Japanese side of the business, the American side of the business, the European side of the business. By the time he left in 2019, Layden was overseeing the company's 13-strong roster of first-party studios. He knew the console business inside out. Read more"
"""We mean business"" - Bethesda union members to march in protest of sweeping Xbox job cuts","Bethesda Game Studios union workers have announced plans to protest the recent mass layoffs impacting Microsoft's Xbox division, telling members, ""The company wants us to accept this as a done deal and quietly disappear. We won't let that happen."" Read more"
"""My 'Microsoft will probably be a good steward of the brand' statement isn't aging well"" - id Software co-founder John Carmack speaks out after devastating Xbox layoffs","John Carmack, the co-founder of legendary Doom and Quake developer id Software, has shared his thoughts on the reported ""bloodbath"" of layoffs at his former studio, following Xbox's devastating ""restructuring"". Read more"
"""It was like being back in 2016"" Pokémon Go celebrates 10th anniversary by recreating the original trailer's Times Square Mewtwo raid",Last night Pokémon Go celebrated its 10th anniversary by fulfilling the final promise of the game's original trailer : giving players the chance to battle Mewtwo in Times Square. Read more
"""No thanks!"" - Assassin's Creed Black Flag remake Resynced being review bombed on Steam for single-player microtransactions","The remake of Assassin's Creed Black Flag, Resynced, is off to a flying start. Before it even launched, the game was already on track to out-perform,Assassin's Creed Shadows, pulling in ""roughly $14m in gross revenue"" for publisher Ubisoft. Not bad! Read more"
"Xbox leader Asha Sharma has joined a US government task force for employment, days after announcing restructuring that has left thousands of people without jobs","After spearheading a restructuring of Xbox that resulted in 3200 job losses , Xbox CEO Asha Sharma has been asked to be an advisor to the US Federal Reserve for Productivity and Jobs, where she will seemingly lead a task force related to, ironically, employment. Read more"
"Dragon Age creator reckons the series is dead following Veilguard flop, but that doesn't mean he wouldn't have another go at it if given the chance","Following the poor commercial performance of 2024's Dragon Age: The Veilguard , Dragon Age creator David Gaider has said he believes developer BioWare's beloved fantasy RPG series is likely dead. But if some twist of fate ever meant he had the opportunity to work on a new one - despite no longer being at BioWare - he'd be interested in taking it in a ""dark and dangerous"" direction, and do with it ""things that will make people upset"". Read more"
Bungie gives Destiny 2 players a final farewell gift as the game enters maintenance mode,Destiny 2 developer Bungie surprised fans earlier this week with something of a farewell gift. The developer posted a code on X that players can redeem on Bungienet to claim a free emblem. Read more
"Games are almost always cheaper in shops, says new report, just as Sony announces an end to PlayStation discs and brings retailers' futures into question","Earlier this month, Sony announced that it's ending manufacturing of physical PlayStation discs beginning January 2028 . The shocking decision means future releases, both from Sony Interactive Entertainment and every other publisher on the planet, will only be available in digital formats. Read more"
"Fallout's second season has been nominated for more Emmys, even if it's significantly fewer than last time","Season two of Amazon's live-action Fallout adaptation might have been a bit of a divisive one, but that hasn't stopped it from being showered with another bunch of nominations ahead of this year's prestigious Emmy Awards. In total, Fallout's second TV outing has made it in nine categories - a decent clutch, even if it's significantly less than the 16 nominations it got for season one. Read more"
"Even The Elder Scrolls 6 is affected by Xbox layoffs, say Bethesda employees, as ""key"" people are let go and morale bottoms out","The impact of this week's massive wave of Xbox layoffs on individual projects and teams is starting to become clear. The latest revelation comes from multiple staff at Bethesda, who have told IGN they expect a ""substantial and cascading effect"" on the long in-development Elder Scrolls 6 . Read more"
"Sony, Bungie settle with ex-Marathon director they accused of ""predatory behaviour"", bringing $200m wrongful dismissal lawsuit to a close","Ex-Marathon director Christopher Barrett has announced a settlement has been reached with Sony and Bungie, after he sued both companies for wrongful dismissal, claiming they had ""deliberately destroyed [his] reputation by falsely, and publicly, insinuating...he had engaged in sexual misconduct."" Read more"
"Doom and Quake studio id Software reportedly gutted, leaving standalone capabilities in doubt and newly revealed game ideas dead","A clearer picture of how hard id Software has been hit by Microsoft's drastic Xbox restructuring is beginning to emerge, and it has been hit very hard indeed. Read more"
"Fallout: New Vegas studio Obsidian reportedly moved onto a new Fallout game by Xbox, but at the cost of a sequel to Avowed","Days after Microsoft's devastating 3200 job cuts at Xbox , the true scope of the redundancies is becoming clearer. Obsidian Entertainment, which reportedly lost a quarter of its staff in the cuts , has had its priorities shifted too. Read more"
"""A hammer blow for games retail"" - Experts weigh in on PlayStation's discless future, and the impact it will have on traditional game stores","Last week, Sony announced that in January 2028, large-scale production of physical discs for new games would cease . This sent waves throughout the industry, raising questions about what it meant for other console manufacturers , game preservation , and more. Read more"
"There are apparently going to be ""changes"" to one of Persona 4 Revival's most important characters, but what exactly does that mean?","After a long period of not knowing much about the upcoming remake, Persona 4 Revival, we last month finally learned that Atlus' re-do of one of its most popular games is launching on 18th February on PlayStation 5, Xbox Series X/S, and PC. But the game isn't a straight one-to-one remake of the 2008 RPG. Similarly to Persona 3 Reload , it will see differences to the source material. Read more"
"Brutal Soulslike Mortal Shell 2 chooses violence, sets release date in the 2026 August traffic jam","Mortal Shell 2, the inventive Soulslike RPG from developer Cold Symmetry, has an official release date. The game will arrive 20th August on PC, PS5, and Xbox Series X/S. While Mortal Shell 2 has always been set for release this year, its release window was the biggest mystery. Read more"
"17 years later, Minecraft is finally adding somewhere to sit","You might want to sit down for this one. Some 17 years after its release, Minecraft is finally adding somewhere for weary adventurers to rest their flagging posteriors: cushions are now available as part of the survival blockbuster's latest preview build, with a full release planned for later this year. Read more"
"""Dracula is King of England"" - New immersive sim Vampirium: 1997 announced by Tron: Catalyst and Thomas Was Alone developer Bithell Games","Bithell Games - the developer of Tron: Catalyst , John Wick Hex and Thomas Was Alone - has revealed a new minimalist immersive vampire sim called Vampirium: 1997. Read more"
Palworld developer Pocketpair decides not to raise the open-world survival game's price tag as it nears a 1.0 launch later this week,"Legal battles with Nintendo aside , open-world survival game Palworld has enjoyed tons of success since it was launched back in January 2024 into early access. After more than two years of updates, it's been confirmed it'll hit 1.0 this Friday , 10th July. Forget about a price increase though. Read more"
"Doom's new Chain Spear weapon seems to be dividing The Dark Ages' audience - ""I'm like an hour in and I can't wait to get the shield back""","Only a few weeks after Doom: The Dark Ages - Revelations was revealed to the world, Xbox has made deep cuts to developer id Software that could change the studio and their games forever. But for now, players seem to be enjoying the expansion - albeit for one divisive new weapon. Read more"
Workers at MindsEye studio protesting controversial fan event this weekend after multiple rounds of layoffs,"UPDATE 9TH JULY, 10AM BST : Following the publication of this story, a Build a Rocket Boy spokesperson reached out with the following statement: Read more"
"Subnautica 2 isn't backing down on fish murder, but you can at least stun them now thanks to its first major update","Subnautica 2 's early access journey reaches a new milestone today as developer Unknown Worlds releases the underwater survival sequel's first major update. It's notable in a number of respects; not least because it adds the ability to stun fish - which, while far from the all-out fish murder some players have been begging for, does at least provide a new defensive option for getting out of sticky situations. Read more"
"Arc Raiders introduces separate Solo, Duo and Trio tracking so you can be friendly in one and a rat in the others","Arc Raiders is evolving its matchmaking behaviour yet again. The game's latest update introduced a feature players have long requested. Patch 1.36.0, available now across PC, PlayStation, and Xbox allows the game to track your playstyle separately for its different matchmaking pools: Solo, Duo, and Trio. Read more"
"Assassin's Creed Black Flag Resynced hasn't set sail yet, but it's already doing better than Shadows on Steam","Assassin's Creed Black Flag Resynced isn't even out yet - Edward Kenway makes his long-awaited return tomorrow, 9th July - but it's already on track to perform better than last year's Assassin's Creed Shadows . Read more"
The retreat from mobile games continues as Mario Kart Tour and Final Fantasy 7 Ever Crisis will be taken offline later this year,"There seems to be a retreat from mobile adaptations of big gaming brands underway. From Call of Duty: Warzone Mobile being shut down to Sony heavily downsizing mobile operations , the gold rush for ambitious big-IP adaptations is declining. And now, Nintendo and Square Enix are following a similar path. Read more"
You can complete medieval vampire RPG The Blood of Dawnwalker even quicker than previously thought - before even the prologue ends,"You can finish medieval vampire RPG The Blood of Dawnwalker even sooner than previously thought: it isn't just possible to end the game after the prologue, you can do it in the prologue too. (Beware, there are some prologue spoilers ahead.) Read more"
Microsoft is reportedly considering making more of its first-party games exclusive to Xbox,"More of Microsoft's future first-party titles may become Xbox exclusives, according to a new report. The company is said to be interested in giving customers a reason to choose Xbox consoles over other brands. Read more"
The upcoming Call of Duty: Black Ops PlayStation re-releases seemingly drop a few fondly remembered features,"We're likely closer than ever to the launch of Call of Duty: Black Ops 1 and 2 re-releases on PlayStation, because their Trophy lists have appeared online. This typically happens days before a game becomes available. Read more"
Assassin's Creed Black Flag Resynced review,"Are you familiar with the Ship of Theseus? It is an ancient philosophical thought experiment about whether an object is the same thing once all of its constituent parts have been replaced. It is a paradox, a fun poke at themes of identity and continuity, and greater minds than mine have attempted to answer the riddle through philosophical, mathematical, and metaphysical lenses. But today, I am going to apply the question to Assassin's Creed: Black Flag Resynced. Read more"
