title,text,scraped_at
WoW's classes were pruned for Midnight because many were 'built in a world' where its devs assumed they'd be using addons,"""We settled into an expectation.""",2026-02-19T12:35:57.046390
Obsidian was 'surprised' that Avowed players bounced off one of the RPG's most important systems: 'That frustration came through loud and clear',Who's got time to upgrade their gear when there are adventures to be had?,2026-02-19T12:35:57.046390
"Firefox is finally ending support for Windows 7, 8, and 8.1, and urges users to upgrade or switch to Linux","Mozilla notes, ""most browsers, including Google Chrome and Microsoft Edge, have already ended support for Windows 7, 8 and 8.1.""",2026-02-19T12:35:57.046390
"Avowed's massive anniversary update adds new playable races, but they don't get any unique dialogue because there were 'no dedicated narrative people available'","The new races are just a ""mechanical distinction"".",2026-02-19T12:35:57.046390
Fill out our quick questionnaire about your gaming habits and you could nab a $300 Amazon voucher,We hunger for your takes.,2026-02-19T12:35:57.046390
Jensen Huang teases reveal of 'a chip that will surprise the world' at next month's GTC,Looking ahead.,2026-02-19T12:35:57.046390
The 'LeBron James of spreadsheets' thought Excel becoming a popular esport was 'unlikely' before winning the grand prize in Las Vegas,'You can have a lot more fun with Excel than people realise.',2026-02-19T12:35:57.046390
"Devil Daggers 2 is in development, as its creator confirms fewer than 1,500 people survived longer than 8 minutes in the original",Because it's as scary as it is hard.,2026-02-19T12:35:57.046390
The Killing Stone combines occult contract law with card-battling in an isolated 17th century mansion,Something is rotten in Little Denmark.,2026-02-19T12:35:57.046390
Todd Howard says Bethesda will return to 'that classic style' for Elder Scrolls 6: 'Fallout 76 and Starfield are a little bit of a creative detour',And it'll be powered by an upgraded engine.,2026-02-19T12:35:57.046390
"Surprise, surprise: The ROG Xbox Ally X just got a AU$200 price hike in Australia",Why? I think you can guess.,2026-02-19T12:35:57.046390
Can you guess which videogame these zombies are from? Take our quiz and evaluate your mastery over the undead!,Or at least zombie adjacent.,2026-02-19T12:35:57.046390
"As Destiny 2's player count continues to tank, Bungie announces that the next major update is delayed until June and getting a new name","The delay comes as no surprise, but the length is unexpected.",2026-02-19T12:35:57.046390
Videogames are 'losing in the War for Attention': Analyst says many of the industry's biggest markets are spending less time on gaming,It's a crowded battlefield.,2026-02-19T12:35:57.046390
Spooky visual novel The Mermaid's Curse is the best kind of sequel: a self-contained mystery,Paranormasight: The Mermaid's Curse is better for not caring if you've played the first game.,2026-02-19T12:35:57.046390
"Todd Howard says there's no Starfield 2.0 coming: The next big update is for people who already love Starfield, and if you don't, 'I don't think this is going to change that'","Bethesda will start talking about the future of Starfield ""really soon,"" but he warned that it may not be all that some fans are hoping for.",2026-02-19T12:35:57.046390
"DICE has 'heard the message very clear' and is now prioritizing larger maps for Battlefield 6, but 'it takes a really long time'","Battlefield 6 Season 2 launched with another decently-sized map in Contaminated, but fans want even bigger.",2026-02-19T12:35:57.046390
Poppy Playtime becomes Steam's global top seller and doubles its all-time peak player count record,"Everyone wants to play with Chapter 5's ""Wrongside Outimals.""",2026-02-19T12:35:57.046390
"Congrats, you played yourself, Arc Raiders' machines aren't actually learning: 'That's just the way we author them'","Players had begun to wonder whether the robot enemies were using AI to learn new tactics based on player behaviour, but Embark has shot the theory down.",2026-02-19T12:35:57.046390
Black Ops 7 ad banned in the UK for 'trivializing sexual violence',"The ad features Peter Stormare and Nicki Glaser as ""Replacers"" in an airport security line.",2026-02-19T12:35:57.046390
Microsoft's ties with ICE come under fire amidst allegations that the company's cloud and AI technology are being used to support mass surveillance of US citizens,No Azure for Apartheid statement comes the day after reports claiming that ICE has tripled the amount of data stored on Microsoft's Azure servers over the past six months.,2026-02-19T12:35:57.046390
"Microsoft uses plagiarized AI slop flowchart to explain how Github works, removes it after original creator calls it out: 'Careless, blatantly amateuristic, and lacking any ambition, to put it gently'","The official Introduction to Github page included an AI-generated graphic with the phrase ""continvoucly morged"" on it, among other mistakes.",2026-02-19T12:35:57.046390
Embark admits Arc Raiders’ bosses are dying too fast because 'they're not intended for the full server to go up against' and 'we gave players too effective abilities',"""When we built that, we had an idealised way where we hoped people would try to engage with it"".",2026-02-19T12:35:57.046390
All the Sims 4 Royalty & Legacy cheats you need to attain a noble lifestyle without the effort,Get all the traits and skill cheats for Royalty & Legacy plus some other handy dynasty and favor controls.,2026-02-19T12:35:57.046390
"I didn't expect to kidnap alligators, save Woodstock or give people dysentery in a game called Transport Fever 3—but here we are","It's OK, I released the alligators.",2026-02-19T12:35:57.046390
And I thought DDR5 prices were bad: Samsung is apparently charging $700 for its latest AI-empowering HBM product,"No joke, but maybe a little funny.",2026-02-19T12:35:57.046390
"Arc Raiders' matchmaking isn't 'binary', says design lead: 'There's no such thing as a friendly lobby or an aggressive lobby'","""We acknowledge that people are having a lot of fun with these safer lobbies"".",2026-02-19T12:35:57.046390
New research claims pretty much all headphones contain toxic chemicals that 'may be migrating' into our bodies,Add this to your list of things to worry about.,2026-02-19T12:35:57.046390
"'The AI era is no longer a distant promise; it is a present reality,' Google declares in a report that also claims its AI principles are the 'north star standards'",Google also promises to fix all the holes that have popped up in the AI ship as it's hurtled forward.,2026-02-19T12:35:57.046390
Japanese toilet manufacturer reportedly 'most undervalued and overlooked' beneficiary of AI boom,Flush with cash.,2026-02-19T12:35:57.046390
"Arc Raiders design director says players 'never worked together' in testing, but the emergence of care bear lobbies 'encourages us to lean toward giving opportunities to have friendly interactions'","Catering to both PvE and PvP-heavy audiences is a ""precarious position"".",2026-02-19T12:35:57.046390
"Valve wins lawsuit against Rothschild and associated entities, with a jury agreeing they violated an anti-patent troll protection act",The court also agreed that they had breached a global license agreement with Valve.,2026-02-19T12:35:57.046390
"After a glitch botched Overwatch's first big post-reboot event, it's sending out the rewards—including 14 lootboxes—out to players anyway","Mmm, sweet lootboxes.",2026-02-19T12:35:57.046390
"DayZ creator calls to 'normalize delaying games,' that consumers can show Xbox and Sony 'that delays are okay' and, oh, 'Personally: don't preorder games, folks. Commercially: please preorder games'","""It's the only way PlayStation/Xbox notice us.""",2026-02-19T12:35:57.046390
Moza AB9 FFB Base + MH16 Flightstick + MTP Throttle review,"One for the serious flight simmers, but a very impressive experience.",2026-02-19T12:35:57.046390
Three of the biggest password managers are vulnerable to 'a cornucopia of practical attacks' say security researchers,But post-its aren't the way either.,2026-02-19T12:35:57.046390
"NZXT's latest mini-ITX PC case looks seriously nifty, I'm just not sure how I'm going to afford the RAM for the build...",If you want a desktop PC that actually fits on your desktop...,2026-02-19T12:35:57.046390
"Yes, Chinese DRAM is fine for gaming but don't think for one moment that any of it is a bargain","But if you can find something that's reasonably priced, by all means grab it while you can.",2026-02-19T12:35:57.046390
"Everyone should get into birdwatching, and as a birdwatching devotee, here are the 4 upcoming birding games on Steam I'm keeping tabs on",Fly from biome to biome and see what you can find.,2026-02-19T12:35:57.046390
"The demo of Sucker for Love: Crush Landing is the gentle reminder I needed that dating an eldritch god wouldn't be straightforward, actually",Sometimes you've got to be willing to put in the work.,2026-02-19T12:35:57.046390
"Deadlock's snazziest rich boy, Apollo, gets struck down by a bunch of nerfs after terrorising matches: 'Yoshi took him out back'",Nerfed in Flawless Advance.,2026-02-19T12:35:57.046390
Windows 11 is getting a handy internet speed test built right into the taskbar,"Plus a load of other quite welcome tweaks, fixes and enhancements.",2026-02-19T12:35:57.046390
"Minecraft has revealed its final batch of baby mobs ahead of the spring update, and they might be the cutest ones yet",My heart can't take any more.,2026-02-19T12:35:57.046390
The Teenage Mutant Ninja Turtles Magic set includes a deck inspired by the videogames,"Mutant, ninja, and turtle were all existing keywords in Magic: The Gathering. It was only a matter of time.",2026-02-19T12:35:57.046390
"YouTube was partially busted for a while, but it's fixed now","YouTube wasn't fully down, but hundreds of thousands of users reported issues.",2026-02-19T12:35:57.046390
"Original Witcher story lead says the surprise twist at the end 'was a mistake,' because instead of focusing on Geralt the sequel was forced into 'a story about witchers who are killing kings for some reason'",Artur Ganszyniec says The Witcher's flashy ending cutscene was created largely without input from the story team.,2026-02-19T12:35:57.046390
"Steam Next Fest hasn't even started, and its first must-play demo is already here","You can play Titanium Court now, and you should be doing that instead of whatever else you're doing.",2026-02-19T12:35:57.046390
Valheim's creative director is still 'dedicated on Valheim every day' in addition to his new co-op dungeon crawler: 'We love making games so much that we want to make more games',"Work on the second game doesn't ""compete in any way"" with the work being done on Valheim, says Robin Eyre.",2026-02-19T12:35:57.046390
"Huge new Avowed update adds New Game Plus, playable dwarves and Orlans, and quarterstaffs",It's also now on PlayStation 5.,2026-02-19T12:35:57.046390
"Thanks to Diablo 2, Blizzard might've found a way to fix Diablo 4's loot fatigue in its next expansion",The Horadric Cube might be a bigger change than the two new classes.,2026-02-19T12:35:57.046390
"Football commentator Guy Mowbray let EA create an AI voice double to help read out the 20,000 player names in EA Sports FC","<img src=""https://assetsio.gnwcdn.com/guy-mowbray-ea-sports-fc.jpg?width=690&quality=85&format=jpg&auto=webp"" /> <p>
Match of the Day football commentator Guy Mowbray has revealed he gave EA permission to create an AI voice clone of himself in order to assist with some of the more onerous aspects of recording commentary for EA Sports FC.
</p> <p><a href=""https://www.eurogamer.net/guy-mowbray-let-ea-create-an-ai-voice-double-to-help-in-ea-sports-fc"">Read more</a></p>",2026-02-19T12:35:57.046390
"""It is not Starfield 2.0"" - Todd Howard squashes Starfield update excitement, but insists work on the space game will not stop ""for a while""","<img src=""https://assetsio.gnwcdn.com/todd-howard-starfield.jpg?width=690&quality=85&format=jpg&auto=webp"" /> <p><a href=""https://www.eurogamer.net/companies/bethesda-game-studios"">Bethesda Game Studios</a> boss <a href=""https://www.eurogamer.net/personas/todd-howard"">Todd Howard</a> has flattened hope for a major <a href=""https://www.eurogamer.net/starfield-main-story-walkthrough-9352"">Starfield</a> overhaul by stating that the long-awaited update in development ""is not Starfield 2.0"".</p> <p><a href=""https://www.eurogamer.net/todd-howard-squashes-starfield-update-excitement"">Read more</a></p>",2026-02-19T12:35:57.046390
"Those Monster Hunter Wilds on Switch 2 rumours refuse to go away, new datamined evidence adds fuel to the fire","<img src=""https://assetsio.gnwcdn.com/mhw-switch-2.jpg?width=690&quality=85&format=jpg&auto=webp"" /> <p>Do you have a sense of deja vu? Because dataminers believe they've discovered more evidence that <a href=""https://www.eurogamer.net/games/monster-hunter-wilds"">Monster Hunter Wilds</a> could be coming to <a href=""https://www.eurogamer.net/platforms/switch-2"">Nintendo Switch 2</a> - a sentence we've already typed out here at Eurogamer in the year 2026.</p> <p><a href=""https://www.eurogamer.net/those-monster-hunter-wilds-on-switch-2-rumours-refuse-to-go-away-new-datamined-evidence-adds-fuel-to-the-fire"">Read more</a></p>",2026-02-19T12:35:57.046390
Get a tease of Marathon's OST with four tracks that are heading to streaming platforms ahead of Bungie game's March release,"<img src=""https://assetsio.gnwcdn.com/New-Project-(28).jpg?width=690&quality=85&format=jpg&auto=webp"" /> <p>Bungie is uploading four tracks from the Marathon official sound track to major music streaming platforms later today, in the build-up to the game's launch on the 5th March.</p> <p><a href=""https://www.eurogamer.net/get-a-tease-of-marathons-ost-with-four-tracks-that-are-heading-to-streaming-platforms-ahead-of-bungie-games-march-release"">Read more</a></p>",2026-02-19T12:35:57.046390
"""The majority of people who made Skyrim are still here"" Bethesda boss on why The Elder Scrolls 6 will be more like Skyrim or Oblivion than Starfield","<img src=""https://assetsio.gnwcdn.com/howard-es6.jpg?width=690&quality=85&format=jpg&auto=webp"" /> <p>It feels like we've heard a lot about Bethesda's mysterious, upcoming RPG, The Elder Scrolls 6, lately. The publisher has been very tight-lipped about the game, <a href=""https://www.eurogamer.net/yes-todd-howard-and-team-have-settled-on-a-region-for-the-elder-scrolls-6"">which we first started hearing about in 2018</a>, for the past eight years. We once got a title card, and that's about it. It was only recently we started learning more litle nuggets of information about the game after Bethesda's long silence on the project - whether it's how an old designer thought <a href=""https://www.eurogamer.net/the-elder-scrolls-6-could-have-been-like-star-wars-the-empire-strikes-back"">it was going to be like The Empire Strikes Back</a>, or how Bethesda boss man <a href=""https://www.eurogamer.net/even-todd-howard-wishes-elder-scrolls-6-development-went-a-little-faster-but-says-its-progressing-really-well"">Todd Howard wishes development ""went a little faster""</a>, we've heard more in the past few months than the past few years combined.</p> <p><a href=""https://www.eurogamer.net/the-majority-of-people-who-made-skyrim-are-still-here-bethesda-boss-on-why-the-elder-scrolls-6-will-be-more-like-skyrim-or-oblivion-than-starfield"">Read more</a></p>",2026-02-19T12:35:57.046390
"Subnautica, one of the best survival games ever, just got a free Switch 2 upgrade, and it's well worth a return","<img src=""https://assetsio.gnwcdn.com/subnautica-switch-2.jpg?width=690&quality=85&format=jpg&auto=webp"" /> <p>Is there a more terrifying sound in video games than the roar of a Reaper Leviathan or the irritated gurgle of a Crashfish as it suddenly torpedoes toward you from shadows unseen? I mean, yes, probably - but that's not the point. Every time I slip the word ""horror"" into conversations about <a href=""https://www.eurogamer.net/games/subnautica"">Subnautica</a>, it's usually met with dismissals and frowns. And sure, developer Unknown Worlds' sublime underwater survival adventure isn't <em>technically</em> horror, but I can think of few games capable of instilling such an ominous sense of dread in me, such a suffocating fear of the watery unknown, as this one. And with Subnautica's free <a href=""https://www.eurogamer.net/platforms/switch-2"">Switch 2</a> update now here, what better time for reminiscences and to make myself unreasonably anxious all over again?</p> <p><a href=""https://www.eurogamer.net/subnautica-one-of-the-best-survival-games-ever-just-got-a-free-switch-2-upgrade"">Read more</a></p>",2026-02-19T12:35:57.046390
"Call of Duty ad banned by UK regulator after investigation determined it ""trivialised sexual violence""","<img src=""https://assetsio.gnwcdn.com/call-of-duty-black-ops-7-banned-ad.jpg?width=690&quality=85&format=jpg&auto=webp"" /> <p>
An advert released to promote <a href=""https://www.eurogamer.net/games/call-of-duty-black-ops-7"">Call of Duty: Black Ops 7</a> has been banned after the UK's Advertising Standards Authority upheld complaints that it ""trivialised sexual violence"" following an investigation.
</p> <p><a href=""https://www.eurogamer.net/call-of-duty-ad-banned-by-uk-regulator-after-investigation-determined-it-trivialised-sexual-violence"">Read more</a></p>",2026-02-19T12:35:57.046390
"Silent Hill: Townfall looks to be a PS5 console launch exclusive, according to official website","<img src=""https://assetsio.gnwcdn.com/silent-hill-townfall_qk4p7AE.jpg?width=690&quality=85&format=jpg&auto=webp"" /> <p><a href=""https://www.eurogamer.net/games/silent-hill-townfall"">Silent Hill: Townfall</a>, the upcoming entry in Konami's legendary horror series, looks to be a console launch exclusive on the PlayStation 5.</p> <p><a href=""https://www.eurogamer.net/silent-hill-townfall-looks-to-be-a-ps5-console-launch-exclusive-according-to-official-website"">Read more</a></p>",2026-02-19T12:35:57.046390
"""We weren't really paying attention"" The Witcher's lead story designer reveals why the first game's final CG cutscene didn't involve the story team","<img src=""https://assetsio.gnwcdn.com/Witcher-1_ending-CG-cutscene.png?width=690&quality=85&format=jpg&auto=webp"" /> <p>The long-awaited <a href=""https://www.eurogamer.net/games/the-witcher-remake"">remake of the first Witcher game</a> is seemingly on the back-burner as CD Projekt Red has reportedly added support studio Fool's Theory to the massive development effort of <a href=""https://www.eurogamer.net/games/the-witcher-4"">The Witcher 4</a>. Moreover, there have been recurring <a href=""https://www.eurogamer.net/witcher-3-expansion-rumours-analyst-100-percent-certain-cd-projekt-red-will-release-significant-new-content-this-year"">rumours of an all-new Witcher 3 DLC</a> made by the same studio. Meanwhile, original lead story designer Artur Ganszyniec has been revisiting Geralt of Rivia's first big RPG adventure, giving longtime fans all-new insights into the game's making.</p> <p><a href=""https://www.eurogamer.net/the-witcher-1-lead-story-designer-talks-final-cg-cutscene"">Read more</a></p>",2026-02-19T12:35:57.046390
"""We need just a few more weeks"" - highly-anticipated cyberpunk platformer Replaced gets delayed into April","<img src=""https://assetsio.gnwcdn.com/Reach-going-up-against-some-Termite-goons-in-Replaced.jpg?width=690&quality=85&format=jpg&auto=webp"" /> <p>Replaced, the highly-anticipated cyberpunk platformer from Sad Cat Studios, has been delayed.</p> <p><a href=""https://www.eurogamer.net/we-need-just-a-few-more-weeks-highly-anticipated-cyberpunk-platformer-replaced-gets-delayed-into-april"">Read more</a></p>",2026-02-19T12:35:57.046390
"Battlefield 6 Season 2 is finally out now, and while the new map is being praised, players are having trouble with gas masks","<img src=""https://assetsio.gnwcdn.com/BF6-Season-2-new-map-assault.jpg?width=690&quality=85&format=jpg&auto=webp"" /> <p>Despite what confused Call of Duty players who changed teams would have you believe, <a href=""https://www.eurogamer.net/games/battlefield-2025"">Battlefield 6</a> is a notable modern military FPS that's doing <em>fine</em> a few months in, usual bumps in the road included. Now, Season 2 has finally arrived <a href=""https://www.eurogamer.net/battlefield-6-season-2-delayed-until-february-but-more-content-for-season-1-and-events-are-on-the-way"">following a delay</a>, and it's kickstarted new positive and negative discussions.</p> <p><a href=""https://www.eurogamer.net/battlefield-6-season-2-first-reactions"">Read more</a></p>",2026-02-19T12:35:57.046390
Want to play a 20-minute visual novel starring idols who also happen to be cleaning products? Yes? Then Souji Souai LOVE is for you,"<img src=""https://assetsio.gnwcdn.com/Souji-Souai-LOVE-character.png?width=690&quality=85&format=jpg&auto=webp"" /> <p>Today, in News I Didn't Expect To Ever Write, I bring to you <a href=""https://kao-shinseikatsu-game.com/?adobe_mc=MCMID%3D33721277683654488724186108689161205022%7CMCORGID%3D952B02BE532959B60A490D4C%2540AdobeOrg%7CTS%3D1771392119"">Souji Souai LOVE</a>, a free game by chemical and cosmetics giant Kao Corporation that stars idols, only the idols are cleaning products. As in... their heads are bottles of detergent and other products. Japan once again proves its marketing game is centuries ahead of the rest of the world's.</p> <p><a href=""https://www.eurogamer.net/souji-souai-love-is-a-free-cleaning-products-idols-visual-novel"">Read more</a></p>",2026-02-19T12:35:57.046390
"Marathon isn't just favouring PlayStation players with exclusive cosmetics; Xbox and Steam players promised bonus loot, too","<img src=""https://assetsio.gnwcdn.com/marathon-bungie_5UWu4c4.jpg?width=690&quality=85&format=jpg&auto=webp"" /> <p>After showing off a selection of PlayStation-exclusive charms for in-game weapons, the Marathon social media account has indicated that similar charms will be coming to other platforms like PC and Xbox.</p> <p><a href=""https://www.eurogamer.net/marathon-isnt-just-favouring-playstation-players-with-exclusive-cosmetics-xbox-and-steam-players-promised-bonus-loot-too"">Read more</a></p>",2026-02-19T12:35:57.046390
"Pokémon Pokopia's secret weapon? Dragon Quest Builders 2 creatives who decided they could ""contribute"" to Game Freak's original idea","<img src=""https://assetsio.gnwcdn.com/New-Project-(35).jpg?width=690&quality=85&format=jpg&auto=webp"" /> <p><a href=""https://www.eurogamer.net/games/pokemon-pokopia"">Pok&eacute;mon Pokopia</a> is almost here, and <a href=""https://www.eurogamer.net/an-hour-with-pokopia-suggests-itll-might-be-the-best-pokemon-spin-off-ever-and-its-more-viva-pinata-than-minecraft-or-animal-crossing"">we're confident it might be a hit</a>, especially after learning <a href=""https://www.eurogamer.net/pokemon-pokopia-has-minecraft-style-persistent-servers-director-confirms"">Minecraft-like persistent servers</a> are part of the game. Now we're just hoping it delivers on all its promise when it launches on 5th March. Wanna get more hyped tho?</p> <p><a href=""https://www.eurogamer.net/pokemon-pokopia-recruited-dragon-quest-builders-vets-after-strong-initial-pitch"">Read more</a></p>",2026-02-19T12:35:57.046390
Avowed was overlooked - it's a double-A blast of gaming sunshine,"<img src=""https://assetsio.gnwcdn.com/New-Project-(32).jpg?width=690&quality=85&format=jpg&auto=webp"" /> <p>I feel for <a href=""https://www.eurogamer.net/games/avowed"">Avowed</a>. It's a bit like an athlete that goes to an Olympics and makes it to a final but doesn't place. It's a great achievement, a success by many people's standards, but history doesn't care.</p> <p><a href=""https://www.eurogamer.net/avowed-was-overlooked-its-a-double-a-blast-of-gaming-sunshine"">Read more</a></p>",2026-02-19T12:35:57.046390
"In an increasingly AI-filled world, it's refreshing to learn Crimson Desert is fully voiced by actual, human people","<img src=""https://assetsio.gnwcdn.com/Crimson-Desert_Screenshot_07.png?width=690&quality=85&format=jpg&auto=webp"" /> <p>Crimson Desert will be fully voiced by humans, Pearl Abyss's marketing director has assured in a recent interview.</p> <p><a href=""https://www.eurogamer.net/crimson-desert-is-fully-voiced-by-actual-human-people"">Read more</a></p>",2026-02-19T12:35:57.046390
"Skyrim's Nintendo Switch 2 port gets proper Performance and Quality modes, finally fixing the mess it was at launch","<img src=""https://assetsio.gnwcdn.com/Skyrim-Switch-2-vampire-lord.jpg?width=690&quality=85&format=jpg&auto=webp"" /> <p><a href=""https://www.eurogamer.net/games/the-elder-scrolls-v-skyrim"">The Elder Scrolls V: Skyrim</a> getting a native <a href=""https://www.eurogamer.net/platforms/switch-2"">Nintendo Switch 2</a> version was one of those no-brainers we expected to see as soon as the console launched, yet it took more than a few months to arrive, and when it finally did, it was a mess. What happened there? It's a game from 2011, for Talos' sake.</p> <p><a href=""https://www.eurogamer.net/skyrim-switch-2-port-gets-proper-performance-and-quality-modes"">Read more</a></p>",2026-02-19T12:35:57.046390
