title,text
Everything you can get from Arknights: Endfield Twitch Drops and how to link accounts,"Free Oroberyl, T-Creds, combat records, and more."
Building an optimized factory is so important in Arknights: Endfield that someone made a simulator tool for sharing your best blueprints,The factory must grow so that my anime characters can too.
"Fallout 4 feels like a brand new game now that it's forcing me to take naps, drink plenty of water, and not save scum",Pro: Everything feels fresh and dangerous. Con: I had to replay the same scripted walk and talk story mission three times on account of bugs.
One of Steam's most wishlisted games announces it's launching next week with a song so unhinged you've got to hear it for yourself,"""Claw your way to the top, let their corpses be your crop!"""
Mass Effect boss Michael Gamble is looking for a production director for the next game in the series: 'They’ll report to me and it’s gonna be awesome',Things are happening.
"Creator of DMCA'd Cyberpunk VR mod takes ball and goes home, removing access to all his VR mods after receiving a second DMCA takedown from 505 Games and a warning from Patreon",I suppose that's one solution.
"'Came for the combat, stayed to be a factory worker': Anime gacha game players are discovering they were born to be factory builders in Arknights: Endfield",The anime characters can wait.
"That team-based shooter with phantom horses that debuted at The Game Awards and then promptly disappeared is not actually dead: A showcase featuring 'gameplay deep dive, year one plans, and much more' is coming next week","Highguard, as originally announced, will arrive on January 26."
I asked Garry Newman if he really was going to rename s&box as Garry's mod 2 after an overwhelming poll and he joked 'people are d*ckheads',"""People like Coldplay and voted for the Nazi party Jeremy. You can't trust people."""
"How to remaster Prince Of Persia: The Sands of Time yourself, since Ubisoft won't","With hopes dashed for an official remake, here's the next best option."
"More than 40 US Democrats call for a 'thorough investigation' of EA's Saudi-led buyout over risks of layoffs, studio closures, and 'coordinated anti-labor practices'","Pushback against the proposed acquisition of Electronic Arts is growing, but whether or not it will matter is a different question"
Microsoft Windows 365 goes down the day after Microsoft celebrates 'reimagining the PC as a cloud service that streams a Cloud PC',That cloud is looking a little grey.
"Software engineer creates classic SimCity-style map of NYC—and argues that AI will be good for creatives, actually",SimCity sights.
"Not even Microsoft is confident that Copilot is right for coding, as it's encouraging staff to try out Anthropic's AI model, according to one report","Anthropic is backed by Microsoft, though, to the tune of at least $5 billion."
"Minecraft's lead dev says Hytale is 'very polished' but he'd rather just play Minecraft, and Hytale boss says he's 'probably right'—for now","Hytale might have a strong Minecraft resemblance today, but its devs say they're aiming for something different as the game evolves."
"Spellcasters Chronicles is getting its second closed beta weekend with more spells, a ranked mode, and better optimisation: 'We want every player to be able to play our game'",My new favourite building: The Wall.
"Palworld developer Pocketpair requires job applicants prove their gamer credentials: 'If the number of Steam games played is 0, we basically pass on them'","""We want our colleagues to play indie games that are only available on Steam."""
"It turns out, GOG players get more achievements than Steam users do",GOG's new Year 2025 feature lays all the data bare.
Panther Lake and 18A 'create a firm foundation on which to build the new Intel',Will betting big on 18A pay off?
"Embark reveals Arc Raiders' next four major monthly updates, which it calls the 'Escalation' phase, teasing new matchmaking, machines, and more, but our second new map is months away","Say hello to new maps, Arcs, gear, and more."
Asus ROG Azoth 96 HE review,Power at a price.
"Master Chief voice actor says he never wants AI cloning his hunky tones: 'That's where we cross a line… I don't like it, and I would prefer that it not be done'",Hail to the Chief.
"Fable is getting rid of the old games' horrible dog, who I hate","Headlines that are bound to make me popular, part one."
MSI Vector A18 HX review,"At last, a laptop for those who like to use crowbars for the job they were originally designed for."
Forza Horizon 6 finally returns to the wristband career mode the series has drifted so far away from: 'You'll start out as just a tourist in Japan',You've gotta earn that supercar.
"Finally, a game other than War Thunder may have led to the release of classified military information",Talk about landing in hot water.
"Making the invisible visible, this engineering artist's creation shows the incredible level to which modern devices fill our world with radio waves","It's a little bit spooky to watch in action, but I'd love one in my office."
"The new Fable's morality system will live in 'shades of gray', which is a huge shift for a series where being too mean made literal devil horns grow out of your head",Everyone always calls me chicken chaser. Nobody asks why I chase chickens.
"Valve warms up for the Steam Machine with a client update bristling with gamepad fixes and, oh, the betas UI is fancier now if you're into that","Pretty excited about this controller glyph thing, too."
"Deadlock just received a huge update, with 6 new heroes, overhauled patrons, and a new game mode—and it was all predicted with Domino's pizza",Pizza time at Valve HQ.
Thermalright Peerless Assassin 120 SE review,Practically peerless on price/performance.
"Highguard requires Secure Boot and Easy Anti-Cheat to run, leaving Linux and kernel-conscious gamers out in the cold",You will also need a TPM.
"'We will f*ck up': The publisher of Against the Storm and Manor Lords is committed to keeping generative AI out, but it's easier said than done",It's everywhere and unavoidable; it's probably going to slip in.
Intel's in no hurry to get 14A all tooled up: 'It does not make sense to build out significant capacity there until we know that we have the customers that will accept that demand',But it's 'aggressively as possible' in getting all other wafers out of the door.
"Nvidia reportedly cancels partner incentive scheme to sell cards at MSRP, says YouTuber Der8auer, signalling hard times ahead for GPU prices","""You will have to expect massive price increases."""
"In less than 1 week, Blizzard's sliced WoW's transmog costs in half after upset to 'bring them more in line with what the prices were prior'","Well, they move fast."
"'There's no way that's real': Marvel Rivals devs send streamer Kingsman free units after he got wrongfully kicked out of a $40,000 Marvel Rivals tournament",All is right with the world again.
Where to find Ferrium Ore in Arknights: Endfield,Learn how to track down this rare mineral.
"Hytale wants to 'achieve ultimate cosy heaven' by improving farming, cooking, and more with a specialist team","Like the Avengers, but they only bake and farm."
"After killing its multiplatform mod manager, Nexus revives its spirit with an announcement that its Windows-only app will support SteamOS in future",Which means someone else can faff with that version to make it play nicely with your Linux distro of choice.
Intel has the memory chips it needs to keep shipping Lunar Lake: 'we were relatively aggressive in terms of getting the memory early',On-package memory would've put Intel in a tough spot if not.
Asus starts an 'immediate internal review' on its 800-series motherboards in light of 'recent reports concerning Ryzen 7 9800X3D CPUs',"No solutions yet, but it's better than staying quiet on the whole matter."
Intel Nova Lake CPUs on track for late 2026 as exec downplays shuffling capacity to meet datacenter demand: 'We have important customers in both datacenter and client and that needs to be our priority',Would you consider Nova Lake?
"Finally, another Armored Core instalment just surprise dropped on Steam, but you'll need to have the patience of a saint to play it","It's not Armored Core 1, 2, 3, 4, or 5, or any of their offshoots, for the record."
"Fable reboot devs aren't trying to make a Lionhead game, but one important hallmark will carry over because 'kicking chickens is classic Fable'","Is it right, or is it wrong, to kick a chicken?"
"After Hytale subreddit goes 'full panic mode,' dev assures players the new patch 'is NOT the magic system' that's coming in the full game","Hypixel CEO Simon Collins-Laflamme says the necromancy grimoire is ""just a random drop fun item, it will evolve over time."""
"Fable has 1,000 'handcrafted' NPCs, and you can apparently marry every single one of them",Polygamy achievement unlocked?
"Roguelike fatigue is real, but I can make an exception for this upcoming project that remixes some of my favorite stealth games at 90 mph",Roguelike Dark Messiah of Might & Magic alright I'm on board.
"'There would be no Alan Wake 2 without Epic Publishing,' Remedy says in defense of Epic's deals with developers: 'The publishing deal with Epic was very fair to Remedy'",The statement comes in response to Larian publishing boss Michael Douse's comment that Epic's deals might do more harm than good by keeping games off of Steam.
An Italian hotel sharing a name with an Arc Raiders map is enjoying a flood of 5-star reviews from players praising the loot in its 'surprisingly charming' Seed Vault and its 'eventful' Night Raid nightlife,Congratulations and/or apologies to Hotel Stella Montis.
Cyberpunk 2077 VR mod creator removes works from Patreon after yet another DMCA strike,"The creator of the Cyberpunk 2077 VR mod, as well as a variety of other R.E.A.L VR mods, has taken his works down from Patreon after receiving another DMCA strike. This time, from Ghostrunner developer 505 Games. Read more"
There's a Super Mario Galaxy Movie Nintendo Direct coming this Sunday,"Nintendo has announced a Direct dedicated to its upcoming film sequel, The Super Mario Galaxy Movie . Read more"
Big Hops uses the greats of platforming history - including Tomb Raider and a dash of Galleon - to create something distinct and wonderful,"Big Hops is a 3D platform game about a frog, but it’s also a 3D platform game about 3D platform games. This seems almost inevitable when it comes to this most nostalgic of video game genres. But what marks Big Hops out, I think, is the sheer enthusiasm with which it explores the genre’s past, along with the invention and imagination with which it brings a panoramically broad range of influences together. Read more"
Vampire Survivors' highly anticipated deck-building spin-off is getting an Xbox and Steam demo soon,"If you're one of the 200K+ people who've already excitedly wish-listed Vampire Survivors' much-anticipated deck-building spin-off Vampire Crawlers, there's some good news to carry you into the weekend: a demo is arriving for Steam and Xbox Game Pass on 23rd February. Read more"
"Only a ""relatively small"" team from Pokémon developer Game Freak is actually working on Beast of Reincarnation","Pokémon developer Game Freak is working with multiple partner companies on its upcoming release, Beast of Reincarnation. Read more"
"Despite signs of a Fallout season two viewership slump, Amazon say it's Prime Video's sixth biggest season of all time","Following its slam-dunk first season, Amazon's TV adaption of Fallout has, according to reports earlier this year, faced a bit of a sophomore slump in terms of viewership. But despite an apparent dip in popularity, Amazon has now revealed enough people are still tuning into the show that it's officially Prime Video's sixth biggest season of all time. Read more"
"Ubisoft's long-in-the-works Beyond Good and Evil 2 ""a unique proposition"" in the open world adventure market, studio says","Ubisoft has confirmed Beyond Good and Evil 2 - which it first announced almost two decades ago - remains a priority for the studio, and ""fits with [its] strategy of focusing on Open World Adventures"". Read more"
"""That situation remains difficult to reflect on"" - GOG's decision to pull Taiwanese horror game Devotion plagues the company still","Digital online PC game store GOG has acknowledged that it ""damaged the trust our users have in us"" when it abruptly removed the acclaimed horror game Devotion from sale just over five years ago. Read more"
"Sophie Turner's Lara Croft is ""so unashamedly capable"", Tomb Raider actor says","Sophie Turner is set to star as Lara Croft in the upcoming live-action Tomb Raider series from Amazon, and it sounds like beyond just costume aesthetics, the globe-trotting heroine will also be leaning into the character's more confident 90s personality as well. Read more"
"United Video Games union writes to US Fed in protest of Saudi EA acquisition, attaching public petition","The CWA-backed United Video Games union has written to the US Federal Trade Commission in opposition to the proposed acquisition of EA by private investors, including Saudi Arabia's Public Investment Fund and various investment firms. Read more"
"Earth Must Die's stellar comedy cast and novel 'no touching' point-and-click twist make for a bawdy sci-fi treat, despite some fumbles","Imagine sitting down with EA Sports FC and discovering your diddy little soccer-man doesn't want to kick the ball, or firing up your favourite FPS and finding your avatar's developed an aversion to guns. And what if Mario suddenly said no more turtles near his bottom? Chaos would ensue! But that's pretty much where we find ourselves in Earth Must Die; a point-and-click sci-fi comedy adventure from acclaimed studio Size Five Games that doesn't even bother with an inventory because its protagonist - VValak Lizardtongue, Grand Shepherd of the Tyrythian Empire - refuses to touch anything. Read more"
"Ey up, this lad from Emmerdale is playing Norse god Heimdall in Amazon's God of War show - that's 'Norse' not up ""north""",Max Parker has joined the cast of Amazon's upcoming God of War series. Read more
"Valve's Deadlock is still invite-only, but that hasn't stopped six new characters being added via a major update","A new major update for Deadlock suddenly dropped, bringing six new characters that will join the roster gradually, a new game mode, and various quality-of-life tweaks to the popular MOBA. Read more"
"Psychonauts studio's latest oddity is pottery themed party brawler Kiln, and it's coming to Xbox, PS5, and PC","You can always count on Pyschonauts studio Double Fine to do something unexpected, and hot off last year's magical lighthouse adventure Keeper , the team has unveiled its latest oddity, Kiln: a pottery themed party brawler making its way to Xbox Series X/S, PC, Game Pass, and PS5 this ""spring"". Read more"
"Fable finally gets a release window following Xbox Developer Direct, will launch in Autumn 2026",A release window for Fable has just been announced at the Xbox Developer Direct. Read more
"Forza Horizon 6 shows off the series' ""largest"" ever map as Microsoft confirms a May release and a PS5 launch later this year","It's a big day for Xbox fans, with Microsoft finally offering a closer look at some of its most anticipated titles, courtesy of its first Developer Direct of the year. And that began with a fresh peek at Forza Horizon 6 , bringing word of a 19th May release date on PC and Xbox, with a PS5 launch coming later this year. Read more"
Beast of Reincarnation gets Summer 2026 release window and gameplay breakdown at Xbox Developer Direct,"Beast of Reincarnation got a new gameplay presentation at the Xbox Developer Direct, as well as a Summer 2026 release window Read more"
Xbox Developer Direct 2026: Everything announced,"The Xbox Developer Direct has returned for 2026! While Microsoft kindly gave us all an early heads up on some of the games appearing - Fable (finally!), Forza Horizon 6 and Beast of Reincarnation. The showcase has given us an excellent look at the gameplay for each game and the new features you can expect to enjoy in returning titles like Forza Horizon 6. Like any good showcase, there was a nice surprise too! Read more"
Metroid Prime series producer Kensuke Tanabe is reportedly retiring after four decades at Nintendo,"Veteran Nintendo producer Kensuke Tanabe, perhaps best known for his work overseeing the long-running Metroid Prime series, is reportedly retiring after almost four decades with the company. Read more"
A Steam Fest every 2.4 weeks: there are 22 planned for 2026,"Valve has announced that Steam will feature 22 themed fests in 2026, coming in at around a different video game festival promotion every 2.4 weeks. Read more"
"Will Fable steal the show at tonight's Xbox Developer Direct? Join us here to discuss everything announced, as it happens","Tonight is the night when - after what has felt like months and months of waiting - we will finally get another look at Playground Games' Fable, thanks to the upcoming Xbox Developer Direct. Read more"
"Are smaller ""one-sitting"" games the way to go? Sorrowful archive-scouring game TR-49 sees Inkle's best launch ever","Creepy archive-searching deduction game TR-49 has had the best launch of any of Inkle's many games, the studio revealed today, meaning it sold better than games like Heaven's Vault and A Highland Song , which took longer and far more resources to make. Read more"
"""My whole balance got wiped"": Arknight Endfield halts Paypal payments after players were charged for transactions they didn't make","Arknights: Endfield, a new gacha action game released today, has temporarily halted PayPal transactions after multiple players were charged real money for in-game purchases they didn't make. Read more"
"Hate snakes? Don't worry: upcoming Hytale patch adds ophidiophobia toggle, as well as other tweaks",Hypixel Studios has detailed the second patch for its Minecraft-like Hytale. Read more
"In 2026, Lara Croft seems to be returning to what made 90s Tomb Raider great - and as a lifelong fan, I couldn't be more excited","This likely won't come as a surprise to read, but I am a huge Tomb Raider and Lara Croft fan, and this fandom goes all the way back to when I was about eight years old. I clearly remember playing the original Tomb Raider games at my friend's house after school on his dad's computer. Now, admittedly, most of the time I was either running away from various creatures while screaming and clenching my buttocks very tightly, or flexing my skills at Croft Manor rather than actually raiding tombs, but the sense of wonder and fun I felt back then has stayed with me all these years later. Read more"
Highguard really is alive and even has a PS5 trophy list,"The PlayStation 5 trophy list for Highguard - The Game Awards' 'and one finale thing' from last year's show - is now out, offering further proof of life for Wildlight Entertainment's live-service hero shooter. Read more"
Ever wanted to play The Witcher 3 with friends? An online multiplayer mod has arrived,We can now finally play The Witcher 3: Wild Hunt with other people courtesy of a new online multiplayer mod. Read more
"One of Battlefield 4's most iconic maps is getting totally remade for Battlefield 6 Season Two, and it'll be the new game's largest map to date",EA has revealed that one of the most iconic maps from Battlefield 4 is being rebuilt and brought over to Battlefield 6 as its largest map to date. Read more
Forza Horizon 6 release date leak corroborated ahead of today's Xbox Developer Direct,Act surprised: the Forza Horizon 6 release date does appear to be 19th May - a date we're expecting to be announced during this evening's Xbox Developer Direct . Read more
Free new Mario Kart World update adds team races to its Knockout Tour mode,"Nintendo has released a free update for Mario Kart World , which adds team races to its chaotic Knockout Tour mode. Read more"
"If you want Gears of War to return to the ""tone and vibes of the original games"" E-Day sounds like it's doing just that","In a new interview, Gears of War E-Day creative director Matt Searcy has peeled back the curtain a little on the upcoming prequel to everyone's favourite gory third-person shooter. Namely, that by returning to Emergence Day the original series' vibes will return. Read more"
"Sands of Time's shock cancellation ""does not mean we are stepping away from the franchise"", says remake team",Ubisoft's Prince of Persia: The Sands of Time Remake studio has shared a statement following its game's shock cancellation. Read more
"Ubisoft's troubled Prince of Persia: Sands of Time remake is dead as publisher kills multiple projects, closes studios, and orders staff back to the office",Ubisoft has closed two studios and cancelled six projects - including its much-delayed Prince of Persia: The Sands of Time remake - as part of a major restructuring effort that will also see delays for seven games. Read more
"Visually impressive open-world fantasy adventure Crimson Desert goes gold, locks in a March release date","Crimson Desert has been making waves since it was revealed in late 2019 , with 2025 giving it an extra boost in popularity following several previews and new trailers . As we approach its 19th March launch date, many were wondering if a delay could happen. Turns out, there was nothing to worry about, as the game has just gone gold. Read more"
"Hats off to 2XKO, which has a included a hidden easter egg alongside its latest character release","2XKO is out properly on PC and consoles, bringing with it a slew of new features and Caitlyn as its 12th fighter. However, inquisitive players quickly found a fun easter egg tied to Caitlyn that significantly changes the character's appearance in game. Read more"
Fallout season two's latest episode has a super Easter egg cameo for fans,"The sixth episode of Fallout season two has just aired on Prime, and with it given viewers and fans a fun cameo to look out for. Read more"
Dark Souls 2 veterans are taking up arms again soon with 'Return to Drangleic' 2026 event set for late February,"Much has been written over the years on Dark Souls 2 's quality and whether it reached the heights of its relatives . In the grand scheme of things, it doesn't really matter, as the sequel has consistently attracted players over the years and with two different versions of the same gruelling action-RPG adventure. Read more"
TR-49 review,Inkle mixes archive-surfing and audio drama to create a surprisingly powerful story of obsession and a machine. Read more
"""We respect their time, and in turn they stick around"" 25 years later, here's why Jagex believes so many people still play RuneScape","One of the UK's home-grown video games is turning 25-years-old, and anybody who ever had to sit through a boring IT lesson at school likely already knows what it is. It's RuneScape , the point-and-click MMORPG that not only has remained popular over the years, but has seen a surprising amount of growth recently. The big question is: why? Read more"
"Little Nightmares spiritual successor Reanimal announces a friend's pass for easy co-op, details post-launch content and system specs","Reanimal might be flying under many radars, but it's one of the most promising horror games set to be released in 2026. Ahead of its February launch, Tarsier Studios wants to make sure we know what's coming next month and beyond. Read more"
"Cyberpunk 2077 VR creator says he's being ""punished"" by pirates after mod take down","The creator of Cyberpunk 2077 's R.E.A.L VR mod, which was taken down earlier this week following a DMCA strike by CD Projekt Red , has stated that he's being punished by pirates sharing his mods online. Read more"
"Final Fantasy 7 Remake is still excellent on Xbox and Switch 2, even if it's beginning to show its age","In many ways, it's sort of hard to believe that Final Fantasy 7 Remake is six years old. I don't mean that in terms of how ahead-of-the-game it was, either - it's sort of the opposite. This is a recent game that, on replay, feels like a curious time capsule, a slice of game design that has become far less common since its release. Mercifully, no matter how aged it might feel in places, it's still a most enjoyable and easy-to-recommend experience. Read more"
"Arc Raiders players who spawn late into matches profit more, senior lead confirms","Arc Raiders who spawn into maps late actually tend to profit more economically, according to a recent interview with design lead Virgil Watkins. Read more"
Don't expect the developers of this popular Fallout 3 and New Vegas crossover mod to rework it for potential remasters from Bethesda,"Fallout games are enjoying yet another surge in popularity following the release of Season 2 of the TV show. At the same time, Fallout 76 continues to evolve as it approaches its eighth anniversary (haters in shambles). Diehard fans can't wait to learn about the long-rumoured remasters of 3 and Vegas, though. Read more"
Animal Crossing New Horizon’s new update is a reminder that the game is at its best when you’re doing nothing at all,"My Animal Crossing island isn't a spot in the ocean so much as it's a gap in the day. It's a place I return to at least once every 24 hours. Like Dale Cooper and his coffee, I don't plan for it, I just let it happen. In between the school run, the inbox, whatever I'm writing and whatever I need to leave the house for, there will surely be that glittering moment when the Switch - or the Switch 2 - calls to me, where I wonder how Spike is doing today, and where I feel like a trip to the Roost would hit pretty good right about now. Read more"
