title,text
"Peak dev solves game pricing and possibly all economics: '4 bucks is also kind of 5 bucks, 3 bucks is 2 bucks. And 2 bucks is basically free'","Oh, to be seen."
"Fanatical bundle lets you snag 3 Fallout games, Disco Elysium, a ton of Steamworld, and more for roughly $3 a pop",I'd take that deal. You'd take that deal? Damn good deal.
Intel's 'Big Battlemage' GPU did not appear at CES but the rumours just won't go away,"G31 GPU shows up again, this time in an Intel driver package."
All Heartopia codes for January 2026: Moonlight Crystals and Materials,"All active Heartopia codes for Moonlight Crystals, Crafting Materials, and Repair Kits."
"Anthem players log in to say goodbye to the game they loved before it's gone forever: 'Strong alone, stronger together'",Another one bites the dust.
"The sound of this one specific bird from Age of Empires keeps haunting me through pop songs, movies, and across other games",It's like the Wilhelm Scream of birdsong.
"Five new Steam games you probably missed (January 12, 2026)",Sorting through every new game on Steam so you don't have to.
A dev on Minecraft-like Hytale has already used its creative tools to make a homebrew side-scroller,"Notably, said developer is not a programmer."
"Warhammer World, Games Workshop's pub-slash-hobby store celebrating the venerable wargame, is coming to the US",My assumption is that it's like a McDonald's PlayPlace but grimdark.
"'Don’t toil away on the things that don’t really matter': Peak creator says its rapid development cycle has 'proved that there are definitely different, but maybe better ways to make games'","Peak started as a game jam, but became a smash hit."
Epic Games CEO Tim Sweeney argues banning Twitter over its ability to AI-generate pornographic images of minors is just 'gatekeepers' attempting to 'censor all of their political opponents',"Not the hill I'd die on, but I'm not a billionaire."
"Larian says Divinity's character customisation will be 'even better' than Baldur's Gate 3's: 'More colors, more options, more control'",Prepare to enter a new frontier of hand-sculpted genitalia.
"Sonic the Hedgehog is everywhere when it comes to merch, but finally some more underrated characters are getting airtime thanks to Steady Hands","Hopefully more characters are due in the future, too."
Here's that noir thriller built in the original Half-Life engine you asked for,Blast your way through the neon-drenched city of Prava as you aim to take down its most dangerous gangster.
The Witcher 3's former lead quest designer says 'of course' there is romance in upcoming vampire RPG The Blood of Dawnwalker: 'You can expect to build relationships with characters',Love bite.
Former Assassin's Creed director doesn't think the current way of making big budget games is 'tenable': 'I think the future lies in smaller teams',"""There's this theory that says that whenever humans create something that surpasses a hundred people, it completely changes the dynamic of it."""
"Manor Lords' dev is experimenting with a new trading system that allows for 'deliberate economic strategies', including establishing monopolies on resources","""You could, for example, attempt to monopolise Iron Slabs by hiring all Merchants on routes that export them."""
"After Netflix pulled the rug from under Monument Valley 3 six months after launch, its developer says it's a 'PC first' studio: 'we can build more direct relationships with our audience and community'","Ustwo is also the studio behind Alba: A Wildlife Adventure, Assemble With Care, and Desta: The Memories Between."
"Divinity: Original Sin 2's brilliant armor system is one of a kind in RPGs, and I'm bummed we'll apparently never see it again",Sic transit gloria mundi.
"Original Fallout lead Tim Cain reckons vitriol around games has always been around, but it's 'more hostile' these days: 'I see lot of people arguing past each other, even if that means denying that the other group even exists'","""People have always had different tastes and they wanted different things."""
"'Every year they got f***ing chocolates that we didn't': Valve gives a box of sweets to Steam's biggest breadwinners every year, and Peak's devs finally got one after years of jealously watching their Slay the Spire office mates enjoy GabeN confections","It's okay, they finally got it."
Deadlock dev teases the community over its favorite hero that was briefly tested and removed: 'We made delicious stock out of his bones and meats',"The curious case of Fathom, Deadlock's missing best boy."
"Larian's head writer has a simple answer for how AI-generated text helps development: 'It doesn't,' thanks to its best output being 'a 3/10 at best' worse than his worst drafts",My worst drafts are a 5/10 but I might have lower standards.
'I can finally do the thing I wanted to do in every previous game': Divinity's head of design teases a new mechanic without saying what it is,"""It stares you right in the face if you think about it."""
"If you've got a spare 200 hours, the massively ambitious sci-fi grand strategy from the creators of X-COM: The Long War just launched out of early access",Terra Invicta aims to be the last word in preparing Earth for alien invasion.
"Valorant's latest update adds a new pistol to spice up early rounds, as Riot plans to take 'a holistic look' at the shooter's arsenal through 2026","Riot wants to continue ""putting the emphasis back on gunplay""."
"If for some reason you can't get enough of Stranger Things' Vecna, you can now play as him in Dead by Daylight's latest crossover",Behaviour Interactive's second collab with Netflix lets you play as the series' fleshy villain.
"A classic space sim conceived by Star Citizen's creator just got an unofficial sequel after 15 years of development: 'The project was based on the crazy idea that Microsoft ""axed"" Chris Roberts' Freelancer'",Freelancer: The Nomad Legacy is available now.
Luto is an underappreciated 2025 horror gem with the perfect mixture of Stanley Parable narration and P.T. ambience,The horrors of being held hostage by your own home.
Baldur's Gate 3's lead writer hopes we won't want to save scum in Divinity: 'Our ambition is certainly to make failure more interesting',"F5 + F8, save scummers say ""great"" / Overwriting autosave, scummers behave!"
"Valve spent 2025 ripping apart Deadlock and putting it back together, and it delivered better live service than most live service games","Valve's futuristic MOBA has been figuring itself out on the fly, and I kind of prefer that to a carefully considered roadmap."
Baldur's Gate 3 composer Borislav 'Bobby' Slavov is coming back for Divinity: 'We wouldn't be able to stop him even if we wanted to',"Slavov's return was confirmed, twice, during today's AMA."
"Arc Raiders player ranks 30 common outfits by how likely they are to shoot you in the back, and I have to admit it's right on the money",And not just because my go-to outfit is in the nicest tier.
Competitive demon slaying is about to take over Diablo 4 as its next update finally adds official leaderboards,Get your builds ready.
Over half of The Sims development team is working on The Sims 4 and 'the next evolution' so I guess it's time to start speculating again,Here we are again trying to divine the future of The Sims from an announcement about the future of The Sims.
"Divinity's reveal trailer was brutal and dark for a reason, Larian's writing director says: 'We want to give players the opportunity to be the light in that darkness'","But not in the way that those dudes who got burned alive in the trailer were lighting up the darkness, I suppose."
It's not the news we wanted but it's what we expected: EA has finally admitted Project Rene is a 'mobile-first' game,"After over a year of leaks, getting some answers about the future of the series is better than more silence."
The PvPvE extraction shooter where you build and drive a huge stompy mechanical base across a ruined planet gets a Steam release window,Sand: Raiders of Sophie is stomping our way soon.
You'll never guess what the 'Random Heart Attacks' mod for Red Dead Redemption 2 does,"OK, maybe you will."
"For all the Divinity dev details Larian isn't ready to comment on, we got a firm answer about the game's controls: the studio's sticking to its guns on no WASD movement",I can respect it.
Tetris creator says the Rubik's cube is 'the symbol of modern civilisation' and we should send them into space,"But Tetris would be ""too complicated."""
"Unfortunately, all of that doomsaying last year was correct and SSD prices are surging as a result of the memory crisis",The best time to buy an SSD? Yesterday.
Panther Lake's gaming chops look solid but the battery life is truly what interests me as a PC gamer on the go,Could Panther Lake be set to make a splash?
"Looks like the EU is getting serious about open source, which could eventually spell good news for Linux and hopefully gaming distros","Open all roads to open source software, I say."
"Larian's given us a single-word spoiler for Divinity, its next game, and for some reason it's 'alligator'",Spoiler alert for the future.
"'I wish Wyll had gotten more content' says the Baldur's Gate 3 writer who wrote him, and splitting his story between devils and dads 'might have been a mistake in hindsight'","I like Wyll fine, but he never feels like he gets the airtime that, say, Astarion does."
Elder Scrolls fans are taking it well after Microsoft says it's a 'big year for games ending in 6' ahead of its upcoming Xbox Direct showcase: 'I'm practically living off hopium and copium at this point',Grand Theft Auto 6 isn't the only big game people are waiting for.
"Gigabyte's new OLED gaming monitor debuts 'HyperNits' brightness tech, so are screens with regular nits now second best?","In a word, no."
Divinity will officially wave goodbye to Original Sin 2's broken armour system,"Now, Larian, are Action Points returning?"
Hell is Us review,The haunting world of Hell is Us has a lot to offer when you're not fighting the same handful of enemies.
Palworld is getting an official card game this summer,"Pocketpair has announced Palworld Official Card Game, which is, yes, an official card game based on the developer's monster catching survival game, Palworld. Read more"
"As roughly one-in-ten Arc Raiders players reset their characters, Embark Studios is looking for new ways to incentivise expeditions","With the first expedition window for Arc Raiders concluded in December, Embark Studios has revealed that just over a million players opted in to reset their characters in exchange for various rewards. Having sold over 12m copies according to analyst estimates , that's under 10 percent of all players. Read more"
"""A sad end to a sad story"" - fond Anthem farewells begin as BioWare's Destiny-like game reaches last day of operation","At some point today, EA will turn the Anthem servers off, rendering BioWare's multiplayer online shooter inaccessible and unplayable, presumably forever. And fond farewells have already started to pour in. Read more"
Why don't we see male V in post-launch Cyberpunk 2077 marketing? The Cyberpunk 2 creative director has a very simple explanation,"When Cyberpunk 2077 was sort of relaunched with its 2.0 update and the Phantom Liberty expansion, female V took over as the face of the game. More than two years later, and with the RPG still selling well and attracting new players, that hasn't changed. Read more"
"The Division appears to be getting the ""definitive edition"" treatment soon, but we don’t know yet quite what that means","Tom Clancy's The Division 2 is still trucking along, and with an ambitious 2026 roadmap to boot, while development on the third game continues. More shocking, though, is the apparent tease that The Division 1 is making a return for its 10th anniversary. Read more"
"Following its cancellation by Riot, Hytale devs anticipate over a million players in Early Access alone",Hytale's founder Simon Collins-Laflamme has revealed the team expects over a million players on the game's Early Access launch day on the 13th January. Read more
"Larian wanted a Baldur's Gate 3 Switch 2 release, but that decision apparently wasn't in the studio's hands",It wasn't Larian's choice to not release Baldur's Gate 3 on Switch 2 . Read more
Awesome Games Done Quick 2026 closes with £1.8m raised for Prevent Cancer Foundation and a 70-player relay in Super Mario 64 Replay,"Awesome Games Done Quick 2026 has raised $2.44 million (£1.8m) for its latest cause, Prevent Cancer Foundation. Read more"
GameStop reportedly shuts hundreds of US stores as CEO strives for $35bn pay packet,US game retailer GameStop has reportedly shut hundreds of stores. Read more
"Former Assassin's Creed director says the future of game design ""lies in smaller teams""","Former Assassin's Creed director Alexandre Amancio has shared his thoughts about AAA development, suggesting we need ""smaller teams"" and admitting that big-budget developers cannot ""solve a problem by throwing people at it"". Read more"
Code Vein 2 wants to introduce you to The Blinded Resurgence Offspring,"Code Vein 2 is just a few short weeks away now, and to celebrate, Bandai Namco has dropped an all-new teaser trailer entitled ""The Blinded Resurgence Offspring"". Read more"
"As Grok continues generating sexualised images, Epic Games boss says senators calling for a ban are trying to ""censor all of their political opponents""","As X/Twitter owner Elon Musk moves Grok's widely condemned AI image manipulation feature to paid-only and users flood the ""town square"" with thousands of sexualised images, Epic Games boss said that senators calling for the removal of X from the Apple and Google stores are trying to ""censor all of their political opponents"". Read more"
"Poppy Playtime: Chapter 5 - Broken Things gets a subtitle and a PC release date, but console players will have to wait a little longer","Surprise! We finally have a release date and a subtitle - ""Broken Things"" - for Poppy Playtime 5: 18th February, 2026. The console release for Chapter 5 will reportedly ""follow in the months ahead"". Read more"
"The Sims wants you to know its values ""are unchanged"" despite EA sale","EA has stressed to its community that ""the values of The Sims are unchanged"" as we head into 2026. Read more"
"2026 will be ""one of the biggest years in the history"" of co-op ghosthunting game Phasmophobia","Phasmophobia developer Kinetic Games reckons 2026 will be ""one of the biggest [years] in the game's history"" as it moves towards the full release of the game. Read more"
"Forza Horizon 5 PS5 port tops 5 million sales, securing $300m in additional sales for Xbox",Forza Horizon 5 has reportedly sold more than 5 million copies on PS5. Read more
"What we've been playing - ""I then made fishcakes and fed them to a time-frozen lad called Pirate Pete""","Hello and Happy New Year - is it okay to say that now? I'm not sure where the cut-off point is. Some people still have their Christmas trees up. We had ours out before New Year. Welcome back to What We've Been Playing! Or as I like to call this particular edition of it: What We Played Over Christmas, because it's been a couple of weeks since we've talked. Read more"
"Larian ""will certainly consider"" a Divinity Switch 2 release","Baldur's Gate 3 developer Larian ""will certainly consider"" getting its upcoming release Divinity onto Switch 2 . Read more"
Roblox adds facial age checks to curb concerns around online safety in world's most popular game for children,"Roblox has begun its global rollout of facial age verification onto the popular gaming platform starting today, in an attempt to improve child safety following a deluge of criticism. This comes after a partial rollout of the technology back in December. Read more"
What would Discord going public mean for gaming's biggest communication platform?,"Earlier this week, reports indicated that big moves were happening at Discord. According to Bloomberg , the company responsible for gaming's most popular social platform had confidentially filed for IPO, indicating a major move towards going public. Read more"
Change of mind: Larian says it will not use gen-AI at all in relation to Divinity concept art,Baldur's Gate 3 developer Larian has changed its stance on generative AI following backlash faced at the end of last year. Read more
"As newer MMOs shutter or struggle to find an audience, 22-year-old Eve Online recently saw a massive surge in new players. But why?","Eve Online - the sci-fi MMO space-faring epic - saw a surge in players at the tail end of 2025. The game had over a million players take to the stars in 2025, and it has benefited from the largest influx of new and returning players in years. Read more"
"Despite helping create it, FromSoft's Hidetaka Miyazaki reckons Game of Thrones author George R. R. Martin would probably be quite surprised by how the world of Elden Ring turned out",Game of Thrones author George R. R. Martin would probably be quite surprised by how the world of Elden Ring - which he helped developer FromSoftware create a backstory for - actually turned out in the end. Read more
"Our New Year 2026 gaming resolutions - ""I want to see how close I can get to 100 percenting the game in 24 hours""","January is the month that, where I live, in the south of England, everyone gets serious again. All the paraphernalia of Christmas - all the merriment and cheer and colourful lighting - is cleared away in favour of sobering goals for the year ahead. It's never something that's appealed strongly to me, making goals, but I do feel the allure of wiping a slate clean and starting again. It's like a run in a roguelike game, I like to think. Time for a new me. Read more"
"Developers of beloved horse game, Umamusume, confirm plans to establish AI-focused sub-studio","Cygames, the Japanese video game developer responsible for a variety of popular games including Umamusume: Pretty Derby, has announced its intention to create an AI-focused subsidiary company. Read more"
"A year later, Xbox RPG Avowed is finally coming to PlayStation 5","Former Xbox exclusive role-playing game Avowed is coming to PlayStation 5, and it'll be released on the game's first anniversary: 17th February 2026 (note: the original PC and Xbox Series S/X release happened on 18th February 2025 but it's only a day's difference). Read more"
"Clair Obscur's final boss was a bit easier than developer Sandfall planned, mostly because everyone actually engaged with all the side content","Clair Obscur: Expedition 33 developer Sandfall underestimated just how much players would engage with the game's various sidequests and optional content, and as a result of this extra grinding would find the final boss fight a tad underwhelming. Read more"
"2026's rumoured Witcher 3 expansion will take us further afield than ever before, per new rumours","It's been a busy year so far for a game that's over 10 years old. If you've not been following, last week, we asked "" is there really going to be a new Witcher 3 expansion this year? "", responding to comments from Borys Nieśpielak, a trusted source of Polish games industry information. Following his remarks, a Noble Securities analyst then added fuel to the fire this week. Read more"
Phasmophobia studio Kinetic moves into indie publishing but is otherwise entirely focused on horror game's impending 1.0 release,"Phasmophobia studio Kinetic Games is branching out into indie game publishing, and is actively seeking ""creative games from small teams and solo developers globally, who have a clear vision for their title and are 12-18 months from release"", a press release said. Read more"
"Xbox is hosting a Developer Direct later this month, featuring Fable, Forza, and more","Microsoft has announced another Developer Direct, set to take place on the 22nd January. It'll feature Fable, Forza, and Beast of Reincarnation. Read more"
"Nintendo's got two new Joy-Con 2 colours for Switch 2, and they're due next month","Nintendo has announced two pastelly new Joy-Con 2 controller colours for Switch 2 , and said they'll release next month. Read more"
"""We reiterate our firm belief that Rockstar broke the law"" - union and GTA 6 maker clash again around preliminary hearing for fired workers","The Independent Workers' Union of Great Britain (IWGB) and Rockstar Games have traded more blows following a preliminary tribunal hearing this week. There, the IWGB asked a judge to grant the fired Grand Theft Auto 6 developers interim relief. Read more"
"Netease pirate RPG Sea of Remnants gets a new gameplay trailer, showcasing drink-offs, Mahjong, and ocean combat","Netease has finally released a gameplay trailer for its pirate Adventure RPG Sea of Remnants, which showcases a variety of features including ship combat, open area exploration, drinking competitions, and Mahjong. Read more"
"Avatar: Frontiers of Pandora sees a boost in players after Avatar: Fire and Ash's box office domination, and the addition of a surprisingly decent DLC drop and update","The world has gone blue once again. James Cameron's Avatar: Fire and Ash is torching the box office, having already passed the $1 billion global mark and probably kickstarting serious conversations about Avatar 4 and 5 (both are written but waiting for the green light). And it looks like 2023's Avatar: Frontiers of Pandora is also benefitting from some brand synergy. Read more"
A mysterious new Life is Strange game has just been rated in Europe,"A new Life is Strange game, titled Life is Strange: Reunion, has been rated in Europe. Since being discovered by fans, the game's presence on the PEGI website has since been removed. Read more"
Netflix confirms The Witcher series will end this year,Netflix has today confirmed that the fifth and final season of The Witcher will air on the streaming service this year. It follows Season 4 in rapid succession - that series having launched at the end of October last year. Read more
"The Witcher 3 expansion rumours refuse to go away: originating analyst is ""100% certain CD Projekt Red will release significant new content this year""","The analyst who forecasted a Witcher 3 expansion release in 2026 has told me they're ""100 percent certain [CD Projekt Red] will release significant new content this year"". Read more"
Fans are convinced a Raid: Shadow Legends collaboration could signal the impending arrival of an Assassin's Creed Black Flag remake,"We've been hearing rumblings of a full-blown remake of Assassin's Creed: Black Flag for the longest time now. After Skull & Bones ' troubled development, those current-gen assets could boost the production of such a project, so the idea never sounded too far-fetched. We've yet to receive official news on it though. Now, a new Raid: Shadow Legends event has got hungry Assassin's Creed fans all hot under the collar. Read more"
Hollywood sure sounds keen to make an Arc Raiders film,"Apparently, there are many studios out there that are interested in making a film or TV show based on Embark's shooter, Arc Raiders . Read more"
"Fallout 4, New Vegas player numbers skyrocket thanks to the unavoidable impact of Fallout Season 2","If you haven't been watching, Fallout Season 2 is pretty great and has been enjoying a good deal of success. So much so that Season 3 is already well into the writing stage . New games are sadly still a ways off, however, which is why both veteran and new players are flocking to Fallout 4 and other entries to go post-apocalyptic. Read more"
Danganronpa and The Hundred Line: Last Defense Academy creator blames an insult from a co-worker on getting him back into game development,"Kazutaka Kodaka is one of the most recognisable names in the games industry for those who really enjoy anime-inspired visual novels. Recently, he led The Hundred Line: Last Defense Academy 's development, and the his name may be familiar to anyone au fait with the Danganronpa series. But the creator's journey to get back into the world of game development wasn't exactly a straight line. Read more"
"It wasn't PlayStation, Switch, PC, or Xbox that dominated my family's gaming this Christmas - it was Netflix, on the TV","My household is tricky to please. A 12-year-old who essentially wants to play Fortnite 24/7, a four-year-old who wants to do what the 12-year-old is doing but can't because she's four, and me and my wife who want to do anything that'll keep those two happy for more than five minutes so we can sit on the sofa and drink a coffee because we deserve FIVE GODDAMN MINUTES! It doesn't sound like much of an ask, but it really is, trust me. I needed a Christmas Golden Goose, something I could tap into whenever family harmony started to teeter towards a level of chaos no amount of Cadbury's Heroes could remedy - while the Bluey scavenger hunt game is good, it definitely skews more four-year-old, and traditional video games were off the menu. In my festive hour of need, as if sent by Santa himself, Netflix provided. Yes, Netflix. And no, we didn't just watch The Grinch on repeat (although we did watch it a lot - the animated one, not the naff Jim Carrey one). Read more"
Fallout season three filming starts sooner than expected,Filming for the third season of Amazon's Fallout adaptation is kicking off sooner that we first expected. Read more
