title,text
"The Division 3 Is Gearing Up ""To Be A Monster,"" Says Series Executive Producer","Ubisoft and Massive Entertainment seem to be feeling pretty good about the development of Tom Clancy's The Division 3. Julian Gerighty, who oversees the franchise as executive producer, says the game is ""shaping up to be a monster."" In an interview at the New Game+ Showcase (via VGC ), Gerighty opened up just a bit about the next major installment in the online action-RPG series. ""The Division 3 is in production, right? This is not a secret; it's been announced,"" Gerighty said. ""It’s shaping up to be a monster."" In 2023, Ubisoft officially announced that The Division 3 was in development , so of course Gerighty is correct that it's not a confidential matter at this point. ""Within these walls at Massive, we are working extremely hard on something that I think will have as big an impact as Division 1 was,"" Gerighty added. Continue Reading at GameSpot"
Fortnite Now Lets Creators Publish Islands With In-Game Transactions,"Epic Games may have opened a can of worms by fully enabling developers in Fortnite Creative to implement in-game purchases into their experiences. Developer tools for in-game transactions were available in Unreal Editor for Fortnite (UEFN) in a preview state since November, letting creators charge V-Bucks for digital items in their unpublished Fortnite Creative modes and games, or ""islands."" Epic Games has just flipped the switch, allowing for these islands to be published. The implementation of these developer tools for monetization in Fortnite Creative has raised complaints and worries, with players comparing this development to Roblox's revenue model. Concerns about pay-to-win practices and predatory microtransactions have emerged in Fortnite communities since Epic Games first announced its plans to implement this approach. Continue Reading at GameSpot"
"Lawsuit Alleges Fortnite, Roblox Structurally Changed A Child’s Brain","Fortnite and Roblox have been named in a new lawsuit filed in San Francisco by a Louisiana mother who's alleging her child may have experienced structural brain changes due to prolonged exposure to online games. Descheca Jackson claims in the lawsuit brought to the US District Court for the Northern District of California on December 30 that her child, a minor only identified by the initials ""MA,"" has developed symptoms consistent with internet gaming disorder (IGD) since playing video games at a young age. This includes behavioral challenges such as her loss of impulse control, withdrawal symptoms, irritability, anxiety, and difficulty disengaging from gameplay. The lawsuit also alleges that MA suffered addiction, social isolation, depression, loss of friends and relationships, and damage to her grades, leading to ""an academic dismissal from school."" According to a February 2025 study reported on by About Lawsuits , IGD is described as a pattern in which gaming negatively impacts a person's daily activities, including school, work, relationships, and family life. The symptoms tend to include nonstop gaming, irritability when access to games is restricted, and continued use despite its negative consequences. The research suggests IGD affects one in 10 adolescent boys, with Minecraft and Roblox often the culprits of the disorder. Continue Reading at GameSpot"
"Larian Studios Draws Harder Line On AI, Clarifies Stance In Reddit AMA","Larian Studios CEO Swen Vincke, as well as creative directors, recently participated in an AMA on Reddit to set expectations for the studio’s upcoming Divinity game , particularly about its stance on generative AI--a hot-button topic in the industry right now. Responding to a fan question about the role of generative AI in game development, Vincke was rather blunt: ""There is not going to be any GenAI art in Divinity."" His comments arrive amid wider debate over how and whether AI should be used in creative processes, especially as some high-profile games have faced backlash for such use. One notable example is Clair Obscur: Expedition 33, the acclaimed RPG that had two Indie Game Awards (including Game of the Year and Debut Game) rescinded when it was revealed the title had included AI-generated assets during development, violating strict no-AI rules--even though those assets were patched out later. In the AMA, Vincke acknowledged that previous discussions about experimenting with AI tools for concept-art had been confusing . To make its intentions clear, the studio has elected to avoid generative AI entirely in concept-art creation for Divinity. As Vincke put it, there should be no doubt about where the art came from. Continue Reading at GameSpot"
Fire Emblem: Path Of Radiance Joins Switch Online’s GameCube Classics Library,"Ahead of the release of Fire Emblem: Fortune's Weave later this year, Nintendo has added Fire Emblem: Path of Radiance to the Switch 2's library of GameCube classics. Regarded as one of the best entries in the entire franchise, Path of Radiance will be available for all Nintendo Switch Online + Expansion Pack subscribers. First released in 2005, Path of Radiance earned critical acclaim for its dark storyline, mature themes, and for being the first 3D Fire Emblem game. Set on the fictional continent of Tellius, the game follows the mercenary Ike and his companions as they set out to rescue a princess and save the kingdom of Crimea from the invading nation of Daein. Like previous Fire Emblem games, Path of Radiance is a turn-based tactical RPG that features permadeath: Any character who falls in battle is permanently lost for the rest of the game. A sequel--Fire Emblem: Radiant Dawn--was released for the Nintendo Wii in 2007. Continue Reading at GameSpot"
Arc Raiders Dev Promises New Anti-Cheating Measures Are Coming Soon,"The extraction shooter Arc Raiders has proven to be one of the top hits of 2025, which has in turn attracted some unscrupulous players who aren't above cheating to win. After the rule-abiding Arc Raiders players became vocal about their displeasure, Embark Studios has announced that new anti-cheat measures are on their way to the game. ""We've seen the discussion around the topic of cheaters in Arc Raiders,"" reads the message shared on Arc Raiders' Discord server via PC Gamer . ""Please know that we are taking this issue very seriously and are listening to, and acting on your feedback. Over the next few weeks, we are implementing significant changes to our rulesets and deploying new detection mechanisms to identify and remove cheaters. This includes updating our Anti-Cheat systems for improved detection and bans, as well as applying client-side fixes specifically addressing the 'out of map glitch.' Furthermore, we are introducing tools for streamers to help mitigate stream sniping."" A firm timetable for the anti-cheat measures wasn't disclosed. However, Embark Studios CEO Patrick Söderlund recently revealed that Arc Raiders has quietly introduced "" aggression-based matchmaking ."" Söderlund went on to clarify that matchmaking is still skill-based, but it will also match players ""based on how likely you are to engage in fights with fellow players."" Continue Reading at GameSpot"
PUBG: Blindspot Is Heading To Early Access Next Month,"Nearly a year ago, Krafton launched the beta test for PUBG: Blindspot , the first-ever spin-off from PlayerUnknown's Battlegrounds (not counting PUBG Mobile). Now, Krafton has announced that Blindspot is getting an early-access release on February 5. This title differs from its predecessor by embracing a top-down perspective and focusing on 5v5 battles in a tactical showdown. Attacking teams are tasked with making their way through a building in order to break into a vault and install a device called the Decrypter. Specific weapons like grenade launchers and explosive hammers can break down the walls standing between the players and their goal. Defending players can set up barricades to slow down their adversaries, but these are battles that ultimately come down to gunplay. The newly released trailer shows off some of the improvements coming to the early-access build, including enhanced visuals and UI, as well as balance adjustments and control refinements. Krafton describes it as a ""launch-ready level of quality"" in support of ongoing development. Continue Reading at GameSpot"
This Star Wars Overhaul Mod Makes Starfield Really Fun To Play,"Starfield has had a somewhat divisive response from players since it debuted in 2023, but there is a Star Wars mod that transforms it into a more rewarding experience. The Star Wars: Genesis mod was released in 2024, but this year, it's adding lightsabers and a more immersive experience for Starfield PC players who want to take the plunge. Star Wars: Genesis was created by a modder who goes by DeityVengy, and it's available for free on Nexus Mods . The mod features an original story that's set between the prequel and original Star Wars trilogies. There is an update coming before the end of January that adds even more content to the mod, and DeityVengy showed off some of those new features in the video below. In the video, DeityVengy notes that using a lightsaber forces players into a first-person perspective because Starfield's melee animations weren't up to the challenge of depicting lightsaber combat. The story featured in this clip also focuses on the player's character confronting one of the Nightsisters of Dathomir before letting them decide whether to spare or slay her. Continue Reading at GameSpot"
Team Fortress 2 Update Released,
