title,text
Call Of Duty: MW4 Features A “Different Version” Of Captain Price,"Call of Duty: Modern Warfare 4 brings back the popular and fan-favorite character Captain Price, played by Barry Sloane, but for the events of MW4, he's a changed man. Spoilers for the Modern Warfare series follow below. At the end of the campaign for 2023's Modern Warfare 3, Price kills General Shepherd, and that's something that Price ""can't really come back from,"" according to MW4 narrative director Jeff Negus. He said in an Xbox Wire interview that Price in MW4 will be ""a different version"" of the character based on his choice to murder Shepherd in MW3. ""We get to forge a new path for him, and see what happens when he’s now in different conflicts --how does this version of Price resolve that conflict?"" Negus said. MW4's campaign follows multiple storylines, one being a group of young South Korean soldiers and the other following ""a vengeful Captain Price"" who is waging a ""personal war from the shadows as he stays one step ahead of those hunting him."" Eventually, the two stories will connect. ""As Price's off-book mission collides with the forces behind the invasion, the war spreads beyond anyone's control,"" reads a line from MW4's story description. The MW4 story description goes on to describe Price as an ""operator-turned-outlaw"" who is now working ""outside the system he once served."" ""A hunt for revenge draws Price toward a weapon powerful enough to shift the balance of power, setting in motion a conflict far greater than he ever anticipated,"" the game's description continues. ""Forced into uneasy alliances and illicit operations, Price is pulled deeper into consequences he can no longer escape."" MW4 launches on October 23 for PC, PS5, and Xbox Series X|S. It's also coming to Nintendo Switch 2 at launch, with Activision's Digital Legends studio building the game's native edition for Switch 2."
007 First Light Includes A Classic Hitman-Era Easter Egg,"Video game developers love to leave Easter eggs behind for longtime fans, and in 007 First Light , IO Interactive has resurrected one of its oldest jokes. Dating all the way back to 2006's Hitman: Blood Money, IO has regularly slipped in an inside joke revolving around Allan and his inability to add details to in-game assets. The tradition is alive and well in 007 First Light, cementing Allan's post-it note legacy. Image credit: David Smith During the 007 First Light campaign, you'll be tasked with searching through rogue MI6 agent 009's stash. Stare at the wall covered in post-it notes, and you'll see several pieces of paper with a polite reminder for Allan to add in some details. This joke and the line ""Allan please add details"" first surfaced in Blood Money, and could be found in a kitchen crate holding a lobster. In the HD version of Blood Money, the line was changed to ""Any details yet, Allan?"" and it would resurface in Hitman 2016. A note with the familiar message was stuck on a computer monitor, and the phrase was also seen briefly in a trailer for the game. The official Hitman website also referenced the joke, this time with a plea for Allan to add some placeholder text. https://www.reddit.com/r/GamingDetails/comments/ayrn04/hitman_series_theres_a_running_joke_about_the/ So who is Allan? That's one of the long-running mysteries in Hitman, with one of the theories revolving around two possible leads. As Reddit sleuths have discovered, Hitman: Blood Money lists two Allans, Hansen and Merrild . Merrild worked on Hitman: Blood Money and Absolution, while Hansen was an artist who worked on every Hitman game through 2012, with Absolution being his final job in the series. A poster for a street magician by the name of Allan Hansen could also be found in Hitman: Blood Money, possibly indicating that IO Interactive is continuing to honor the artist. In other 007 First Light news, the game is off to a strong start and is IO Interactive's fastest-selling game to date . The studio confirmed that it reached 1.5 million sales in just 24 hours, and 007 First Light reviews have been very positive so far. 007 First Light: Meet The Celebrity Cast Of The New James Bond Game View Images"
Call Of Duty: MW4 Cast Includes Leading Actors From Two Very Popular TV Shows,"Call of Duty: Modern Warfare 4's cast of actors is coming into focus, with Luke Tennie from the beloved Apple TV show Shrinking taking on a leading role and Beef and The Last of Us actor Young Mazino in the main role of Private Park . Other actors with roles in the game include Prisca Kim (Beef, Loot), Lanny Joon (Baby Driver, Hollywood Wasteland), William Lipton (General Hospital), and Barry Sloane returning as Price. Variety confirmed the general casting details, and Resonate confirmed Mazino will play Park. Tennie plays the character Lieutenant West in Modern Warfare 4. Posting on Instagram , Tennie said, ""Pretty sure I made lifelong friends working on this."" https://www.youtube.com/watch?v=3V6Y591Zrkg Tennie plays Sean on Shrinking, and he's coming back to reprise the role for the upcoming fourth season, which features a time jump and a totally new story . In addition to Tennie as Lieutenant West, MW4 features María Elisa Camargo reprising her role as Valeria. We aren't totally sure who Kim, Joon, and Lipton are playing, however. Mazino, for his part, is known for playing Jesse on HBO's The Last of Us, so this is not the first time he's involved with a video game project. See at Amazon Modern Warfare 4 releases on October 23, which is about a month before GTA 6 arrives . The new Call of Duty game is coming to PS5, Xbox Series X|S, and PC, as well as Switch 2. For more, check out GameSpot's hands-on preview of MW4 ."
Modern Warfare 4 On Switch 2 Has Been “So Smooth” For Infinity Ward,"Infinity Ward is bringing Call of Duty: Modern Warfare 4 to Nintendo Switch 2, and that's a big deal since the CoD franchise hasn't been on a Nintendo platform since 2013. Infinity Ward co-studio head Jack O'Hara discussed the process of bringing MW4 to Switch 2 with a native version, saying it's been ""so smooth."" This came after former Xbox boss Phil Spencer said there was ""definitely"" work that needed to be done to get Call of Duty running on Switch. ""The game got up and running on the platform really quickly once we got the hardware. So far it's been really good. To be honest, it's been really fun to be on a new platform,"" O'Hara told GamesRadar about bringing MW4 to Switch 2. Also in the interview, O'Hara confirmed that cross-play between Switch 2 and the other console platforms and PC is currently supported, but, ""We'll see at launch exactly where the mix ends up."" The Switch 2 is a relatively less powerful console than the PS5 and Xbox Series X|S, but it remains to be seen what concessions the Nintendo console version will have. Microsoft, which owns Activision and the Call of Duty franchise, first confirmed plans to bring Call of Duty to Switch in 2023 as a means to appease regulators and get its blockbuster deal for Activision across the line. At the time, Microsoft pledged that Call of Duty releases on Switch would arrive ""the same day as Xbox, with full features and content parity."" The last time a Call of Duty game came to a Nintendo platform was in 2013 with the Wii U edition of Infinity Ward's Call of Duty: Ghosts. MW4 is launching on October 23 for Switch 2, PS5, Xbox Series X|S, and PC. It is not coming to PS4 and Xbox One. Preorders are open now, but not on Switch 2 . Activision has also confirmed a ""Loyalty"" discount for MW4 that allows people to get 10% off the game's Vault edition."
"Witcher Dev Will Focus On Sequels Over Expansions For Witcher 4, 5, 6","The Witcher 3 may be getting a big new expansion almost 12 years after launch, but you shouldn’t expect that to be the norm for the series going forward. From Witcher 4 on, CDPR will focus on full games instead of developing expansions, the studio said. In the Q&A section of CD Projekt Red’s latest earnings call, as reported by Games Radar , joint CEO Michał Nowakowski said that getting the next trilogy out on schedule will be the studio’s priority after Witcher 4. CDPR optimistically plans to release the full trilogy of Witcher 4, 5, and 6 within six years , which is a tight timeline even without taking time to release expansions. “The plans are pretty ambitious--specifically, it's to release three Witcher games within a six-year period,” Nowakowski said. “It would be difficult, to be very honest, for us to add an expansion to the upcoming trilogy. This is where we are here and now with this particular issue.” This is a major departure from what we’ve seen from the Witcher series in the past--The Witcher 3 received two major expansions in the years following release, with one more titled Songs of the Past now on the way over a decade later. Given CDPR was specific about calling Songs of the Past an expansion rather than a DLC --classing the latter as a smaller content update generally released for free--there may be hope that the next Witcher trilogy will still get some kind of post-launch content. Songs of the Past will release in 2027, meaning that we’re not likely to see The Witcher 4 until at least 2028--but between the new expansion and the upcoming trilogy, it’s a great time to be a Witcher fan."
GTA 6 Boss Says High Review Scores Reflect Rockstar’s “Commitment To Quality”,"Grand Theft Auto 6 is still on-track to release in just under six months. And while it’s too soon to claim the title will receive the same critical acclaim that Grand Theft Auto 5 received in 2013, Strauss Zelnick--the CEO of Rockstar Games’ parent company, Take-Two Interactive--is confident the sequel will receive high reviews. He also believes the glowing response to Rockstar’s previous games reflects well on the company itself. “Rockstar’s scores are typically in the mid-90s, sometimes high 90s,” Zelnick said during an interview with The Game Business . “Not many games can say that. And that’s a reflection on Rockstar’s commitment to quality.” Zelnick also acknowledged that great reviews still matter for games like GTA 6, but his fellow guest, Future content director Dan Dawkins, suggested that the gaming media landscape has greatly changed in the 13 years since GTA 5 was released. “The media and cultural environment has completely transformed,” Dawkins said. “At that point in time ... it was easier--not easy, but easier--to handpick the journalists you wanted to review that game ahead of time. I was one of those journalists. Social media is so noisy. And someone has to be first to say the thing you like is rubbish. Someone will do that. All narratives are available at once now, about everything. Rockstar are going to get, from the gates, some dissenting voices.” Regardless, Zelnick remains bullish about GTA 6’s prospects , even in the face of rising costs for everyday needs. “If you give people what they want in the entertainment business, they will come out for it,” Zelnick told IGN earlier this week. He also hinted that GTA 6 will have a “ reasonable price ,” but has yet to specify what it will be. If GTA 6 hadn’t been delayed, it would have released earlier this week . Instead, it will launch on Xbox Series X|S and PlayStation 5 on November 19. Rockstar recently reaffirmed that release date in the face of another rumored delay."
Leaked Persona 6 Design Docs Reveal Potential Protagonists,"It's been a hot minute since we've heard anything from Atlus about Persona 6--or whatever it ends up being called--other than reassurances of, ""It's coming, guys, we swear!"" However, it seems now that fans who have been eagerly waiting for years might have a tiny little taste of what to expect when the upcoming RPG does get its full reveal. The leaks come in the form of screenshots that appear to have surfaced on Chinese forums , but may originally have come from Chinese social-media-sharing site RedNote, according to reposters on ResetEra . Among the images seen in the links are concept-art and graphic-design reference sheets of a blonde-haired character with a bowl cut, who is believed to be the game's protagonist. This character is pictured in another image staring wistfully out of a bus or train window in a rough sketch for either an animated sequence or promotional art. Another image shows a female character who has dark hair with red highlights at the tips next to the blonde-haired male. She also has a character sheet showing a variety of different expressions. Some fans are speculating that she may be an additional or selectable protagonist, while others think she might be the primary companion to the main character. There's also a screenshot of a list of file names that seem to be art assets, containing several potential character names in Japanese last-name-first order: Kujo Inko, Karaki Toma, Ogami Renji, Nishiura Akari, Engoku Hana, Sentaka Shino, Hiruma Yumi, and Satozaki Oguriri. There also appears to be a file for a mascot-type character (similar to Persona 4's Teddie and Persona 5's Morgana) named Nilfer. Finally, there's a concept drawing of a train station, which some online observers have said looks similar to the Sakuragicho station in Yokohama, Japan . So when will we be able to verify that this information is legit? 2026 is the Persona series' 30th anniversary, and Atlus has been promoting this fact with events across the globe. An announcement showcasing the first official P6 reveal would be a great way to cap off the celebrations. Of course, it's all speculation at this point, but if the leaks have any veracity to them, Persona fans can be comforted in knowing that at least development seems to be moving along. The Best RPGs To Play In 2026 View Images"
"Fortnite Is Giving Out A Bunch Of Free Stuff, But Only On Saturday","Fortnite is holding what Epic Games is calling a ""community day"" on Saturday, May 30, and that means there will be free cosmetics for everyone who logs in that day, more free stuff for anyone who earns a win in Battle Royale, and a bonus style for The Foundation (Reforged) for battle pass owners. There's a gameplay component to the event as well, as the community day will also add some interesting new one-day-only gameplay changes and our first teaser for the upcoming Chapter 7 Season 3. Free cosmetics for Fortnite community day Anyone who logs in to Fortnite between 9 AM ET on May 30 and 9 AM ET on May 31 will receive the Reflector weapon wrap and the Community Brella . The Reflector wrap is all silver and was added to the game files as part of the Silver Surfer's set in 2020, but it was never released. The Community Brella is an all-black umbrella glider that is very similar to the old One Shot John Wick umbrella, and it also comes with an additional style. And for those who have the battle pass, either by purchasing with V-Bucks or an active Fortnite Crew subscription, you'll also be awarded with the tie-wearing, office-ready variant of The Foundation (Reforged) when you log in. There's also another set of three items you can earn by winning a round of Battle Royale during the community day event: The Lemmie Axe pickaxe, the Space Blaster weapon wrap , and the Loons back bling . Like the Reflector wrap, these items were all originally added to the game files years ago but weren't released, and one of them is particularly interesting--The Loons back bling dates all the way back to 2019, and the skin it belongs to, Brilliant Bomber, still hasn't been released. Lastly, we've got a set of Twitch drops you can earn by watching Fortnite content creators on Twitch. These items are the accessories from the Metal Menace item shop bundle . If you get these drops, you'll be able to buy the bundle, with the Skulldroid skin, for 200 V-Bucks next time it rotates into the shop. Fortnite community day gameplay changes Battle Royale will be full of new wrinkles and loot for the community day event, with golden fireworks guns, finger guns, and supercharged pizza joining the loot pool, and the map being filled with blue chests. And Fortnite will hold a special new Power Hour in Battle Royale from 12:30 PM PT to 1:30 PM PT on May 30, with all players starting each match with a self-res, a Cube Rifle, and an Infinity Blade. The Power Hour will also start the final stretch of the season with some sort of in-game teaser for the Season 2 finale event next Friday. That teaser should also give us our first meaningful clues about Chapter 7 Season 3, which starts just a week after the community day event on June 6."
"Xbox Game Pass Price Cut Is Working, CEO Says","One of the first decisions that Xbox CEO Asha Sharma made after becoming the new boss earlier this year was to cut the price of Xbox Game Pass significantly. In a memo to staff recently, Sharma explained the thinking behind the price cut and talked about the impact it's making so far, saying it's helping move Xbox in the right direction. “Growth slowed down and subscriber loss accelerated after the pricing and SKU changes last year,” Sharma said in the memo obtained by The Verge . “Since our price reduction we have seen acquisitions grow and retention improve, which is a good first step.” Also in the memo, Sharma said Game Pass still has a challenging road ahead. “We will not solve this in one moment or one launch,” Sharma said. “We will have to outwork the problem in front of us in our path to restore durable growth.” The next evolution of Game Pass launched today, with Discord Nitro members now getting access to a starter version of Game Pass for no extra charge . Looking further out, a top boss at Netflix has said Sharma is considering bundling more services into Game Pass to draw people in . Netflix co-CEO Greg Peters said he and Sharma have “kicked around ideas” for how Netflix and Xbox could work together on subscription bundles. Nothing has been confirmed, but Peters said he “wouldn’t eliminate any possibilities.” “You would have to do it in a way that works for the consumer and works for both companies, and frankly, I think Microsoft’s still trying to figure out how to make the Game Pass bundle work for Microsoft,” Peters said. “But what I like about Asha’s thinking is, it’s all about, ‘How do we do more?’ And it’s already been exciting to watch.” The executive also discussed her decision to rebrand Xbox as XBOX . ""We are building a stronger XBOX. That means making hard choices about what we build, where we invest, and what kind of company we need to be going forward,” she said. “That is part of what you are starting to see in the shift from Xbox to XBOX. It reflects a decision to be deliberate in how we show up for the players who care most about this brand.” Beyond the Game Pass price cut and the decision to change the styling of Xbox to XBOX, Sharma was personally responsible for killing off the controversial ""This is an Xbox"" marketing slogan . It's a big year for Xbox, as 2026 marks the 25th anniversary of the brand. Microsoft's next big Xbox event is the Xbox Games Showcase on June 7 , so be sure to keep checking back with GameSpot for more."
Hated CoD: Black Ops 7’s Omnimovement? MW4 Ditches It,"Players who hated the omnimovement of Black Ops 6 and 7 can rejoice, as today's reveal of Modern Warfare 4 confirmed that player movement will be dialed back for this new year of Call of Duty. Introduced just two years ago, Treyarch's omnimovement allowed for player movement in any direction, and actions could be chained together to create some really fancy plays reminiscent of action movies. Players could dive backwards to avoid grenades or commit to a series of complicated wall jumps and slides. Omnimovement allowed the recent Black Ops games to cater to the ""sweaty"" movement kings of Call of Duty. While no one was required to perform these actions in game, there are likely players who will be happy to see the movement scaled back for Modern Warfare 4. Of course, this doesn't mean Modern Warfare 4's movement will feel clunky or stale. Developers at Infinity Ward told GameSpot the studio changed its approach to player movement, with a heavier emphasis placed on "" making Modern Warfare 4's movement as fast and fluid as possible ."" They said they felt that, with Modern Warfare 2, the team had made choices that restricted players, like slowing them down as they went through doors. https://www.youtube.com/watch?v=Aj1RQW7phc0 Modern Warfare 4 does remove omnimovement and the wall-jump capability, so this is very much a boots-on-the-ground Call of Duty, but it will still feature refined parkour-style movement. Players will still be able to perform fluid mantling, sliding, and grabbing ledges, and the game adds the ability to climb up pipes for even more interesting engagement opportunities. In other news, Modern Warfare 4 will allow players to choose a progression path for prestiging , and the campaign will also be playable offline , so players won't need to have an internet connection just to enjoy the game's story. Call of Duty: Modern Warfare 4 launches on October 23 for PC, PS5, Xbox Series X|S, and Switch 2. Unfortunately, this means the old generation of consoles are losing support, and Warzone will also no longer be playable on PS4 and Xbox One after Season 1 of Modern Warfare 4. Like previous years, Modern Warfare 4 will feature an open beta ahead of launch, and more details on that hands-on opportunity will be revealed soon."
007 First Light Put Up Massive Launch-Day Sales Numbers,"007 First Light was already shaping up to be one of the biggest games of 2026, and its launch-day sales numbers indicate it could very well live up to that high standard. As shared by IO Interactive--who both developed and published the game--First Light managed to sell 1..5 million units in its first 24 hours. The game was initially available on May 26 for those who preordered it digitally, with the full launch following one day later. https://twitter.com/007GameIOI/status/2060058908014551246 ""Thank you for showing up to the launch of 007 First Light, for your overwhelming enthusiasm, and for sharing your experience with the game,"" IO said in the announcement post. It's certainly been a long time since we've gotten a new James Bond game, and even longer since we got one truly worthy of the 007 name. 007 First Light seems to fit fully into the ""truly worthy"" category, with a snappier combat system than we saw in the Hitman games but with a healthy dose of improvisation and creative stealth thrown in for good measure. In our 007 First Light review , Mark Delaney said it ""wisely repurposes what works in both [007 and Hitman] universes but isn't afraid to reimagine or ditch those parts that don't."" 007 First Light is available now for PS5, Xbox Series X|S, and PC, with a Nintendo Switch 2 version arriving at a later date. It just received a new patch , as well, aimed at fixing several pesky crashes."
"Call Of Duty: Modern Warfare 4 Has A “Loyalty” Discount For The Vault Edition, Here’s How To Get It","As part of the Call of Duty: Modern Warfare 4 announcement today, Activision unveiled what it called a ""Loyalty"" discount that will allow certain people to get the game's $100 Vault Edition for 10% off. That's not a whole lot, but it's enough to offset the tax you'd pay, and in a world where seemingly everything is getting more expensive, it's a notable discount if you want the more expensive version of the game. The discount does not apply to the game's $70 base edition. There are a couple ways to get 10% off Modern Warfare 4's Vault Edition with this program. First, Activision is offering 10% off for anyone who owned and played a Call of Duty game digitally or physically going back to 2019's Call of Duty: Modern Warfare. The full list of qualifying titles is below--note that Call of Duty: Warzone is not included because it's free, nor are any Call of Duty games for mobile. https://www.youtube.com/watch?v=Aj1RQW7phc0 Another way to score the discount on the Vault Edition is to have played one of the qualifying games on Xbox Game Pass and have an active subscription to Game Pass Ultimate, Game Pass Premium, or PC Game Pass. You also qualify for the discount if you claimed a qualifying title from PlayStation Plus. Something further to note is that the 10% discount only applies to preorders and only within the same platform and on the same account. The discount does not apply to the $30 Vault Edition upgrade offering. If you meet all of those criteria, you should see the 10% discount on your preferred digital store. Here is an image of what it should look like: Qualifying Call of Duty titles for the Loyalty discount Call of Duty: Modern Warfare (2019) Call of Duty: Modern Warfare 2 Campaign Remastered (2020) Call of Duty: Black Ops Cold War Call of Duty: Vanguard Call of Duty: Modern Warfare II (2022) Call of Duty: Modern Warfare III (2023) Call of Duty: Black Ops 6 Call of Duty: Black Ops 7 Modern Warfare 4's Vault Edition includes the base game, along with a series of extras, including weapons, cosmetics, and Season 1's BlackCell bundle, among other things. Additionally, people who preorder any edition of Modern Warfare 4 get early access to the open beta and the Hunter Killer operator skin that can be used immediately in Black Ops 7 and Warzone. Modern Warfare 4 launches on October 23 for PS5, Xbox Series X|S, and PC. It's also coming to the Nintendo Switch 2 the same day, and that's notable because the Call of Duty series has been absent from Nintendo's platforms since 2013."
