title,text
Final Fantasy 7 Remake Part 3's Title Has Finally Been Decided,"The ""Remake"" in Final Fantasy VII Remake refers to much more than just the technical aspects of the original 1997 game being remade. The remaking of fate is a core concept of the title that adds additional layers to its story. Remake’s sequel, Final Fantasy VII Rebirth, continues that trend by exploring a world reborn by the machinations of the game’s antagonist Sephiroth. As such, it stands to reason that the final game in the trilogy will use a similar naming convention that ties into the reimagining’s meta narrative. And, according to that game’s director Naoki Hamaguchi, the third and final installment’s title has been decided by the trilogy’s creative director Tetsuya Nomura. ""I remember an interview I did at Paris Games Week about how we’d narrowed it down to two [names],"" says Hamaguchi. ""It was up to Mr. Nomura to decide which it is. And yes, after returning from Paris Games Week, he did choose one, so I can say the title has been locked."" Hamaguchi is in New York City to promote the release of Final Fantasy VII Remake Intergrade on the Nintendo Switch 2, giving us the opportunity to speak with him about the franchise. Regarding the game’s performance on the device--which has been received positively by even the most diehard of pixel peepers--Hamaguchi says that while it was relatively smooth getting the game running on the hardware, the team spent a lot of time trying to achieve a stable frame rate. Continue Reading at GameSpot"
"Final Fantasy 7 Remake Part 3 Will ""Enhance"" Queen's Blood, Brings Back Snowboarding","Although Square Enix has already decided when to announce Final Fantasy 7 Remake Part 3 , that time hasn't come just yet. But while promoting the newly released Xbox Series X|S and Switch 2 ports of Final Fantasy 7 Remake Intergrade , director Naoki Hamaguchi confirmed that the third game in the trilogy will bring back the popular Queen's Blood card game as well as Cloud's snowboarding sequence from the original game. ""Queen's Blood is a very popular and beloved minigame, and I believe a lot of people are still wanting something like that,"" said Hamaguchi during an interview with Polygon . ""I want to expand on Queen's Blood so that we are enhancing it, and giving you a more powered-up version of it when you see that third installment … Queen's Blood is still going to be available in the third installment. We just want to expand on it."" Hamaguchi declined to share many specific details about the snowboarding sequence, but he did say it won't simply be a minigame as it was in the original Final Fantasy 7. Instead, his team wants ""to make sure that it's incorporated into the story to have that sort of connection with the theming of it."" Continue Reading at GameSpot"
Marathon: Cross-Play And Cross-Progression Explained,"Extraction shooters are currently taking the world by storm, and Bungie is eager to make its mark on the genre with its fast-paced first-person shooter Marathon . Much like Arc Raiders --another popular entry in the world of extraction shooters--Marathon is a much more accessible experience compared to more hardcore titles in the genre, but it still comes packing plenty of danger around every corner. As such, you'll want to have a team to watch your back--meaning you'll need to bring along some friends you can trust. If you're diving into Marathon and looking to link up with your pals, you'll probably be asking whether the game features cross-play support. Below, we'll answer that question, as well as share information about Marathon's cross-progression options so that you can know what to expect before you even boot up the game. Does Marathon have cross-play? If you're hoping to play Marathon with your friends on different platforms, you'll be thrilled to hear that Marathon features cross-play . This means that you can team up with players across PlayStation 5, Xbox Series X, or PC, regardless of where you choose to play. Continue Reading at GameSpot"
"Nioh 3 Gameplay Overview Shows You’re A Time-Jumping, Yokai-Killing, Ninja-Samurai Badass","Team Ninja's super-hard souls-like Nioh 3 lands on February 6 for PC and PlayStation 5, and ahead of its imminent launch, the studio dropped a 17-minute gameplay overview showing off everything you'll do in the action-RPG--from battling historical figures and giant monsters to purifying areas and becoming Shogun. The gameplay overview takes you on a whirlwind of excursions, revealing that you're a time-jumping ninja-samurai on a quest to understand why your brother stole the title of Shogun--the military leader and de facto ruler of Japan--and betrayed his countrymen. (Probably for power, as is always the case.) You'll go from the Edo period (approximately 1601 to 1868) back to the Heian period (roughly 794 to 1185) through to the Sengoku (1467 to 1615) and Bakumatsu eras (1853 to 1868) to uncover the truth behind the Crucible's emergence. To do all of that, you'll equip yourself with all sorts of weapons--from claws, fists, and odachis to scythes, katanas, and kusarigamas--to slay or get slain as you battle well-trained samurai and freakishly huge monsters on your path toward cleansing the lands of evil. The Crucible, a horrifying realm spawning and enhancing the monstrous creatures overwhelming Japan, is the source, and Nioh 3 will test your patience and resolve to survive long enough to kill everyone and save everything else. Continue Reading at GameSpot"
"Game Freak's Beast Of Reincarnation Team Is ""Relatively Small"" With Many External Developers","The ""one-person, one-dog action-RPG"" Beast of Reincarnation looks like a larger endeavor than developer Game Freak's previous titles--large enough to require support from outside partners to bring the studio's vision to life. Speaking to IGN , game director Kota Furushima said that Game Freak's team is ""quite large,"" but the studio ""managed to seek out a lot of partner companies"" and was ""lucky to have a lot of people working on it externally as well."" A PR representative clarified with IGN that Game Freak's internal team for Beast of Reincarnation is ""relatively small"" and is still leading the project in a core role. Neither Furushima nor the PR spokesperson gave any numbers for how large or small Game Freak's team is. Working with external partners isn't unusual for a AAA video game--the credits for Game Freak's Pokemon Legends: Z-A list around 30 partner companies that worked on the project. Continue Reading at GameSpot"
Super Mario Galaxy Movie Nintendo Direct Announced For The Weekend,"Nintendo has announced a new Super Mario Galaxy Movie Direct, and it's not being held on a weekday. Nintendo fans can get an ""exclusive look"" at the sequel to the Super Mario Bros. Movie on Sunday, January 25, at 6 AM PT / 9 AM ET . Beyond that, Nintendo is staying tight-lipped about what else you can expect or how long the Direct will run. This will be focused purely on the animated movie, which sees the return of Chris Pratt as Mario, Charlie Day as Luigi, Anya Taylor-Joy as Princess Peach, Jack Black as Bowser, and Keegan-Michael Key as Toad. New additions to the cast include Brie Larson as Rosalina and Benny Safdie as Bowser Jr . Join us on Sunday, Jan 25, at 6am PT for the #NintendoDirect featuring an exclusive look at The Super Mario Galaxy Movie. Please note that no game information will be included in this presentation. Watch here: https://t.co/gTC114mMLz pic.twitter.com/4DOoFU1fFJ — Nintendo of America (@NintendoAmerica) January 23, 2026 The first trailer for the Super Mario Galaxy Movie was officially shown off last year, and was followed up by a brief scene where Mario and Luigi chat with Bowser, who is still imprisoned in Princess Peach's castle after he was shrunk down from his monstrous size. The scene ended with the appearance of Bowser Jr., who is aiming to break his dad out of his makeshift prison. Continue Reading at GameSpot"
"Fable Isn't In Works For Switch 2, But Is Being Considered - Report","While Microsoft has stated an intention to bring its games to Nintendo Switch 2, Fable won't be one of them--at least, not immediately. According to Windows Central's Jez Corden, a port is ""under consideration for the future."" Corden claimed in an X post that a version of Playground Games's reboot of Fable for Switch 2 ""isn't 100% definite for now."" In a follow-up post , Corden stated that a port is not currently in development because of ""purely logistics,"" but he expressed belief that it'll eventually happen. Putting Fable on Switch 2 would fit with Xbox's multiplatform strategy-- it's coming to PlayStation 5 , after all. While the rollout of Microsoft-owned titles on Nintendo's new machine has been slow so far, both Indiana Jones and the Great Circle and South of Midnight are slated to release on Switch 2 this year. Continue Reading at GameSpot"
Forza Horizon 6 Channels Initial D-Inspired Anime Racing With Its New Mode,"A romanticized slice of Japan is the playground that Forza Horizon 6 takes place in, but if this week's Developer Direct livestream is any indicator, the game looks like it'll have plenty of anime inspiration under its hood. One such example was seen in Forza Horizon 6's Touge Battle mode, which looks like it was pulled straight from the cult-classic street-racing manga and anime series Initial D. The Touge Battle mode was briefly described by developer Playground Games as a series of nighttime races down Japanese mountain passes, and to hammer home the Initial D influence, the gameplay footage showed a Toyota Sprinter Trueno AE86 drifting through tight corners. The same car used by the manga's protagonist--and which has become an icon of street racing over the years--the tribute to the series was joined by a very brief glimpse of what appeared to be a full-sized Gundam. If previous games with their showcase races are any indicator, don't be too surprised if you're tasked with racing a skyscraper-sized robot in Forza Horizon 6. Continue Reading at GameSpot"
Cult Of The Lamb: Woolhaven Expansion Is Out Now,"Cult of the Lamb 's massive new paid expansion Woolhaven is out today, marking the biggest influx of new content since the game released in 2022. The $17 expansion takes the cult and its followers to the wintry new region of Woolhaven, the ancestral home of the Lambs. Devolver Digital and developer Massive Monster celebrated Woolhaven's release with an animated trailer showing the spirits of Lambs past helping the Lamb face off against new enemies in the snowy mountains. Devolver also hosted a live stream where players could watch a Lamb ice sculpture slowly melting--with just a tiny bit of help from a blowtorch. Players hoping to get stuck into Woolhaven will need to have played the base game to near completion, as the DLC picks up after the end of the game. Continuing the main story of the Lamb and their growing cult, Woolhaven explores the history of lambkind, tasking the player with restoring an abandoned village to its former glory and restoring the power of Yngya, the forgotten god of the Lambs. Continue Reading at GameSpot"
The Fable Reboot Is Doing Away With One Of The Series' Signature Features,"One of the biggest stories to emerge out of this week's Xbox Developer Direct was the long-awaited update about the new Fable reboot. It's been 15 years since Fable 3 wrapped up the original trilogy, but one of the franchise's key features won't be returning in the new game. In the first three Fable games, the physical appearance of player characters changed depending on their moral alignment. This was called ""morphing,"" and players who were particularly bad took on a devilish appearance complete with horns. According to Fable general manager and director Ralph Fulton, that won't be the case in the new game. ""That sort of character morphing feature--obviously a really central part of the original games--it's not in ours,"" Fulton told IGN . ""There is no objective good and evil. And the original games were predicated on there being an objective good and an objective evil, and you were somewhere along that scale, and that's what determined how your appearance changed. But for us, that doesn't really work. The way I've described our morality system working, you're never that thing, absolutely. You're different things to different people based on what they like or what they choose to value. So, that's one reason that it didn't work."" Continue Reading at GameSpot"
Fable Is Going Deeper With Its Morality Scale,"The original Fable trilogy gave players a choice between actions that were defined as either good or evil. Playground Games' Fable reboot is retaining a morality system, but it's not going to be quite so simple and binary. Instead, players will be able to have more nuanced characters who may not necessarily be either good or evil. ""Morality was always such an important part of the original trilogy,"" said Fable general manager and director Ralph Fulton during an interview with Xbox Wire . ""I think that original trilogy is inextricably linked with the concept of good and evil--but I think morality in video games has moved on in the intervening period. How we think about morality in the world today has really informed how we wanted to represent it as a game system in this game. That’s to say: There is no objective good, there is no objective evil. Really it's just about people's subjective opinions and what they choose to value in someone else when they make that judgment."" Fulton went on to explain that the new Fable's morality ""isn't a sliding scale."" Instead, players will be judged by their actions if they're spotted by at least one other character. He added that players may gain significantly different reputations at each town based on what they've become known for. Continue Reading at GameSpot"
Team Fortress 2 Update Released,
