title,text,scraped_at
"Dark And Darker Can ""Move Ahead With Full Legal Certainty"" After Court Ruling","<p dir=""ltr""><a href=""https://www.gamespot.com/games/dark-and-darker/"">Darker and Darker</a> can continue development and move forward with ""full legal certainty,"" developer Ironmace announced, following a South Korean Supreme Court ruling that upheld a lower court's copyright-dispute ruling and dismissed appeals from both Ironmace and Nexon in what has been a years-long legal battle.</p><p dir=""ltr"">Ironmace was founded by former Nexon employees, who Nexon accused of stealing trade secrets related to a canceled Nexon project codenamed ""P3"" in order to make Dark and Darker. Ironmace stated it never used <a href=""https://www.gamespot.com/articles/dark-and-darker-dev-tells-fans-no-stolen-assets-or-code-were-used-in-development/1100-6511773/"">stolen Nexon assets or code</a> to create its game.</p><div data-embed-type=""video"" data-src=""https://www.youtube.com/watch?v=_Z4cMslhbrs"" data-width=""100%"" data-height=""100%"">          <iframe src=""https://www.youtube-nocookie.com/embed/_Z4cMslhbrs"" height=""100%"" width=""100%"" scrolling=""no"" frameborder="""" webkitallowfullscreen mozallowfullscreen allowfullscreen></iframe></div><p dir=""ltr"">As reported by <a href=""https://www.koreatimes.co.kr/business/companies/20260430/supreme-court-sides-with-nexon-in-trade-secret-dispute-with-ironmace"">The Korea Times</a>, last year, a court ruled Ironmace did infringe on Nexon trade secrets when Ironmace CEO Choi Ju-hyun stored Nexon data on a personal server before establishing the independent studio. The developer was ordered to pay damages, though, importantly, the court also found Ironmace not guilty of copyright infringement. An appellate court later concurred with the first court's ruling, but lowered the amount to be paid to Nexon to 5.7 billion won, or nearly $4 million dollars. South Korea's Supreme Court has now upheld that ruling, seemingly putting an end to issues stemming from Dark and Darker's copyright status.</p><a href=""https://www.gamespot.com/articles/dark-and-darker-can-move-ahead-with-full-legal-certainty-after-court-ruling/1100-6539735/?ftag=CAD-01-10abi2f/"">Continue Reading at GameSpot</a>",2026-05-01T01:52:02.270920
"Intergalactic Star Says The Game Shows ""Such A Different Side"" Of Naughty Dog","<p>Naughty Dog's next game is the new, original game <a href=""https://www.gamespot.com/gallery/intergalactic-the-heretic-prophet-trailer-story-setting-and-everything-else-we-know/2900-6082/"">Intergalactic: The Heretic Prophet</a>, and it will show a ""different side"" of the developer, according to the game's lead actor.</p><p>Tati Gabrielle, who plays the game's protagonist Jordan A. Mun, told <a href=""https://x.com/IGN/status/2049672043965063338"">IGN</a> that Intergalactic represents ""such a different side of Naughty Dog that I think people are going to get really excited for.""</p><p>Gabrielle did not elaborate further on this, but added, ""It seems that they've even challenged themselves in ways of world building. I'm super stoked.""</p><a href=""https://www.gamespot.com/articles/intergalactic-star-says-the-game-shows-such-a-different-side-of-naughty-dog/1100-6539732/?ftag=CAD-01-10abi2f/"">Continue Reading at GameSpot</a>",2026-05-01T01:52:02.270920
Subnautica 2 Release Times For PC And Xbox Series X|S Revealed,"<p>A lot of the news surrounding Subnautica 2 has been focused on the behind-the-scenes drama, but it's now been confirmed that the game will have its <a href=""https://www.gamespot.com/articles/subnautica-2-steams-most-wishlisted-game-gets-release-date-amid-publisher-drama/1100-6539722/"">early-access release on May 14</a> for PC and Xbox. But when exactly can you start playing the survival game? Developer Unknown Worlds has now <a href=""https://unknownworlds.com/en/news/subnautica-2-cinematic-trailer-release-date"">published</a> the official times.</p><p>Subnautica 2 unlocks on May 14 at 8 AM PT / 11 AM ET, and you can see more times below. The game has been confirmed for PC and Xbox Series X|S, but not any other platforms.</p><h2><strong>Subnautica 2 early access launch times</strong></h2><p><strong>May 14</strong></p><a href=""https://www.gamespot.com/articles/subnautica-2-release-times-for-pc-and-xbox-series-x-s-revealed/1100-6539731/?ftag=CAD-01-10abi2f/"">Continue Reading at GameSpot</a>",2026-05-01T01:52:02.270920
Diablo 4: Lord Of Hatred's All-New Class Skill Trees Have Players Divided,"<p dir=""ltr""><a href=""https://www.gamespot.com/games/diablo-iv/"">Diablo 4</a>: Lord of Hatred and its subsequent 3.0 update have been live for a few days now, and if there is one thing the community can't seem to agree on, it's whether Blizzard's second attempt at class skill trees is a roaring success or a downgrade from what came before.</p><p dir=""ltr"">Blizzard shocked more than a few Diablo 4 players when it announced in the leadup to Lord of Hatred's release that the expansion would herald the arrival of all-new skill trees for each class, and that those trees would <a href=""https://www.gamespot.com/articles/diablo-4-lord-of-hatred-is-completely-removing-passive-skills/1100-6538191/"">no longer feature any passive skills</a>. Prior to Lord of Hatred, a large amount of player power came directly from damage-boosting passive skills, making their removal controversial.</p><p dir=""ltr"">Instead, players would have more options to customize their active skills, as well as the ability to invest more points into key skills in order to make them even more powerful. The idea was to make it so the power of a character largely came from gear and the endgame paragon system, rather than selecting the right passive skills in the skill tree.</p><a href=""https://www.gamespot.com/articles/diablo-4-lord-of-hatred-all-new-class-skill-trees-have-players-divided/1100-6539730/?ftag=CAD-01-10abi2f/"">Continue Reading at GameSpot</a>",2026-05-01T01:52:02.270920
Gabe Newell Emailed Elon Musk To Try To Get Hideo Kojima An Invite To SpaceX,"<p>Thanks to the ongoing trial pitting billionaires Elon Musk and Sam Altman against each other, it's come to light that Valve founder Gabe Newell--the third billionaire in this story--emailed Musk to ask if Hideo Kojima could get a tour of SpaceX.</p><p>In an <a href=""https://app.box.com/s/d8dxew0n3g2xg13y5812lioqa9hxyoo4/file/2213934513159?sv1=affiliate&amp;sv_campaign_id=78888&amp;sscid=98797_1777570993_5046639dc6133ac613573a79f5004800&amp;awc=98797_1777570993_5046639dc6133ac613573a79f5004800"">email from October 2018</a>, Newell wrote to Musk telling him that Kojima really wants to go to space. Newell thought Musk--who runs SpaceX--might be a good person to talk to. ""He'd love to get a SpaceX tour,"" Newell wrote to Musk, according to <a href=""https://www.pcgamer.com/gaming-industry/thanks-to-musk-v-altman-lawsuit-its-now-public-record-that-gabe-newell-emailed-elon-musk-to-get-his-pal-hideo-kojima-a-tour-of-spacex-and-openai/"">PC Gamer</a>.</p><p>Musk wrote back to Newell, saying, ""Sure, it would be great to meet Hideo Kojima and he's welcome to see the rocket factory."" Whether or not Kojima actually got this tour is unknown, however.</p><a href=""https://www.gamespot.com/articles/gabe-newell-emailed-elon-musk-to-try-to-get-hideo-kojima-an-invite-to-spacex/1100-6539727/?ftag=CAD-01-10abi2f/"">Continue Reading at GameSpot</a>",2026-05-01T01:52:02.270920
Resident Evil Movie's Giant Creature Sure Looks Like He Came From Dune,"<p dir=""ltr"">The first trailer for director Zach Cregger's <a href=""https://www.gamespot.com/articles/resident-evil-movie-trailer-debuts-highlighting-a-terrifying-new-vision/1100-6539639/"">Resident Evil movie</a> is here, and it gives fans just a taste at what this new adaptation of Capcom's legendary survival-horror series will look like. It's less zombie movie and more monster flick, and includes a creature that looks ripped straight out of the recent Dune films (before you get too excited, no, it's not a sandworm).</p><p dir=""ltr"">About a minute into the trailer, the film's hero Bryan, in true Resident Evil fashion, drops into a sewer. He's then confronted with a massive, pale-looking man sitting directly in his path--one that bears a striking resemblance to Baron Harkonnen, the main villain of author Frank Herbert's early Dune books.</p><div data-embed-type=""video"" data-src=""https://www.youtube.com/watch?v=SJPu1spHqfk"" data-width=""100%"" data-height=""100%"">          <iframe src=""https://www.youtube-nocookie.com/embed/SJPu1spHqfk"" height=""100%"" width=""100%"" scrolling=""no"" frameborder="""" webkitallowfullscreen mozallowfullscreen allowfullscreen></iframe></div><p dir=""ltr"">The similarities to Cregger's monster and the Baron, particularly director Denis Villeneuve's interpretation of the character seen in 2021's Dune Part One and 2024's Dune Part 2, are hard to ignore. Both characters are giant, pale, seemingly hairless men. In Baron Harkonnen's case, he's so massive he uses anti-gravity technology to float around. Despite the two looking nearly identical, Cregger in a trailer breakdown with <a href=""https://www.youtube.com/watch?v=D_FMSyTWmA8"">IGN</a> actually revealed a different literary inspiration behind the giant man in the sewer.</p><a href=""https://www.gamespot.com/articles/resident-evil-movies-giant-creature-sure-looks-like-he-came-from-dune/1100-6539726/?ftag=CAD-01-10abi2f/"">Continue Reading at GameSpot</a>",2026-05-01T01:52:02.270920
You Can Get A Free Marvel Rivals Skin Just In Time For The New Avengers Mode,"<p dir=""ltr"">The Marvel Cinematic Universe is marching toward Doomsday, its upcoming Avengers sequel, and Marvel Rivals is starting the countdown with a new Avengers mode alongside a free skin for Loki.</p><p dir=""ltr"">Subscribers to Disney Plus can claim their free Loki skin by visiting the website and scrolling to their <a href=""https://tarabrunopr-dot-yamm-track.appspot.com/2kz2xoSHOeL2argySC1hJv7jXZNW4QCz98e-Ox8wqlHOLODbfnQFf5JKu9BUZs_zW_XaI-OtMYBbKG0CxCGr0dUwtF16TIWOU12TF6L5o06Z6p5YS7tKfbDdfD4CcXD4AnXZ6EWTlszX2-KxAEGFyTJTXn0lSUi_FCWOg4_KgjR9usqxXb03MIw"">Disney Plus perks</a>, but the skin won't be around forever. Players only have between May 1 and July 30 to add the outfit to their in-game wardrobe. The Loki skin is said to be styled with ""Disney Plus colors,"" or, for the uninitiated, that bluish-green color you see below.</p><figure data-align=""center"" data-size=""large"" data-img-src=""https://www.gamespot.com/a/uploads/original/1632/16320660/4690862-image%2812%29.png"" data-ref-id=""1300-4690862"" data-ratio=""0.5625"" data-width=""512"" data-embed-type=""image"" style=""width: 512px""><a href=""https://www.gamespot.com/a/uploads/original/1632/16320660/4690862-image%2812%29.png""><img alt=""No Caption Provided"" src=""https://www.gamespot.com/a/uploads/original/1632/16320660/4690862-image%2812%29.png"" srcset=""https://www.gamespot.com/a/uploads/original/1632/16320660/4690862-image%2812%29.png 512w, https://www.gamespot.com/a/uploads/scale_medium/1632/16320660/4690862-image%2812%29.png 480w"" sizes=""(max-width: 512px) 100vw, 512px"" data-width=""512""></a></figure><p dir=""ltr"">Loki is getting the special attention because he's the star of the game's new limited-time Avengers mode. In it, one player takes on the role of the trickster god himself, while a team of six others works together to try to defeat him. The asymmetrical PvP mode is the first of several updates planned between now and the end of the year. As a roadmap, it's collectively called the Path to Doomsday, as it all leads to the release of Avengers: Doomsday on December 18.</p><a href=""https://www.gamespot.com/articles/you-can-get-a-free-marvel-rivals-skin-just-in-time-for-the-new-avengers-mode/1100-6539725/?ftag=CAD-01-10abi2f/"">Continue Reading at GameSpot</a>",2026-05-01T01:52:02.270920
"After 30 Years In Development, Magic: The Gathering Legend Reveals His Next Card Game","<p>For over 30 years, Mark Rosewater has been leading design teams for some of Magic: the Gathering's biggest sets, and continues to do so with his role as lead designer on the upcoming Marvel Super Heroes expansion. However, while he's been exploring the Magic multiverse, he's been developing his own game on the side, with the hopes of one day sharing that side game with the world. Today, on the official Magic: the Gathering Secret Lair website, Rosewater has finally unveiled that game, Mood Swings, and players will be able to order it soon.</p><p>Mood Swings is a game played with a single 45-card deck, though there will be over 100 cards available for the game at launch. Each card is named after a mood--Patience, Hostility, Cheer, Bashfulness, etc.--and comes with a corresponding power and point value. Each player in the two-to-four-player game will play one mood from their hand per turn, and once all of the powers resolve, the player whose board has the most points wins the round, and first to three rounds wins the whole game.</p><div data-embed-type=""video"" data-src=""https://www.youtube.com/watch?v=-uf-1lbPvyM"" data-width=""100%"" data-height=""100%"">          <iframe src=""https://www.youtube-nocookie.com/embed/-uf-1lbPvyM"" height=""100%"" width=""100%"" scrolling=""no"" frameborder="""" webkitallowfullscreen mozallowfullscreen allowfullscreen></iframe></div><p>Rosewater released a <a href=""https://magic.wizards.com/en/news/announcements/introducing-mood-swings"">blog on the MTG website</a>, as well as a tutorial video on the official Wizards of the Coast YouTube, diving deeper into the game's rules and some of the cards players will find in their decks. ""About 28 years ago, I came up with an idea for a more accessible trading card game called Mood Swings,"" Rosewater says in the blog. ""The idea behind it is simple. Trading card games are a lot of fun, but Magic, while amazing, can be complicated. Mood Swings is my attempt to make something simpler.""</p><a href=""https://www.gamespot.com/articles/after-30-years-in-development-magic-the-gathering-legend-reveals-his-next-card-game/1100-6539723/?ftag=CAD-01-10abi2f/"">Continue Reading at GameSpot</a>",2026-05-01T01:52:02.270920
"GTA 6 Owner Passed On A Sequel To A Legacy Franchise, And We're Dying To Know Which One","<p>Take-Two boss Strauss Zelnick has shared a story about passing on making a sequel to one of the company's legacy franchises because the developer pitching the game wasn't all that jazzed about it. Which franchise was it? Frustratingly, Zelnick didn't say, but he shared the story as a means to speak to why Take-Two doesn't make every game it could and is instead more selective.</p><p>""We had a greenlight meeting years ago, and it was about a sequel to one of our franchises. There was something in the room, some vibe in the room I wasn't comfortable with,"" Zelnick said at the iicon event this week, <a href=""https://variety.com/2026/gaming/news/gta-6-take-two-strauss-zelnick-zynga-iicon-conference-1236733784/"">as reported by Variety</a>. ""So I said to the producer, 'Listen, let's pause. How excited are you about working on this title?' And he said, 'Well, I know we're making this sequel and I feel good about making the sequel.' I said, 'You're not answering the question. And how excited are you?' And he said, 'Well, candidly, I'm not all that excited about working on it.' I said, 'Well, let's end the meeting right here. We're just not doing that.'""</p><p>He said this amid a wider conversation about making sequels to Take-Two's legacy franchises, including L.A. Noire. On the subject of another L.A. Noire game, Zelnick said <a href=""https://www.gamespot.com/articles/take-two-boss-gives-hope-for-la-noire-2-and-other-sequels/1100-6539678/"">Take-Two is looking at making new installments in all of its franchises</a>, but isn't committing to anything unless the people behind those pitches are passionate.</p><a href=""https://www.gamespot.com/articles/gta-6-owner-passed-on-a-sequel-to-a-legacy-franchise-but-wont-say-which-one/1100-6539720/?ftag=CAD-01-10abi2f/"">Continue Reading at GameSpot</a>",2026-05-01T01:52:02.270920
"Subnautica 2, Steam's Most-Wishlisted Game, Gets Release Date Amid Publisher Drama","<p>Despite the legal drama playing out between developer Unknown Worlds and publisher Krafton, Subnautica 2 will soon see an early-access release. The game arrives on May 14 for PC and Xbox Series X|S.</p><p>The <a href=""https://store.steampowered.com/app/1962700/Subnautica_2/"">announcement</a> was made alongside a price--$30--though it's not clear if that price will then rise in the future. Those who purchase the game during the early-access period will, of course, maintain access to the game forever, including updates and content released following its 1.0 launch, whenever that happens to be.</p><p>""We have plenty more in store for you all as we count down to early access on May 14,"" the development team said in the announcement.</p><a href=""https://www.gamespot.com/articles/subnautica-2-steams-most-wishlisted-game-gets-release-date-amid-publisher-drama/1100-6539722/?ftag=CAD-01-10abi2f/"">Continue Reading at GameSpot</a>",2026-05-01T01:52:02.270920
Injustice 3 Is Looking Like The Next Fighting Game From NetherRealm - Report,"<p dir=""ltr"">After almost a decade without a new entry, the Injustice series might be returning from NetherRealm Studios. <a href=""https://mp1st.com/news/report-injustice-3-in-development-at-netherrealm-studios"">MP1st</a> reports a Warner Bros. Games artist listed Injustice 3 on their resume, alongside <a href=""https://www.gamespot.com/articles/hogwarts-legacy-2-gets-unexpected-update-connection-to-upcoming-show/1100-6527589/"">Hogwarts Legacy 2</a> and two unannounced projects. This comes almost a year after <a href=""https://www.gamespot.com/articles/injustice-3-could-be-on-the-way-dataminer-hints/1100-6531632/"">a dataminer strongly hinted that Injustice 3 was in the works</a>.</p><p dir=""ltr"">It's been almost exactly nine years since Injustice 2 launched in May 2017. To put that in perspective, the original Nintendo Switch had only been out two months and Justice League hadn't even been released in theaters yet. In fact, director Zack Snyder hadn't even stepped away from that DC film quite yet--a domino that led to the Snyder Cut movement. Fast forward to today, and <a href=""https://www.gamespot.com/articles/james-gunn-will-co-lead-dc-studios-steering-upcoming-dceu-movies-shows-and-cartoons/1100-6508620/"">James Gunn is now co-leading DC Studios</a>, with Supergirl set to premiere in June.</p><p dir=""ltr"">Last year, Gunn and his co-chief Peter Safran noted that they had met with NetherRealm and Rocksteady about video games in the new incarnation of the DC Universe. NetherRealm has been consistently crafting fight games over the past 15 years. Mortal Kombat 1 was its latest release, coming out in 2023. Before that, the developer launched Mortal Kombat 11 in 2019, with Injustice 2 preceding that in 2017.</p><a href=""https://www.gamespot.com/articles/injustice-3-is-looking-like-the-next-fighting-game-from-netherrealm-report/1100-6539721/?ftag=CAD-01-10abi2f/"">Continue Reading at GameSpot</a>",2026-05-01T01:52:02.270920
Rude For Apex Legends To Tease Me With A Cool Battle Racer Idea Just For New Hero Reveal,"<p dir=""ltr""><a href=""https://www.gamespot.com/articles/destruction-allstars-narrative-hook-was-always-part-of-the-plan/1100-6491021/"">Destruction AllStars</a> and <a href=""https://www.gamespot.com/games/onrush/"">Onrush</a> were deeply underappreciated games that deserved way more players than they each got, and I have held fast that the continued lack of the ""hero"" formula in racing/derby games is a <em>crime</em>. So you can imagine my anguish when <a href=""https://www.gamespot.com/games/apex-legends/"">Apex Legends</a> Season 29, titled Overclocked, teased its next playable character with a <a href=""https://www.youtube.com/watch?v=qb00PDb7eqM"">cinematic trailer</a> that reveals her racing origins before reiterating that she's being added to a battle royale, not a battle racer.</p><p dir=""ltr"">Now, I know that Apex Legends has always been and will always be a shooter. Respawn is not going to make a brand-new mode in an entirely different style of game just because of one character's backstory or my wish to see Apex Legends' universe expanded in more gaming genres. But dammit, there's just such a huge narrative and gameplay draw to what's otherwise some throwaway clips in a short cinematic trailer. The glimpse of this battle race is brief, but it is memorable--I want to play as unique racers who speed through obstacles in the Mad Max-looking world of Salvo! Hell, why wasn't <em>that </em><a href=""https://www.gamespot.com/games/apex-legends-mobile/"">the mobile spin-off</a>?</p><figure data-align=""center"" data-size=""large"" data-img-src=""https://www.gamespot.com/a/uploads/scale_super/1587/15875866/4690657-axleloreart.jpg"" data-ref-id=""1300-4690657"" data-ratio=""0.58823529411765"" data-width=""5100"" data-embed-type=""image"" style=""width: 5100px""><a href=""https://www.gamespot.com/a/uploads/scale_super/1587/15875866/4690657-axleloreart.jpg""><img alt=""No Caption Provided"" src=""https://www.gamespot.com/a/uploads/scale_super/1587/15875866/4690657-axleloreart.jpg"" srcset=""https://www.gamespot.com/a/uploads/original/1587/15875866/4690657-axleloreart.jpg 5100w, https://www.gamespot.com/a/uploads/scale_super/1587/15875866/4690657-axleloreart.jpg 1280w, https://www.gamespot.com/a/uploads/scale_medium/1587/15875866/4690657-axleloreart.jpg 480w"" sizes=""(max-width: 1280px) 100vw, 1280px"" data-width=""1280""></a></figure><p dir=""ltr"">My selfish dreams aside, Overclocked's new racer-turned-legend, who goes by the codename of Axle, looks like a very cool and awesome addition to the game. As an Octane main, Axle's need for speed is immediately appealing--I haven't been this excited about a new playable legend since Season 9's Valkyrie, who was also all about movement but specifically through the skies. So you're off the hook Respawn (for now), but I'm watching y'all--you can't expect to tease me with the idea of a hero battle racer in the Titanfall/Apex Legends universe and then just expect me to forget about how amazing an idea that is.</p><a href=""https://www.gamespot.com/articles/rude-for-apex-legends-to-tease-me-with-a-cool-battle-racer-idea-just-for-new-hero-reveal/1100-6539710/?ftag=CAD-01-10abi2f/"">Continue Reading at GameSpot</a>",2026-05-01T01:52:02.270920
007 First Light Could Be 2026's Game Of The Year And The Best Bond Game Ever,"<p dir=""ltr"">James Bond is no stranger to video games, but has only lived up to the prestige of his films once with GoldenEye 64, a game beloved for its pioneering first-person-shooter design, generation-defining multiplayer, and absurdly good soundtrack.</p><p dir=""ltr"">Although the Bond games that followed it never received the same level of acclaim, they still enjoyed some success. In a medium fixated on coming up with new ways to make firing guns and employing gadgets fun, it's no surprise that Bond games sustained interest through multiple eras. The fantasy of being a secret agent--James Bond in particular--is enduring, and the wish-fulfillment opportunities video games present are unmatched.</p><p dir=""ltr"">GoldenEye 64 aside, Bond games haven't been where innovations happen in the spy game genre. However, the effectiveness with which they realize the fantasy of being a globe-trotting, gun-toting, silver-tongued cop in a tuxedo has often offered good markers of how the action genre's design and tastes around it have evolved. After 2004's Everything or Nothing, however, Bond games became mediocre tie-ins, nostalgia bait, or both.</p><a href=""https://www.gamespot.com/articles/007-first-light-could-be-2026s-game-of-the-year-and-the-best-bond-game-ever/1100-6539709/?ftag=CAD-01-10abi2f/"">Continue Reading at GameSpot</a>",2026-05-01T01:52:02.270920
"GTA 6 Won't Have Product Placement, Exec Says","<p>While Take-Two's NBA 2K franchise is known to feature real-world brands--<a href=""https://www.gamespot.com/articles/omg-jake-from-state-farm-is-in-nba-2k22/1100-6496140/"">and even Jake from State Farm himself</a>--don't expect the company's biggest franchise, GTA, to follow suit.</p><p>Take-Two boss Strauss Zelnick said at iicon this week in Las Vegas that fans should not expect product placement or brand integration deals in <a href=""https://www.gamespot.com/articles/grand-theft-auto-6-everything-we-know/1100-6503729/"">GTA 6</a>.</p><p>""We need to be true to the underlying intellectual property and we need to be true to our consumers,"" he said, <a href=""https://variety.com/2026/gaming/news/gta-6-take-two-strauss-zelnick-zynga-iicon-conference-1236733784/"">as reported by Variety</a>. ""It's a fictional world and everything in it is fictional. So we're not even at risk of doing brand partnerships because all the brands are made up. And I think that keeps us pure.""</p><a href=""https://www.gamespot.com/articles/gta-6-wont-have-product-placement-exec-says/1100-6539719/?ftag=CAD-01-10abi2f/"">Continue Reading at GameSpot</a>",2026-05-01T01:52:02.270920
