title,text,scraped_at
"Hitman: World of Assassination will finally let you use your PS5 save on Switch 2, plus other variations, from next month","<img src=""https://assetsio.gnwcdn.com/Hitman-WoA_header.jpg?width=690&quality=85&format=jpg&auto=webp"" /> <p>As we prepare for <a href=""https://www.eurogamer.net/companies/io-interactive"">IO Interactive</a>'s <a href=""https://www.eurogamer.net/games/007-first-light"">007 First Light</a>, set to finally launch in May, and celebrate <a href=""https://www.eurogamer.net/hitman-3-world-of-assassination-all-time-classic"">Hitman 3's five-year anniversary</a>, we've received news <a href=""https://www.eurogamer.net/games/hitman-world-of-assassination"">Hitman: World of Assassination</a> is, at long last, getting cross-progression support.</p> <p><a href=""https://www.eurogamer.net/hitman-world-of-assassination-getting-cross-progression-in-february-2026"">Read more</a></p>",2026-01-27T12:23:57.086919
Here's the next batch of Xbox Game Pass games for January,"<img src=""https://assetsio.gnwcdn.com/Screenshot-from-Indika-showing-a-nun-with-a-male-character.-There-is-an-Xbox-logo-in-the-upper-right-corner.jpg?width=690&quality=85&format=jpg&auto=webp"" /> <p>Microsoft has revealed the next batch of games coming to its Xbox Game Pass subscription service this January, and into next month.</p> <p><a href=""https://www.eurogamer.net/heres-the-next-batch-of-xbox-game-pass-games-for-january"">Read more</a></p>",2026-01-27T12:23:57.086919
Divinity: Original Sin 2 hits new post-launch-window high as Larian's bloodthirsty The Game Awards reveal boosts studio's back catalogue,"<img src=""https://assetsio.gnwcdn.com/BG3---Divinity-OS2_skeleton.jpg?width=690&quality=85&format=jpg&auto=webp"" /> <p>Larian Studios' <a href=""https://www.eurogamer.net/divinity-will-be-a-turn-based-rpg-and-see-larian-unleashed-declares-ceo-swen-vincke-replacing-the-dd-system-with-one-made-for-a-video-game"">new Divinity game</a> has been the talk of town since it was revealed at <a href=""https://www.eurogamer.net/heres-everything-announced-at-the-game-awards-2025"">The Game Awards 2025</a>. Even the comments on potential gen-AI use, ensuing backlash, and <a href=""https://www.eurogamer.net/change-of-mind-larian-says-it-will-not-use-gen-ai-at-all-in-relation-to-divinity-concept-art"">course-correction</a> haven't sunk the excitement around the next RPG from the developers behind <a href=""https://www.eurogamer.net/baldurs-gate-3-a-critical-success-with-critical-failures"">Baldur's Gate 3</a>. In fact, the 2023 CRPG and the studio's previous game, <a href=""https://www.eurogamer.net/divinity-original-sin-2-review"">Divinity: Original Sin 2</a>, have seen a surge in popularity.</p> <p><a href=""https://www.eurogamer.net/divinity-original-sin-2-and-baldurs-gate-3-hit-new-highs-after-larian-game-awards-reveal"">Read more</a></p>",2026-01-27T12:23:57.086919
Elder Scrolls Online studio insists shift from expansions to smaller seasonal updates unrelated to sweeping Microsoft layoffs,"<img src=""https://assetsio.gnwcdn.com/eso-screenshot-fire.jpg?width=690&quality=85&format=jpg&auto=webp"" /> <p>
Following last week's announcement that long-running MMO The Elder Scrolls Online would be moving away from traditional major expansions to focus on smaller seasonal updates, developer ZeniMax Online has insisted the big shake-up is in no way related to last year's sweeping layoffs at parent company Microsoft, which <a href=""https://www.eurogamer.net/zenimax-employees-discuss-chaos-of-microsofts-inhumane-mass-layoffs-in-new-report"">heavily impacted</a> the studio.
</p> <p><a href=""https://www.eurogamer.net/elder-scrolls-online-studio-says-smaller-seasonal-updates-unrelated-to-microsoft-layoffs"">Read more</a></p>",2026-01-27T12:23:57.086919
"Despite their simple, nostalgia-fuelled formula, the original Pokémon games took ""a great deal of trial and error"" to develop","<img src=""https://assetsio.gnwcdn.com/pokemon_TXoH4jO.png?width=690&quality=85&format=jpg&auto=webp"" /> <p><a href=""https://www.eurogamer.net/games/pokemon-legends-z-a"">Pok&eacute;mon</a> is celebrating its 30th anniversary on 27th February, and we're collectively dying to see what might be revealed about the <a href=""https://www.ign.com/articles/pokmon-teraleak-reveals-unannounced-games-seemingly-laying-out-franchises-major-releases-through-2030"">long-rumoured next mainline game</a> and other projects. Moreover, <a href=""https://www.eurogamer.net/games/pokemon-pokopia"">Pokopia</a> aims to shake things up with a new take on town life sims in early March. In its beginnings, however, the series took a long time to figure out.</p> <p><a href=""https://www.eurogamer.net/the-original-pokemon-games-took-lots-of-trial-and-error-to-develop"">Read more</a></p>",2026-01-27T12:23:57.086919
"As Hitman 3 turns five years old, we surely have enough hindsight to declare: this is one of the greatest of all time, right?","<img src=""https://assetsio.gnwcdn.com/hitman-3_720.jpg?width=690&quality=85&format=jpg&auto=webp"" /> <p>I can still very clearly remember the first time I was told anything about 2016's Hitman, the soft reboot of the adventures of gaming's most-beloved slaphead. It was at an industry event, several months before the game was due to be announced at E3 2015. It was the usual sort of 'told about a game early' affair. Someone from <a href=""https://www.eurogamer.net/companies/square-enix"">Square Enix</a> gushed over a pint.</p> <p><a href=""https://www.eurogamer.net/hitman-3-world-of-assassination-all-time-classic"">Read more</a></p>",2026-01-27T12:23:57.086919
"Tomb Raider publishers floated a Lara Croft anime redesign in Japan, but the original developers refused it","<img src=""https://assetsio.gnwcdn.com/Lara-and-Natla-from-Tomb-Raider-manga-style.jpg?width=690&quality=85&format=jpg&auto=webp"" /> <p>One of the original Tomb Raider creators has shared some details on a previous request from a Japanese publisher, which asked the team to give Lara Croft an anime-style redesign to make her more widely appealing.</p> <p><a href=""https://www.eurogamer.net/tomb-raider-publishers-floated-a-lara-croft-anime-redesign-in-japan-but-the-original-developers-refused-it"">Read more</a></p>",2026-01-27T12:23:57.086919
"The Atari Hotel is a step closer to reality, but look at the designs and tell me: would you actually want to sleep there?","<img src=""https://assetsio.gnwcdn.com/Phoenix-Atari-Hotel---4-Breezeway.jpg?width=690&quality=85&format=jpg&auto=webp"" /> <p>A top-to-bottom Atari-themed hotel is increasingly close to becoming a reality. A location has been found - in the centre of Phoenix, Arizona - and the company responsible, Intersection Development, says construction will begin late 2026 with a prospective opening date of late 2028.</p> <p><a href=""https://www.eurogamer.net/atari-hotel-closer-to-reality-new-designs-renders"">Read more</a></p>",2026-01-27T12:23:57.086919
"Nintendo Switch 2 sales may be lagging a bit in the West, but its impact on Japan's console market is undeniable","<img src=""https://assetsio.gnwcdn.com/Mario_stonks.jpg?width=690&quality=85&format=jpg&auto=webp"" /> <p>With the <a href=""https://www.eurogamer.net/is-the-switch-2-getting-more-expensive-soon-nintendo-says-theres-no-immediate-impact-but-will-keep-an-eye-on-volatile-memory-market"">menace of price hikes</a> looming over every piece of gaming hardware and early 2026 reports that <a href=""https://www.ign.com/articles/nintendo-source-blames-switch-2-holiday-sales-slowdown-on-the-economic-landscape-and-the-absence-of-a-major-western-game-despite-the-release-of-metroid-prime-4-beyond"">Nintendo Switch 2 was below Switch 1's sales curve over its first December period</a> in the US and Europe, many have started to wonder if we were looking at a strong start with bad legs for the newest hybrid console. But, in Japan at least, that doesn't seem to be the case.</p> <p><a href=""https://www.eurogamer.net/nintendo-switch-2-boosted-japan-console-market-in-2025"">Read more</a></p>",2026-01-27T12:23:57.086919
Marathon soars to Steam's Top Sellers after release date reveal,"<img src=""https://assetsio.gnwcdn.com/marathon-trailer-crop-header.jpg?width=690&quality=85&format=jpg&auto=webp"" /> <p>Marathon has swiftly climbed Steam's Top Sellers list following the <a href=""https://www.eurogamer.net/marathon-release-date-reportedly-leaks-via-xbox-store-pre-order-trailer"">reveal of its 5th March release date</a>.</p> <p><a href=""https://www.eurogamer.net/marathon-soars-to-steams-top-sellers-after-release-date-reveal"">Read more</a></p>",2026-01-27T12:23:57.086919
"Highguard Is Crashing On PC,  Here's How To Address It","<p>Following a surprise reveal at <a href=""https://www.gamespot.com/gallery/the-game-awards-2025-all-the-biggest-announcements/2900-7341/"">2025's The Game Awards</a>, the new hero shooter <a href=""https://www.gamespot.com/games/highguard/"">Highguard</a> has arrived. However, the free-to-play game appears to be crashing on PC. If it's happening to you, there may be some steps you can take to fix the issue.</p><p>According to <a href=""https://steamdb.info/app/4128260/charts/"">the Steam charts</a>, Highguard peaked at over 97,000 concurrent players shortly after its debut. That number may have put a significant strain on the game's servers. It's currently dropped down to just over 11,000 concurrent players.</p><p>If the crashes are due to an issue on the game's end, developer Wildlight Entertainment will likely patch it out. If the crashes are happening due to players' computers these are the recommended steps to take at this time:</p><a href=""https://www.gamespot.com/articles/highguard-is-crashing-on-pc-heres-how-to-address-it/1100-6537670/?ftag=CAD-01-10abi2f/"">Continue Reading at GameSpot</a>",2026-01-27T12:23:57.086919
Pokemon Theme Park Shows Off Its Features Ahead Of Opening Day,"<p>In just over a week, the first-ever permanent Pokemon theme park, PokePark Kanto, will open in Japan. Judging from advance sales, it's likely to be difficult to get tickets until demand dies down. In the meantime, PokePark Kanto opened up its doors a few days early to let fans know what the experience has in store for them.</p><div data-embed-type=""tweet"" data-src=""https://twitter.com/TokyoGameLife/status/2015744572396302564"" data-has-image=""true""><blockquote align=""center"" class=""twitter-tweet"" data-conversation=""none"" data-mce-disable-toolbar=""true""><p dir=""ltr"">Today was press day for PokePark Kanto opening on 2/5, and there’s a ton of new pics from inside the park! It really feels like a Gen I town come to life. Still waiting on lottery results but you can also buy tickets for two months ahead of time.<br />More: <a href=""https://t.co/aMDkTct5OT"">https://t.co/aMDkTct5OT</a> <a href=""https://t.co/jVYeISFSXu"">pic.twitter.com/jVYeISFSXu</a></p>  — Tokyo Game Life (@TokyoGameLife) <a href=""https://twitter.com/TokyoGameLife/status/2015744572396302564?ref_src=twsrc%5Etfw"">January 26, 2026</a></blockquote>          <text></text>    </div><p>According to the message posted above by Tokyo Game Life, PokePark Kanto ""feels like a Gen 1 town come to life."" That includes a station where a cast member portrays Nurse Joy as she extracts captured Pokemon from Pokeballs.</p><div data-embed-type=""tweet"" data-src=""https://x.com/Stealth40k/status/2015773315764277538"" data-has-image=""true""><blockquote align=""center"" class=""twitter-tweet"" data-conversation=""none"" data-mce-disable-toolbar=""true""><p dir=""ltr"">Real life Nurse Joy at PokePark Kanto!<a href=""https://t.co/JswF69310G"">pic.twitter.com/JswF69310G</a></p>  — Stealth (@Stealth40k) <a href=""https://twitter.com/Stealth40k/status/2015773315764277538?ref_src=twsrc%5Etfw"">January 26, 2026</a></blockquote>          <text></text>    </div><p>There are a lot of Pokemon statues placed throughout the park for fans to take pictures with.</p><a href=""https://www.gamespot.com/articles/pokemon-theme-park-shows-off-its-features-ahead-of-opening-day/1100-6537669/?ftag=CAD-01-10abi2f/"">Continue Reading at GameSpot</a>",2026-01-27T12:23:57.086919
Two New Friday The 13th 4K Steelbook Blu-Rays Are Up For Preorder At Amazon,"<div title=""6537658 - Friday the 13th Remake and Part 2 SteelBook Preorders"" data-embed-type=""buylink"" data-ref-id=""5460"" data-template=""2"" data-size=""buylink__large"" data-title=""6537658 - Friday the 13th Remake and Part 2 SteelBook Preorders"" data-collection="""" class=""norewrite"">    <div class=""buylink__container"">                                                                                                                                                                                               <div class=""buylink__item"">                  <div class=""buylink__image-container clickable"">                                            <img class=""buylink__image"" src=https://www.gamespot.com/a/uploads/square_avatar/1865/18658661/4640842-710part1.jpg alt="""">                                 <a href=""https://www.amazon.com/Friday-13th-Marcus-Nispel/dp/B0G4DYD1C3?tag=gamespot-preorders-20""></a>                              </div>                   <div class=""buylink__text"">                      <p class=""buylink__title text-bold"">                        <a href=""https://www.amazon.com/Friday-13th-Marcus-Nispel/dp/B0G4DYD1C3?tag=gamespot-preorders-20"">Friday the 13th (2009) Reprint</a>           </p>                                                       <p class=""buylink__deck"">                          <a href=""https://www.amazon.com/Friday-13th-Marcus-Nispel/dp/B0G4DYD1C3?tag=gamespot-preorders-20"">$32 (was $50) | Releases February 3</a>             </p>                                              </div>                  <div class=""buylink__links"">                                                                                                                                                          <a href=""https://www.amazon.com/Friday-13th-Marcus-Nispel/dp/B0G4DYD1C3?tag=gamespot-preorders-20"">Preorder at Amazon</a>                     </div>                         </div>                                                                                                                                                                                                                 <div class=""buylink__item"">                  <div class=""buylink__image-container clickable"">                                            <img class=""buylink__image"" src=https://www.gamespot.com/a/uploads/square_avatar/1865/18658661/4640843-710part2.jpg alt="""">                                 <a href=""https://www.amazon.com/Friday-13th-Part-Amy-Steel/dp/B0G3RMTTVX?tag=gamespot-preorders-20""></a>                              </div>                   <div class=""buylink__text"">                      <p class=""buylink__title text-bold"">                        <a href=""https://www.amazon.com/Friday-13th-Part-Amy-Steel/dp/B0G3RMTTVX?tag=gamespot-preorders-20"">Friday the 13th: Part 2 45th Anniversary Edition</a>           </p>                                                       <p class=""buylink__deck"">                          <a href=""https://www.amazon.com/Friday-13th-Part-Amy-Steel/dp/B0G3RMTTVX?tag=gamespot-preorders-20"">$27 (was $31) | Releases February 3</a>             </p>                                              </div>                  <div class=""buylink__links"">                                                                                                                                                          <a href=""https://www.amazon.com/Friday-13th-Part-Amy-Steel/dp/B0G3RMTTVX?tag=gamespot-preorders-20"">Preorder at Amazon</a>                     </div>                         </div>                     </div> </div><p>Friday the 13th is getting a duo of new 4K Blu-ray SteelBook releases next month. The 2009 remake 4K Blu-ray was originally released as a limited edition back in 2024, but swiftly sold out. Luckily, a <strong><a href=""https://www.amazon.com/Friday-13th-Marcus-Nispel/dp/B0G4DYD1C3?tag=gamespot-preorders-20&amp;tag=gamespot-buybutton-20"">new reprint is available preorder at Amazon for $37.49</a></strong> (was $50). Then there's the Friday the 13: Part 2 45th Anniversary Edition 4K SteelBook, which comes with a handful of new bonus features, <a href=""https://www.amazon.com/Friday-13th-Part-Amy-Steel/dp/B0G3RMTTVX?tag=gamespot-preorders-20&amp;tag=gamespot-buybutton-20""><strong>available to preorder for $24.49</strong></a> (was $31). Both titles will release simultaneously on February 3, 2026.</p><div title=""6537658 - Friday the 13th Remake and Part 2 SteelBook Preorders"" data-embed-type=""buylink"" data-ref-id=""5460"" data-template=""4"" data-size=""buylink__listicle"" data-title=""6537658 - Friday the 13th Remake and Part 2 SteelBook Preorders"" data-collection="""" class=""norewrite"">  <div class=""buylink-container"">                                                                     <div class=""js-buylink-item-container buylink-item-container"">             <h2 class=""item-title"">                    <a href=""https://www.amazon.com/Friday-13th-Marcus-Nispel/dp/B0G4DYD1C3?tag=gamespot-preorders-20"">Friday the 13th (2009) Reprint</a>       </h2>                                   <h3 class=""item-deck"">                      <a href=""https://www.amazon.com/Friday-13th-Marcus-Nispel/dp/B0G4DYD1C3?tag=gamespot-preorders-20"">$32 (was $50) | Releases February 3</a>         </h3>                                                                                                        <div class=""image-container"">                                  <img class=""main-image"" src=https://www.gamespot.com/a/uploads/square_medium/1865/18658661/4640842-710part1.jpg>                             <a href=""https://www.amazon.com/Friday-13th-Marcus-Nispel/dp/B0G4DYD1C3?tag=gamespot-preorders-20""></a>                        </div>              <div class=""item-description""><p>The 2009 remake was a pretty faithful recreation of the campy original thanks to director Marcus Nispel, who also remade The Texas Chainsaw Massacre in 2003. This 4K Blu-ray SteelBook from Arrow Video comes with a reversible sleeve with new artwork. Below are all the special features included: </p><ul><li>Audio Commentary with the Filmmakers</li><li>Interviews with the Filmmakers</li><li>Delete Scenes</li><li>Image Gallery</li><li>A Killer New Beginning Video Essay</li><li>Excerpts from the Terror Trivia Track</li><li>The Rebirth of Jason Voorhees Archival Featurette</li><li>Hacking Back/ Slashing Forward Archival Featurette</li><li>The 7 Best Kills Archival Featurette</li></ul></div>                <div class=""item-buttons"">                  <div>                      <a href=""https://www.amazon.com/Friday-13th-Marcus-Nispel/dp/B0G4DYD1C3?tag=gamespot-preorders-20"">Preorder at Amazon</a>                              </div>                                         </div>      </div>                                                                     <div class=""js-buylink-item-container buylink-item-container"">             <h2 class=""item-title"">                    <a href=""https://www.amazon.com/Friday-13th-Part-Amy-Steel/dp/B0G3RMTTVX?tag=gamespot-preorders-20"">Friday the 13th: Part 2 45th Anniversary Edition</a>       </h2>                                   <h3 class=""item-deck"">                      <a href=""https://www.amazon.com/Friday-13th-Part-Amy-Steel/dp/B0G3RMTTVX?tag=gamespot-preorders-20"">$27 (was $31) | Releases February 3</a>         </h3>                                                                                                        <div class=""image-container"">                                  <img class=""main-image"" src=https://www.gamespot.com/a/uploads/square_medium/1865/18658661/4640843-710part2.jpg>                             <a href=""https://www.amazon.com/Friday-13th-Part-Amy-Steel/dp/B0G3RMTTVX?tag=gamespot-preorders-20""></a>                        </div>              <div class=""item-description""><p>The 1981 follow up to the iconic original, this 45th Anniversary Edition of Friday the 13th: Part 2 is a two-disc featuring a remastered version of the film and some new special features. The story picks up five years after the end of the first movie, with another group of stubborn teens fallen victim to the hockey mask-clad killer. Here are the special features you can look forward to:</p><ul><li>Inside ""Crystal Lake Memories""</li><li>Friday's Legacy: Horror Conventions</li><li>Lost Tales From Camp Blood - Part 2</li><li>Jason Forever Featurette</li><li>Original Theatrical Trailer</li></ul></div>                <div class=""item-buttons"">                  <div>                      <a href=""https://www.amazon.com/Friday-13th-Part-Amy-Steel/dp/B0G3RMTTVX?tag=gamespot-preorders-20"">Preorder at Amazon</a>                              </div>                                         </div>      </div>   </div> </div><p>The Friday the 13th franchise is one of the most iconic slasher series in the history of the medium, spanning 12 movies and even a handful of <a href=""https://www.gamespot.com/games/friday-the-13th-the-game/"">video game adaptations</a>. We've seen Jason go from his backwoods roots to New York City, and even a short stint in space (yes, really). The 2009 remake retells the original story well, hitting every big story beat, ridiculous kill scenes, and the twist in a very faithful way. Friday the 13th: Part 2 is a direct follow-up to the first one, following a new group for Jason to stalk.</p><p>Both movies come in premium SteelBook cases, and the remake reprint includes brand-new cover art by artist Gary Pullin, reversible -- one side features the retro look of the original, while the other is the original poster for the remake. If you're unfamiliar, SteelBook cases are roughly the same size as a typical plastic Blu-ray case but much sturdier, and they often feature alternate art and other physical bonuses. For physical media collectors, the spines look really nice on a bookshelf, and these two horror movies are no different.</p><a href=""https://www.gamespot.com/articles/friday-the-13th-remake-and-part-2-4k-blu-rays-are-available-to-preorder-on-amazon/1100-6537658/?ftag=CAD-01-10abi2f/"">Continue Reading at GameSpot</a>",2026-01-27T12:23:57.086919
Veteran Mario Kart Director Retires From Nintendo After Four Decades,"<p>Hideki Konno, a longtime director for Nintendo, has resigned from the video game publisher. Konno confirmed the news on<a href=""https://www.facebook.com/hideki.konno.10""> his Facebook page</a> months ago, which largely went unnoticed by the press at the time. His last month at Nintendo was July 2025.</p><p>The fans at the <a href=""https://famiboards.com/threads/hideki-konno-producer-and-game-designer-has-left-nintendo.16356/"">Famiboard Forums</a> were the first to notice Konno's employment update, which has since blown up online. Konno joined Nintendo in 1986, and worked as a designer and assistant director on Super Mario Bros. 2 and Super Mario Bros. 3. He also directed Yoshi's Island and SimCity for the SNES, and Luigi's Mansion for the GameCube.</p><p>Konno's most enduring work was on the Mario Kart franchise. He directed the first two games, Super Mario Kart and Mario Kart 64, in addition to producing Mario Kart DS, Mario Kart Wii, Mario Kart 7, Mario Kart 8, and Mario Kart Tour. Although Konno didn't work on the most recent game, he received a special thanks credit in Mario Kart World.</p><a href=""https://www.gamespot.com/articles/veteran-mario-kart-director-retires-from-nintendo-after-four-decades/1100-6537666/?ftag=CAD-01-10abi2f/"">Continue Reading at GameSpot</a>",2026-01-27T12:23:57.086919
