title,text
Microsoft Refutes Notion That Foreign-Worker Visas Were Behind Mass Xbox Layoffs,"Since news broke of Microsoft's recent round of mass layoffs --which affected 1,600 people immediately and will reach double that number over the next year--a number of reports have claimed that mass approvals of foreign-worker visas were behind the decision. Now, Microsoft communications lead Frank X. Shaw has refuted what he calls ""bad information."" In a Twitter post, Shaw said that while there are Microsoft workers using H-1B visas, they are ""not specific to Xbox and represent a small percentage of Microsoft's overall workforce. And the majority of the roles impacted were not American roles."" https://twitter.com/fxshaw/status/2075637298046374135 ""Recent workforce changes were made to restructure the Xbox business because it is not healthy. They were not made to replace employees with foreign workers,"" Shaw said. Shaw's comments come after multiple conservative news outlets pointed out that Microsoft was approved for more than 2,200 H-1B visas this year. Fox News was told by Microsoft prior to publishing its story that H-1B employees were also among those affected by the layoffs. The recent Xbox layoffs are among the biggest we've ever seen in the gaming industry. Alongside losing roughly 20% of the Xbox workforce, Microsoft also made the decision to separate from five studios. Two of these--Double Fine and Compulsion Games--will return to operating as independent studios. Ninja Theory and Undead Labs, meanwhile, are being sold to a currently unknown buyer, and Microsoft is currently reviewing options with Arkane for its sale or separation. The studios that remain operational were still heavily impacted by the layoffs, however. Among the worst-hit, at least that we know of, was id Software, which lost roughly half its headcount just as it launched the latest Doom: The Dark Ages expansion."
This Promising DayZ Rival Is Thankfully Pivoting To PvE Before Launch,"Zeverland , the upcoming open-world zombie sim for PC, plays a lot like DayZ, but the team at Quantum Quirks has announced a major shift in the game's design following a closed alpha test. According to the studio, players wanted the PvPvE game to be an entirely cooperative PvE experience instead, so much so that the team is meeting the community's requests and turning Zeverland into exactly that. ""You talked. We listened,"" the studio said on the Zeverland Steam page . ""We've decided to shift Zeverland from a pure [massive multiplayer online game] into a [buy-to-play], survival-crafting, co-op PvE game [...] After hearing from our community, we've confirmed: Zeverland is doubling down on cooperative PvE. Survive together. Build together. Explore together--not harm each other."" While such a change will fundamentally reshape the game's gameplay, Quantum Quirks isn't changing what most people call out when they first see Zeverland in action. The game's chibi-like art style is very eye-catching for a zombie survival sim, and it's not going anywhere. I've not seen a zombie game that looks like this before, though when I participated in the playtest recently, I came around to it quickly. While much of the game feels reminiscent of the games it's borrowing from, its standout aesthetic is a nice touch. More than that, what I enjoyed most about my time with Zeverland is how much more forgiving it felt. As much as I love it, I've never quite gotten good at DayZ. I've never joined a particular server and really built on my progression for many hours at a time. I've always jumped into one that's open, messed about for some time, and probably eventually died from blood loss, starvation, or a player who wanted to loot my pockets. https://www.youtube.com/watch?v=0hJ2YPMt38E My early impression of Zeverland is that it'll be a bit less grueling for newcomers. In addition to the game switching to PvE, my hands-on time revealed that bicycles are abundant for easier, faster travel, and even cars often worked right away--so long as they had gas. Beyond that, it has many of the key qualities I look for in games like it. The world is huge and desolate. Combat is nerve-racking, demanding I carefully avoid even just some scratches from the undead. Looting is exciting and instructive; I was constantly finding new crafting recipes and items that suggested there is a lot to learn, just in an environment that is not immediately, unrelentingly hostile the way I'm used to. It's not a zombie game for kids; don't get me wrong. You might think the aesthetic and the game's more welcoming early hours mean it's going for a younger audience, but I don't think it is. It's still checking many of the same gameplay boxes that a game like Project Zomboid or State of Decay also target. It's just that it feels like the on-ramp to learning how to play Zeverland won't be nearly as treacherous as some of its inspirations have proven to be. I never get tired of playing the best zombie games . I'd likely have sunk some hours into Zeverland even with its previous PvPvE focus to see if it belongs in that conversation, but I definitely prefer the game's North Star now being PvE, and I'm looking forward to diving back into the game when its renewed focus is ready to see for myself."
Roblox’s Latest Crossover Is One I Guarantee You’d Never Guess,"The Rolling Stones, one of the most legendary rock bands of all time, are coming to Roblox. The band is launching an ""immersive"" new game inside Roblox today, July 10, but it's only going to be around for a short time. The Stones are coming to Roblox's The Block virtual venue starting today and ending on July 17. The in-game event will feature ""classic hits"" and new songs from the band's Foreign Tongues album, which released on July 10. As for the game, players are called on to work together to ""save rock history"" by defeating a mysterious force known as The Man, who went back in time to destroy rock and roll. ""Stop The Man and bring back The Rolling Stones for the biggest music event ever,"" reads a line from the game's description. https://www.youtube.com/watch?v=qiKjPE0xBY4 In the game, players will ""progress through decades representing the band's eras"" as they seek out and destroy ""crystals"" while famous Stones song play. Finding and shattering the crystals ""powers up a massive tongue-and-lips that releases a surge of rock and roll energy to disrupt each decade and unlock the next--culminating in a globally shared interactive performance that evolves based on community participation."" The Stones are just the latest rock band or musical artist to appear in Roblox, following Lil Nas X and Twenty One Pilots. It's been tough times for Roblox Corp. of late, as the company's share price is down 30% this year. The dropoff is due in part to ongoing concerns about child safety, prompting lawsuits and other negative press. In response, Roblox rolled out new protections and other significant changes ."
"AC Black Flag Resynced Is A Hit, But People Are Particularly Upset About One Thing","Assassin's Creed Black Flag Resynced launched on July 9, and the swashbuckling pirate adventure game got off to a great start. Vantage Studios, the new company in charge of the Assassin's Creed brand, announced today that Resynced sold more than 2 million copies in its first 24 hours. It hasn't been a total success story, however, and the negativity surrounding the game pertains to the usual culprit: microtransactions. Beyond the strong sales and player numbers, Resynced is scoring well with critics, sitting at an impressive 84 on GameSpot sister site Metacritic . It's the most celebrated Assassin's Creed game since 2013 based on Metacritic scores. The game also reached 99,451 concurrent players on Steam in the first day , setting a record for an Assassin's Creed game on Steam. Resynced is off to a good start. It hasn't been completely smooth sailing for Resynced, however, as players have taken issue with how there is $85's worth of microtransactions for the $60 game. In a post on Steam , Ubisoft said it's aware of the feedback and ""reading all of it."" The studio said the add-on content that people can buy is ""entirely optional."" None of the extra content is a ""requirement to enjoy or complete the game."" Eight out of the nine microtransaction items for Resynced are $10 cosmetic packs, including one that gives you a bright blue monkey with glowing eyes . There is also a $5 ""Map Pack"" that does not include any new maps, but instead gives players a special spyglass they can use to reveal collectibles that players would otherwise need to seek out and find on their own. Ubisoft's games, including the Assassin's Creed series, are known for extensive microtransaction offerings. Numerous other publishers utilize microtransactions as well, and another recent high-profile example is CFB 27, which is pissing everyone off with its microtransactions . GameSpot's Assassin's Creed Black Flag Resynced review scored the game a 7/10. Reviewer Jordan Ramee said the game ""goes beyond the scope of a traditional remaster and adjusts the content of Black Flag to make improvements to the experience."" At the same time, Ramee said the remake ""creates problems the original Black Flag didn't have."" Ubisoft has been undergoing a cost-cutting program in recent times, and this also impacted dozens of developers who worked on Resynced, according to Insider Gaming . For more, check out the story below: Black Flag Resynced Hides Its Connection To Assassin’s Creed Shadows, And That’s A Shame"
GTA 6 Preloading: Start Date And What To Know About Digital And Physical Copies,"After years of development and multiple delays, Rockstar's Grand Theft Auto 6 is finally launching on November 19, and you can now actually preorder the game . The $80 game arrives on November 19, but you can actually preload it a week earlier, which is nice for the countless people who no doubt want to begin playing the second they can. Here's everything you need to know about GTA 6 preloading. GTA 6 preload schedule GTA 6 players who preorder a digital copy of GTA 6 can begin preloading on November 12. This is to ""ensure they are able to play at launch,"" Rockstar said. GTA 6 is not going to be released on a disc , but Rockstar is still selling physical copies of the game at retailers with a code in the box. The game's physical edition will be available to buy on November 12 ""to support preloading,"" Rockstar said. So if you walk into a GameStop or Walmart on November 12 and see a copy of GTA 6 on the shelves to buy, you can do so, but the game itself won't unlock until November 19. GTA 6 will arrive in November. The file size GTA 6's file size has not been disclosed as of yet, but many are expecting it to be huge. GTA 5's file size varies by platform but can be more than 100 GB. Given that, we would expect GTA 6 to be at least 100 GB as well. Launch times GTA 6 launches on November 19, but when exactly? We don't know yet, as Rockstar has not yet shared that information. Keep checking back with GameSpot for the latest on GTA 6's launch times and more."
Xbox Is Teasing Something Big For Next Week Amid Disc-To-Digital Rumors,"The future is looking increasingly digital for next-gen video game consoles, but one method that might ease the transition is a disc-to-digital service that allows users to bring their libraries with them. While there is speculation that this feature will launch around the time that Xbox debuts its next-gen console, Project Helix , a first taste of the future might be arriving sooner than expected. Xbox Insiders received a message in lieu of an update this week, with Xbox's program lead Brad Rossetti teasing that something big was on the way. ""Xbox Insiders on console, as you have seen we paused flighting this week as we prep for week next. Thanks for being patient! The wait is worth the wait, I promise,"" Rossetti wrote online . https://www.youtube.com/watch?v=4FatSqS3VYY This is widely rumored to be the first look at Xbox's disc-to-digital program, something that Windows Central editor Jez Corden--who has filed several reports on the feature-- teased its debut with a ""positron cometh"" tweet. This is reportedly the codename for the rumored disc-to-digital feature, with other reports claiming that Xbox Play Anywhere will give users the option to switch from physical to digital. While Xbox has yet to confirm if Project Helix will be an all-digital games console, its rival Sony has confirmed that it will stop manufacturing PlayStation discs in 2028, something analysts believe will lead to a discless PS6 . The backlash was swift and negative for Sony, with the company going radio silent on its social media channels for several days while people rallied against the company. Even with the negative publicity, Sony's reasons for ditching physical media make complete financial sense . Digital sales vastly overshadow physical sales, and Sony recorded its highest-ever quarterly digital game sales period just before it made the announcement. Other companies like EA, Capcom, and Nintendo have also experienced a surge in digital sales , which means those publishers and studios have less overhead to deal with, like covering the costs of pressing game discs or paying retailer fees. And as one analyst has said, player loyalty means nothing to these companies."
"Game Pass Gets A Few Freebies For This Weekend Only, Including One Where You’re A Teddy Bear Fighting Nightmares Come To Life","The weekend is here, and if you're looking for something new to play on Xbox but don't want to spend any money, you're in luck. The Free Play Days promotion is back this weekend, with three games offered up for the low, low price of $0, or at least nothing beyond the price of a Game Pass membership. MLB The Show 26, which is the newest entry in the professional baseball series, is free this weekend. The survival game The Alters is free as well, along with the FPS Stuffed, in which you play as a teddy bear and fight off the nightmares of a young girl. All of these games are free now through July 12, and you need a membership to Game Pass Ultimate, Premium, or Essential. If you want to buy the games after the free weekend, MLB The Show 26 is marked down to $35 , while The Alters is discounted to $17.50 . Stuffed, however, is not on sale and sells for its normal $12.50 price . A spooky scene from Stuffed. Beyond these free games, Gears of War: Reloaded was just added to Game Pass Premium tier (joining Game Pass Ultimate and PC Game Pass) on July 9, while the arcade-style corridor shooter Tamashika came to Game Pass Ultimate, Game Pass Premium, and PC Game Pass on that day as well. For more, check out all of the new additions to Game Pass for July so far . Xbox is facing challenging times of late, as the company recently laid off 1,600 people, divested from five studios, and cancelled games . Xbox CEO Asha Sharma said the changes were necessary because Xbox is not a healthy business currently. Sharma was recently appointed to a Federal Reserve task force focused on productivity and jobs ."
"Dragon Ball Xenoverse 3’s New Transformations Look Nerfed, But That’s Not The Full Story","Bandai Namco dropped the first gameplay reveal for Dragon Ball Xenoverse 3 this week, showcasing one of the game's missions and new key combat features. While the core beat-'em-up gameplay has been retained from the previous games, it's the approach to transformations in Xenoverse 3 that has Dragon Ball fans talking, as many believe this signature component has been nerfed for the threequel. One of the big changes in Xenoverse 3 revolves around how and when players can use their high-powered skills, like beam attacks and area-of-effect ki explosions. Previous Xenoverse games required players to charge up their Ki meter, but Xenoverse 3 has swapped to a cooldown meter for abilities. Ki now functions as a stamina gauge that recharges over time, and transformations aren't available at the start of a mission. Instead, players have to build up power and charge their ""Awakening"" transformation, allowing them to change into a Super Saiyan or use the Kaioken boost in battle. https://youtu.be/HE82-Zr6ky0 This shift in transformations also has the Dragon Ball Xenoverse subreddit convinced that transformations are also on a timer, but that doesn't appear to be the case. If you look closely at the icon, the artwork changes from a Super Saiyan design to what appears to be a Super Saiyan 3-inspired illustration with a timer counting down. This suggests that players will need to transform in stages, instead of skipping Super Saiyan forms in battle. We have reached out to Bandai Namco for clarification and will update this post once we hear back. This hasn't stopped Dragon Ball fans from complaining about the changes, with many still believing that transformations are limited-time power-ups. ""I hope to see the whole community bashing this idea non-stop until they change it, because they won't do anything if they can pretend it's only a minority of people,"" one of the top-voted comments on the Xenoverse 3 reddit thread reads. It's worth pointing out that the Xenoverse 3 gameplay doesn't have any footage of the player powering down after the timer reaches zero, but being knocked out by one of the major stage bosses doesn't seem to cancel the transformation. Previous Dragon Ball Xenoverse games allowed you to maintain your transformation for as long as you had Ki energy, and several items allowed you to minimize the drain on your reserves or charge up Ki quickly, making transformations last for the duration of a bout. No skipping the Super Saiyan power-up line in Xenoverse 3. Awakenings are one of several new tools available in the game, alongside Soul Assist and Soul Change. Soul Assist allows a player to call upon the powers of a legendary Dragon Ball warrior like Piccolo or Krillin and use their signature powers in battle, while Soul Change lets a player incarnate into that fighter and harness their strength firsthand. Fighters like Trunks and Vegeta don't just have character-specific powers; they also have quicker cooldown timers for these skills. Each race has its own unique transformation, and so far, it looks like players can choose from the Saiyan, Human, and Majin races. Set over 300 years after the end of the main Dragon Ball sagas, Dragon Ball Xenoverse 3 launches in 2027 for PC, PS5, and Xbox Series X|S."
"Harry Kane And Erling Haaland, Best Known For Their Gaming Skins, Are Facing Off This Weekend At The World Cup","The 2026's Men's World Cup is heating up, and one of this weekend's most-anticipated matchups is between Harry Kane of England and Erling Haaland of Norway, who are of course best known for their gaming skins. England captain Harry Kane has a Fortnite skin, while Norway striker and noted Xbox fan Erling Haaland has his own Clash of Clans skin. On June 11, the two gaming skins who are also know for their sporting prowess will play to decide who gets through the semifinals of the World Cup. Erling Haaland in Clash of Clans. Kane came to Fortnite as a skin five years ago, while Halaan's skin in Clash of Clans arrived about two years ago. Harry Kane in Fortnite EA Sports' World Cup simulation chose Spain to win , and they remain a popular choice to win the whole thing, only behind the overall betting favorite France. Spain plays Belgium today, June 10, and the winner will take on France on July 14. The World Cup wraps up on Sunday, July 19."
Xbox CEO Joins Federal Reserve’s Productivity And Jobs Task Force Amid Tumultuous Time,"The United States central bank, the Federal Reserve, has announced new task forces to ""advance the conduct of monetary policy,"" and its board has chosen Xbox CEO Asha Sharma to help guide one task force pertaining to AI, as part of a wider effort to help create jobs and keep prices stable. The new Productivity and Jobs task force will look into the ""economic impact of new general-purpose technologies,"" including AI, to help the Fed make better policy decisions. Sharma is joined on this task force by billionaire businessman and venture capitalist Marc Andreessen, along with Stanford University economics professor Charles I. Jones--he is currently on leave from the university to become a scholar-in-residence at the AI company Anthropic. Fed chairman Kevin Warsh said the new task forces are part of the group's ""commitment to price stability and maximum employment."" Asha Sharma is the new Xbox CEO. Sharma, for her part, recently oversaw huge Xbox price hikes and mass layoffs at Xbox that people reacted negatively to. These dramatic changes came against the backdrop of the entire consume electronics industry managing the ongoing memory and component shortages that have eaten into margins. ""We are in a hardware component crisis. When I joined as CEO in February, the price we paid for console storage components was over 2x as high as we paid last fall,"" Sharma said. ""These costs have since doubled again. And as we plan for the 2027 holiday season, we expect another significant increase, taking us over 5x the prices we paid only two years earlier. Memory costs have followed a broadly similar trajectory. While the entire industry is facing a components crisis, we believe we have been impacted more greatly than many of our peers due to the choices we made over the last half decade. We are currently unable to make as many consoles as players want to buy, and we need a new business model and partnerships for hardware as we remain committed to Helix."" On the AI part, Sharma, 37, comes from an AI background at Microsoft. She has promised no ""soulless AI slop"" at Xbox under her leadership, and she has canceled some AI plans for Xbox already . The Fed's new task forces will ""operate independently,"" the Fed said. They will attempt to ""follow the evidence, provide candid feedback, and produce rigorous findings."" The other task forces include ones dedicated to improving the Fed's communications, examining costs and benefits generally, bettering the quality and timeliness of key economic data points, and revisiting how the Fed tracks and reacts to inflation. The Xbox ""reset"" that was announced this week included 1,600 Xbox layoffs, with 1,600 more to come. Microsoft also got rid of five studios and canceled games, including Avowed 2 . This was all done because Sharma said the Xbox business was not healthy and was in need of major changes."
Assassin’s Creed Black Flag Resynced Has The Best Launch The Series Has Seen In Years,"Assassin's Creed Black Flag Resynced isn't just the best-reviewed game in the series in 13 years; it's also off to a flying start with more than 100,000 players on Steam alone. That's one of the highest opening weeks for an Assassin's Creed game in several years, and the number doesn't include Black Flag Resynced's availability through other PC storefronts, PS5, and Xbox Series X|S, either. One thing to note is that not every Assassin's Creed game has been available through Steam at launch, but Black Flag Resynced's performance can still be compared to recent releases. Assassin's Creed Odyssey peaked at 62,049 players during its launch week, and Assassin's Creed Shadows reached 64,825 players when it first hit the scene last year. Assassin's Creed Valhalla is something of an anomaly, as it wasn't available at launch through Steam. https://www.youtube.com/watch?v=niSS6zePbYs&t=2s When Ubisoft did return to Steam after a gap of several years, it peaked at 15,679 players on launch day--two years after it first launched on PC and console--and it later surpassed that number in January 2026 with 19,181 players. For Black Flag Resynced, those are some impressive launch week numbers--even if they do pale in comparison to the similarly themed pirate game Windrose, which reached more than 220,000 peak concurrent users on Steam during its launch week in April. While there's plenty to celebrate, several Black Flag Resynced developers at Ubisoft Barcelona are also facing layoffs following the game's launch. Part of the cuts that Ubisoft initiated in June, around 51 developers will be impacted, while Black Flag Resynced is expected to be a big seller for Ubisoft during a lean year of releases from the company. Best Assassin’s Creed Games: Every Game, Ranked View Images"
