title,text,scraped_at
"Windrose studio outlines pirate survival hit's eagerly awaited first major content update, but it sounds like there'll be a bit of a wait","<img src=""https://assetsio.gnwcdn.com/Windrose_jungle.jpg?width=690&quality=85&format=jpg&auto=webp"" /> <p>After only two weeks out on the early access seas, pirate-themed online survival game has made quite the splash on Steam. It's already sold <a href=""https://www.eurogamer.net/windrose-1m-copies-celebration"">over 1m copies</a> and reached a peak above 200,000 concurrent players. And now, with its most pressing launch issues addressed, developer Kraken Express has revealed initial details of what's planned for Windrose's first major content update.</p> <p><a href=""https://www.eurogamer.net/windrose-first-content-update-details"">Read more</a></p>",2026-05-01T01:52:02.270920
Resident Evil Requiem director says Capcom cut an entire chapter before game's release,"<img src=""https://assetsio.gnwcdn.com/Victor-Gideon-in-Resident-Evil-Requiem.-He-has-scarred-pale-skin-and-is-wearing-headgear-that-covers-his-eyes.jpg?width=690&quality=85&format=jpg&auto=webp"" /> <p>Capcom cut an entire chapter from Resident Evil Requiem ahead of its release, as part of a ""rigorous process of selection and elimination"".</p> <p><a href=""https://www.eurogamer.net/resident-evil-requiem-cut-chapter-final-release"">Read more</a></p>",2026-05-01T01:52:02.270920
"After ditching PvP for solo and co-op, legendary designer Warren Spector's stealthy Thick as Thieves reveals a price so low I thought it was a typo","<img src=""https://assetsio.gnwcdn.com/thick-as-thieves-header.jpg?width=690&quality=85&format=jpg&auto=webp"" /> <p>We're just weeks away from the launch of Thick as Thieves, the intriguing new stealth game from legendary <a href=""https://www.eurogamer.net/games/thief-the-dark-project"">Thief: The Dark Project</a> designer Warren Spector's OtherSide Entertainment studio. And with its 20th May release date looming, the team has shared some pricing details - and, unexpectedly, you'll be able to pick it up for less than the cost of a coffee.</p> <p><a href=""https://www.eurogamer.net/thick-as-thieves-price-low"">Read more</a></p>",2026-05-01T01:52:02.270920
"Fears mount that PlayStation has ""re-armed the CBOMB"" issue which stops you playing purchased games, amid 30-day DRM and AI chat bot confusion","<img src=""https://assetsio.gnwcdn.com/ps5-explosion-custom-header.jpg?width=690&quality=85&format=jpg&auto=webp"" /> <p>PlayStation users have discovered an issue whereby some digital games become unplayable unless an online connection is made every 30 days - although further community digging suggests it seems to be only a one-off, temporary form of digital rights management (commonly known as DRM).</p> <p><a href=""https://www.eurogamer.net/playstation-digital-games-30-day-online-drm"">Read more</a></p>",2026-05-01T01:52:02.270920
"In the wake of $100 GTA 6 rumours, Take-Two still won't give an actual price, but says ""our job is to charge way, way, way less of the value""","<img src=""https://assetsio.gnwcdn.com/GTA-6's-Jason-aims-a-gun-with-a-bandana-scarf-covering-his-lower-face-and-yellow-rimmed-sunglasses-over-his-eyes.jpg?width=690&quality=85&format=jpg&auto=webp"" /> <p><a href=""https://www.eurogamer.net/gta-6-everything-we-know-so-far-9357"">Grand Theft Auto 6</a> publisher Take-Two recently discussed the upcoming game's price, and while it won't give us that all important figure, it stressed that its ""job is to charge way, way, way less of the value delivery"".</p> <p><a href=""https://www.eurogamer.net/gta-6-rockstar-take-two-price-expectation-player-experience"">Read more</a></p>",2026-05-01T01:52:02.270920
Mega Mewtwo's Pokémon Go debut finally announced and Go Fest Global is free for all players,"<img src=""https://assetsio.gnwcdn.com/Pokemon-Go-Mega-Mewtwo-Debut-Header.jpg?width=690&quality=85&format=jpg&auto=webp"" /> <p>Mega Mewtwo X and Y will debut in <a href=""https://www.eurogamer.net/games/pokemon-go"">Pok&eacute;mon Go</a> during Go Fest 2026, the game's annual celebration. Developer Scopey has also confirmed Go Fest 2026: Global will be free for all players this year on 11th and 12th July. This includes access to the Special Research quest and coveted increased shiny Pok&eacute;mon spawns bonus.</p> <p><a href=""https://www.eurogamer.net/mega-mewtwo-debut-announced-go-fest-global-free-pokemon-go"">Read more</a></p>",2026-05-01T01:52:02.270920
"Mortal Kombat 2 first reactions call it ""the movie we should've gotten the first time""","<img src=""https://assetsio.gnwcdn.com/Mortal-Kombat-2_Baraka.jpg?width=690&quality=85&format=jpg&auto=webp"" /> <p>The <a href=""https://www.eurogamer.net/games/mortal-kombat-2"">Mortal Kombat 2</a> movie is almost ready to fill cinemas with over-the-top fights and gallons of blood, and the good news - following its predecessor's lukewarm critical reception - is that first reactions are looking positive.</p> <p><a href=""https://www.eurogamer.net/first-mortal-kombat-2-movie-reactions"">Read more</a></p>",2026-05-01T01:52:02.270920
"Call of Duty fans debate upcoming movie director Peter Berg's years-old comments, where he once called games ""pathetic"" and gamers ""weak""","<img src=""https://assetsio.gnwcdn.com/Call-of-Duty-screenshot-showing-a-male-in-body-armour-dual-weilding-two-guns-as-he-fires-them-both.jpg?width=690&quality=85&format=jpg&auto=webp"" /> <p>A 2013 interview with Call of Duty film director Peter Berg, in which he called those who played war games such as Call of Duty ""weak"" and ""pathetic"", has recently resurfaced, leading to plenty of discussion amongst the series' fans.</p> <p><a href=""https://www.eurogamer.net/call-of-duty-film-peter-berg-war-game-pathetic-weak-comments"">Read more</a></p>",2026-05-01T01:52:02.270920
"As rumours of a live-action Metroid movie swirl, Nintendo and Illumination set a mysterious new animated ""event film"" for April 2028","<img src=""https://assetsio.gnwcdn.com/Samus-Aran-x-Super-Mario-Galaxy-Movie-blue-background.jpg?width=690&quality=85&format=jpg&auto=webp"" /> <p>The <a href=""https://www.eurogamer.net/super-mario-galaxy-movie-highest-grossing-film-of-2026"">Super Mario Galaxy Movie has been a massive success</a> in spite of its so-so critical reception, and the <a href=""https://www.eurogamer.net/legend-of-zelda-live-action-film-link-outfit"">live-action Legend of Zelda adaptation</a> is making good progress. But if a succession of recent reports are to be believed, there's a busy few years ahead in the world of Nintendo films, with Universal and Illumination seemingly set to release <a href=""https://bsky.app/profile/wario64.bsky.social/post/3mkkrbwriz223"">a new animated movie in 2028</a>. That news comes amid suggestions a previously reported live-action Metroid might soon get the green light.</p> <p><a href=""https://www.eurogamer.net/metroid-movie-rights-rumours-new-illumination-project-2028-date"">Read more</a></p>",2026-05-01T01:52:02.270920
Dark fantasy vampire RPG The Blood of Dawnwalker gets a release date and an autumn showdown with Fable,"<img src=""https://assetsio.gnwcdn.com/blood-of-the-dawnwalker_qF6jbW1.jpg?width=690&quality=85&format=jpg&auto=webp"" /> <p>Dark fantasy vampire role-playing game The Blood of Dawnwalker releases on 3rd September 2026, publisher Bandai Namco and developer Rebel Wolves have announced. The game previously had a vague ""2026"" window but now it's got an exact date.</p> <p><a href=""https://www.eurogamer.net/blood-of-dawnwalker-release-date"">Read more</a></p>",2026-05-01T01:52:02.270920
"""Companies should use AI,"" says The Blood of Dawnwalker director, but there's an important caveat and a declaration that nothing in this dark fantasy vampire RPG was created using it","<img src=""https://assetsio.gnwcdn.com/blood-of-dawnwalker-vampire-2.jpg?width=690&quality=85&format=jpg&auto=webp"" /> <p>There's been some concern surrounding dark fantasy vampire role-playing game The Blood of Dawnwalker and how AI tools were used during its development. Rebel Wolves studio co-founder Konrad Tomsazkiewicz, known for having directed <a href=""https://www.eurogamer.net/games/the-witcher-3-wild-hunt"">The Witcher 3: Wild Hunt</a>, previously said gen-AI tools were used during development, but to test dialogue before it was finalised and actors were employed to record it. You might remember that <a href=""https://www.eurogamer.net/i-dont-feel-that-games-created-with-only-ai-will-have-soul-the-blood-of-dawnwalker-director-doesnt-think-ai-can-replace-human-creativity-but-the-studio-is-using-it-in-reasonable-ways"">I talked with Tomaszkiewicz about Blood of the Dawnwalker and AI use late last year.</a></p> <p><a href=""https://www.eurogamer.net/the-blood-of-dawnwalker-ai"">Read more</a></p>",2026-05-01T01:52:02.270920
I've seen 90 minutes more of The Blood of Dawnwalker and I'm excited - could this be 2026's breakout RPG?,"<img src=""https://assetsio.gnwcdn.com/blood-of-dawnwalker-header-art.jpg?width=690&quality=85&format=jpg&auto=webp"" /> <p>What struck me most about the 90-minute presentation of The Blood of Dawnwalker I watched recently, at developer Rebel Wolves' studio in Poland, is how confident this dark fantasy role-playing game is. That's despite being a debut, and amplified by how boldly it embraces difference - and how sophisticated it is in its approach.</p> <p><a href=""https://www.eurogamer.net/the-blood-of-dawnwalker-preview-excited-breakout-rpg"">Read more</a></p>",2026-05-01T01:52:02.270920
"""It'll be something that makes you go Whoo-hoo!!"" - Resident Evil Requiem director says ""sharpen your tomahawks"" as new minigame details emerge","<img src=""https://assetsio.gnwcdn.com/A-chainsaw-weilding-zombie-advances-on-Leon-in-Resident-Evil-Requiem.jpg?width=690&quality=85&format=jpg&auto=webp"" /> <p>Resident Evil Requiem's upcoming minigame is in the ""final stages"" of development, and will be based on the main game's combat, Requiem's director has teased. However, you'll need to have finished the main story to give it a go.</p> <p><a href=""https://www.eurogamer.net/resident-evil-requiem-minigame-dlc-combat"">Read more</a></p>",2026-05-01T01:52:02.270920
"""This isn't true"" - mixed reports emerge following Marvel's Spider-Man 2 actor's claims a Venom spin-off game was in the works prior to Tony Todd's death","<img src=""https://assetsio.gnwcdn.com/Venom-in-Marvel's-Spider-Man-2.jpg?width=690&quality=85&format=jpg&auto=webp"" /> <p>Insomniac reportedly once had an idea for Venom-centric DLC for <a href=""https://www.eurogamer.net/spider-man-2-walkthrough-9356"">Marvel's Spider-Man 2</a> as well as a spin-off game starring the aggressive symbiote, but it's claimed these plans changed following the death of actor Tony Todd.</p> <p><a href=""https://www.eurogamer.net/marvel-spider-man-2-venom-dlc-spin-off-cancelled-rumour"">Read more</a></p>",2026-05-01T01:52:02.270920
Think fast: Games Done Quick is coming to Europe with a special three-day programme at Gamescom 2026,"<img src=""https://assetsio.gnwcdn.com/gdq-gamescom.jpg?width=690&quality=85&format=jpg&auto=webp"" /> <p>There's always a lot to look forward to at <a href=""https://www.gamescom.global/en"">Gamescom</a>, but this year, the German games show has an extra surprise packed into its already stuffed programme: a special three-day Games Done Quick (GDQ) speedrunning event is taking place at the trade show between 28th and 30th August, 2026. Notably, this is GDQ's first-ever event hosted in Europe.</p> <p><a href=""https://www.eurogamer.net/games-done-quick-gamescom-2026"">Read more</a></p>",2026-05-01T01:52:02.270920
"Xbox boss Asha Sharma hints memory costs ""will impact"" pricing and availability of next-gen Project Helix console","<img src=""https://assetsio.gnwcdn.com/xbox-side-by-side.jpg?width=690&quality=85&format=jpg&auto=webp"" /> <p>Following last week's flurry of Xbox news - which included word that new Xbox boss Asha Sharma <a href=""https://www.eurogamer.net/xbox-boss-asha-sharma-hasnt-decided-exclusive-games"">hasn't yet ruled out the return of exclusive games</a> - Sharma has been discussing the ongoing <a href=""https://www.eurogamer.net/steam-controller-release-date"">RAM crisis</a>, acknowledging that memory shortages could lead to a price bump and limited stock where its next-gen console, Project Helix, is concerned.</p> <p><a href=""https://www.eurogamer.net/xbox-boss-on-project-helix-pricing-and-availability"">Read more</a></p>",2026-05-01T01:52:02.270920
"""The people in control would be mad not to consider him"" - 007 First Light actor is so ""fantastic"" as Bond, he should play him in the next movie, says co-star","<img src=""https://assetsio.gnwcdn.com/James-Bond-gun-barrel-opening-with-an-image-of-Bond-in-007-First-Light-wearing-a-black-DJ-overlaid-on-top.jpg?width=690&quality=85&format=jpg&auto=webp"" /> <p>While we still have to wait and see for ourselves just exactly how Patrick Gibson does as James Bond in <a href=""https://www.eurogamer.net/companies/io-interactive"">IO Interactive</a>'s upcoming origin game 007 First Light, one person already believes he is good enough to take the lead on the franchise's next live-action movie.</p> <p><a href=""https://www.eurogamer.net/007-first-light-patrick-gibson-james-bond-amazon-film-reboot"">Read more</a></p>",2026-05-01T01:52:02.270920
"Crimson Desert is so successful that the studio that makes it has reportedly given each of its employees a $3,400 bonus","<img src=""https://assetsio.gnwcdn.com/crimson-desert-bonus.jpg?width=690&quality=85&format=jpg&auto=webp"" /> <p>Like it or loathe it, you can't argue with the success of Crimson Desert. Per a new report, Pearl Abyss' latest action-RPG has sold so well that the developer and publisher has reportedly given every employee a bonus that equates to about $3,400 USD.</p> <p><a href=""https://www.eurogamer.net/crimson-desert-success-bonus-employee-package"">Read more</a></p>",2026-05-01T01:52:02.270920
"Arc Raiders' Riven Tides update goes live today with a new map, ""a totally unique fight"", and better PSSR for PS5 Pro","<img src=""https://assetsio.gnwcdn.com/ARC-Raiders_Turbine-Arc.jpg?width=690&quality=85&format=jpg&auto=webp"" /> <p><a href=""https://www.eurogamer.net/marathon-review"">Marathon</a>'s arrival in March hasn't made much of an impact on <a href=""https://www.eurogamer.net/games/arc-raiders"">Arc Raiders</a>' player numbers, but the player sentiment, <a href=""https://store.steampowered.com/app/1808500/ARC_Raiders/"">at least on Steam</a>, isn't exactly where it was a few months ago. That hasn't substantially altered Embark Studios' early 2026 roadmap, however, which culminates with today's Riven Tides update.</p> <p><a href=""https://www.eurogamer.net/arc-raiders-riven-tides-update-launch-details"">Read more</a></p>",2026-05-01T01:52:02.270920
"Resident Evil's Leon Kennedy is named after a milk-guzzling hitman, Hideki Kamiya casually confirms","<img src=""https://assetsio.gnwcdn.com/Leon-Kennedy-from-the-Resident-Evil-series-looking-over-his-shoulder.jpg?width=690&quality=85&format=jpg&auto=webp"" /> <p>Back in 1994, Luc Besson released a movie that not only introduced us to Natalie Portman in her feature film debut, but also - it turns out - inspired the name for one of gaming's most iconic characters: Leon Kennedy. That film was L&eacute;on: The Professional, and saw actor Jean Reno in the titular role of a milk-loving hitman who takes 12 year old Mathilda (played by Portman) under his wing.</p> <p><a href=""https://www.eurogamer.net/resident-evil-leon-kennedy-name-hideki-kamiya"">Read more</a></p>",2026-05-01T01:52:02.270920
"Wuchang: Fallen Feathers might have a future, with western publisher swooping in to buy rights after its dev was shut down","<img src=""https://assetsio.gnwcdn.com/wuchang-fallen-feathers-commander-honglan.jpg?width=690&quality=85&format=jpg&auto=webp"" /> <p><a href=""https://www.eurogamer.net/games/wuchang-fallen-feathers"">Wuchang: Fallen Feathers</a>, the popular Chinese Soulslike released in July 2025, has had its intellectual property rights fully acquired by Italian games publisher/developer Digital Bros for roughly &euro;4m.</p> <p><a href=""https://www.eurogamer.net/wuchang-fallen-feathers-rights-digital-bros"">Read more</a></p>",2026-05-01T01:52:02.270920
"Final Fantasy 7 Rebirth gets a surprise demo today, complete with progression carry-over on Xbox, Switch 2 and PC","<img src=""https://assetsio.gnwcdn.com/FinalFantasyVIIRebirth_01.jpg?width=690&quality=85&format=jpg&auto=webp"" /> <p>Surprise! From today, 28th April, you can download a free demo for <a href=""https://www.eurogamer.net/companies/square-enix"">Square Enix</a>'s <a href=""https://www.eurogamer.net/final-fantasy-7-rebirth-guides-tips-tricks-9403"">Final Fantasy 7 Rebirth</a> on both the <a href=""https://www.eurogamer.net/platforms/switch-2"">Nintendo Switch 2</a> and Xbox Series X/S. Any progress made during the demo will carry over when <a href=""https://www.eurogamer.net/final-fantasy-7-remake-gets-switch-2-release-date"">the full game launches for Switch 2 and Xbox on 3rd June</a>. As an added bonus, if you have demo save data on your device when the full game launches, you will be able to claim a 'kupo charm' (for you Moogle fans) and 'survival set' featuring bonus healing items that'll be a boon during the opening hours of the game. The demo weighs in at 45GB on Nintendo Switch 2 and 91GB on Xbox Series X/S.</p> <p><a href=""https://www.eurogamer.net/final-fantasy-vii-remake-demo-switch-2-xbox-pc-save-data"">Read more</a></p>",2026-05-01T01:52:02.270920
"Valve is ""hard at work"" on Steam Deck 2, but the company's idea of ""next-gen"" performance isn't possible yet","<img src=""https://assetsio.gnwcdn.com/overview_oled.jpg?width=690&quality=85&format=jpg&auto=webp"" /> <p>While <a href=""https://www.eurogamer.net/valve-admits-its-steam-machine-and-steam-frame-will-be-delayed-due-to-ram-and-storage-price-surges"">the ongoing RAM crisis</a> is preventing the Steam Machine and Frame's arrival, <a href=""https://www.eurogamer.net/steam-controller-release-date"">the new Steam Controller is launching next week</a>, and we think <a href=""https://www.eurogamer.net/steam-controller-review"">it's pretty sweet, albeit a bit niche still</a>. What about a potential Steam Deck 2 though? Is Valve working on that already?</p> <p><a href=""https://www.eurogamer.net/steam-deck-2-comments-next-gen-performance"">Read more</a></p>",2026-05-01T01:52:02.270920
"Even with some rough edges, Final Fantasy 7 Rebirth on Switch 2 still manages to feel like a miracle","<img src=""https://assetsio.gnwcdn.com/ff7r-s2.jpg?width=690&quality=85&format=jpg&auto=webp"" /> <p>Look, let's be honest, <a href=""https://www.eurogamer.net/companies/square-enix"">Square Enix</a> is a hard company to get behind right now. <a href=""https://www.eurogamer.net/eidos-montreal-march-2026-layoffs-caused-by-cancellation-of-massive-original-open-world-game"">Between layoffs</a>, <a href=""https://www.gamesindustry.biz/square-enix-announces-mass-layoffs-as-restructuring-plan-pulls-development-from-overseas"">peculiar restructuring plans</a>, and <a href=""https://www.eurogamer.net/after-chasing-nfts-and-the-metaverse-square-enix-wants-generative-ai-to-do-70-of-its-qa-by-2027"">a penchant for chasing the hottest controversial flavour of the month</a>, there are many reasons to be sceptical of one of Japan's biggest publishers in 2026. But, for all the dubious business moves and articles about <a href=""https://www.eurogamer.net/topics/nfts"">NFTs</a>, there exists a publisher that looks like the Square Enix we remember from generations past; one that was keen to push technical limitations, to iterate on the boundaries of what video game RPGs look like, and that wanted to be at the bleeding edge of our bizarre little industry.</p> <p><a href=""https://www.eurogamer.net/final-fantasy-7-rebirth-switch-2-impressions"">Read more</a></p>",2026-05-01T01:52:02.270920
"Valve's Steam Machine might be delayed thanks to the RAM crisis, but its brand-new £85 Steam Controller is going it alone and finally has a release date","<img src=""https://assetsio.gnwcdn.com/steam-controller-header_tnTp790.jpg?width=690&quality=85&format=jpg&auto=webp"" /> <p>Six months after Valve tantalisingly unveiled its future hardware plans, one of them has successfully escaped the vortex caused by the mounting RAM crisis. Valve has announced its new Steam Controller - the successor to its long-discontinued 2015 effort - goes on sale 4th May.</p> <p><a href=""https://www.eurogamer.net/steam-controller-release-date"">Read more</a></p>",2026-05-01T01:52:02.270920
"After a week testing Valve's new Steam Controller, it's better in almost every way - but still a bit of a niche proposition","<img src=""https://assetsio.gnwcdn.com/steam-controller-header.jpg?width=690&quality=85&format=jpg&auto=webp"" /> <p>Perhaps the greatest compliment I can give Valve's new Steam Controller is that in the week or so I've been using it, I haven't really thought about it much at all. With its heavily Steam-Deck-inspired design, it improves on the original Steam Controller in almost every way - and it's certainly vastly more convincing as an everyday controller - but the things it does best are specific enough that, even with those upgrades, it remains a bit of a niche proposition.</p> <p><a href=""https://www.eurogamer.net/steam-controller-review"">Read more</a></p>",2026-05-01T01:52:02.270920
You'll reportedly be able to enjoy The Super Mario Galaxy Movie from home next week,"<img src=""https://assetsio.gnwcdn.com/Yoshi---a-green-dinosaur-like-creature---uses-his-tongue-to-stop-Kamek---a-yellow-skinned-wizard-like-character---in-The-Super-Mario-Galaxy-Movie.jpg?width=690&quality=85&format=jpg&auto=webp"" /> <p>If you wanted to check out <a href=""https://www.eurogamer.net/movies/the-super-mario-galaxy-movie-2026"">The Super Mario Galaxy Movie</a> for yourself, but have no interest in traipsing to the cinema to watch it and instead decided to hold out for its home debut, good news. A new report claims you will be able to do just that from next week.</p> <p><a href=""https://www.eurogamer.net/super-mario-galaxy-movie-digital-home-release-date-rumour"">Read more</a></p>",2026-05-01T01:52:02.270920
PowerWash Simulator 2 is getting a Star Wars level pack focused on original trilogy locations this summer,"<img src=""https://assetsio.gnwcdn.com/PowerWash-Simulator-2-x-Star-Wars.png?width=690&quality=85&format=jpg&auto=webp"" /> <p><a href=""https://www.eurogamer.net/games/powerwash-simulator-2-1"">PowerWash Simulator 2</a> didn't exactly reinvent the original game's formula, but sometimes more of the same in a slightly fancier package is all you really need. Now, following this month's <a href=""https://www.ign.com/videos/powerwash-simulator-2-official-adventure-time-pack-launch-trailer"">Adventure Time DLC</a>, cleaners are being sent to a galaxy far, far away...</p> <p><a href=""https://www.eurogamer.net/powerwash-simulator-2-star-wars-dlc-revealed"">Read more</a></p>",2026-05-01T01:52:02.270920
"Mass Effect: Andromeda actor says the game ""was done dirty"" by EA and ""a very toxic atmosphere"" online","<img src=""https://assetsio.gnwcdn.com/ME-Andromeda_desert-planet.jpg?width=690&quality=85&format=jpg&auto=webp"" /> <p>It's been over nine years since <a href=""https://www.eurogamer.net/mass-effect-andromeda"">Mass Effect: Andromeda</a> tried to kickstart a new era of BioWare's original sci-fi RPG universe, an experiment that ended with pretty poor results. Now, we're eagerly awaiting <a href=""https://www.ign.com/articles/bioware-explains-mass-effect-5-silence"">news on the mainline follow-up</a> revealed in late 2020 and <a href=""https://www.eurogamer.net/amazon-mass-effect-tv-show-wasnt-ordered-to-rewrite-scripts"">Amazon's TV show</a>.</p> <p><a href=""https://www.eurogamer.net/mass-effect-andromeda-actor-reflects-on-poor-reception"">Read more</a></p>",2026-05-01T01:52:02.270920
Hong Kong-set 'bodycam FPS' Better Than Dead gets a release date,"<img src=""https://assetsio.gnwcdn.com/better-than-dead-screenshot.jpg?width=690&quality=85&format=jpg&auto=webp"" /> <p>A release date for body cam FPS Better Than Dead has been announced, as well as a new gameplay trailer packed with Hong Kong cinema-style action.
</p> <p><a href=""https://www.eurogamer.net/better-than-dead-release-date"">Read more</a></p>",2026-05-01T01:52:02.270920
"The Last of Us Part 2's most shocking death was ""controversial internally, too"", former Naughty Dog developer admits","<img src=""https://assetsio.gnwcdn.com/Abby-from-The-Last-of-Us-Part-2-emerges-from-some-water.jpg?width=690&quality=85&format=jpg&auto=webp"" /> <p>There is one death in particular in The Last of Us Part 2 that many are still struggling to come to terms with, six years on from the game's release. And, it turns out that this death was not only controversial for those of us in The Last of Us' gaming community. Even many developers internally at <a href=""https://www.eurogamer.net/companies/naughty-dog"">Naughty Dog</a> - the studio that made the game - questioned this decision.</p> <p><a href=""https://www.eurogamer.net/the-last-of-us-part-2-death-naughty-dog-controversial"">Read more</a></p>",2026-05-01T01:52:02.270920
