title,text
The Witcher 3’s Incredible Sales Streak Still Hasn’t Slowed Down,"The Witcher 3: Wild Hunt hasn't just been one of CD Projekt's most critically acclaimed games in the years since it was first released, but also a consistent best-seller. The company has revealed that the game has reached a new sales milestone, selling 65 million units globally. To put this into perspective, that's another 5 million sales in just one year. While this figure is impressive, it won't budge The Witcher 3 out of its current eighth-place position on the list of best-selling video games. Terraria is still in seventh place with 70 million lifetime sales to date, and it's probably a safe bet that Geralt's adventure won't be unseating Tetris (520 million lifetime sales) or Grand Theft Auto V (230 million lifetime sales). Nevertheless, CDPR says that the game has built a massive network of players since its 2015 launch, and it expects to see more people return to the game when it releases the new expansion-- don't call it DLC -- Songs of the Past in 2027. Co-developed with Fool's Theory, the new expansion will continue the tale of Geralt. ""The return of Geralt after more than one decade will be an excellent adventure, and a trip down memory lane, before we pass the baton to Ciri in the upcoming The Witcher 4,"" CDPR Joint-CEO Michał Nowakowski said in a statement . The Witcher 3 built up those sales over a long period of time, with re-releases on multiple platforms and big discounts, not to mention the influence of The Witcher on Netflix. The game is usually available at a bargain price on sites like GOG whenever there's an annual sale, and with all of those factors added up, it's no wonder that it reached such high sales numbers. CDPR also provided an updated look at how its development teams are split across several projects. Development teams have increased slightly for games like The Witcher 4 and Cyberpunk 2 , with the only exceptions being Project Hadar's team shrinking by two people, and the unit dedicated to ""other"" projects at CDPR hasn't changed at all. As of April 30, 2026, here's what those numbers look like: Several CDPR teams have grown. The Witcher 4: 513 people Cyberpunk 2: 163 people Project Sirius (The Witcher multiplayer game): 83 people Project Hadar (original IP): 24 people Shared services: 173 people Other: 19 people Several other projects are also in development currently. The first Witcher game is also getting a remake, and the first look at the second season of the Cyberpunk: Edgerunners anime series will be shown off at Anime Expo 2026 on July 3. Best-Selling Games Of Each Year Since 1998 In The US View Images"
Call Of Duty’s Prestige System Is Getting A Big Change In Modern Warfare 4,"Activision officially revealed Modern Warfare 4 today, and we learned several new details about what to expect for a new year of Call of Duty, including a promising new change for how players progress in multiplayer. Modern Warfare 4 arrives on October 23, featuring campaign, multiplayer, and the return of DMZ. While we don't have the full details of how progression will work, or if it will be available across all modes, we did learn that Modern Warfare 4 will give players the choice of two separate progression paths: classic or regular. Call of Duty's classic prestige system is a popular choice in the community, which delivers the traditional reset experience, relocking a player's create-a-class progression in exchange for increased XP earn rates and access to exclusive rewards. However, not everyone wants to deal with the hassle of a reset and lose all their progress. The option to choose Modern Warfare 4's ""regular"" path will still allow players to restart from level one without resetting their create-a-class content and losing everything. This path gives a flexible way to reward continued progression and offers its own set of prestige rewards and progression milestones. Additionally, Modern Warfare 4's big reveal confirms there will be open-beta early access prior to release. It's also worth noting that Call of Duty is leaving the old console generation behind, and Warzone will no longer be playable on PS4 and Xbox One after Season 1 of Modern Warfare 4. The full version of Call of Duty: Modern Warfare 4 will be available for Xbox Series X|S, PlayStation 5, Switch 2, and PC. Multiplayer launches with 12 core multiplayer maps for standard-size matches, and some additional modes are planned for 3v3 and 10v10 experiences as well. The campaign includes a mix of legacy characters like Captain Price and Ghost alongside brand-new characters fighting in a Korean war."
Call of Duty: Modern Warfare 4 Fixes One Of Black Ops 7’s Biggest Problems,"One of the big gripes around last year's Call of Duty: Black Ops 7 was its always-online requirement for its campaign. Progress was often tedious--especially if you had a spotty online connection--and you couldn't even pause the game without risking death and a checkpoint restart. Fortunately, Call of Duty: Modern Warfare 4 looks set to rectify that point of content, as its single-player campaign will be playable offline. As confirmed by Insider Gaming , players will have the option to untether themselves from the internet if they want to play through the single-player campaign, which is particularly good news for anyone looking to experience the game through a mobile gaming PC like the Steam Deck or the Nintendo Switch 2 edition of Modern Warfare 4. Maintaining a stable connection on those platforms isn't always possible, so the removal of the always-online requirement means that users will have one less hurdle to worry about. Call of Duty: Black Ops 7 players can attest to just how annoying this feature was. Originally, the idea for the game's campaign was to promote co-op play over solo missions, but this also meant that players working through a corridor of bullet-sponge enemies could be booted back to the previous checkpoint if their internet connection dropped. Open channels also meant that fellow players could talk over cutscenes, an issue that wasn't too bad if you were playing with friends. But if matchmaking paired you with someone unaware of just how bad their background noise was? It was absolute hell on the ears. https://www.youtube.com/watch?v=Aj1RQW7phc0&pp=ygUIZ2FtZXNwb3Q%3D Call of Duty: Modern Warfare 4 launches on October 23 for PC, PS5, Xbox Series X|S, and Switch 2 . Developer Infinity Ward has described the campaign as a dark and dangerous tale, partly told from the perspective of a South Korean soldier as his country faces a full-scale invasion by North Korea. The game will also feature Call of Duty's signature action, without you needing to worry about a car chase being derailed by a bad internet connection. Like previous years, an open beta for the game will kick off ahead of its launch--with more details on that to be revealed soon--and Modern Warfare 2's DMZ mode will be making a return. Best Call Of Duty Games, Ranked View Images"
Call Of Duty: Warzone Is Dying On PS4 And Xbox One,"As part of the announcement of Call of Duty: Modern Warfare 4 today, Activision also confirmed that Call of Duty: Warzone is going away on legacy platforms. Starting with MW4 Season 1 (which itself is expected ""shortly"" after the game releases on October 23), Warzone will no longer be playable on PS4 and Xbox One. The game itself will be delisted for new downloads on those platforms on June 4, though anyone who still has the game can keep playing. Items like Call of Duty Points bundles will be removed on PS4 and Xbox One as well. Then on June 25, the in-game store for Warzone on PS4 and Xbox One will be removed. Players will still be able to progress through the free Battle Pass, however. People playing Warzone on PS4 and Xbox One who hold a Call of Duty Points balance when the game closes aren't completely out of luck. That's because content purchased with Call of Duty Points is connected to your Activision account, so as long as you're playing with the same account, your currency balance and purchased content should still be there. You can visit Activision's support page to get more specifics about this. Activision also announced that when MW4 Season 1 launches, content from that game will begin to appear in Warzone. Modern Warfare 4 launches on October 23 for PlayStation 5, Xbox Series X|S, PC, and Switch 2. An open beta is coming ahead of launch, and you can get in early ."
"Call Of Duty: Modern Warfare 4 Open Beta Confirmed, And You Can Get In Early","Call of Duty: Modern Warfare 4 was officially announced today, and it'll be releasing in October. Prior to its full launch, however, the game will have an open beta, and as per usual, you're going to have an opportunity to get in early. The open beta was confirmed via a post on the official Call of Duty blog , but Activision went short of saying exactly when the beta will be. In the past, beta tests have been held several weeks before launch, which would put the window here at sometime in September or very early October. https://www.youtube.com/watch?v=jLbst85USN8 If you want to play even earlier than that date, you can preorder Modern Warfare 4 for open-beta early access. The open beta will run for at least two days, and because Modern Warfare 4 is not going to be on Game Pass at launch , preordering it is likely necessary to play early. The full version of Call of Duty: Modern Warfare 4 launches on October 23 for Xbox Series X|S, PlayStation 5, Switch 2 , and PC. Multiplayer will include a number of new and updated modes , including a 10-on-10 version of Gun Game. The campaign , meanwhile, will feature of a mix of legacy characters like Captain Price alongside low-level ""grunts"" in a renewed Korean War."
"Modern Warfare 4 Release Date, Open Beta, Story, Trailer, And Everything Else We Know","Activision has officially announced Call of Duty: Modern Warfare 4, which is being led by series creator Infinity Ward. The game is set for release this October, and Activision is surely hoping the game performs better than 2025’s Black Ops 7--that game had the series’ worst sales-year ranking since 2008. In this post, we’re rounding up everything we’ve heard so far. You can also read GameSpot's hands-on preview of MW4. When will Modern Warfare 4 be released? Modern Warfare 4 releases on October 23, 2026. That's about a month before GTA 6 launches on November 19. Who is making Modern Warfare 4? Infinity Ward is leading the development of Modern Warfare 4. The studio created the Call of Duty sub-brand and is working alongside a number of other teams on it. In alphabetical order, these include Activision Central Design, Activision Central Technology, Activision QA, Activision Shanghai, Beenox, Demonware, High Moon Studios, Raven Software, Sledgehammer Games, and Treyarch. MW4 trailers You can check out the announcement trailer for MW4 below. https://www.youtube.com/watch?v=jLbst85USN8 MW4 platforms Modern Warfare 4 is coming to all the major modern platforms, including PlayStation 5, Xbox Series X|S, PC, and Switch 2. The Nintendo release is notable given that Call of Duty has been absent from Nintendo's platforms since 2013's Wii U version of Call of Duty: Ghosts. Microsoft pledged to bring Call of Duty to Switch as part of its appeal to regulators to approve the company's blockbuster buyout of Activision, and now it's finally happening. The Switch 2 edition is a native version, Activision said. Additionally, the company said the PC version of MW4 is being developed by Beenox and that MW4 in general has been ""built with the PC community in mind."" To that end, Activision said PC players can expect ""more ways to tune performance, visual fidelity, responsiveness, and customization."" Modern Warfare 4 won’t be on Game Pass All of Microsoft’s first-party new releases come to Xbox Game Pass Ultimate on day one–or at least that used to be the case. In April this year, Microsoft announced drastic changes to Game Pass that included a price decrease and the announcement that new Call of Duty games will no longer launch into Game Pass Ultimate or PC Game Pass. They will, however, arrive on Game Pass after about a year. What this means for MW4 is that anyone hoping to play it as part of their Game Pass subscription is out of luck and will need to pay for it outright. Modern Warfare 4 preorders Preorders for Modern Warfare 4 are not yet open, so there is no word yet on the game's various editions and their price points. Modern Warfare 4 story, setting, and characters As rumored, Modern Warfare 4 centers its action on the Korea peninsula, with players taking on the role of Private Park. He is a young Korean ""grunt"" soldier who is going to battle for the first time. Park and his team are trying to overcome impossible odds in what Activision described as a ""zero-to-hero"" journey. One of the most famous members of Modern Warfare's Task Force 141, Captain Price, returns for Modern Warfare 4, but he's no longer part of the team. While the game is centered on Korea, Modern Warfare 4 will put players into battles in various places around the world, including New York, Paris, and Mumbai. What's new for multiplayer? Multiplayer is Call of Duty's bread and butter, and of course it's returning for Modern Warfare 4. Activision said players can expect multiplayer that feels ""grounded,"" which would be in keeping with tradition for the Modern Warfare series. This may be welcome news to those who do not enjoy the futuristic setup in the recent Black Ops games where players can run on walls and use cloaking devices, among other things. Activision is promising the ""most authentic"" Modern Warfare gunplay in Modern Warfare 4, with updates coming for bullet trajectory, weapon motion, Operator stance, camera, audio, FOV, and target visibility. Additionally, there is no more weapon bloom for hipfire. In terms of maps, there will be 12 all-new core 6v6 maps at launch, and that's notable because some previous Call of Duty games launched with recycled maps from previous games. Beyond the core modes, MW4 has dedicated Gunfight maps and Big War maps featuring vehicles and large-scale battles. There is also a new ""Gunny"" system for weapon customization, along with new ""Apex"" attachments that players unlock when they reach max weapon progression. Open beta An open beta for MW4 was confirmed by Activision, but there is no word yet on any specifics like what it will include or when it will begin. The return of DMZ DMZ was a new mode for 2022’s Modern Warfare II, and while some people enjoyed and embraced it, others said it felt like a half-baked idea. The large-scale extraction-based mode had players amassing contracts, taking on missions, and fighting enemies in a variety of settings. As rumored, DMZ is returning in Modern Warfare 4, but that's the extent of what we know so far. Presumably more details about DMZ will be divulged later on. Not expected to outsell GTA 6 The Call of Duty franchise is a juggernaut, but Call of Duty games are not known to outsell new releases from Rockstar Games, and that trend is expected to continue this year with MW4. For example, GTA 5 was the No. 1 best-selling game in the US in 2013 , with Call of Duty: Ghosts ranking No. 2. In 2018, when Rockstar released Red Dead Redemption II, the open-world Western outsold Call of Duty: Black Ops 4 in the US. It doesn’t take a Rockstar release to beat Call of Duty any more, though, as 2023 saw Hogwarts Legacy outsell Modern Warfare 3 and 2025 had Battlefield 6 as the No. 1 game , with Black Ops 7 all the way down to No. 5 for the year. GTA 6 is coming to market with a seemingly unprecedented level of hype behind it, and it’s unthinkable that it wouldn’t be the No. 1 game of 2026. How Modern Warfare 4 could use AI Unlike other studios that either do not discuss AI or reject it outright, Activision has freely acknowledged that it uses generative AI to create some content in Call of Duty games. For Black Ops 7, the developer said they also used AI technologies , but also stressed, “Everything that goes into the game is touched by the team a hundred percent.” We do not know anything for certain yet about Modern Warfare 4 and AI, however. Keep checking back with GameSpot for more on Call of Duty 2026 as more information becomes available."
