title,text
Former BioWare Writer Says EA Always Favored Mass Effect Over Dragon Age,"Following the disappointing sales of Dragon Age: The Veilguard , it's looking like BioWare's fantasy IP won't be making a comeback anytime soon. Former Dragon Age lead writer David Gaider believes that the series may be dead, and the game's poor commercial performance-- according to EA's expectations --was likely the final nail in its coffin. ""Throughout the entire time I was there, we were always one breath away from the project being shelved,"" Gaider said to PC Gamer . ""The thing that happened is that we kept releasing games, and it would sell much better than they thought it should, and it kept surprising them."" Gaider added that Mass Effect was treated as EA's favorite child , even if they didn't sell as well as early Dragon Age games did. The writer added that Mass Effect was seen as a ""slick, modern RPG"" that was easy to sell, whereas Dragon Age was perceived to be an ""old-fashioned"" story-focused RPG, and any success it experienced was deemed to be a ""fluke"" by EA. https://www.youtube.com/watch?v=Z-j1zzzKWpo But would Gaider ever consider returning to the franchise? Absolutely, he said, so long as he was handed the keys to the IP and it wasn't produced under EA. ""I think that'd be an interesting thing to do. To go back to the basics of what made Dragon Age appeal to so many people in the first place. And go somewhere dark and dangerous, and do things that will make people upset. I think that's what I would want to do with it,"" Gaider concluded. In the aftermath of Dragon Age: The Veilguard, EA laid off a lot of BioWare's staff , leaving behind a ""core"" team to work on the next Mass Effect game . Other related developments include EA announcing last year that it will go private, as part of a $55 billion leveraged buyout funded by Saudi Arabia's Public Investment Fund, Jared Kushner's Affinity Partners, and private equity company Silver Lake. Multiple analysts believe that EA might sell off some of its studios so that it can service its $20 billion debt, and BioWare could be a prime candidate ."
"Call Of Duty: Black Ops 1 And 2 Ports Are Out Now On PS5, But DLC Costs Extra","The ports of Call of Duty: Black Ops (2010) and Black Ops 2 (2012) are available now. The ports, which were confirmed in June, are developed by Iron Galaxy in conjunction with Activision. As announced previously , these are not remasters or remakes--if you enjoyed the games in their original states, that's what you're getting here. The games cost $40, but PlayStation Plus members can get each for $20 through August 6. There is no bundle that puts them together. Black Ops 1 and 2 are out now on PS4 and PS5. The descriptions for each state that the games offer ""a classic Call of Duty experience,"" and as such, cross-platform multiplayer is not supported. Beyond the base games, Activision is also selling each game's season pass for $30 (or $10 through August 6 for PlayStation Plus members). The season pass bundles include additional multiplayer maps and Zombies content. The next brand-new Call of Duty game is Call of Duty: Modern Warfare 4, which launches this October for PS5, Xbox Series X|S, Switch 2, and PC."
"New Counter-Strike 2 Map Has Players Rescuing Dogs Instead Of Hostages, And That’s Very Nice","A new, fan-made map for Valve's free shooter Counter-Strike 2 has a unique spin on the game's popular Hostage Rescue mode, having players instead rescue dogs in danger. The ""Shelter"" map ( via Dexerto ) takes place in a fictionalized suburban animal shelter, as players race to stop ""Phoenix Biotechnical"" from kidnapping animals for medical trials. https://www.youtube.com/watch?v=Rtd0HLui7W4 As you can see in the walkthrough video below, Shelter is a large, impressively detailed map, featuring all manner of indoor and outdoor spaces. The attention to detail is notable, as you can see in the video that there are even ""kennel cards"" for the dogs in the facility that are only visible when scoping in. These are complete with descriptions like, ""Very energetic and loves to run around."" It's also grim and sad to see the areas of the shelter with medical equipment where the kidnapped animals are tested on. In terms of gameplay, a video shows that players rescue the dogs and carry them on their shoulders to safety. If the mode is similar to regular Hostage Rescue, one team will try to rescue the dogs and the other team will try to stop them. I wouldn't want to play that side. https://www.youtube.com/watch?v=1tqmCaemBNA Counter-Strike 2 has more than 1 million people playing it concurrently right now , making it Steam's most popular game by far. The new Shelter map comes not long after a story about dogs being rescued from a medical research facility garnered international headlines. More than 1,500 beagles were released from the Ridglan Farms facility in Wisconsin this year and have been put up for adoption, with many heartwarming stories of pups landing in good homes ."
Palworld Won’t Raise Its Price Following 1.0 Launch,"After more than two years in early access, Palworld has launched in 1.0 , and there's some good news for anyone looking to dive into it. Usually, early access games charge a smaller fee to entice users, increasing the sticker price once the full release goes live. Palworld developer Pocketpair is bucking that trend, and it says that the game's price will remain at $30 following its full launch on PC and console. ""After much thought, we have decided not to raise the price of Palworld following the 1.0 release and will keep it at $29.99,"" the developer wrote . ""We are incredibly proud of how far Palworld has come. Thanks to the amazing support of our players, it has become a success beyond our wildest dreams. As a small way of saying thank you, we'll be keeping the price at $29.99. Thank you for your continued support."" https://www.youtube.com/watch?v=J4iJOJi87_4 A lot has changed in Palworld since it first hit the scene in 2024, as the creature-collecting and survival-crafting game has received numerous gameplay updates and new content. Some of these changes were legally required, as Palworld found itself in the crosshairs of Nintendo shortly after launch. The company sued Pocketpair for copyright and patent infringement of the Pokemon franchise, and Pocketpair was forced to appease Nintendo by compromising on certain gameplay mechanics , like gliding. Meanwhile, Nintendo has also been taken to task for attempting to copyright the gameplay mechanic of ""summoning characters and making them fight,"" an idea that numerous games utilized long before Pokemon arrived on the scene. In November 2025, the new head of the United States Patent and Trademark Office (USPTO), John A. Squires, ordered a reexamination of Nintendo's patent. What's next for Pocketpair, now that Palworld is out in the wild? The studio plans to keep supporting the game with post-launch content, and it's also working on an official IRL card game alongside a cozy Palworld spin-off . Palworld also reached an impressive milestone before its 1.0 release, as Pocketpair reported that the game had reached 40 million players so far."
How One Teacher (And A Private Investigator) Revived The Beloved Franchise Of Your Childhood,"The Backyard Sports series' resurgence began a few years ago with a re-release of the classic 1997 game Backyard Baseball , but this month's launch of Backyard Baseball--an all-new entry--is a monumental step for a franchise that had been on ice for years. But getting there wasn't easy, requiring years of work (and the help of a private investigator) to even acquire the rights, let alone find a development partner who could revive such a legendary franchise. Playground Productions CEO Lindsay Barnett was up to the challenge, ultimately pivoting from her job as an elementary-school teacher when it became clear she was capable of bringing Backyard Baseball to a new generation of baseball fans. And now, the time has come for those kids (and their parents, if we're being honest) to see just what Barnett and her team have been cooking up. Making the best of a bad situation While the Backyard Sports franchise is a pop-culture staple for many Millennial sports fans, it was essentially dead prior to the COVID-19 pandemic. Barnett was teaching second grade in Chicago at the time, and as her students shifted to remote-learning setups and she had a chance to ask them about what kinds of activities they were doing at home, it became clear that many were playing violent video games. She wanted to find something more age-appropriate for them to spend their time playing outside of class. Playground Productions CEO Lindsay Barnett ""I said, 'Well, what about sports games?""' Barnett told GameSpot. ""And they said, 'Well, sports games are too hard for us to play. We can't play them. We can't master the controls.' And so I had suggested the Backyard Sports games [to them], and that's when I determined that they were nowhere to be found. And as any bored teacher would do during a pandemic in which they are stuck at home, I went and searched for the rights for the brand, and it was a very difficult search to find it. I wound up hiring a private investigator to track the rights down."" It took more than two years, but Barnett was eventually able to acquire the rights to the Backyard Sports franchise, partnering with the Pittsburgh-based Mega Cat Studios to develop new games. Initially, the plan was to make a new game that was very similar to Backyard Baseball '97, but Mega Cat had another idea. ""They said, 'Well, we could actually bring back Backyard Baseball '97.' And I said, 'No way. No you can't. We don't have any source code.' And they were like, 'No, we'll reverse-engineer and CD-ROM hack it and we can do it.'"" That led to a number of re-releases of classic Backyard Sports games to test the waters, including the original Backyard Baseball '97 and its follow-up, Backyard Baseball 2001. Then it was time to make something a bit riskier: an entirely new game. The 2D style had been perfected, but Barnett wanted something that could merge that classic style and charm with a more modern look. ""When I was thinking about what hadn't been done with this brand, there was no faithful representation of the 2D game that people like me loved when they were kids in the 3D world,"" Barnett said. ""And so that became our mission from day one: How can we expand the Backyard universe, as we like to call it, into this 3D world?"" The solution, as you can see in the new Backyard Baseball game, was sort of a half-step between full-on 3D and the original games' visual style. The character models and environments are all in 3D, but they look extremely similar to the original 2D designs, and a number of 2D elements are still included. It's undeniably Backyard Baseball--instantly recognizable to a generation of sports fans who, like Barnett, grew up playing the originals. The secret weapon It wasn't just the fans who loved those games, however: Current MLB players are right in that age range as well, and when it came time to promote the new game, Playground Productions had no shortage of interest. These pro players wanted Backyard Baseball at their ballparks, and that meant bringing the legendary Pablo Sanchez--The Secret Weapon--to do some public outreach. If you've watched an MLB game this year, there's a good chance you've seen him lurking in the crowd, perhaps hoping for a chance to pinch hit and send one over the fence. https://www.youtube.com/watch?v=AszLikoI3RU ""When we brought the brand back, we had tons of requests from athletes and teams to bring Pablo to their various stadiums or to interact with Pablo in some capacity. The games originally in 1997 were created as an educational tool to teach kids the rules of baseball or the rules of any of the sports that they were playing. And now fast-forward, a generation of Millennials have learned to play the sports that they've [then] mastered in the real world from these games."" One thing Millennials didn't have to deal with back at the turn of the century was microtransactions, and neither will a new generation of Backyard Baseball players. Once again, it comes back to Barnett's time as a teacher. Put away your wallet ""I would see my students--for holidays and birthdays--asking for virtual currency and spending so much money to unlock parts of the game that they could be grinding on and not be able to beat without the microtransaction. I saw people accidentally spend a lot of money and that was a huge part that I'd see from my students. They'd accidentally click a button because they were seven years old and then their parents wouldn't be able to get the money back. And I kind of just was like, 'Let's go back to basics.' When we were kids, we [just] played the game and this new game has tons of unlockables. There are trophies to win, [and] there are achievements to uncover. There are cards that you can redeem by just playing the game. You get tokens and you can redeem them for cards and try to chase and find them, but there are no microtransactions, which just felt kind of yucky."" The classic Backyard clubhouse More than just not wanting to siphon extra money from children, though, Playground Productions wants to ensure that kids trying out Backyard Baseball have a positive experience so they might try playing some real-life baseball. Backyard Baseball may just be their gateway to a lifetime of hitting dingers and throwing some power-up-free fastballs. ""We don't want any of these kids to have a bad experience because we have a bigger commitment to kids in general, which is, if they have a bad experience with a baseball game like ours, they might be completely [unwilling] to interact with the whole sport. And we want to get kids and families to be connected together in sports in general."" Baseball is for everyone That philosophy of inclusion and removing barriers to entry is at the heart of Backyard Baseball, and has been since the original 1997 game. It launched with 15 boys and 15 girls, with many different ethnic backgrounds represented and the excellent pitcher Kenny Kawaguchi famously using a wheelchair. All of those kids return for the 2026 game, and that was a very deliberate decision. ""It becomes more and more important every [time] that I meet a new fan because they tell our team about the different characters that they resonate with and why. And for me, the really great girls resonated with me and inspired me to go outside and play different sports that perhaps I wouldn't have played. I played on a co-ed flag football team when I was in elementary school. I never would've done that had I not had this game,"" Barnett said. ""We hear all the time [from] tons of people in the wheelchair sports community [that] Kenny Kawaguchi means so much. They've never seen a character who's actually a star player represented in a wheelchair. And it means the world to our team when people come up and say, 'Yeah, I always pick Kenny on my team because he's like me.' We just hear different stories every day. ""Even [play-by-play broadcaster] Sunny Day! Sunny Day is a Black sports reporter and has been for almost 30 years, and that's meant something to a lot of girls who have been looking up at her. I think the representation means a ton. And we just leaned into who those characters were from the beginning."" Sunny Day and Vinnie The Gooch Backyard Baseball is available now for PC and Mac on Steam, with console releases to follow. The decision to not attach a number or year to the game's title was intentional, as Playground Productions has big plans for expansions and more content in the future. ""This is not Backyard Baseball 2026,"" Barnett stressed. ""And I, again, from my teaching experience, felt like having a sports game that comes out [with] a new one every single year is not always the best for fans. They spend a lot of money to play a great game and they want to have long-term fun. And so what we've done is design[ed] Backyard Baseball to be a long-term game. And so we have expansion packs that might come out in the future. We have unlockables that might come out in the future, new modes, and all sorts of different things that people will be able to do within this game for a very long time."" That approach is extended beyond Backyard Baseball, as well, with Playground already bouncing around ideas for how the franchise could re-emerge in other sports, much like it did back in the early 2000s. ""It's going to be a very long road for the Backyard,"" Barnett added. ""We're not going anywhere."""
