title,text,scraped_at
Fallout: Season 2 Blu-Rays Are Already Up For Preorder,"<div title=""6538022 -- Fallout: Season 2 Blu-ray preorder"" data-embed-type=""buylink"" data-ref-id=""5495"" data-template=""2"" data-size=""buylink__large"" data-title=""6538022 -- Fallout: Season 2 Blu-ray preorder"" data-collection="""" class=""norewrite"">    <div class=""buylink__container"">                                                                                                                                                                                               <div class=""buylink__item"">                  <div class=""buylink__image-container clickable"">                                            <img class=""buylink__image"" src=https://www.gamespot.com/a/uploads/square_avatar/1701/17013431/4653590-fallouts2steelbook.jpg alt="""">                                 <a href=""https://www.amazon.com/Fallout-Complete-Second-Exclusive-Steelbook/dp/B0GK5ZFN17?tag=gamespot-preorders-20""></a>                              </div>                   <div class=""buylink__text"">                      <p class=""buylink__title text-bold"">                        <a href=""https://www.amazon.com/Fallout-Complete-Second-Exclusive-Steelbook/dp/B0GK5ZFN17?tag=gamespot-preorders-20"">Fallout: Complete Second Season Limited-Edition Steelbook (4K)</a>           </p>                                                       <p class=""buylink__deck"">                          <a href=""https://www.amazon.com/Fallout-Complete-Second-Exclusive-Steelbook/dp/B0GK5ZFN17?tag=gamespot-preorders-20"">$48 | Release date TBD</a>             </p>                                              </div>                  <div class=""buylink__links"">                                                                                                                                                          <a href=""https://www.amazon.com/Fallout-Complete-Second-Exclusive-Steelbook/dp/B0GK5ZFN17?tag=gamespot-preorders-20"">Preorder at Amazon</a>                     </div>                         </div>                                                                                                                                                                                                                 <div class=""buylink__item"">                  <div class=""buylink__image-container clickable"">                                            <img class=""buylink__image"" src=https://www.gamespot.com/a/uploads/square_avatar/1701/17013431/4653655-fos2standard.jpg alt="""">                                 <a href=""https://www.amazon.com/Fallout-Complete-Second-Season-UHD/dp/B0GK6LFX47?tag=gamespot-preorders-20""></a>                              </div>                   <div class=""buylink__text"">                      <p class=""buylink__title text-bold"">                        <a href=""https://www.amazon.com/Fallout-Complete-Second-Season-UHD/dp/B0GK6LFX47?tag=gamespot-preorders-20"">Fallout: Complete Second Season Standard Edition</a>           </p>                                                       <p class=""buylink__deck"">                          <a href=""https://www.amazon.com/Fallout-Complete-Second-Season-UHD/dp/B0GK6LFX47?tag=gamespot-preorders-20"">$35 | Release Date TBD</a>             </p>                                              </div>                  <div class=""buylink__links"">                                                       <input               class=""buylink__extra""               type=""checkbox""             />                                                                                                                          <a href=""https://www.amazon.com/Fallout-Complete-Second-Season-UHD/dp/B0GK6LFX47?tag=gamespot-preorders-20"">Preorder at Amazon (4K)</a>                                                                                                                                                                           <a href=""https://www.amazon.com/Fallout-Complete-Second-Season-Blu-ray/dp/B0GK6MBH8G?tag=gamespot-preorders-20"">Preorder at Amazon (Blu-ray)</a>                                                                                                                                                                           <a href=""https://www.amazon.com/Fallout-Complete-Second-Season-DVD/dp/B0GK6RYFQ8?tag=gamespot-preorders-20"">Preorder at Amazon (DVD)</a>                     </div>                         </div>                     </div> </div><p>Fallout: Season Two recently wrapped on Prime Video, and, like clockwork, a <a href=""https://www.amazon.com/Fallout-Complete-Second-Exclusive-Steelbook/dp/B0GK5ZFN17?tag=gamespot-preorders-20"">4K Blu-ray containing all eight episodes is up for preorder</a>. There's no release date yet for the $48 4K steelbook, but Amazon has opened up preorders for it alongside the upcoming standard Blu-ray and DVD release of the show.</p><div title=""6538022 -- Fallout: Season 2 Blu-ray preorder"" data-embed-type=""buylink"" data-ref-id=""5495"" data-template=""4"" data-size=""buylink__listicle"" data-title=""6538022 -- Fallout: Season 2 Blu-ray preorder"" data-collection="""" class=""norewrite"">  <div class=""buylink-container"">                                                                     <div class=""js-buylink-item-container buylink-item-container"">             <h2 class=""item-title"">                    <a href=""https://www.amazon.com/Fallout-Complete-Second-Exclusive-Steelbook/dp/B0GK5ZFN17?tag=gamespot-preorders-20"">Fallout: Complete Second Season Limited-Edition Steelbook (4K)</a>       </h2>                                   <h3 class=""item-deck"">                      <a href=""https://www.amazon.com/Fallout-Complete-Second-Exclusive-Steelbook/dp/B0GK5ZFN17?tag=gamespot-preorders-20"">$48 | Release date TBD</a>         </h3>                                                                                                        <div class=""image-container"">                                  <img class=""main-image"" src=https://www.gamespot.com/a/uploads/square_medium/1701/17013431/4653590-fallouts2steelbook.jpg>                             <a href=""https://www.amazon.com/Fallout-Complete-Second-Exclusive-Steelbook/dp/B0GK5ZFN17?tag=gamespot-preorders-20""></a>                        </div>              <div class=""item-description""><p>Fallout: Complete Second Season Limited-Edition Steelbook cover art features the core trio of Lucy, the Ghoul, and Maximus overlooking the blasted landscape of New Vegas, with a menacing, mutant-shaped cloud hanging overhead. This cover art is exclusive to the Limited-Edition Steelbook 4K Blu-ray.</p><p>Bonus features haven't been revealed yet, but we're expecting this release to take a few cues from the Fallout: Season One Blu-ray release, which included a collection of behind-the-scenes featurettes. We'll update this post once the Fallout: Complete Second Season special features have been listed.</p></div>                <div class=""item-buttons"">                  <div>                      <a href=""https://www.amazon.com/Fallout-Complete-Second-Exclusive-Steelbook/dp/B0GK5ZFN17?tag=gamespot-preorders-20"">Preorder at Amazon</a>                              </div>                                         </div>      </div>                                                                     <div class=""js-buylink-item-container buylink-item-container"">             <h2 class=""item-title"">                    <a href=""https://www.amazon.com/Fallout-Complete-Second-Season-UHD/dp/B0GK6LFX47?tag=gamespot-preorders-20"">Fallout: Complete Second Season Standard Edition</a>       </h2>                                   <h3 class=""item-deck"">                      <a href=""https://www.amazon.com/Fallout-Complete-Second-Season-UHD/dp/B0GK6LFX47?tag=gamespot-preorders-20"">$35 | Release Date TBD</a>         </h3>                                                                                                        <div class=""image-container"">                                  <img class=""main-image"" src=https://www.gamespot.com/a/uploads/square_medium/1701/17013431/4653655-fos2standard.jpg>                             <a href=""https://www.amazon.com/Fallout-Complete-Second-Season-UHD/dp/B0GK6LFX47?tag=gamespot-preorders-20""></a>                        </div>              <div class=""item-description""><p>Along with the Steelbook 4K Blu-ray version, Fallout: Complete Second Season will also launch in a standard edition on 4K Blu-ray, standard Blu-ray, and DVD. As with the Steelbook version, no release date or special features have been announced, but it's safe to assume the standard edition will launch on the same day and likely include the same bonus materials. Preorders are available at Amazon.</p></div>                <div class=""item-buttons"">                  <div>                      <a href=""https://www.amazon.com/Fallout-Complete-Second-Season-UHD/dp/B0GK6LFX47?tag=gamespot-preorders-20"">Preorder at Amazon (4K)</a>                              </div>                                                                      <div>                        <a href=""https://www.amazon.com/Fallout-Complete-Second-Season-Blu-ray/dp/B0GK6MBH8G?tag=gamespot-preorders-20"">Preorder at Amazon (Blu-ray)</a>           </div>                                                                                                             <div>                        <a href=""https://www.amazon.com/Fallout-Complete-Second-Season-DVD/dp/B0GK6RYFQ8?tag=gamespot-preorders-20"">Preorder at Amazon (DVD)</a>           </div>                                    </div>      </div>   </div> </div><p>Speaking of the first Fallout season, you can also pick up the Blu-ray and DVD for it at a great price. The steelbook edition has been out of stock for a while, but the<a href=""https://www.amazon.com/Fallout-Season-1-4K-UHD/dp/B0F8BL2VDM?tag=gamespot-promos-20""> 4K version is on sale for $35 </a>(was $40), and the <a href=""https://www.amazon.com/Fallout-Season-One-Ella-Purnell/dp/B0F48J26VM?tag=gamespot-promos-20"">DVD is $20</a> (was $25).</p><h2>Fallout: Season One Blu-rays</h2><ul><li><a href=""https://www.amazon.com/dp/B0F7MVP4ZD?tag=gamespot-promos-20"">4K Blu-ray</a> -- $35 (<del>$40</del>)</li><li><a href=""https://www.amazon.com/Fallout-Season-Blu-ray-Ella-Purnell/dp/B0F48J2BS8?tag=gamespot-promos-20"">Blu-ray</a> -- $38.17</li><li><a href=""https://www.amazon.com/Fallout-Season-One-Ella-Purnell/dp/B0F48J26VM?tag=gamespot-promos-20"">DVD</a> -- $20 (<del>$25</del>)</li></ul><hr /><p>Several big video games have been adapted into live-action TV series recently, and if you're looking to build a Blu-ray library around them, there are plenty of options to choose from. HBO's<a href=""https://www.amazon.com/Last-Us-Complete-First-Season/dp/B0BYPBGNQP?tag=gamespot-promos-20""> The Last of Us series</a> is considered to be the gold standard, while <a href=""https://www.amazon.com/Twisted-Metal-Blu-ray-Anthony-Mackie/dp/B0DGLP2PS6"">Twisted Metal</a> is a surprisingly well-crafted spin on the cult-classic road-rage racing games. <a href=""https://www.amazon.com/Halo-Season-One-Limited-Steelbook/dp/B0BF2WXJ3X?tag=gamespot-promos-20"">Halo also made it to TV</a>, and both seasons are available on Blu-ray.</p><a href=""https://www.gamespot.com/articles/fallout-season-2-blu-ray-buying-guide/1100-6538022/?ftag=CAD-01-10abi2f/"">Continue Reading at GameSpot</a>",2026-02-19T12:35:57.046390
"Bigfoot Has Been Found, And He's In Fallout 76","<p>Few cryptids are better known than Bigfoot, and we know where he's going to be at the beginning of next month. Bethesda has teased the arrival of Bigfoot in the next season of <a href=""https://www.gamespot.com/games/fallout-76/"">Fallout 76</a> with a teaser video that resembles supposed real-world attempts to catch the creature on camera.</p><div data-embed-type=""tweet"" data-src=""https://twitter.com/Fallout/status/2023789980301119894"" data-has-image=""true""><blockquote align=""center"" class=""twitter-tweet"" data-conversation=""none"" data-mce-disable-toolbar=""true""><p dir=""ltr"">Bigfoot is coming to a wasteland near you! <br />The Backwoods update and Season 24 arrives March 3 in <a href=""https://twitter.com/hashtag/Fallout76?src=hash&amp;ref_src=twsrc%5Etfw"">#Fallout76</a> <a href=""https://t.co/38m0Y22rcB"">pic.twitter.com/38m0Y22rcB</a></p>  — Fallout (@Fallout) <a href=""https://twitter.com/Fallout/status/2023789980301119894?ref_src=twsrc%5Etfw"">February 17, 2026</a></blockquote>          <text></text>    </div><p>Bigfoot will be a part of the Backwoods update when Fallout 76 Season 24 begins on March 3. However, this won't be Bigfoot's first appearance in the game. Bigfoot's footprints have been spotted in the <a href=""https://www.gamespot.com/articles/fallout-76-burning-springs-update-adds-new-map-region-and-walton-goggins-the-ghoul/1100-6536654/"">Burning Springs</a> update, and the character has randomly spawned during public events in the game. Judging from the video teaser, it appears Bigfoot will be more prominently featured going forward.</p><p>Fallout 76 already has a large assortment of cryptids in the game, including the Jersey Devil, Mothman, Wendigo, Sheepsquatch, Blue Devil, and the Smiling Man. Since players can battle those creatures, it stands to reason that Bigfoot will be available as a miniboss fight as well.</p><a href=""https://www.gamespot.com/articles/bigfoot-has-been-found-and-hes-in-fallout-76/1100-6538264/?ftag=CAD-01-10abi2f/"">Continue Reading at GameSpot</a>",2026-02-19T12:35:57.046390
Mario Voice Actor Charles Martinet Reveals His Most Treasured Mario Item,"<p>Charles Martinet, the longtime voice of Mario and Luigi, has revealed his most treasured Mario-related item, and it's probably not something you would guess.</p><p>On the Nintendo Today app (<a href=""https://x.com/Stealth40k/status/2024155632811606294"">via Stealth</a>), Martinet is quoted as saying his most treasured Mario item that he collected over his career is ""a little music box that plays the Mario theme.""</p><p>He said he was given this music box from a fan, and it's so special to him because ""those beautiful sounds"" remind him of the joy he had working with composer Koji Kondo and Mario creator Shigeru Miyamoto over the years.</p><a href=""https://www.gamespot.com/articles/mario-voice-actor-charles-martinet-reveals-his-most-treasured-mario-item/1100-6538263/?ftag=CAD-01-10abi2f/"">Continue Reading at GameSpot</a>",2026-02-19T12:35:57.046390
"Sony Could Offset Rising RAM Costs By ""Monetizing"" The PS5 Install Base","<p>Sony revealed during its latest financial results presentation that while the PlayStation 5 is selling well, pushing out 92.2 million units as of February 5, the company's plan now is to grow ""software and network services revenue"" by monetizing the existing install base.</p><p>According to <a href=""https://automaton-media.com/en/news/sony-plans-to-minimize-effect-of-rising-playstation-5-memory-costs-by-boosting-software-and-network-service-revenue-according-to-cfo/"">an Automaton report</a>, CFO Lin Tao <a href=""https://www.sony.com/en/SonyInfo/IR/library/presen/er/pdf/25q3_sonyspeech.pdf"">addressed concerns during the presentation</a> about securing enough PlayStation 5s to meet the demand in the wake of the ongoing memory chip shortage. <span>Tao stated that Sony is already prepared to gather the minimum amount of memory chips necessary to meet the year-end sales season.</span></p><p>""Going forward, we intend to further negotiate with various suppliers to secure enough supply to meet the demand of our customers,"" Tao said, explaining that the company's goal is to ""minimize the impact"" of rising memory costs by focusing on ""monetizing the installed base"" and growing software and network services revenue. ""We will continue to monitor the situation while working to minimize the impact on profitability, too.""</p><a href=""https://www.gamespot.com/articles/sony-could-offset-rising-ram-costs-by-monetizing-the-ps5-install-base/1100-6538266/?ftag=CAD-01-10abi2f/"">Continue Reading at GameSpot</a>",2026-02-19T12:35:57.046390
Sonic The Hedgehog 4 Movie Has Found Its Amy Rose,"<p>The upcoming live-action Sonic the Hedgehog 4 movie has landed a noteworthy television and film star for a key role, casting Kristen Bell as the hammer-wielding pink hedgehog Amy Rose.</p><p>Per <a href=""https://www.hollywoodreporter.com/movies/movie-news/sonic-4-kristen-bell-voice-amy-rose-1236508342/"">The Hollywood Reporter</a>, Bell, who is best known for her lead roles in The Good Place, Veronica Mars, and Frozen, has closed a deal to join the cast of the sequel, which is <a href=""https://www.gamespot.com/articles/sonic-the-hedgehog-4-gets-march-2027-release-date/1100-6528922/"">scheduled for a March 2027 release date</a>. Sonic voice actor Ben Schwartz, who co-starred in House of Lies with Bell, celebrated the news in <a href=""https://x.com/rejectedjokes/status/2024183496823230522"">an X post</a> that included a picture of both actors holding figurines of their respective characters.</p><div data-embed-type=""tweet"" data-src=""https://x.com/rejectedjokes/status/2024183496823230522"" data-has-image=""true""><blockquote align=""center"" class=""twitter-tweet"" data-conversation=""none"" data-mce-disable-toolbar=""true""><p dir=""ltr"">WE HAVE OUR AMY ROSE!!! And I could not be more excited!!! Please welcome the incredible Kristen Bell to the <a href=""https://twitter.com/SonicMovie?ref_src=twsrc%5Etfw"">@SonicMovie</a> family!!! 💙 <a href=""https://t.co/jcFLLoplqC"">pic.twitter.com/jcFLLoplqC</a></p>  — Ben Schwartz (@rejectedjokes) <a href=""https://twitter.com/rejectedjokes/status/2024183496823230522?ref_src=twsrc%5Etfw"">February 18, 2026</a></blockquote>          <text></text>    </div><p>Amy Rose made a small appearance in the post-credits scene of Sonic the Hedgehog 3, fighting off several Metal Sonic robots with her trusty Piko Piko Hammer. Both Amy and Metal Sonic made their video game debuts in 1993's Sonic CD, so it's a fair bet that the new movie will include elements from that title.</p><a href=""https://www.gamespot.com/articles/sonic-the-hedgehog-4-movie-has-found-its-amy-rose/1100-6538265/?ftag=CAD-01-10abi2f/"">Continue Reading at GameSpot</a>",2026-02-19T12:35:57.046390
The Easiest Way To Build Your Own Steam Machine Isn't On Steam,"<p>If you've been itching to build a new PC but have been stopped in your tracks by the harsh reality of the price of components currently, the latest Epic Games Store exclusive could be the next best thing.</p><p><a href=""https://www.gamespot.com/games/pc-building-simulator-2/"">PC Building Simulator 2</a> bring more components, deeper simulation, and a host of more options for you to craft the gaming rig of your dreams. The sequel expands upon the surprisingly addictive foundations of its debut, with a more robust campaign mode (and additional endless mode on top of it) as well as over 40 hardware brands and their components to choose from.</p><p>The sequel is exclusive to the Epic Games Store on PC, meaning you might be able to build your own <a href=""https://www.gamespot.com/articles/steam-machine-release-date-price-everything-we-know/1100-6536286/"">Steam Machine</a> while waiting for Valve to release theirs, but you won't be able to do so via Steam itself. PC Building Simulator 2 will also <a href=""https://www.pcbuildingsim.com/news/pc-building-simulator-2-console-edition"">launch on Xbox Series X|S and PlayStation 5</a> next week, on February 26, letting you build your own Xbox on an Xbox.</p><a href=""https://www.gamespot.com/articles/the-easiest-way-to-build-your-own-steam-machine-isnt-on-steam/1100-6538259/?ftag=CAD-01-10abi2f/"">Continue Reading at GameSpot</a>",2026-02-19T12:35:57.046390
How To Open Locked Chests In Dragon Quest 7 Reimagined,"<p>Doesn’t matter which one it is, if a game spends hours telling you you can break open everything not nailed down, if they start putting locks on things, you’re gonna take that Michael Jordan-level personally. Even in its newfangled Reimagined form, <em>Dragon Quest 7</em> is no different, you’ll eventually start running into chests that won’t open, and what’s worse, because chests aren’t specifically color-coded here, you won’t know what key opens what kind of chest till you try to open it. While letting Maribel complain at them until they surrender their contents sounds like a grand idea on paper, we might suggest finding a few keys for these things might go a little easier. We’ll show you where you’re headed for these.</p><p dir=""ltr""><strong>The Thief Key</strong></p><p dir=""ltr"">So, in general, you’re gonna want to tackle as many of these chests as you can once you get access to their specific areas, since the time jump mechanic means some of these locations can be locked or blocked off if you progress a bit too far too fast. Fortunately, they’re all very much on your way through the main story. You’ll find the Thief Key when you’ve handled your business in Alltrades Abbey. Once you’re able to roam freely after taking down Cardinal Sin, head back to Pilgrim’s Perdition, and head to the weird little hostel at the north of town next to a well. The NPCs that were guarding the chest here will be gone, and you can grab the key in here. Even better, you can use it right away by opening the other chest in here for a Mini-Medal.</p><a href=""https://www.gamespot.com/articles/how-to-open-locked-chests-in-dragon-quest-7-reimagined/1100-6538148/?ftag=CAD-01-10abi2f/"">Continue Reading at GameSpot</a>",2026-02-19T12:35:57.046390
"Valve Wins Trial Against ""Patent Troll"" Inventor","<p>A Washington jury has favored Valve in its lawsuit against the ""patent troll"" inventor Leigh Rothschild and a myriad of his associated companies for breaching a contract and violating a state patent protection law.</p><p>According to reports by <a href=""https://news.bloomberglaw.com/ip-law/steam-game-developer-wins-patent-troll-trial-against-inventor"">Bloomberg Law</a> and <a href=""https://www.pcgamer.com/hardware/valve-wins-lawsuit-against-rothschild-and-associated-entities-with-a-jury-agreeing-they-violated-an-anti-patent-troll-protection-act/"">PC Gamer</a>, the US District Court for the Western District of Washington favored Valve on all counts as part of a lawsuit that dates back to July 2023. In <a href=""https://www.bloomberglaw.com/public/desktop/document/ValveCorporationvRothschildetalDocketNo223cv01016WDWashJul072023C/18"">a minute filed on February 17 and uploaded by Bloomberg Law</a>, the count determined that Rothschild and his affiliates violated Washington’s Patent Troll Prevention Act and Consumer Protection Act, as well as breached the contract.</p><p>Rothschild and Valve have a storied history, with the two being in and out of courts since at least 2016. The inventor has an assortment of patents, both granted and pending, under his name that extends to a broad array of fields, including barcodes and QR codes. Many of his companies deal in patents, too. For example, Rothschild Broadcast Distribution Systems (RBDS) <a href=""https://patents.google.com/patent/US8856221B2/en"">owns patent </a><a href=""https://patents.google.com/patent/US8856221B2/en"">US8856221B2</a>, which is a ""system and method for storing broadcast content in a cloud-based computing environment."" Valve obtained a ""perpetual, irrevocable, royalty-free, fully paid-up, worldwide license"" for it and others in Rothschild's portfolio in 2016. Rothschild sued Valve in 2022 for patent infringement, then again in 2023 over US8856221B2.</p><a href=""https://www.gamespot.com/articles/valve-wins-trial-against-patent-troll-inventor/1100-6538260/?ftag=CAD-01-10abi2f/"">Continue Reading at GameSpot</a>",2026-02-19T12:35:57.046390
Fortnite Studio Buys This Digital Human Company,"<p>Epic Games, the maker of Fortnite and the Unreal Engine, has acquired the digital human company Meshcapade for an undisclosed sum.</p><p>Meshcapade produces AI-based products that claim to provide the ""industry's most accurate 3D motion and body shape data"" from a video source. ""Our AI transforms footage--from subtle social gestures to intense dynamic movements--into precise, high-fidelity 3D data ready for immediate integration,"" the company said.</p><div data-embed-type=""video"" data-src=""https://www.youtube.com/watch?v=ujEgfqDSzcw"" data-width=""100%"" data-height=""100%"">          <iframe src=""https://www.youtube-nocookie.com/embed/ujEgfqDSzcw"" height=""100%"" width=""100%"" scrolling=""no"" frameborder="""" webkitallowfullscreen mozallowfullscreen allowfullscreen></iframe></div><p>Co-founder Naureen Mahmood said the goal from the beginning was to make ""developing digital humans easier, more expressive, and more accessible for creators.""</p><a href=""https://www.gamespot.com/articles/fortnite-studio-buys-this-digital-human-company/1100-6538258/?ftag=CAD-01-10abi2f/"">Continue Reading at GameSpot</a>",2026-02-19T12:35:57.046390
