title,text
Backrooms to triple previous A24 opening weekend record at $85+ million,Maybe Michael Bay shouldn't have nuked the Skibidi Toilet movie after all.
Traffic to DuckDuckGo's proudly 'No AI' search page has tripled since latest Google AI search update,Traffic to DuckDuckGo's proudly 'No AI' search page has tripled since latest Google AI search update
"A toast to the wild west weirdos of the MMO goldrush—from the game that unleashed pandora's lootbox, to a deeply strange mess based off a 1996 science fiction novel","Trendsetting freaks of 2005-2015, I salute thee."
"I am the law, man, thanks to this mod for Red Dead Redemption 2",My first days as a sheriff in the First Response mod don't go as smoothly as hoped.
"The remarkable story of Unreal 2, the sequel rescued from development hell by dooming it to failure: 'There was just no way we could succeed'","""It made it possible for us to ship something, but what we shipped was not what people wanted."""
"After more than two decades, the creator of Paint.NET finally owns the domain paint.net, and it's all thanks to a 'slam dunk case of trademark infringement'","""I've been trying to get this domain for 22 years."""
Paralives is home to the kind of architectural creative freedom I haven't felt from a life sim since The Sims 2,An amateur architect's dream.
"Robot watch: The weirdest things the clankers did this month including moonwalking themselves to death, losing a fight to a step, and drowning by the dozens in Sydney Harbour","Android are you okay? Android are you okay? Are you okay, Android?"
"Bungie spills the beans on combat tuning for Marathon Season 2, and it's bad news for shotgun lovers and thermal snipers","Bungie says it wants player weapon choices to ""feel more intentional""."
007: Nightfire review (2003),EA’s latest Bond romp is a ferocious misfire—aiming low and tragically hitting its mark.
"A burnt-out Final Fantasy 14 playerbase is noticeably more chipper after its latest reveal, even if we've seen nothing come of it yet","With Evercold's plans on the table, the air feels a little lighter in Eorzea."
"Our Baldur's Gate 3 quiz gauntlet is complete—now try a bonus round on romance, literature, and classes",I hope you're well-read and well-loved.
Balatro publisher Playstack only discovered it because they had a guy checking all the new releases on Steam every day: 'I saw the game the day it went up on Steam',"""I went to Twitter at the time and contacted LocalThunk. I think he had maybe two or three followers."""
"It seems Terraria's developer is as bad at making small updates as it is final ones, as it says its latest balance patch is much more than 'adjusting a few numbers'","""Sometimes, addressing balance means rethinking some core aspects around how things function."""
"Pragmata's developers take all your comparisons to Xbox 360 shooters as a 'huge compliment', though I'm not convinced by their theory for why players are making the connection","""That's basically an honour."""
A conversation with Infinity Ward about Call of Duty,"Two senior Modern Warfare 4 devs talk friendly competition between studios, SBMM, and ""ripped from the headlines"" campaigns."
"Legend has it that The 7th Guest's creators were 'fired' on the spot after pitching the game—it's 'hyperbole,' but not entirely untrue","The classic puzzle game began as notes on an airport napkin before ""blowing minds"" at CES 1991."
"An EVE newbie got an impossibly rare $7,000 ship out of a free loot box, leaving him set for life in the space MMO: 'Everyone gets this for free, right?'","""I guess I’ve always been a lucky person."""
The Witcher 3 sold another 5 million copies over the last year: 'This cements its place among the best-selling videogames in history',"It was already among the best-selling games of all time, really, but now it's even bigger."
Backrooms and Exit 8 make the perfect double feature for videogame-adjacent horror movies,Quiet. Tense. Creepy. And not overstuffed with lore or exposition.
Bungie devs have resurrected an obscene amount of guns for Destiny 2's final update: 'My body physically hurts from the amount of items we were updating',Kindled Orchid. Now that's a name I haven't heard in a long time.
"Game Pass success story: It turns out that when you make things cheaper, more people will buy them",Who could've guessed?
Balatro publisher Playstack could soon belong to the same private equity firm that owns Fandom and GameSpot,"Playstack CEO Harvey Elliott says ""for now, it's business as usual."""
"StarCraft 2 development ended 6 years ago, but Blizzard still won't stop messing with it","A new patch for 2026 rolled out yesterday, and it's a big one."
Fable 4 is delayed into 2027 and we all know why,"Microsoft says 2026 is ""packed"" with new games including, uh, one in particular."
An Arc Raiders player demonstrates how to kill a Bastion in 16 seconds without a Deadline—now I'm questioning my own skills,"""You need to be wearing the doctor's outfit with this kind of surgical skill."""
"Call of Duty: Modern Warfare 4 promises more 'grounded' cosmetics, and I feel like I've heard this before",Find TP for your bunghole anywhere but in COD.
"Amazon bins an internal AI leaderboard for its Kiro employees, because they were burning through too many costly tokens","Sorry, my bad. It's been 'deprecated'."
CDPR is aiming to 'release 3 Witcher games within a 6 year period' but don't expect any expansions for the upcoming trilogy,I don't think we have much to complain about if that's the case.
One of the ideas pitched to save Destiny 2 was reportedly a 'Destiny Infinity' relaunch and a return to the annual expansion model,Things could've been different—but enough to save it? Who knows.
007 First Light review,IO awkwardly welds together two schools of game design.
"AMD chief Dr. Lisa Su tells MIT graduates, 'Technology itself does not decide what the future looks like. People do'","""[AI] cannot make the hard judgment calls with imperfect information. It cannot take responsibility for the outcome."""
"Counter-Strike is good for personal development, but don't let me tell you, listen to this bona fide Buddhist monk with a beast RTX 4090 rig instead","True Zen runs on Intel, it seems."
"Cooler Master and G.Skill team up to bring you actively cooled DRAM kits, answering that incredibly distant call for even more expensive memory","Y'all wanted actively cooled memory, yes?"
"An Overwatch poster has been spotted in Call of Duty: Modern Warfare 4, leaving some to speculate a collaboration is on the horizon",If Soap gets added to Overwatch he better go to Hazard.
"I'm sorry, but I'm here to say that I really do not enjoy parrying stuff in videogames",Everyone's favourite mechanic may be my most hated.
"Cozy cleaning sim Moldwasher is perfect for fans of PowerWash Simulator, or any life-long haters of the fungi Stachybotrys Chartarum","If Stachybotrys Chartarum has no haters, I'm dead."
I absolutely agree with 33% of you when it comes to your choice of freaky Subnautica 2 critters,So freaky. So adorable.
"It's only a little thing but with the latest Windows update, Microsoft has dragged its OS into the modern world of sharing audio streams","The checklist for it all to work is a tad convoluted, though."
Anbernic claims quiet memory size downgrade in its retro handheld devices is 'an unexpected error' without addressing criticisms over speed decreases,"It claims it will ""assist with a replacement as a priority"" for anyone affected."
"'Basically Lego for gamers': This new game controller has modular buttons, sticks, grips, and even vibration motors","I do wish the aesthetic was nicer, though."
It looks like the MSI Claw 8 EX AI+ handheld powered by Intel's new Arc G-series chips will have a pinch of ROG Xbox Ally to it,There's a little jut to that screen.
This supply chain Sankey diagram for an Nvidia AI megachip is a handy guide to understanding just how easy it is to ruin the prices of graphics cards,"One hiccup over there, a price increase here, and our precious GPUs become a whole lot more expensive."
"Take-Two CEO says 'former Rockstar employees' have tried to match GTA's success and 'haven't been able to'—and while he doesn't name names, that's gotta sting for a certain someone",MindsEye given the side-eye.
007 First Light has sold 1.5 million copies in its first 24 hours and claims the victory of 'fastest selling title in IO Interactive's history',I wonder who the seventh person to buy the game was?
"Tim Sweeney takes swipes at Valve for Steam Deck price hike, blames it on the 'component parts supply chain for megayachts'",Maybe Sweeney isn't the best person to make this point.
Overwatch's general manager has ignited player hopes for an animated series after revealing that he 'would not rule out' other narrative experiences in the future,I've waited 10 years for this.
Acer's Predator Atlas 8 handheld gaming PC with new Intel G-series chips looks a lot like a beefier Lenovo Legion Go S,"Beefier in raw horsepower as well as weight, from the looks of it."
"In a sea of videogame movie adaptations, 28% of you are sick and tired of 'em and 24% of you are PC Gamer as hell",And 17% of you have something totally different in mind.
Where to find the Minamino region Treasure Hunt in Forza Horizon 6,Search the golf course for this week's Festival Playlist Treasure Hunt challenge.
"""The secret weapon of Star Wars"" and editor Marcia Lucas dies aged 80","Marcia Lucas, the Academy Award-winning editor and former wife of Star Wars creator George Lucas, has died aged 80. Read more"
Diablo 4's next season is doing something bold with Mythical items that should pique the interest of casual players,"Diablo 4 developer Blizzard is seemingly not done making big changes to loot and itemisation in the game. As an ARPG, the chase of ever more powerful loot is a core part of the experience, and the game's next season will deliver something of a shake-up to a particular tier of attainable loot. Read more"
"I'm a mega Batman nerd, so here's a selection of my favourite references in Lego Batman: Legacy of the Dark Knight","I will hold my hands up and say I did not expect Lego Batman: The Legacy of the Dark Knight to be this good, or to throw so many references to the Caped Crusader's vast history into your adventure around Gotham. Read more"
"What we've been playing - ""The following day, I kid you not, our TV broke""","Hello and welcome back to our regular feature where we write a little about the games we've been playing. This week, Marie pootles around Japan in whatever season it happens to be; Victoria suspects her husband of breaking their TV; Chris walks the one-way street of Warhammer 40K miniature addiction; and Bertie enjoys being a secret agent. Read more"
Fable reboot delayed to 2027 amid reported GTA 6 'worries',Playground Games' much-anticipated reboot of Fable has been delayed. It's now set to release in February 2027. Read more
"""This market is not behaving normally"" - analysts react to Valve's Steam Deck price increases, and what it means for the cost of the upcoming Steam Machine","Earlier this week, Valve announced a steep price increase for its Steam Deck OLED models . In the UK, would-be-buyers saw a rise of over £200 for the company's chunkier 1TB Steam Deck OLED model, which increased from £569 to £779. Its lower-tier 512GB Steam Deck OLED model, meanwhile, increased by £170. Its price rose from £479 to £649. Read more"
"After 007 First Light, IO Interactive's next game probably won't be another James Bond or a Hitman, but rather something else entirely","The new James Bond game, 007 First Light, seems to be enjoying a very positive response. We were charmed in our 007 First Light review , and judging by the impressive 007 First Light launch sales , many of you were too. The chances of developer IO Interactive realising that James Bond trilogy dream one day seem strong. But even so, the next game from IO probably won't be a James Bond game at all, or a Hitman game - that other series the studio built its reputation on. Read more"
"""We're determined to win justice for the 31 fired workers"" - Rockstar Games workers publicly launch union, as legal battle with the GTA 6 maker rages on","Developers at Rockstar Games have publicly announced a union known as the Rockstar Game Workers Union (RGWU), which is a subsidiary of the wider Independent Workers' Union of Great Britain (IWGB). It comes as the IWGB is preparing to take the Grand Theft Auto 6 maker to court over the firing of staff members in a move seen by many as 'union busting' in October last year, which sparked protests as well as legal action. Read more"
Crimson Desert's 1.09.00 patch adds another highly-requested player feature (as well as loads of new pets),"The 1.09.00 Patch for Crimson Desert has arrived, just one week after the last patch - proving that developer Pearl Abyss is moving at a rate of knots when it comes to fixing and updating its massively popular RPG. Read more"
"The Xbox Game Pass price cut is working, Asha Sharma reportedly tells staff, but ""we will not solve this in one moment or one launch""",Microsoft's recent decision to cut the price of Xbox Game Pass seems to have done what it was designed to do and increase Game Pass subscriber activity. Read more
Mina the Hollower review,"Here is a game that feels like an adventure. And it feels like it was an adventure to make, too. Mina the Hollower took six years to design and build, six years that took it from what sounds like a kind of coding doodle to a panoramic journey across a richly imagined island, taking in platforming and combat, puzzle-solving, and sheer immersion in the world building. It's Zelda and it's Bloodborne. It's smacking bosses and reading the in-game newspaper. All of which is to say that those six years of design work are apparent throughout, in the complexity of the landscapes you travel, in the density of the secrets and the lore. Read more"
"007 First Light truly 'earns the number', as critical acclaim leads to impressive sales milestone in just 24 hours",IO Interactive 's Bond origin game 007 First Light has already reached an impressive milestone. Read more
"The Witcher 3 expansion Songs of the Past was once intended to launch this year, CD Projekt Red reveals, so the rumours were correct","So the rumours were true : CD Projekt Red did originally plan to release Witcher 3 expansion Songs of the Past this year, but it changed its plan to 2027 to achieve ""the best possible result"". Read more"
"CD Projekt Red reveals huge The Witcher 3 sales milestone, which helps explain why a third expansion is in development 11 years later","Why is CD Projekt Red making a third expansion for The Witcher 3: Wild Hunt , more than a decade after the original game was released? A newly revealed sales milestone of 65 million units probably has something to do with it. That's a hell of an installed base to sell to. Read more"
"Unlike The Sims, early access hit Paralives will ""never"" have paid DLC and will stick to free updates, devs say","Though we'd known about it for quite some time, breezy life simulator Paralives has managed to become one of this month's surprise hits. With over 250k copies sold in less than eight hours, it was off to a great start on Steam earlier this week, and now the developers are promising no paid DLC will be released. Read more"
"Call of Duty: Modern Warfare 4 finally revealed, and it's officially leaving last-generation consoles behind","Activision and Infinity Ward have revealed Call of Duty: Modern Warfare 4. It's launching on Xbox Series X/S, PS5, PC, and Nintendo Switch 2 on the 23rd October, 2026. Read more"
"""We make an entertainment product"" - Call of Duty: Modern Warfare 4 leads on their sure to be controversial North vs South Korea campaign","Call of Duty: Modern Warfare 4 is taking the series to South Korea. The campaign starts with North Korean missiles reigning down on a densely packed urban environment, and puts you in the shoes of soldiers in the midst of this chaos. Read more"
"Call of Duty is in need of a big win, and Modern Warfare 4's multiplayer might be it","Call of Duty is in desperate need of a win. Black Ops 7 was the climax of rising displeasure in the established formula. It lacked that bite, amongst other things. It missed the mark for many , especially compared to older entries. Read more"
Heroes of Might and Magic: Olden Era reveals early access roadmap as publisher Hooded Horse celebrates 1m copies sold during its first month,"Heroes of Might and Magic: Olden Era , the latest entry in the iconic turn-based fantasy strategy series, has convinced most players so far , but it's got a long early access journey ahead. Today, publisher Hooded Horse and developer Unfrozen Studio have shared an extensive roadmap. Read more"
"IOI is 'keeping the British end up' in 007 First Light by switching out Americanisms to ""reinforce the immersion""","Following earlier gameplay teaser trailers, developer IO Interactive has made some changes to the dialogue in 007 First Light. Read more"
That sword Geralt unsheaths in The Witcher 3 Songs of the Past expansion artwork? We've seen it before,"A third Witcher 3 expansion, Songs of the Past , was only announced yesterday, but it appears we've seen the sword Geralt unsheaths in the artwork before. Read more"
"Planet Zoo 2 finally revealed after much teasing, with an autumn release date, aquatic and flying species, and the ability to conserve outside of your zoo","Earlier this week, the park sim veterans at Frontier Developments began teasing Planet Zoo 2 . Now, the sequel has been fully revealed, and it's coming later this year with a handful of huge additions. Read more"
Subnautica 2 publisher Krafton now forced to pay $250m earnout to Unknown Worlds developers after more than 4m units sold,"Subnautica 2 has been off to a stellar start despite some discussions over fighting alien fish , with 2m copies sold within 12 hours of launching on Steam and Xbox's storefronts. Since its 14th May launch, its success has only become bigger, and now Krafton will be forced to pay developer Unknown Worlds $250m. Read more"
Donkey Kong 64 finally arrives on Nintendo Switch Online next month,"90s classic Donkey Kong 64 is finally coming to Nintendo Switch Online. It will be available for all those Nintendo Switch Online + Expansion Pack subscribers from next month, on 4th June. Read more"
"A Pragmata sequel? Well, ""of course"" Capcom's game director would love one, but alas, he is ""not the only one who decides""","Pragmata's director would ""of course"" love to make a sequel to Capcom's space-based small girl and astronaut starring game, but he isn't the only person who needs to give it the green light. Read more"
"Fortnite's return to the Apple App Store and iOS has caused an eight-year record surge in downloads, with a spike in daily activity, too","Fortnite has faced tons of difficulties in recent times, with engagement going down and massive layoffs at Epic affecting its short-term creative potential. However, its recent return to the Apple App Store has kickstarted a surge in downloads and activity. Read more"
"Bungie details Marathon Season 2 and the new Sentinel class, with a free-to-play week and special sale planned, too","Right after dropping the untimely news Destiny 2 won't be getting more support after June , Bungie is ramping up work on Marathon , with Season 2 introducing a spooky new map and mysterious new threats next week. Read more"
"Valve announces significant Steam Deck price rise of almost £200 in the UK, over 40% around the world","Valve has announced a substantial price increase for its Steam Deck OLED models, citing ""rising memory and storage costs"" as the reason. Read more"
"Alan Wake and Control ""should have sold more"", says Remedy's newly-appointed CEO, who promises he's not the evil exec people expected","While both games were critically acclaimed, Remedy's newly-appointed CEO believes Alan Wake and Control ""should have sold more"" and been more commercially successful than they were. That being said, he has a remedy for Remedy's titles (thank you Matt, for pointing out this the perfect word play here), and believes film and TV adaptations will give the games a boost. Read more"
IO Interactive has a plan to keep you playing 007: First Light long after the credits roll,"As a linear, scripted action game, the replayability of James Bond game 007: First Light has been called into question. It's something Rick brought up in Eurogamer's 007: First Light review , mostly because it jars with the sandbox approach IO Interactive used for Hitman, which is replayable by design. Read more"
"Dragon Quest 40th anniversary event reveals DQ12 restart with new title, DQ11 Switch 2 port, and the return of Dragon Quest Monsters series","It's been a few years since Dragon Quest 12: The Flames of Fate 's announcement, so fans were logically expecting news during today's 40th-anniversary stream. An update has indeed been shared, but it's not what we were expecting. Read more"
"""Hoping we'll be spared"" - The bowieknife99 saga in Forza Horizon 6 continues as the urban legend goes viral and Walmart bans the mysterious racer","Forza Horizon 6 is a blast, but there's a recurring 'drivatar' AI racer making things harder for many drivers. Their nickname is bowieknife99, and they've caused enough mayhem to become an urban legend of sorts . Now, the myth has gone viral. Read more"
Another live service game crashes as Sony switches off servers for PS5 exclusive Destruction AllStars,"Sony has abruptly shut down multiplayer services for PlayStation 5 launch exclusive Destruction AllStars , and it doesn't sound like they're ever coming back. Read more"
"Hideo Kojima and Nicolas Winding Refn have teamed up for a Prada mode event teaser exploring ""new creative possibilities through AI technology""","Hideo Kojima and filmmaker Nicolas Winding Refn have teamed up again after Death Stranding 2 , but they aren't working on a new game or movie. Instead, they've released a short made with the help of AI tools for Prada. Read more"
"No Man's Sky goes to war as Swarm update brings universe-ending threat, hundred-ship space battles, and a splash of… Splatoon?","Even if you're not particularly up on your No Man's Sky lore, you'll likely have at least heard in-game mention of the World of Glass, a kind of archival afterlife linked to the exploratory sci-fi game's ill-fated simulation. And in its latest update, Swarm, something fearsome is breaking through from that other realm - so it's time to band together and fight back. Read more"
Mina the Hollower is an 8-bit world of complex wonder,"My favourite moment in The Legend of Zelda: Link's Awakening happens in a library. You're wandering between the stacks, trying to learn more about this strange island you've washed up on, when you spy a book that's hidden up high, stuck at the top of a book shelf, and well out of range of your grasping hands. Read more"
"Resident Evil Requiem finally has a free PC and console demo, three months after the full game released","Three months after its full release, Capcom has announced a demo for Resident Evil Requiem. Read more"
"Pokémon game sales cross 515m units as The Pokémon Company looks to Winds and Waves next year, and TCG production is ramping up too","Pokémon Winds and Waves will no doubt be huge when the two games launch on Nintendo Switch 2 in 2027, but Pokémon is thriving regardless of what's going on in the mainline series. Legends: Z-A had a killer debut last year , and you don't need us to remind you Pokopia has been huge , too. It all adds up, and the latest update straight from The Pokémon Company is staggering. Read more"
"The Witcher 3 minimum PC requirements rise significantly ahead of new expansion, forcing you to use Windows 11 and an SSD","UPDATE 28th May: CD Projekt Red has responded to concerns about the changing Witcher 3 PC system requirements, particularly as they relate to Windows 10 no longer being supported. Read more"
Another GTA 5 multiplayer mod service is shutting down as Take-Two and Rockstar push to consolidate modding around FiveM,"As we eagerly await GTA 6's marketing push to kick off, Grand Theft Auto 5 and GTA Online continue to make millions of dollars each month , so it's not surprising to see Take-Two push to consolidate multiplayer mods around FiveM, the platform it acquired back in 2023 . Read more"
"Marathon's Season 2 cinematic trailer promises things are about to get spookier on Tau Ceti IV: ""Moon's EXTRA haunted""","Marathon continues to grow, even as Destiny 2 is on its way out . Following an official announcement of Season 2 earlier this month, the cinematic trailer is promising the extraction shooter will get even scarier this summer. Read more"
The rumoured third Witcher 3 expansion has been announced by CD Projekt Red,"CD Projekt Red has announced the much-rumoured third expansion for The Witcher 3: Wild Hunt . It's called Songs of the Past, it's based around Geralt again, and it's coming out next year on PC, PlayStation 5 and Xbox Series S/X. Read more"
First Metal Gear Solid 4 port footage confirms Konami is keeping those real world iPod and Playboy cameos,Product placement will remain alive and well in Konami's upcoming and long-awaited modern port of Metal Gear Solid 4: Guns of the Patriots . Read more
