title,text,scraped_at
"Microsoft rolls out tables in Notepad for all Windows 11 users, though I'd feel happier about this if I knew this was the final addition to my favorite little app",You can have too much of a good thing.,2026-01-16T12:21:21.997919
Asus and MSI have now both clarified the RTX 5070 Ti hasn't received an end-of-life status,"Asus has officially echoed its response to us yesterday and MSI has confirmed it has ""no plans to EoL anything.""",2026-01-16T12:21:21.997919
"Yakuza Kiwami 3's new expansion basically turns it into a breakneck roguelite dungeon crawl, complete with random drops and goofy sidekicks","It's like fight club, only you're Yakuza Batman.",2026-01-16T12:21:21.997919
"Yakuza Kiwami 3 includes the first official emulation of 2 bizarro Sega arcade games, including one like Crazy Taxi but you're racing an ambulance to the hospital before a patient bleeds to death",Forget all that yakuza drama. Time to play some obscure arcade games.,2026-01-16T12:21:21.997919
"Resident Evil Requiem was originally a tense, stealth-oriented horror starring only Leon, before the team went back to the drawing board: 'People wouldn't want to see a timid Leon'",Capcom is combining all the different intensities of Resi into one game.,2026-01-16T12:21:21.997919
The studio behind the best metroidvania of 2021 has a new game coming out next month—and I'm dropping everything to play it,Sorry everything else.,2026-01-16T12:21:21.997919
Embark dev teases Arc Raiders 2026 roadmap with 'multiple maps coming this year' that span 'a spectrum of size',"The next roadmap is coming ""sometime soon.""",2026-01-16T12:21:21.997919
Dawn of War 4's combat director goes even further than the original game's sync-kill animations: 'I don't think any RTS has really done anything like this in the past',"If there's only going to be war in the far future, at least it'll look sick as hell.",2026-01-16T12:21:21.997919
The JRPG veteran responsible for Persona and Megami Tensei is working on a 'school life RPG' with the Neptunia series studio,Kouji Okada is joined by two other Atlus veterans.,2026-01-16T12:21:21.997919
Fatal Fury fans accuse new City of the Wolves trailer of being filled with AI slop: 'All that Saudi money and can't pay someone a couple bucks to make real s**t',"Fatal Fury: City of the Wolves season 2 looks strong, but it's been overshadowed by anger over the announcement trailer.",2026-01-16T12:21:21.997919
Here's our first look at Sophie Turner as Lara Croft in the upcoming Tomb Raider show,The show's first promo photo reveals a pretty faithful take on Lara's classic costume.,2026-01-16T12:21:21.997919
New World will join the graveyard of defunct MMOs when it goes offline in 2027,The MMO's last season will be extended until its final day.,2026-01-16T12:21:21.997919
Marathon's free loadout option will have limitations that some Arc Raiders fans keep asking Embark for,Rook is a free class option with its own stealth abilities.,2026-01-16T12:21:21.997919
It's my duty as a child of the early 2000s to let you know a Beyblade-inspired roguelike was released on Steam last month,We've wasted weeks where we could have been letting it rip.,2026-01-16T12:21:21.997919
"A 'deeply social, psychological' Fallout Shelter reality TV series is coming from the producers of the Squid Game reality series",The success of the Fallout series on Prime probably made this inevitable.,2026-01-16T12:21:21.997919
Skyrim's co-lead designer was building real-time horse and cart travel and a dynamic civil war: 'We were pretty disappointed that didn't ship',Kurt Kuhlmann was co-lead on Skyrim and Bethesda's Elder Scrolls loremaster.,2026-01-16T12:21:21.997919
"Arc Raiders lead admits putting together new loadouts is a pain when you want to just 'get in there and do stuff', says the game got a lot right but 'looking through a bunch of menus isn't necessarily it'","""If we can [...] get you through the front end faster, I think that's a great ambition.""",2026-01-16T12:21:21.997919
The best parody account in gaming hangs up its hat after 17 years: Peter Molydeux is retiring,"Peter Molyneux's last game is coming in April, and that means it's time for his social media doppleganger to ride off into the sunset.",2026-01-16T12:21:21.997919
Acer Nitro V15 (2025) review,5060 shades of grey.,2026-01-16T12:21:21.997919
"Bethesda's former Elder Scrolls loremaster on why he left, Starfield's 'communication breakdowns', and how he wanted The Elder Scrolls 6 'to be The Empire Strikes Back'","""It was almost certainly time for a change.""",2026-01-16T12:21:21.997919
"Redditor claims that Monster Hunter Wilds runs better 'the more DLC you own', and it does—but not by much on my machine",Your mileage may vary.,2026-01-16T12:21:21.997919
"Total War: Warhammer 40,000 surpasses Steam wishlist milestone, with over 1 million people ready to fight for their dessicated corpse of an Emperor",The galaxy-spanning strategy game has already amassed a huge following.,2026-01-16T12:21:21.997919
"It's 2026, CES is over, and there's still no sign of Intel's Arrow Lake refresh, but one hardware channel is adamant it'll be here in the spring",Would a no-show even matter when Nova Lake is coming?,2026-01-16T12:21:21.997919
"Avert thine eyes no more, as the file explorer 'flash bang' bug has finally been addressed",A light bulb moment.,2026-01-16T12:21:21.997919
"WoW: Midnight beta introduces a new Mythic+ dungeon modifier that's kinda just yellow paint for routing, and you know what? Good","Dungeon routing is a huge pain, but this should make it easier.",2026-01-16T12:21:21.997919
"While it's unclear How Many Dudes it'd take to beat up a gorilla, I can with certainty tell you that 15 zombies, 4 samurai, 2 barbarians, 4 ghosts, and 4 dudes do a pretty good job",How Many Dudes? is shaping up to be a silly autobattling time.,2026-01-16T12:21:21.997919
QPAD Flux 65 Model 5 review,QPAD re-enters the market with a wonderful little clacker.,2026-01-16T12:21:21.997919
Asus TUF Gaming A16 (2025) review,"Big, hot, and just a little too expensive.",2026-01-16T12:21:21.997919
"'I know how stupid this is, but it had to be done': YouTuber gets Doom to run on touchscreen cooking pot",Let him cook!,2026-01-16T12:21:21.997919
"The name's still Bond but at least everything is right this time, as 007 First Light's devs have corrected their system requirements after 'an internal miscommunication' error",Who knew that PC hardware was so complicated?,2026-01-16T12:21:21.997919
Monster Train 2's first DLC is transforming the game with a giant new mode and the hammer-swinging Railforged clan,"Exclusive reveal: First details on a major update to Monster Train 2, Destiny of the Railforged.",2026-01-16T12:21:21.997919
Mchose Ace 68 16 kHz gaming keyboard review,For those who measure their lives in fractions of a second.,2026-01-16T12:21:21.997919
Asus is NOT killing off the RTX 5070 Ti as Asus issues statment saying 'certain media may have received incomplete information',"Hardware Unboxed cited conversations it's had with Asus over the EoL status it has applied to the RTX 5070 Ti. Asus says, no we haven't.",2026-01-16T12:21:21.997919
"To meet 'tremendous and humongous demand' from AI customers, SK Hynix accelerates 2027 fab plans by three months, with an even fresher fab beginning wafer production next month",Good news…for somebody!,2026-01-16T12:21:21.997919
"Gaming on Linux just got a bump with new Wine 11 improvements that'll make for a better Proton on SteamOS, too",We can expect better and more robust compatibility.,2026-01-16T12:21:21.997919
"Despite an incredibly tough 2025 for ZeniMax, The Elder Scrolls Online's leadership is hopeful: 'We've definitely got our eyes on the future, because this is our home'","""We aren't done yet.""",2026-01-16T12:21:21.997919
"Marvel Rivals Season 6 release date, Deadpool abilities, and more",Deadpool and Elsa Bloodstone in the Night at the Museum update.,2026-01-16T12:21:21.997919
Disco Elysium had so much text it broke the branching narrative software: 'we were writing too much',"""Oh no, no one else writes things that long!""",2026-01-16T12:21:21.997919
"With only 2,300 hours to go until a full Ecco the Dolphin reveal, new details emerge about the forthcoming reboot",The iconic New Age mammal is coming back.,2026-01-16T12:21:21.997919
Here's one big benefit to Hytale not being on Steam: its refund policy is way better than Valve's,You can play for longer before deciding whether or not you want a refund.,2026-01-16T12:21:21.997919
Quarantine Zone has been patched so now you can actually detect people smuggling hand grenades in their butts,What's in your (prison) wallet?,2026-01-16T12:21:21.997919
How well do you know classic videogame cheats? See if you can answer these 10 tricky questions,Turn on big head mode and root around in there for the answers to these questions about classic cheat codes and console commands.,2026-01-16T12:21:21.997919
'I consider it a millennial shooter': The FPS dev making hit shooters by leaning into '2007-core',"Echo Point Nova's Matt Larrabee talks movement shooters, making niche games, and '2007-core' game design.",2026-01-16T12:21:21.997919
How to get Azure Logs in Hytale,"Blue are the streets, and all the trees are too.",2026-01-16T12:21:21.997919
"Ryan Hurst, the voice of Thor in God of War: Ragnarok, will star as Kratos in the God of War TV series on Prime",Will Chris Judge appear as Thor? Because that'd be pretty cool.,2026-01-16T12:21:21.997919
All EB Games outlets in New Zealand will close by the end of the month following 'multi-million dollar' losses,Videogame retail takes another hit.,2026-01-16T12:21:21.997919
Hopes for an eventual Anthem private server resurrection ignited as former executive producer says code for running the game locally 'is there to be salvaged and recovered',So you're telling me there's a chance? An extremely slim chance?,2026-01-16T12:21:21.997919
"Bully Online, the ambitious mod that brought multiplayer and more to Rockstar's classic school sim, shuts down a month after launch: 'This was not something we wanted'","An official explanation for the shutdown hasn't been shared yet, but it sure looks like a C&D dropped hard.",2026-01-16T12:21:21.997919
Hytale vs Minecraft: 5 key differences you should know about,"Here's what you're getting, and what you're not, if you try Hypixel Studios' new sandbox adventure game.",2026-01-16T12:21:21.997919
Umamusume developer Cygames bullied into apology by outraged horse girl enthusiasts after announcing AI subsidiary: 'We sincerely apologize for the concern we've caused',Nobody liked that.,2026-01-16T12:21:21.997919
"""We as a company are always ready to take a stand on the right values"" - GOG says selling indie game Horses when Steam and Epic wouldn't was ""a matter of freedom""","<img src=""https://assetsio.gnwcdn.com/gog-horses.jpg?width=690&quality=85&format=jpg&auto=webp"" /> <p>When provocative horror game Horses was banned from sale on Steam and the Epic Game Store late last year, it nearly led to the closure of acclaimed Italian studio Santa Ragione - denied, as it was, access to some of the world's largest paying game audiences. But amid the panicked delistings there was another company determined to sell Horses and <a href=""https://www.eurogamer.net/following-controversial-bans-from-steam-and-epic-santa-ragiones-horses-has-sold-18k-copies-and-repaid-debts"">throw Santa Ragione a lifeline</a>: Poland-based online store GOG.</p> <p><a href=""https://www.eurogamer.net/gog-says-selling-horses-when-steam-wouldnt-was-matter-of-freedom"">Read more</a></p>",2026-01-16T12:21:21.997919
"Resident Evil Requiem ""an experience with an emotional range"" unlike any other series entry to date (and, um, janitor zombies)","<img src=""https://assetsio.gnwcdn.com/Resident-Evil-Requiem-screenshot-showing-a-scarred-character-in-a-strange-helmet-that-covers-their-eyes.jpg?width=690&quality=85&format=jpg&auto=webp"" /> <p>Capcom's upcoming Resident Evil Requiem will be ""an experience with an emotional range unlike any other Resident Evil title to date"", complete with ... (checks notes) ... a cleaning zombie.</p> <p><a href=""https://www.eurogamer.net/resident-evil-requiem-an-experience-with-an-emotional-range-unlike-any-other-series-entry-to-date-and-um-janitor-zombies"">Read more</a></p>",2026-01-16T12:21:21.997919
"The next Life is Strange game will be revealed next week, following PEGI rating leak","<img src=""https://assetsio.gnwcdn.com/Max-Caulfield-wears-a-yellow-beanie-in-Life-is-Strange-Double-Exposure.jpg?width=690&quality=85&format=jpg&auto=webp"" /> <p>The next game in the <a href=""https://www.eurogamer.net/games/life-is-strange"">Life is Strange</a> series will be unveiled later this month.</p> <p><a href=""https://www.eurogamer.net/the-next-life-is-strange-game-will-be-revealed-next-week-following-pegi-rating-leak"">Read more</a></p>",2026-01-16T12:21:21.997919
You have 12 months to play Amazon's New World before it shuts down forever (unless the COO of Rust gets involved),"<img src=""https://assetsio.gnwcdn.com/amazon-offers-advice-after-reports-its-mmo-new-world-is-bricking-pricey-rtx-3090-graphics-cards-1626892638027.jpg?width=690&quality=85&format=jpg&auto=webp"" /> <p>Amazon Games has announced that New World, its MMORPG first released in 2021, will shut down on the 31st January 2027. <a href=""https://www.eurogamer.net/amazon-reportedly-gutting-its-video-game-division-as-part-of-14000-company-wide-job-cuts"">This comes a few months after the developer ""gutted"" a vast number of staff late last year</a>.</p> <p><a href=""https://www.eurogamer.net/new-world-shutting-down-unless-saved-by-rust"">Read more</a></p>",2026-01-16T12:21:21.997919
"I'm not sure Animal Crossing: New Horizons' busted megaphone and other Switch 2 bits are worth £4.19, but 3.0's a welcome nudge back into Nintendo's lovely world","<img src=""https://assetsio.gnwcdn.com/animal-crossing-megaphone-header.jpg?width=690&quality=85&format=jpg&auto=webp"" /> <p>I cannot begin to tell you how much I was looking forward to hoisting megaphone and bellowing insults at Chops from halfway across my island in Animal Crossing: New Horizon's <a href=""https://www.eurogamer.net/platforms/switch-2"">Switch 2</a> Edition, but the whole voice recognition thing is so flakey - so prone to drawing the attention of entirely the wrong villager - there's liable to be Honaloha-wide revolt if this goes on. I've already shoved the damn thing into storage, and with that out the way, I'm not sure there's enough left of note to warrant the upgrade, even at &pound;4.19.</p> <p><a href=""https://www.eurogamer.net/im-not-sure-animal-crossing-new-horizons-busted-megaphone-and-other-switch-2-bits-are-worth-419-but-30s-a-welcome-nudge-back-into-nintendos-lovely-world"">Read more</a></p>",2026-01-16T12:21:21.997919
"Zelda: Ocarina of Time Lego set leaks, and Ganon looks fierce","<img src=""https://assetsio.gnwcdn.com/Ganondorf-looks-shocked-after-his-demise-in-Zelda-Ocarina-of-Time.jpg?width=690&quality=85&format=jpg&auto=webp"" /> <p>The recently teased Legend of Zelda: <a href=""https://www.eurogamer.net/games/the-legend-of-zelda-ocarina-of-time"">Ocarina of Time</a> Lego set has leaked.</p> <p><a href=""https://www.eurogamer.net/zelda-ocarina-of-time-lego-set-leaks-and-ganon-looks-fierce"">Read more</a></p>",2026-01-16T12:21:21.997919
Amazon's newly-announced Fallout reality show will plop competitors inside a vault to find out just how SPECIAL they are,"<img src=""https://assetsio.gnwcdn.com/Fallout's-Vault-Boy-giving-a-thumbs-up-and-a-wink(1).jpg?width=690&quality=85&format=jpg&auto=webp"" /> <p>After the undeniable success of its live-action adaptation, Amazon Prime Video has announced a reality television show based on the Fallout games.</p> <p><a href=""https://www.eurogamer.net/amazons-newly-announced-fallout-reality-show-will-plop-competitors-inside-a-vault-to-find-out-just-how-special-they-are"">Read more</a></p>",2026-01-16T12:21:21.997919
"""What is a fair end-of-life cycle for a game?"" As Anthem servers are switched off, GOG weighs the ""complicated riddle"" of multiplayer game preservation","<img src=""https://assetsio.gnwcdn.com/gog-anthem.jpg?width=690&quality=85&format=jpg&auto=webp"" /> <p>Polish digital game-shop GOG has built a business out of restoring classic games - those built for a different era of computers that have been rendered no longer playable. It has been finding a way to bring old classics back since it began operating 17 years ago. But in that time things have changed. New games released during that period became modern classics in their own right and found their way onto GOG, and the company's remit slightly widened. And as time marches forward again, a new challenge in game preservation has emerged - the question of how we save or resurrect fallen multiplayer games.</p> <p><a href=""https://www.eurogamer.net/gog-weighs-complicated-riddle-of-multiplayer-game-preservation"">Read more</a></p>",2026-01-16T12:21:21.997919
First images of Sophie Turner as Lara Croft revealed in classic game attire,"<img src=""https://assetsio.gnwcdn.com/G-tZ8YqWkAAE2iF.jpg?width=690&quality=85&format=jpg&auto=webp"" /> <p>Amazon has released the first official image of Sophie Turner as Lara Croft, ahead of the release of its Tomb Raider TV series.</p> <p><a href=""https://www.eurogamer.net/first-images-of-sophie-turner-as-lara-croft-revealed-in-classic-game-attire"">Read more</a></p>",2026-01-16T12:21:21.997919
Final Fantasy 7 Remake on PS5 and PC get a meaty update ahead of the launch of the Switch 2 and Xbox versions of the game next week,"<img src=""https://assetsio.gnwcdn.com/FF7-intergrade.jpg?width=690&quality=85&format=jpg&auto=webp"" /> <p>Are you excited for <a href=""https://www.eurogamer.net/final-fantasy-7-remake-review-a-faithful-remake-with-a-few-missteps-along-the-way"">Final Fantasy 7 Remake</a> on <a href=""https://www.eurogamer.net/platforms/switch-2"">Switch 2</a> and Xbox Series X/S? If you haven't already tried out the demo to see how it'll run on both platforms, then a new update from <a href=""https://www.eurogamer.net/companies/square-enix"">Square Enix</a> might get you even more hyped for the adventures of Cloud and co. on non-PlayStation and PC platforms. The publisher has announced that next Thursday, 22nd January, 2026, a patch for the PS5 and PC versions will launch that will update existing versions of the game will all the bells and whistles coming to the new platform versions of the game. Per <a href=""https://x.com/finalfantasyvii/status/2011740264772305213"">a tweet</a> from the company, this new patch introduces ""Streamlined Progression, including the ability to keep HP and MP topped up"", and the option to ""always hit for 9,999 damage"". Boosters include the option to toggle HP full, MP full, Limit gauge full, and maximum damage dealt - all of which can be turned on and off individually or as a set.</p> <p><a href=""https://www.eurogamer.net/final-fantasy-7-remake-on-ps5-and-pc-get-a-meaty-update-ahead-of-the-launch-of-the-switch-2-and-xbox-versions-of-the-game-next-week"">Read more</a></p>",2026-01-16T12:21:21.997919
"Pathologic 3 is the great Russian novel told as a video game, and a timely critique of intellectualism","<img src=""https://assetsio.gnwcdn.com/pathologic-3_UrsXkhG.jpg?width=690&quality=85&format=jpg&auto=webp"" /> <p>
What would the great Russian novel look like as a video game? If Dostoyevsky or Gogol had lived to dabble in Unity, what would be the result? The answer might well be Pathologic 3; or, to be more precise, the series of Pathologic games, since their daunting individual thematic and narrative complexity is in part a consequence of how they stand in relation to one another.
</p> <p><a href=""https://www.eurogamer.net/pathologic-3-is-the-great-russian-novel-told-as-a-video-game-and-a-timely-critique-of-intellectualism"">Read more</a></p>",2026-01-16T12:21:21.997919
"Sony wiped over 1,000 shovelware games off the PlayStation store without warning, all from a single developer","<img src=""https://assetsio.gnwcdn.com/jumping-taco.jpg?width=690&quality=85&format=jpg&auto=webp"" /> <p>Over a thousand games from a single developer have been suddenly removed from the PlayStation store in what appears to be a massive move by Sony to shift shovelware games off the PS5 and PS5 store.</p> <p><a href=""https://www.eurogamer.net/sony-wiped-over-1000-shovelware-games-off-the-playstation-store-without-warning-all-from-a-single-developer"">Read more</a></p>",2026-01-16T12:21:21.997919
Evidence mounts to suggest Ubisoft really is about to announce an Assassin’s Creed 4: Black Flag remake,"<img src=""https://assetsio.gnwcdn.com/black-flag-whale.jpg?width=690&quality=85&format=jpg&auto=webp"" /> <p>Ubisoft has re-uploaded a sizable selection of sea shanties from <a href=""https://www.eurogamer.net/games/assassins-creed-iv-black-flag"">Assassin's Creed 4: Black Flag</a>, the latest indication that a remake announcement is imminent.</p> <p><a href=""https://www.eurogamer.net/assassins-creed-black-flag-remake-music-upload"">Read more</a></p>",2026-01-16T12:21:21.997919
"IO Interactive revises (and reduces) 007 First Light PC system specs after gamers highlight ""inconsistencies"" in previous versions","<img src=""https://assetsio.gnwcdn.com/James-Bond-in-007-First-Light-dressed-as-a-chauffer.jfif?width=690&quality=85&format=jpg&auto=webp"" /> <p><a href=""https://www.eurogamer.net/companies/io-interactive"">IO Interactive</a> has released a new set of PC specs for its upcoming Bond origin game, 007 First Light. This is following ""inconsistencies"" in the previous versions, which were brought to its attention by the community.</p> <p><a href=""https://www.eurogamer.net/io-interactive-revises-and-reduces-007-first-light-pc-system-specs-after-gamers-highlight-inconsistencies-in-previous-versions"">Read more</a></p>",2026-01-16T12:21:21.997919
British comedian-packed space comedy Earth Must Die releases really soon and there's now a demo,"<img src=""https://assetsio.gnwcdn.com/earth-must-die.jpg?width=690&quality=85&format=jpg&auto=webp"" /> <p>Earth Must Die, the new game by Dan Marshall's Size Five Game, has just been given a 27th January release date and <a href=""https://store.steampowered.com/app/3639780/Earth_Must_Die/"">a Steam demo</a>.</p> <p><a href=""https://www.eurogamer.net/british-comedian-packed-earth-must-die-gets-release-date-demo"">Read more</a></p>",2026-01-16T12:21:21.997919
Hopes around the unannounced Guild Wars 3 reignite thanks to a new job listing posted by ArenaNet,"<img src=""https://assetsio.gnwcdn.com/guild-wars-2-characters.jpg?width=690&quality=85&format=jpg&auto=webp"" /> <p>A new job listing posted by MMO developer ArenaNet has reignited hopes about Guild Wars 3 being in development.</p> <p><a href=""https://www.eurogamer.net/hopes-around-the-unannounced-guild-wars-3-reignite-thanks-to-a-new-job-listing-posted-by-arenanet"">Read more</a></p>",2026-01-16T12:21:21.997919
"Amazon's God of War series has found its Kratos, and it's Ragnarök's Thor","<img src=""https://assetsio.gnwcdn.com/Kratos-and-Thor-fighting-in-God-of-War-Ragnarok.jpg?width=690&quality=85&format=jpg&auto=webp"" /> <p>Amazon's live action God of War series has found its Kratos, and it's a name you may already recognise from the franchise.</p> <p><a href=""https://www.eurogamer.net/amazons-god-of-war-series-has-found-its-kratos-and-its-ragnaroks-thor"">Read more</a></p>",2026-01-16T12:21:21.997919
"Hytale's early access launch isn't quite ready to step out of Minecraft's shadow, but as a block-loving survival fan I'm still having a blast","<img src=""https://assetsio.gnwcdn.com/hytale-header.jpg?width=690&quality=85&format=jpg&auto=webp"" /> <p>I did not anticipate it'd take me an hour to start my first game of Hytale after loading it up, but you can thank its surprisingly involved character creator for that. Eventually,though - after fashioning a blonde 'tashed, barechested, leather-clad lothario who swings a little more 'porn star' than I was aiming for - I finally went in, and the positive impressions continued.</p> <p><a href=""https://www.eurogamer.net/hytales-early-access-launch-isnt-quite-ready-to-step-out-of-minecrafts-shadow-but-im-still-having-a-blast"">Read more</a></p>",2026-01-16T12:21:21.997919
Here are our PS Plus Extra and Premium games for January,"<img src=""https://assetsio.gnwcdn.com/The-Exit-8-screenshot-showing-a-poster-with-eyes-on-the-wall-of-a-Japanese-underground-with-a-PS-Plus-logo-in-the-corner.jpg?width=690&quality=85&format=jpg&auto=webp"" /> <p>Sony has lifted the lid on its PS Plus Premium and Extra game offerings for January.</p> <p><a href=""https://www.eurogamer.net/here-are-our-ps-plus-extra-and-premium-games-for-january"">Read more</a></p>",2026-01-16T12:21:21.997919
"""I'm not afraid of risk"" - A newly independent GOG eyes indie game publishing, something it couldn't do under CD Projekt Red","<img src=""https://assetsio.gnwcdn.com/gog_oCP6FKH.jpg?width=690&quality=85&format=jpg&auto=webp"" /> <p>Newly independent PC digital game shop GOG is interested in getting into publishing indie games - something it apparently couldn't do while part of CD Projekt Red.</p> <p><a href=""https://www.eurogamer.net/gog-eyes-indie-game-publishing-something-it-couldnt-do-under-cd-projekt-red"">Read more</a></p>",2026-01-16T12:21:21.997919
